{
  "0" : {
    "description" : "",
    "favorited" : true,
    "hyperlink" : "https://messari.io/",
    "lastlocation" : 7,
    "taglist" : [ "newtag" ],
    "text" : "Messari"
  },
  "1" : {
    "description" : "",
    "favorited" : true,
    "hyperlink" : "https://github.com/dboudro?tab=stars",
    "id" : "0",
    "lastlocation" : 6,
    "taglist" : [ "newtag" ],
    "text" : "Github Favorites"
  },
  "2" : {
    "description" : "",
    "favorited" : true,
    "hyperlink" : "https://www.swapalease.com/lease/search.aspx?zip=02468&maxmopay=500&so=1&distance=500",
    "id" : "1",
    "lastlocation" : 6,
    "taglist" : [ "newtag" ],
    "text" : "Car Lease Search"
  },
  "3" : {
    "description" : "",
    "favorited" : true,
    "hyperlink" : "https://router.vuejs.org/guide/#html",
    "id" : "2",
    "lastlocation" : 6,
    "newtag" : "",
    "taglist" : [ "root", "education", "vue", "javascript", "api" ],
    "text" : "Vue Router Doc"
  },
  "4" : {
    "description" : "personal finance",
    "favorited" : true,
    "hyperlink" : "http://www.mrmoneymustache.com/",
    "id" : "3",
    "lastlocation" : 840,
    "newtag" : "",
    "taglist" : [ "personal-finance", "finance", "root" ],
    "text" : "Mr Money Mustache"
  },
  "5" : {
    "dateAddedLocal" : "6/7/2019, 4:44:29 PM",
    "dateAddedUTC" : "2019-06-07T20:44:29.277Z",
    "description" : "Lorem ipsum dolor sit amet, consectetur adipiscing elit. Vivamus vel lectus ut turpis fermentum vestibulum. ",
    "favorited" : true,
    "hyperlink" : "https://github.com/vuejs/awesome-vue#podcasts",
    "id" : "4",
    "index" : 8,
    "lastlocation" : 155,
    "newtag" : "",
    "parentId" : "1",
    "taglist" : [ "javascript", "vue", "education" ],
    "text" : "vuejs/awesome-vue: ðŸŽ‰ "
  },
  "6" : {
    "description" : "",
    "favorited" : true,
    "hyperlink" : "https://tailwindcss.com/course/setting-up-tailwind-and-postcss",
    "id" : "5",
    "lastlocation" : 835,
    "newtag" : "",
    "taglist" : [ "default", "education", "video" ],
    "text" : "Tailwind CSS Course"
  },
  "7" : {
    "description" : "",
    "favorited" : true,
    "hyperlink" : "https://www.youtube.com/playlist?list=PL0zVEGEvSaeEd9hlmCXrk5yUyqUag-n84",
    "id" : "6",
    "lastlocation" : 832,
    "newtag" : "",
    "taglist" : [ "education", "root", "javascript", "video" ],
    "text" : "Functional Programming JS [Youtube]"
  },
  "8" : {
    "description" : "",
    "favorited" : false,
    "hyperlink" : "https://router.vuejs.org/guide/#html",
    "id" : "7",
    "lastlocation" : -1,
    "newtag" : "",
    "taglist" : [ "modern-aesthetic" ],
    "text" : "Vue Router Site Design"
  },
  "9" : {
    "description" : "",
    "favorited" : false,
    "hyperlink" : "https://www.grailed.com/shop/HqS_Y1WQag",
    "id" : "8",
    "lastlocation" : -1,
    "newtag" : "",
    "taglist" : [ "grailed" ],
    "text" : "v6 grailed"
  },
  "10" : {
    "description" : "",
    "favorited" : false,
    "hyperlink" : "https://calc.randomcrypto.org/",
    "id" : "9",
    "lastlocation" : -1,
    "newtag" : "",
    "taglist" : [ "crypto", "modern-aesthetic" ],
    "text" : "Random Crypto Mining Calc"
  },
  "11" : {
    "description" : "",
    "favorited" : false,
    "hyperlink" : "",
    "id" : "10",
    "lastlocation" : -1,
    "newtag" : "",
    "taglist" : [ "student-portfolio" ],
    "text" : "student portfolio placeholder 3"
  },
  "12" : {
    "description" : "",
    "favorited" : false,
    "hyperlink" : "",
    "id" : "11",
    "lastlocation" : 6,
    "newtag" : "",
    "taglist" : [ "student-portfolio" ],
    "text" : "student portfolio placeholder 2"
  },
  "13" : {
    "description" : "",
    "favorited" : false,
    "hyperlink" : "",
    "id" : "12",
    "lastlocation" : -1,
    "newtag" : "",
    "taglist" : [ "student-portfolio" ],
    "text" : "student portfolio placeholder 1"
  },
  "14" : {
    "description" : "",
    "favorited" : false,
    "hyperlink" : "https://www.grailed.com/shop/sK814puAGA",
    "id" : "13",
    "lastlocation" : -1,
    "newtag" : "",
    "taglist" : [ "grailed", "clothing" ],
    "text" : "Shoes Search"
  },
  "15" : {
    "description" : "",
    "favorited" : false,
    "hyperlink" : "https://www.grailed.com/shop/7JOd3X8N0A",
    "id" : "14",
    "lastlocation" : -1,
    "newtag" : "",
    "taglist" : [ "grailed", "clothing" ],
    "text" : "Raf Simons Search"
  },
  "16" : {
    "description" : "",
    "favorited" : false,
    "hyperlink" : "https://www.grailed.com/shop/UfhgQhW4gA",
    "id" : "15",
    "lastlocation" : -1,
    "newtag" : "",
    "taglist" : [ "grailed", "clothing" ],
    "text" : "Rick Owens Search"
  },
  "17" : {
    "description" : "",
    "favorited" : false,
    "hyperlink" : "https://www.grailed.com/designers/maison-margiela/ER3DP-zYfg",
    "id" : "16",
    "lastlocation" : -1,
    "newtag" : "",
    "taglist" : [ "grailed", "clothing" ],
    "text" : "Maison Margiella Search"
  },
  "18" : {
    "description" : "",
    "favorited" : false,
    "hyperlink" : "https://a16z.com/content/",
    "id" : "17",
    "lastlocation" : -1,
    "newtag" : "",
    "taglist" : [ "venture-capital", "blog", "fintech" ],
    "text" : "a16z Blog "
  },
  "19" : {
    "description" : "",
    "favorited" : false,
    "hyperlink" : "https://codepen.io/wolthers/pen/LkOLQA",
    "id" : "18",
    "lastlocation" : -1,
    "newtag" : "",
    "taglist" : [ "ui-example" ],
    "text" : "Nice Range Slider Design"
  },
  "20" : {
    "dateAddedLocal" : "1/9/2015, 10:38:40 AM",
    "dateAddedUTC" : "2015-01-09T15:38:40.347Z",
    "description" : "Lorem ipsum dolor sit amet, consectetur adipiscing elit. Vivamus vel lectus ut turpis fermentum vestibulum. ",
    "favorited" : false,
    "hyperlink" : "http://www.ibm.com/design/language/",
    "id" : "19",
    "index" : 12,
    "lastlocation" : 19,
    "newtag" : "",
    "parentId" : "38",
    "taglist" : [ "design-language" ],
    "text" : "IBM Design Language"
  },
  "21" : {
    "dateAddedLocal" : "10/5/2014, 7:10:02 PM",
    "dateAddedUTC" : "2014-10-05T23:10:02.869Z",
    "description" : "An Angular.js application that organizes data-visualization resources",
    "favorited" : false,
    "id" : "20",
    "index" : 16,
    "lastlocation" : 3,
    "newtag" : "",
    "parentId" : "2",
    "taglist" : [ "my-projects" ],
    "text" : "VisualDB"
  },
  "22" : {
    "dateAddedLocal" : "3/6/2015, 12:25:45 PM",
    "dateAddedUTC" : "2015-03-06T17:25:45.887Z",
    "description" : "Nice website design, interactive typography, all orange background",
    "favorited" : false,
    "hyperlink" : "http://www.grandone.fi/",
    "id" : "21",
    "index" : 2,
    "lastlocation" : 3,
    "newtag" : "",
    "parentId" : "35",
    "taglist" : [ "creative-agency" ],
    "text" : "Grand One Gallery"
  },
  "23" : {
    "dateAddedLocal" : "1/11/2014, 12:51:31 PM",
    "dateAddedUTC" : "2014-01-11T17:51:31.167Z",
    "description" : "liquid drum n bass",
    "favorited" : false,
    "hyperlink" : "http://www.youtube.com/watch?v=UsU0zSXmuzQ",
    "id" : "22",
    "index" : 2,
    "lastlocation" : -1,
    "newtag" : "",
    "parentId" : "164",
    "taglist" : [ "music" ],
    "text" : "Liquid dnb Song"
  },
  "24" : {
    "dateAddedLocal" : "6/22/2017, 10:42:14 PM",
    "dateAddedUTC" : "2017-06-23T02:42:14.510Z",
    "description" : "Gradient color selection",
    "favorited" : false,
    "hyperlink" : "https://webkul.github.io/coolhue/",
    "id" : "23",
    "index" : 129,
    "lastlocation" : -1,
    "newtag" : "",
    "parentId" : "1",
    "taglist" : [ "color-tool" ],
    "text" : "Coolhue"
  },
  "25" : {
    "dateAddedLocal" : "4/22/2018, 12:49:46 PM",
    "dateAddedUTC" : "2018-04-22T16:49:46.039Z",
    "description" : "Lorem ipsum dolor sit amet, consectetur adipiscing elit. Vivamus vel lectus ut turpis fermentum vestibulum. ",
    "favorited" : false,
    "hyperlink" : "http://www.spacex.com/careers/position/216324",
    "id" : "24",
    "index" : 2,
    "lastlocation" : 7,
    "newtag" : "",
    "parentId" : "522",
    "taglist" : [ "career" ],
    "text" : "Vehicle Software Automation Engineer | SpaceX"
  },
  "26" : {
    "dateAddedLocal" : "9/23/2015, 8:58:05 PM",
    "dateAddedUTC" : "2015-09-24T00:58:05.002Z",
    "description" : "studio lighting etc.",
    "favorited" : false,
    "hyperlink" : "http://www.lynda.com/Lighting-training-tutorials/1464-0.html",
    "id" : "25",
    "index" : 39,
    "lastlocation" : -1,
    "newtag" : "",
    "parentId" : "2",
    "taglist" : [ "education", "photography" ],
    "text" : "Photography Lighting Course | Lynda"
  },
  "27" : {
    "dateAddedLocal" : "11/13/2015, 12:04:07 PM",
    "dateAddedUTC" : "2015-11-13T17:04:07.295Z",
    "description" : "",
    "favorited" : false,
    "hyperlink" : "http://www.taoism.net/ttc/complete.htm",
    "id" : "26",
    "index" : 230,
    "lastlocation" : -1,
    "newtag" : "",
    "parentId" : "1",
    "taglist" : [ "wisdom" ],
    "text" : "Tao Te Ching"
  },
  "28" : {
    "dateAddedLocal" : "10/1/2015, 5:20:55 PM",
    "dateAddedUTC" : "2015-10-01T21:20:55.852Z",
    "description" : "Lorem ipsum dolor sit amet, consectetur adipiscing elit. Vivamus vel lectus ut turpis fermentum vestibulum. ",
    "favorited" : false,
    "hyperlink" : "http://bradfrost.com/blog/post/the-principles-of-adaptive-design/",
    "id" : "27",
    "index" : 10,
    "lastlocation" : -1,
    "newtag" : "",
    "parentId" : "48",
    "taglist" : [ "web-design", "blog" ],
    "text" : "The Principles of Adaptive Design | Brad Frost"
  },
  "29" : {
    "dateAddedLocal" : "4/15/2015, 3:58:27 PM",
    "dateAddedUTC" : "2015-04-15T19:58:27.962Z",
    "description" : "animated narrative, large text menu",
    "favorited" : false,
    "hyperlink" : "http://www.codeandtheory.com/why-we-make",
    "id" : "28",
    "index" : 7,
    "lastlocation" : -1,
    "newtag" : "",
    "parentId" : "756",
    "taglist" : [ "creative-agency" ],
    "text" : "Why We Make - Code and Theory"
  },
  "30" : {
    "dateAddedLocal" : "8/12/2016, 1:03:48 PM",
    "dateAddedUTC" : "2016-08-12T17:03:48.144Z",
    "description" : "Lorem ipsum dolor sit amet, consectetur adipiscing elit. Vivamus vel lectus ut turpis fermentum vestibulum. ",
    "favorited" : false,
    "hyperlink" : "http://web.mit.edu/mitoc/www/",
    "id" : "29",
    "index" : 184,
    "lastlocation" : -1,
    "newtag" : "",
    "parentId" : "1",
    "taglist" : [ "boston" ],
    "text" : "MIT Outing Club"
  },
  "31" : {
    "dateAddedLocal" : "7/23/2014, 2:00:08 PM",
    "dateAddedUTC" : "2014-07-23T18:00:08.712Z",
    "description" : "",
    "favorited" : false,
    "hyperlink" : "http://analogplayerssociety.bandcamp.com/album/analog-players-society-vol-2",
    "id" : "30",
    "index" : 10,
    "lastlocation" : -1,
    "newtag" : "",
    "parentId" : "49",
    "taglist" : [ "music" ],
    "text" : "Analog Players Society | sunday reggae "
  },
  "32" : {
    "dateAddedLocal" : "4/4/2015, 10:33:56 PM",
    "dateAddedUTC" : "2015-04-05T02:33:56.501Z",
    "description" : "Modern smooth digital agency",
    "favorited" : false,
    "hyperlink" : "http://huncwot.com/",
    "id" : "31",
    "index" : 13,
    "lastlocation" : -1,
    "newtag" : "",
    "parentId" : "35",
    "taglist" : [ " creative-agency" ],
    "text" : "Huncwot"
  },
  "33" : {
    "dateAddedLocal" : "11/13/2018, 5:48:34 PM",
    "dateAddedUTC" : "2018-11-13T22:48:34.319Z",
    "description" : "crypto research & analysis platform",
    "favorited" : false,
    "hyperlink" : "http://merkledata.io/#/dashboard",
    "id" : "32",
    "index" : 26,
    "lastlocation" : -1,
    "newtag" : "",
    "parentId" : "1",
    "taglist" : [ "crypto" ],
    "text" : "MerkleData"
  },
  "34" : {
    "dateAddedLocal" : "10/5/2014, 7:32:14 PM",
    "dateAddedUTC" : "2014-10-05T23:32:14.731Z",
    "description" : "",
    "favorited" : false,
    "hyperlink" : "http://api.jquery.com/category/events/",
    "id" : "33",
    "index" : 9,
    "lastlocation" : -1,
    "newtag" : "",
    "parentId" : "36",
    "taglist" : [ "javascript", "api" ],
    "text" : "Jquery Events"
  },
  "35" : {
    "dateAddedLocal" : "12/27/2013, 1:30:48 AM",
    "dateAddedUTC" : "2013-12-27T06:30:48.957Z",
    "description" : "Lorem ipsum dolor sit amet, consectetur adipiscing elit. Vivamus vel lectus ut turpis fermentum vestibulum. ",
    "favorited" : false,
    "hyperlink" : "http://www.webtype.com/",
    "id" : "34",
    "index" : 0,
    "lastlocation" : -1,
    "newtag" : "",
    "parentId" : "9",
    "taglist" : [ "typography" ],
    "text" : "Webtype | Free Fonts"
  },
  "36" : {
    "dateAddedLocal" : "9/19/2018, 10:06:54 PM",
    "dateAddedUTC" : "2018-09-20T02:06:54.618Z",
    "description" : "Google's material design language",
    "favorited" : false,
    "hyperlink" : "https://material.io/design/",
    "id" : "35",
    "index" : 301,
    "lastlocation" : -1,
    "newtag" : "",
    "parentId" : "1",
    "taglist" : [ "design-language" ],
    "text" : "Material Design"
  },
  "37" : {
    "dateAddedLocal" : "7/5/2014, 12:33:57 AM",
    "dateAddedUTC" : "2014-07-05T04:33:57.051Z",
    "description" : "",
    "favorited" : false,
    "hyperlink" : "http://css-tricks.com/snippets/css/a-guide-to-flexbox/",
    "id" : "36",
    "index" : 0,
    "lastlocation" : -1,
    "newtag" : "",
    "parentId" : "36",
    "taglist" : [ "css", "web-design" ],
    "text" : "A Complete Guide to Flexbox | CSS-Tricks"
  },
  "38" : {
    "dateAddedLocal" : "3/23/2015, 11:51:54 AM",
    "dateAddedUTC" : "2015-03-23T15:51:54.791Z",
    "description" : "",
    "favorited" : false,
    "hyperlink" : "https://www.youtube.com/watch?v=INMOAH2wFn0",
    "id" : "37",
    "index" : 41,
    "lastlocation" : -1,
    "newtag" : "",
    "parentId" : "49",
    "taglist" : [ "music" ],
    "text" : "Ellie Goulding - Lights (RAC Remix) - YouTube"
  },
  "39" : {
    "dateAddedLocal" : "5/10/2016, 1:16:18 AM",
    "dateAddedUTC" : "2016-05-10T05:16:18.774Z",
    "description" : "",
    "favorited" : false,
    "hyperlink" : "http://brutalistwebsites.com/",
    "id" : "38",
    "index" : 169,
    "lastlocation" : -1,
    "newtag" : "",
    "parentId" : "1",
    "taglist" : [ "website-gallery" ],
    "text" : "Brutalist Websites "
  },
  "40" : {
    "dateAddedLocal" : "10/5/2014, 7:32:06 PM",
    "dateAddedUTC" : "2014-10-05T23:32:06.078Z",
    "description" : "Lorem ipsum dolor sit amet, consectetur adipiscing elit. Vivamus vel lectus ut turpis fermentum vestibulum. ",
    "favorited" : false,
    "hyperlink" : "http://api.jquery.com/category/effects/",
    "id" : "39",
    "index" : 8,
    "lastlocation" : -1,
    "newtag" : "",
    "parentId" : "36",
    "taglist" : [ "api", "javascript", "education" ],
    "text" : "Jquery Effects"
  },
  "41" : {
    "dateAddedLocal" : "12/10/2015, 6:57:54 PM",
    "dateAddedUTC" : "2015-12-10T23:57:54.597Z",
    "description" : "",
    "favorited" : false,
    "hyperlink" : "https://www.google.com/webhp?sourceid=chrome-instant&ion=1&espv=2&ie=UTF-8#q=kaballah%20boston",
    "id" : "40",
    "index" : 49,
    "lastlocation" : -1,
    "newtag" : "",
    "parentId" : "2",
    "taglist" : [ "boston", "wisdom" ],
    "text" : "Kaballah boston - Google Search"
  },
  "42" : {
    "dateAddedLocal" : "3/30/2015, 7:11:04 PM",
    "dateAddedUTC" : "2015-03-30T23:11:04.008Z",
    "description" : "The Recurse Center is a self-directed, community-driven educational retreat for programmers in New York City. ",
    "favorited" : false,
    "hyperlink" : "https://www.recurse.com/?redirected_from_hs=true",
    "id" : "41",
    "index" : 5,
    "lastlocation" : -1,
    "newtag" : "",
    "parentId" : "29",
    "taglist" : [ "education", "computer-science" ],
    "text" : "The Recurse Center"
  },
  "43" : {
    "dateAddedLocal" : "10/25/2014, 12:02:40 PM",
    "dateAddedUTC" : "2014-10-25T16:02:40.204Z",
    "description" : "Anti smoking campaign, nice website design.",
    "favorited" : false,
    "hyperlink" : "http://www.thetruth.com/facts",
    "id" : "42",
    "index" : 1,
    "lastlocation" : -1,
    "newtag" : "",
    "parentId" : "23",
    "taglist" : [ "wisdom" ],
    "text" : "Truth - The Facts"
  },
  "44" : {
    "dateAddedLocal" : "10/14/2017, 10:27:02 PM",
    "dateAddedUTC" : "2017-10-15T02:27:02.896Z",
    "description" : "The 6 most common SEO mistakes and how to avoid them.",
    "favorited" : false,
    "hyperlink" : "https://yoast.com/avoid-common-seo-mistakes/",
    "id" : "43",
    "index" : 122,
    "lastlocation" : -1,
    "newtag" : "",
    "parentId" : "1",
    "taglist" : [ "seo", "blog" ],
    "text" : "Yoast"
  },
  "45" : {
    "dateAddedLocal" : "9/24/2015, 4:09:34 PM",
    "dateAddedUTC" : "2015-09-24T20:09:34.083Z",
    "description" : "",
    "favorited" : false,
    "hyperlink" : "http://abookapart.com/products/responsible-responsive-design",
    "id" : "44",
    "index" : 7,
    "lastlocation" : -1,
    "newtag" : "",
    "parentId" : "48",
    "taglist" : [ "reading", "web-design" ],
    "text" : "A Book Apart, Responsible Responsive Design"
  },
  "46" : {
    "dateAddedLocal" : "9/8/2015, 9:37:06 PM",
    "dateAddedUTC" : "2015-09-09T01:37:06.917Z",
    "description" : "",
    "favorited" : false,
    "hyperlink" : "http://www.jonathan-sun.com/",
    "id" : "45",
    "index" : 4,
    "lastlocation" : -1,
    "newtag" : "",
    "parentId" : "50",
    "taglist" : [ "creative-agency", "portfolio", "mentors" ],
    "text" : "jonathan sun"
  },
  "47" : {
    "dateAddedLocal" : "9/23/2015, 8:57:59 PM",
    "dateAddedUTC" : "2015-09-24T00:57:59.493Z",
    "description" : "Lorem ipsum dolor sit amet, consectetur adipiscing elit. Vivamus vel lectus ut turpis fermentum vestibulum. ",
    "favorited" : false,
    "id" : "46",
    "index" : 52,
    "lastlocation" : -1,
    "newtag" : "",
    "parentId" : "2",
    "taglist" : [ "my-projects" ],
    "text" : "Zafu"
  },
  "48" : {
    "dateAddedLocal" : "1/16/2016, 1:07:51 PM",
    "dateAddedUTC" : "2016-01-16T18:07:51.774Z",
    "description" : "",
    "favorited" : false,
    "hyperlink" : "http://tools.pingdom.com/fpt/",
    "id" : "47",
    "index" : 11,
    "lastlocation" : -1,
    "newtag" : "",
    "parentId" : "65",
    "taglist" : [ "web-tools" ],
    "text" : "Website speed test"
  },
  "49" : {
    "dateAddedLocal" : "6/4/2017, 1:53:51 PM",
    "dateAddedUTC" : "2017-06-04T17:53:51.462Z",
    "description" : "",
    "favorited" : false,
    "hyperlink" : "http://www.vanschneider.com/",
    "id" : "48",
    "index" : 2,
    "lastlocation" : -1,
    "newtag" : "",
    "parentId" : "76",
    "taglist" : [ "creative-agency", "portfolio", "mentors" ],
    "text" : "Tobias van Schneider"
  },
  "50" : {
    "dateAddedLocal" : "1/27/2016, 9:45:08 AM",
    "dateAddedUTC" : "2016-01-27T14:45:08.068Z",
    "description" : " Creative Digital Production / Venice, CA",
    "favorited" : false,
    "hyperlink" : "http://activetheory.net/",
    "id" : "49",
    "index" : 160,
    "lastlocation" : -1,
    "newtag" : "",
    "parentId" : "1",
    "taglist" : [ "cretive-agency" ],
    "text" : "Active Theory /"
  },
  "51" : {
    "dateAddedLocal" : "11/21/2015, 2:06:46 PM",
    "dateAddedUTC" : "2015-11-21T19:06:46.929Z",
    "description" : "independent type foundry and type blog",
    "favorited" : false,
    "hyperlink" : "http://www.losttype.com/browse/",
    "id" : "50",
    "index" : 154,
    "lastlocation" : -1,
    "newtag" : "",
    "parentId" : "1",
    "taglist" : [ "typography" ],
    "text" : "LostType"
  },
  "52" : {
    "dateAddedLocal" : "6/4/2019, 11:42:23 PM",
    "dateAddedUTC" : "2019-06-05T03:42:23.723Z",
    "description" : "",
    "favorited" : false,
    "hyperlink" : "http://wiki.bakabt.me/index.php/IRC",
    "id" : "51",
    "index" : 98,
    "lastlocation" : -1,
    "newtag" : "",
    "parentId" : "2",
    "taglist" : [ "anime" ],
    "text" : "IRC - BakaBT Wiki"
  },
  "53" : {
    "dateAddedLocal" : "8/24/2014, 10:57:24 PM",
    "dateAddedUTC" : "2014-08-25T02:57:24.750Z",
    "description" : "",
    "favorited" : false,
    "hyperlink" : "http://kerningjs.com/",
    "id" : "52",
    "index" : 1,
    "lastlocation" : -1,
    "newtag" : "",
    "parentId" : "457",
    "taglist" : [ "typography" ],
    "text" : "Kerning.js"
  },
  "54" : {
    "dateAddedLocal" : "3/4/2019, 4:05:38 PM",
    "dateAddedUTC" : "2019-03-04T21:05:38.590Z",
    "description" : "",
    "favorited" : false,
    "hyperlink" : "https://reactjs.org/tutorial/tutorial.html",
    "id" : "53",
    "index" : 256,
    "lastlocation" : -1,
    "newtag" : "",
    "parentId" : "1",
    "taglist" : [ "education", "tutorials", "react.js", "javascript", "web-dev" ],
    "text" : "Tutorial: Intro to React â€“ React"
  },
  "55" : {
    "dateAddedLocal" : "2/11/2016, 3:54:28 PM",
    "dateAddedUTC" : "2016-02-11T20:54:28.960Z",
    "description" : "",
    "favorited" : false,
    "hyperlink" : "https://www.hellobonsai.com/best-freelance-tools?ref=producthunt",
    "id" : "54",
    "index" : 163,
    "lastlocation" : -1,
    "newtag" : "",
    "parentId" : "1",
    "taglist" : [ "web-dev", "web-tools" ],
    "text" : "Tools for Freelance Designers and Developers | Bonsai"
  },
  "56" : {
    "dateAddedLocal" : "11/25/2015, 2:36:39 PM",
    "dateAddedUTC" : "2015-11-25T19:36:39.202Z",
    "description" : "Record label website",
    "favorited" : false,
    "hyperlink" : "http://poobah.com/",
    "id" : "55",
    "index" : 142,
    "lastlocation" : -1,
    "newtag" : "",
    "parentId" : "1",
    "taglist" : [ "music" ],
    "text" : "Poobah "
  },
  "57" : {
    "dateAddedLocal" : "9/11/2018, 10:11:25 PM",
    "dateAddedUTC" : "2018-09-12T02:11:25.854Z",
    "description" : "NYC software designer portfolio, really nice modern design",
    "favorited" : false,
    "hyperlink" : "https://zhamed.com/",
    "id" : "56",
    "index" : 249,
    "lastlocation" : -1,
    "newtag" : "",
    "parentId" : "1",
    "taglist" : [ "portfolio", "creative-agency", "mentors" ],
    "text" : "https://zhamed.com/"
  },
  "58" : {
    "dateAddedLocal" : "6/10/2018, 11:12:52 PM",
    "dateAddedUTC" : "2018-06-11T03:12:52.344Z",
    "description" : "",
    "favorited" : false,
    "hyperlink" : "https://github.com/explore",
    "id" : "57",
    "index" : 39,
    "lastlocation" : -1,
    "newtag" : "",
    "parentId" : "1",
    "taglist" : [ "root", "computer-science" ],
    "text" : "Github explore"
  },
  "59" : {
    "dateAddedLocal" : "9/6/2018, 9:22:10 PM",
    "dateAddedUTC" : "2018-09-07T01:22:10.348Z",
    "description" : "CS Professor at Stanford with lots of online content",
    "favorited" : false,
    "hyperlink" : "http://crypto.stanford.edu/~dabo/",
    "id" : "58",
    "index" : 4,
    "lastlocation" : -1,
    "newtag" : "",
    "parentId" : "508",
    "taglist" : [ "education", "computer-science" ],
    "text" : "Dan Boneh"
  },
  "60" : {
    "dateAddedLocal" : "12/28/2017, 7:14:25 AM",
    "dateAddedUTC" : "2017-12-28T12:14:25.517Z",
    "description" : "Crypto landscape treemap",
    "favorited" : false,
    "hyperlink" : "http://cryptomaps.org/?ref=producthunt",
    "id" : "59",
    "index" : 87,
    "lastlocation" : -1,
    "newtag" : "",
    "parentId" : "1",
    "taglist" : [ "crypto", "data-viz" ],
    "text" : "Coin 360 "
  },
  "61" : {
    "dateAddedLocal" : "8/29/2015, 9:35:24 PM",
    "dateAddedUTC" : "2015-08-30T01:35:24.878Z",
    "description" : "Creative studio",
    "favorited" : false,
    "hyperlink" : "http://superfamous.com/",
    "id" : "60",
    "index" : 1,
    "lastlocation" : -1,
    "newtag" : "",
    "parentId" : "50",
    "taglist" : [ "creative-agency" ],
    "text" : "Superfamous â€” Folkert Gorter"
  },
  "62" : {
    "dateAddedLocal" : "2/26/2015, 11:45:07 AM",
    "dateAddedUTC" : "2015-02-26T16:45:07.903Z",
    "description" : "",
    "favorited" : false,
    "hyperlink" : "http://www.typography.com/",
    "id" : "61",
    "index" : 0,
    "lastlocation" : -1,
    "newtag" : "",
    "parentId" : "24",
    "taglist" : [ "typography" ],
    "text" : "Hoefler & Co. Typography.com"
  },
  "63" : {
    "dateAddedLocal" : "4/6/2015, 2:22:53 PM",
    "dateAddedUTC" : "2015-04-06T18:22:53.418Z",
    "description" : "Web Design Inspiration",
    "favorited" : false,
    "hyperlink" : "http://www.siteinspire.com/",
    "id" : "62",
    "index" : 5,
    "lastlocation" : -1,
    "newtag" : "",
    "parentId" : "38",
    "taglist" : [ "website-gallery" ],
    "text" : "SiteInspire"
  },
  "64" : {
    "dateAddedLocal" : "3/21/2018, 9:38:39 PM",
    "dateAddedUTC" : "2018-03-22T01:38:39.863Z",
    "description" : "",
    "favorited" : false,
    "hyperlink" : "https://www.investopedia.com/",
    "id" : "63",
    "index" : 73,
    "lastlocation" : -1,
    "newtag" : "",
    "parentId" : "1",
    "taglist" : [ "education", "finance", "root" ],
    "text" : "Investopedia "
  },
  "65" : {
    "dateAddedLocal" : "2/6/2016, 10:54:36 PM",
    "dateAddedUTC" : "2016-02-07T03:54:36.801Z",
    "description" : "A beautiful resort in Morocoo",
    "favorited" : false,
    "hyperlink" : "http://ane-vert.com/",
    "id" : "64",
    "index" : 161,
    "lastlocation" : -1,
    "newtag" : "",
    "parentId" : "1",
    "taglist" : [ "travel", "resorts", "africa" ],
    "text" : "Welcome to L'Ã¢ne vert / Bienvenue Ã  l'Ã¢ne vert"
  },
  "66" : {
    "dateAddedLocal" : "10/24/2016, 10:42:48 PM",
    "dateAddedUTC" : "2016-10-25T02:42:48.559Z",
    "description" : "Lorem ipsum dolor sit amet, consectetur adipiscing elit. Vivamus vel lectus ut turpis fermentum vestibulum. ",
    "favorited" : false,
    "hyperlink" : "http://plants.usda.gov/core/profile?symbol=ORVU",
    "id" : "65",
    "index" : 9,
    "lastlocation" : -1,
    "newtag" : "",
    "parentId" : "666",
    "taglist" : [ "plants", "botany", "data" ],
    "text" : "USDA maps for plants"
  },
  "67" : {
    "dateAddedLocal" : "9/24/2015, 3:43:43 PM",
    "dateAddedUTC" : "2015-09-24T19:43:43.397Z",
    "description" : "Patterns and Resources for Responsive Web Design",
    "favorited" : false,
    "hyperlink" : "http://bradfrost.github.io/this-is-responsive/",
    "id" : "66",
    "index" : 0,
    "lastlocation" : -1,
    "newtag" : "",
    "parentId" : "48",
    "taglist" : [ "web-design", "web-tools", "responsive" ],
    "text" : "This Is Responsive "
  },
  "68" : {
    "dateAddedLocal" : "10/16/2016, 7:42:53 PM",
    "dateAddedUTC" : "2016-10-16T23:42:53.820Z",
    "description" : "flickr gallery",
    "favorited" : false,
    "hyperlink" : "https://www.flickr.com/photos/biodivlibrary/albums",
    "id" : "67",
    "index" : 4,
    "lastlocation" : -1,
    "newtag" : "",
    "parentId" : "666",
    "taglist" : [ "botany", "plants" ],
    "text" : "Old Botanical drawings "
  },
  "69" : {
    "dateAddedLocal" : "10/24/2016, 10:42:36 PM",
    "dateAddedUTC" : "2016-10-25T02:42:36.762Z",
    "description" : "Mike Bostock dendrogram",
    "favorited" : false,
    "hyperlink" : "http://mbostock.github.io/d3/talk/20111018/tree.html",
    "id" : "68",
    "index" : 8,
    "lastlocation" : -1,
    "newtag" : "",
    "parentId" : "666",
    "taglist" : [ "data-viz" ],
    "text" : "Dendrogram"
  },
  "70" : {
    "dateAddedLocal" : "3/9/2015, 2:34:51 PM",
    "dateAddedUTC" : "2015-03-09T18:34:51.704Z",
    "description" : "code websites to properly get indexed by Google, with rich snippets.",
    "favorited" : false,
    "hyperlink" : "http://schema.org/",
    "id" : "69",
    "index" : 12,
    "lastlocation" : -1,
    "newtag" : "",
    "parentId" : "65",
    "taglist" : [ "root", "education", "seo" ],
    "text" : "Home - schema.org"
  },
  "71" : {
    "dateAddedLocal" : "9/8/2015, 10:06:59 AM",
    "dateAddedUTC" : "2015-09-08T14:06:59.552Z",
    "description" : "Boston's Best Events, Restaurants, & Bars",
    "favorited" : false,
    "hyperlink" : "http://weekendpick.com/",
    "id" : "70",
    "index" : 5,
    "lastlocation" : -1,
    "newtag" : "",
    "parentId" : "42",
    "taglist" : [ "boston" ],
    "text" : "Weekend Pick"
  },
  "72" : {
    "dateAddedLocal" : "8/25/2017, 10:08:20 AM",
    "dateAddedUTC" : "2017-08-25T14:08:20.774Z",
    "description" : "indie cooking blog",
    "favorited" : false,
    "hyperlink" : "http://sugarfreenyc.com/",
    "id" : "71",
    "index" : 0,
    "lastlocation" : -1,
    "newtag" : "",
    "parentId" : "580",
    "taglist" : [ "cooking", "blog" ],
    "text" : "SugarfreeNYC"
  },
  "73" : {
    "dateAddedLocal" : "8/3/2018, 3:58:07 PM",
    "dateAddedUTC" : "2018-08-03T19:58:07.377Z",
    "description" : "Lorem ipsum dolor sit amet, consectetur adipiscing elit. Vivamus vel lectus ut turpis fermentum vestibulum. ",
    "favorited" : false,
    "hyperlink" : "http://jscolor.com/",
    "id" : "72",
    "index" : 242,
    "lastlocation" : -1,
    "newtag" : "",
    "parentId" : "1",
    "taglist" : [ "color-tool", "web-tools" ],
    "text" : "jscolor - JavaScript Color Picker (Palette) with touch support"
  },
  "74" : {
    "dateAddedLocal" : "1/14/2018, 9:37:06 PM",
    "dateAddedUTC" : "2018-01-15T02:37:06.511Z",
    "description" : "Lorem ipsum dolor sit amet, consectetur adipiscing elit. Vivamus vel lectus ut turpis fermentum vestibulum. ",
    "favorited" : false,
    "hyperlink" : "https://ertdfgcvb.xyz/",
    "id" : "73",
    "index" : 5,
    "lastlocation" : -1,
    "newtag" : "",
    "parentId" : "549",
    "taglist" : [ "creative-agency", "cypherpunk" ],
    "text" : "ertdfgcvb"
  },
  "75" : {
    "dateAddedLocal" : "8/10/2015, 1:36:37 AM",
    "dateAddedUTC" : "2015-08-10T05:36:37.186Z",
    "description" : "Lorem ipsum dolor sit amet, consectetur adipiscing elit. Vivamus vel lectus ut turpis fermentum vestibulum. ",
    "favorited" : false,
    "id" : "74",
    "index" : 33,
    "lastlocation" : -1,
    "newtag" : "",
    "parentId" : "2",
    "taglist" : [ "zafu" ],
    "text" : "zafu bg videos"
  },
  "76" : {
    "dateAddedLocal" : "5/2/2019, 11:03:32 AM",
    "dateAddedUTC" : "2019-05-02T15:03:32.944Z",
    "description" : "Lorem ipsum dolor sit amet, consectetur adipiscing elit. Vivamus vel lectus ut turpis fermentum vestibulum. ",
    "favorited" : false,
    "hyperlink" : "https://mail.google.com/mail/u/0/#inbox/FMfcgxwCgVTbTzMxctVxSxbkKbphFMJC",
    "id" : "75",
    "index" : 19,
    "lastlocation" : -1,
    "newtag" : "",
    "parentId" : "1",
    "taglist" : [ "graphic-design", "career" ],
    "text" : "AIGA Jobs"
  },
  "77" : {
    "dateAddedLocal" : "9/10/2016, 12:31:33 PM",
    "dateAddedUTC" : "2016-09-10T16:31:33.452Z",
    "description" : "Lorem ipsum dolor sit amet, consectetur adipiscing elit. Vivamus vel lectus ut turpis fermentum vestibulum. ",
    "favorited" : false,
    "hyperlink" : "https://www.ventusky.com/?p=29.8;-72.1;3&l=temperature&t=20160910/03",
    "id" : "76",
    "index" : 193,
    "lastlocation" : -1,
    "newtag" : "",
    "parentId" : "1",
    "taglist" : [ "data-viz" ],
    "text" : "Ventusky - Wind, Rain and Temperature Maps"
  },
  "78" : {
    "dateAddedLocal" : "10/10/2017, 5:18:24 PM",
    "dateAddedUTC" : "2017-10-10T21:18:24.960Z",
    "description" : "Lorem ipsum dolor sit amet, consectetur adipiscing elit. Vivamus vel lectus ut turpis fermentum vestibulum. ",
    "favorited" : false,
    "hyperlink" : "https://www.cybrary.it/",
    "id" : "77",
    "index" : 231,
    "lastlocation" : -1,
    "newtag" : "",
    "parentId" : "1",
    "taglist" : [ "cypherpunk", "cybersecurity", "education" ],
    "text" : "Cybrary - Online Cyber Security Training, Free, Forever"
  },
  "79" : {
    "dateAddedLocal" : "1/27/2019, 9:37:31 PM",
    "dateAddedUTC" : "2019-01-28T02:37:31.035Z",
    "description" : "Lorem ipsum dolor sit amet, consectetur adipiscing elit. Vivamus vel lectus ut turpis fermentum vestibulum. ",
    "favorited" : false,
    "hyperlink" : "https://framer.com/",
    "id" : "78",
    "index" : 264,
    "lastlocation" : -1,
    "newtag" : "",
    "parentId" : "1",
    "taglist" : [ "web-tools", "graphic-design" ],
    "text" : "Framer"
  },
  "80" : {
    "dateAddedLocal" : "4/8/2019, 9:01:12 PM",
    "dateAddedUTC" : "2019-04-09T01:01:12.609Z",
    "description" : "Lorem ipsum dolor sit amet, consectetur adipiscing elit. Vivamus vel lectus ut turpis fermentum vestibulum. ",
    "favorited" : false,
    "hyperlink" : "https://www.mylt.life/clubs/ma/chestnut-hill/classes.html?selecteddate=2019-04-08",
    "id" : "79",
    "index" : 23,
    "lastlocation" : -1,
    "newtag" : "",
    "parentId" : "1",
    "taglist" : [ "root", "health", "boston" ],
    "text" : "GYM SCHEDULE"
  },
  "81" : {
    "dateAddedLocal" : "10/27/2014, 10:10:10 PM",
    "dateAddedUTC" : "2014-10-28T02:10:10.000Z",
    "description" : "SMS messages visualization",
    "favorited" : false,
    "hyperlink" : "http://sandbox.aaronkoblin.com/projects/amsterdam/",
    "id" : "80",
    "index" : 2,
    "lastlocation" : -1,
    "newtag" : "",
    "parentId" : "392",
    "taglist" : [ "portfolio", "MIT", "creative-agency", "data-viz" ],
    "text" : "Aaron Koblin - Sand Box - Amsterdam SMS Messages"
  },
  "82" : {
    "dateAddedLocal" : "2/6/2019, 11:13:11 PM",
    "dateAddedUTC" : "2019-02-07T04:13:11.710Z",
    "description" : "Lorem ipsum dolor sit amet, consectetur adipiscing elit. Vivamus vel lectus ut turpis fermentum vestibulum. ",
    "favorited" : false,
    "hyperlink" : "https://www.lawofone.info/results.php?c=Meditation",
    "id" : "81",
    "index" : 308,
    "lastlocation" : -1,
    "newtag" : "",
    "parentId" : "1",
    "taglist" : [ "wisdom", "meditation" ],
    "text" : "The Law of One Category Meditation"
  },
  "83" : {
    "dateAddedLocal" : "9/7/2016, 5:42:35 PM",
    "dateAddedUTC" : "2016-09-07T21:42:35.200Z",
    "description" : "Lorem ipsum dolor sit amet, consectetur adipiscing elit. Vivamus vel lectus ut turpis fermentum vestibulum. ",
    "favorited" : false,
    "hyperlink" : "http://nuweb5.neu.edu/nuhoc/",
    "id" : "82",
    "index" : 191,
    "lastlocation" : -1,
    "newtag" : "",
    "parentId" : "1",
    "taglist" : [ "boston" ],
    "text" : "NUHOC"
  },
  "84" : {
    "dateAddedLocal" : "7/9/2018, 6:14:56 PM",
    "dateAddedUTC" : "2018-07-09T22:14:56.819Z",
    "description" : "crypto analysis platform",
    "favorited" : false,
    "hyperlink" : "https://sanbase-low.santiment.net/projects/tron",
    "id" : "83",
    "index" : 0,
    "lastlocation" : -1,
    "newtag" : "",
    "parentId" : "502",
    "taglist" : [ "crypto" ],
    "text" : "Santiment"
  },
  "85" : {
    "dateAddedLocal" : "8/20/2014, 2:18:28 PM",
    "dateAddedUTC" : "2014-08-20T18:18:28.281Z",
    "description" : "Lorem ipsum dolor sit amet, consectetur adipiscing elit. Vivamus vel lectus ut turpis fermentum vestibulum. ",
    "favorited" : false,
    "hyperlink" : "http://www.amazon.com/Eat-Drink-Be-Healthy-Harvard/dp/0743266420/ref=sr_1_3?ie=UTF8&qid=1408550736&sr=8-3&keywords=nutrition",
    "id" : "84",
    "index" : 0,
    "lastlocation" : -1,
    "newtag" : "",
    "parentId" : "17",
    "taglist" : [ "reading", "books" ],
    "text" : "Eat, Drink, and Be Healthy, Harvard Med School"
  },
  "86" : {
    "dateAddedLocal" : "10/5/2016, 7:58:44 PM",
    "dateAddedUTC" : "2016-10-05T23:58:44.156Z",
    "description" : "Lorem ipsum dolor sit amet, consectetur adipiscing elit. Vivamus vel lectus ut turpis fermentum vestibulum. ",
    "favorited" : false,
    "hyperlink" : "http://upstatement.com/about/",
    "id" : "85",
    "index" : 201,
    "lastlocation" : -1,
    "newtag" : "",
    "parentId" : "1",
    "taglist" : [ "creative-agency" ],
    "text" : "About | Upstatement"
  },
  "87" : {
    "dateAddedLocal" : "6/26/2014, 8:19:35 AM",
    "dateAddedUTC" : "2014-06-26T12:19:35.830Z",
    "description" : "Lorem ipsum dolor sit amet, consectetur adipiscing elit. Vivamus vel lectus ut turpis fermentum vestibulum. ",
    "favorited" : false,
    "hyperlink" : "http://thecharlesnyc.com/",
    "id" : "86",
    "index" : 11,
    "lastlocation" : -1,
    "newtag" : "",
    "parentId" : "35",
    "taglist" : [ "creative-agency" ],
    "text" : "The Charles NYC - Full service creative and digital agency"
  },
  "88" : {
    "dateAddedLocal" : "9/4/2014, 1:20:06 PM",
    "dateAddedUTC" : "2014-09-04T17:20:06.659Z",
    "description" : "Lorem ipsum dolor sit amet, consectetur adipiscing elit. Vivamus vel lectus ut turpis fermentum vestibulum. ",
    "favorited" : false,
    "hyperlink" : "http://pitchfork.com/reviews/albums/19715-sinkane-mean-love/",
    "id" : "87",
    "index" : 12,
    "lastlocation" : -1,
    "newtag" : "",
    "parentId" : "49",
    "taglist" : [ "music" ],
    "text" : "Sinkane: Mean Love | Album Reviews | Pitchfork"
  },
  "89" : {
    "dateAddedLocal" : "9/14/2014, 6:57:32 PM",
    "dateAddedUTC" : "2014-09-14T22:57:32.155Z",
    "description" : "Lorem ipsum dolor sit amet, consectetur adipiscing elit. Vivamus vel lectus ut turpis fermentum vestibulum. ",
    "favorited" : false,
    "hyperlink" : "https://www.youtube.com/watch?v=aiYzrCjS02k",
    "id" : "88",
    "index" : 36,
    "lastlocation" : -1,
    "newtag" : "",
    "parentId" : "49",
    "taglist" : [ "music" ],
    "text" : "RJD2 - Deadringer (Full Album) - YouTube"
  },
  "90" : {
    "dateAddedLocal" : "8/3/2018, 12:10:35 PM",
    "dateAddedUTC" : "2018-08-03T16:10:35.245Z",
    "description" : "Lorem ipsum dolor sit amet, consectetur adipiscing elit. Vivamus vel lectus ut turpis fermentum vestibulum. ",
    "favorited" : false,
    "hyperlink" : "https://www.chainalysis.com/",
    "id" : "89",
    "index" : 3,
    "lastlocation" : -1,
    "newtag" : "c",
    "parentId" : "508",
    "taglist" : [ "crypto" ],
    "text" : "Chainalysis â€“ Blockchain analysis"
  },
  "91" : {
    "dateAddedLocal" : "9/22/2015, 10:05:54 AM",
    "dateAddedUTC" : "2015-09-22T14:05:54.471Z",
    "description" : "Lorem ipsum dolor sit amet, consectetur adipiscing elit. Vivamus vel lectus ut turpis fermentum vestibulum. ",
    "favorited" : false,
    "hyperlink" : "http://www.interrobangletterpress.com/html/type.php",
    "id" : "90",
    "index" : 34,
    "lastlocation" : -1,
    "newtag" : "",
    "parentId" : "2",
    "taglist" : [ "graphic-design", "boston" ],
    "text" : "interrobang letterpress | Jamaica Plain"
  },
  "92" : {
    "dateAddedLocal" : "5/31/2018, 8:43:48 PM",
    "dateAddedUTC" : "2018-06-01T00:43:48.842Z",
    "description" : "Lorem ipsum dolor sit amet, consectetur adipiscing elit. Vivamus vel lectus ut turpis fermentum vestibulum. ",
    "favorited" : false,
    "hyperlink" : "https://www.builtincolorado.com/",
    "id" : "91",
    "index" : 55,
    "lastlocation" : -1,
    "newtag" : "",
    "parentId" : "1",
    "taglist" : [ "colorado" ],
    "text" : "Built in Colorado"
  },
  "93" : {
    "dateAddedLocal" : "4/14/2019, 10:52:50 PM",
    "dateAddedUTC" : "2019-04-15T02:52:50.926Z",
    "description" : "architecture firm",
    "favorited" : false,
    "hyperlink" : "https://ar-ma.net/work",
    "id" : "92",
    "index" : 42,
    "lastlocation" : 79,
    "newtag" : "",
    "parentId" : "1",
    "taglist" : [ "architecture", "creative-agency" ],
    "text" : "AR-MA"
  },
  "94" : {
    "dateAddedLocal" : "12/24/2017, 2:50:56 AM",
    "dateAddedUTC" : "2017-12-24T07:50:56.200Z",
    "description" : "Lorem ipsum dolor sit amet, consectetur adipiscing elit. Vivamus vel lectus ut turpis fermentum vestibulum. ",
    "favorited" : false,
    "hyperlink" : "https://www.bitstamp.net/",
    "id" : "93",
    "index" : 90,
    "lastlocation" : -1,
    "newtag" : "",
    "parentId" : "1",
    "taglist" : [ "crypto" ],
    "text" : "BitStamp"
  },
  "95" : {
    "dateAddedLocal" : "8/27/2015, 10:36:35 PM",
    "dateAddedUTC" : "2015-08-28T02:36:35.585Z",
    "description" : "clothing store online",
    "favorited" : false,
    "hyperlink" : "http://www.etro.com/en_us/man/autumn-winter-15-16/shirts.html#p=2&gan_data=true",
    "id" : "94",
    "index" : 6,
    "lastlocation" : -1,
    "newtag" : "",
    "parentId" : "25",
    "taglist" : [ "clothing" ],
    "text" : "ETRO Men's Shirts | Fall Winter 15-16"
  },
  "96" : {
    "dateAddedLocal" : "4/28/2014, 6:59:59 PM",
    "dateAddedUTC" : "2014-04-28T22:59:59.681Z",
    "description" : "Lorem ipsum dolor sit amet, consectetur adipiscing elit. Vivamus vel lectus ut turpis fermentum vestibulum. ",
    "favorited" : false,
    "hyperlink" : "http://www.youtube.com/watch?v=-CG4jzqUdCM",
    "id" : "95",
    "index" : 3,
    "lastlocation" : -1,
    "newtag" : "",
    "parentId" : "189",
    "taglist" : [ "music" ],
    "text" : "ANTY the ç´…ä¹ƒå£± [Kunoichi] - Kick the door - HipHop"
  },
  "97" : {
    "dateAddedLocal" : "1/30/2014, 10:47:20 PM",
    "dateAddedUTC" : "2014-01-31T03:47:20.748Z",
    "description" : "Lorem ipsum dolor sit amet, consectetur adipiscing elit. Vivamus vel lectus ut turpis fermentum vestibulum. ",
    "favorited" : false,
    "hyperlink" : "http://farshchian.deviantart.com/art/The-Crystal-Ball-48631258",
    "id" : "96",
    "index" : 1,
    "lastlocation" : -1,
    "newtag" : "",
    "parentId" : "12",
    "taglist" : [ "art" ],
    "text" : "The Crystal Ball by Farshchian on deviantART"
  },
  "98" : {
    "dateAddedLocal" : "10/18/2016, 5:47:19 PM",
    "dateAddedUTC" : "2016-10-18T21:47:19.346Z",
    "description" : "Lorem ipsum dolor sit amet, consectetur adipiscing elit. Vivamus vel lectus ut turpis fermentum vestibulum. ",
    "favorited" : false,
    "hyperlink" : "https://catalog.data.gov/dataset/plants",
    "id" : "97",
    "index" : 5,
    "lastlocation" : -1,
    "newtag" : "",
    "parentId" : "666",
    "taglist" : [ "data-viz" ],
    "text" : "PLANTS - Data.gov"
  },
  "99" : {
    "dateAddedLocal" : "6/5/2016, 4:45:10 PM",
    "dateAddedUTC" : "2016-06-05T20:45:10.809Z",
    "description" : "Lorem ipsum dolor sit amet, consectetur adipiscing elit. Vivamus vel lectus ut turpis fermentum vestibulum. ",
    "favorited" : false,
    "hyperlink" : "http://www.frc.ri.cmu.edu/~hpm/project.archive/general.articles/1998/SimConEx.98.html",
    "id" : "98",
    "index" : 173,
    "lastlocation" : -1,
    "newtag" : "",
    "parentId" : "1",
    "taglist" : [ "wisdom", "philosophy" ],
    "text" : "Simulation, Consciousness, Existence -- Hans Moravec, 1998"
  },
  "100" : {
    "dateAddedLocal" : "8/29/2015, 9:43:05 PM",
    "dateAddedUTC" : "2015-08-30T01:43:05.372Z",
    "description" : "Lorem ipsum dolor sit amet, consectetur adipiscing elit. Vivamus vel lectus ut turpis fermentum vestibulum. ",
    "favorited" : false,
    "hyperlink" : "http://www.siteinspire.com/",
    "id" : "99",
    "index" : 149,
    "lastlocation" : -1,
    "newtag" : "",
    "parentId" : "1",
    "taglist" : [ "website-gallery" ],
    "text" : "SiteInspire"
  },
  "101" : {
    "dateAddedLocal" : "6/8/2018, 12:47:04 PM",
    "dateAddedUTC" : "2018-06-08T16:47:04.653Z",
    "description" : "Lorem ipsum dolor sit amet, consectetur adipiscing elit. Vivamus vel lectus ut turpis fermentum vestibulum. ",
    "favorited" : false,
    "hyperlink" : "http://bahaasamir.me/jafenart/",
    "id" : "100",
    "index" : 59,
    "lastlocation" : -1,
    "newtag" : "",
    "parentId" : "1",
    "taglist" : [ "creative-agency" ],
    "text" : "Jafen Art Studio"
  },
  "102" : {
    "dateAddedLocal" : "8/29/2015, 9:33:51 PM",
    "dateAddedUTC" : "2015-08-30T01:33:51.202Z",
    "description" : "Lorem ipsum dolor sit amet, consectetur adipiscing elit. Vivamus vel lectus ut turpis fermentum vestibulum. ",
    "favorited" : false,
    "hyperlink" : "http://hoverstat.es/",
    "id" : "101",
    "index" : 147,
    "lastlocation" : -1,
    "newtag" : "",
    "parentId" : "1",
    "taglist" : [ "website-gallery" ],
    "text" : "Hoverstates"
  },
  "103" : {
    "dateAddedLocal" : "6/5/2018, 1:01:05 AM",
    "dateAddedUTC" : "2018-06-05T05:01:05.766Z",
    "description" : "Lorem ipsum dolor sit amet, consectetur adipiscing elit. Vivamus vel lectus ut turpis fermentum vestibulum. ",
    "favorited" : false,
    "hyperlink" : "http://micahmador.com/11-steps-to-plug-into-the-boulder-denver-startup-scene/",
    "id" : "102",
    "index" : 60,
    "lastlocation" : -1,
    "newtag" : "",
    "parentId" : "1",
    "taglist" : [ "colorado", "career" ],
    "text" : "11 Steps to Plug into the Boulder/Denver StartupÂ Scene "
  },
  "104" : {
    "dateAddedLocal" : "1/14/2016, 2:44:52 AM",
    "dateAddedUTC" : "2016-01-14T07:44:52.048Z",
    "description" : "Lorem ipsum dolor sit amet, consectetur adipiscing elit. Vivamus vel lectus ut turpis fermentum vestibulum. ",
    "favorited" : false,
    "hyperlink" : "http://neilpatel.com/2015/07/07/the-on-page-seo-cheat-sheet/",
    "id" : "103",
    "index" : 4,
    "lastlocation" : -1,
    "newtag" : "",
    "parentId" : "65",
    "taglist" : [ "seo", "marketing" ],
    "text" : "seo checklist - neil patel"
  },
  "105" : {
    "dateAddedLocal" : "9/11/2014, 5:14:06 PM",
    "dateAddedUTC" : "2014-09-11T21:14:06.272Z",
    "description" : "Lorem ipsum dolor sit amet, consectetur adipiscing elit. Vivamus vel lectus ut turpis fermentum vestibulum. ",
    "favorited" : false,
    "hyperlink" : "http://madebyevan.com/webgl-water/",
    "id" : "104",
    "index" : 4,
    "lastlocation" : -1,
    "newtag" : "",
    "parentId" : "756",
    "taglist" : [ "webgl", "3d", "web-tools" ],
    "text" : "WebGL Water"
  },
  "106" : {
    "dateAddedLocal" : "10/8/2017, 3:02:16 PM",
    "dateAddedUTC" : "2017-10-08T19:02:16.975Z",
    "description" : "Lorem ipsum dolor sit amet, consectetur adipiscing elit. Vivamus vel lectus ut turpis fermentum vestibulum. ",
    "favorited" : false,
    "hyperlink" : "http://annarosa.com/",
    "id" : "105",
    "index" : 0,
    "lastlocation" : -1,
    "newtag" : "",
    "parentId" : "549",
    "taglist" : [ "portfolio", "creative-agency" ],
    "text" : "Anna Rosa Krau"
  },
  "107" : {
    "dateAddedLocal" : "1/25/2019, 9:50:12 PM",
    "dateAddedUTC" : "2019-01-26T02:50:12.766Z",
    "description" : "Lorem ipsum dolor sit amet, consectetur adipiscing elit. Vivamus vel lectus ut turpis fermentum vestibulum. ",
    "favorited" : false,
    "hyperlink" : "https://jobs.lever.co/kensho/d9ab8128-1a07-4425-ad36-c1556a0cc0af/apply",
    "id" : "106",
    "index" : 89,
    "lastlocation" : -1,
    "newtag" : "",
    "parentId" : "2",
    "taglist" : [ "fintech", "boston", "career" ],
    "text" : "Kensho - UX & Data Visualization Designer"
  },
  "108" : {
    "dateAddedLocal" : "7/16/2018, 7:22:55 PM",
    "dateAddedUTC" : "2018-07-16T23:22:55.613Z",
    "description" : "Lorem ipsum dolor sit amet, consectetur adipiscing elit. Vivamus vel lectus ut turpis fermentum vestibulum. ",
    "favorited" : false,
    "hyperlink" : "https://www.thedailybit.news/",
    "id" : "107",
    "index" : 90,
    "lastlocation" : -1,
    "newtag" : "",
    "parentId" : "2",
    "taglist" : [ "crypto" ],
    "text" : " dailybit cryptonews "
  },
  "109" : {
    "dateAddedLocal" : "3/31/2015, 1:08:43 AM",
    "dateAddedUTC" : "2015-03-31T05:08:43.934Z",
    "description" : "Lorem ipsum dolor sit amet, consectetur adipiscing elit. Vivamus vel lectus ut turpis fermentum vestibulum. ",
    "favorited" : false,
    "hyperlink" : "http://en.wikipedia.org/wiki/Om_Namah_Shivaya",
    "id" : "108",
    "index" : 1,
    "lastlocation" : -1,
    "newtag" : "c",
    "parentId" : "26",
    "taglist" : [ "wisdom" ],
    "text" : "Om Namah Shivaya "
  },
  "110" : {
    "dateAddedLocal" : "10/15/2018, 3:21:48 AM",
    "dateAddedUTC" : "2018-10-15T07:21:48.723Z",
    "description" : "Lorem ipsum dolor sit amet, consectetur adipiscing elit. Vivamus vel lectus ut turpis fermentum vestibulum. ",
    "favorited" : false,
    "hyperlink" : "https://www.underarmour.com/en-us/mens-ua-cage-shorts/pid1304127-001",
    "id" : "109",
    "index" : 81,
    "lastlocation" : 108,
    "newtag" : "",
    "parentId" : "2",
    "taglist" : [ "clothing" ],
    "text" : "Men's UA Cage Shorts | Under Armour US"
  },
  "111" : {
    "dateAddedLocal" : "5/7/2015, 3:17:12 PM",
    "dateAddedUTC" : "2015-05-07T19:17:12.914Z",
    "description" : "Lorem ipsum dolor sit amet, consectetur adipiscing elit. Vivamus vel lectus ut turpis fermentum vestibulum. ",
    "favorited" : false,
    "hyperlink" : "http://www.farfetch.com/",
    "id" : "110",
    "index" : 2,
    "lastlocation" : -1,
    "newtag" : "",
    "parentId" : "25",
    "taglist" : [ "clothing" ],
    "text" : "Fartetch"
  },
  "112" : {
    "dateAddedLocal" : "1/14/2016, 2:22:48 AM",
    "dateAddedUTC" : "2016-01-14T07:22:48.589Z",
    "description" : "Lorem ipsum dolor sit amet, consectetur adipiscing elit. Vivamus vel lectus ut turpis fermentum vestibulum. ",
    "favorited" : false,
    "hyperlink" : "http://neilpatel.com/",
    "id" : "111",
    "index" : 22,
    "lastlocation" : -1,
    "newtag" : "",
    "parentId" : "65",
    "taglist" : [ "seo", "marketing" ],
    "text" : "Neil Patel"
  },
  "113" : {
    "dateAddedLocal" : "1/15/2019, 11:05:18 AM",
    "dateAddedUTC" : "2019-01-15T16:05:18.178Z",
    "description" : "Lorem ipsum dolor sit amet, consectetur adipiscing elit. Vivamus vel lectus ut turpis fermentum vestibulum. ",
    "favorited" : false,
    "hyperlink" : "https://divinityclothingshop.bigcartel.com/",
    "id" : "112",
    "index" : 291,
    "lastlocation" : -1,
    "newtag" : "",
    "parentId" : "1",
    "taglist" : [ "my-projects" ],
    "text" : "Divinity Clothing BigCartel"
  },
  "114" : {
    "dateAddedLocal" : "3/25/2018, 5:59:50 PM",
    "dateAddedUTC" : "2018-03-25T21:59:50.347Z",
    "description" : "Lorem ipsum dolor sit amet, consectetur adipiscing elit. Vivamus vel lectus ut turpis fermentum vestibulum. ",
    "favorited" : false,
    "hyperlink" : "http://www.greenhornconnect.com/events/",
    "id" : "113",
    "index" : 66,
    "lastlocation" : -1,
    "newtag" : "",
    "parentId" : "1",
    "taglist" : [ "boston", "career" ],
    "text" : "Greenhorn Connect"
  },
  "115" : {
    "dateAddedLocal" : "11/21/2018, 2:52:16 PM",
    "dateAddedUTC" : "2018-11-21T19:52:16.453Z",
    "description" : "Lorem ipsum dolor sit amet, consectetur adipiscing elit. Vivamus vel lectus ut turpis fermentum vestibulum. ",
    "favorited" : false,
    "hyperlink" : "https://thechalkboardmag.com/",
    "id" : "114",
    "index" : 284,
    "lastlocation" : -1,
    "newtag" : "",
    "parentId" : "1",
    "taglist" : [ "blog", "health" ],
    "text" : "Chalkboard Mag"
  },
  "116" : {
    "dateAddedLocal" : "9/6/2018, 9:13:15 PM",
    "dateAddedUTC" : "2018-09-07T01:13:15.817Z",
    "description" : "Lorem ipsum dolor sit amet, consectetur adipiscing elit. Vivamus vel lectus ut turpis fermentum vestibulum. ",
    "favorited" : false,
    "hyperlink" : "http://www.michaelnielsen.org/ddi/how-the-bitcoin-protocol-actually-works/",
    "id" : "115",
    "index" : 5,
    "lastlocation" : -1,
    "newtag" : "",
    "parentId" : "508",
    "taglist" : [ "crypto" ],
    "text" : "How the Bitcoin protocol actually works "
  },
  "117" : {
    "dateAddedLocal" : "7/4/2017, 1:03:52 AM",
    "dateAddedUTC" : "2017-07-04T05:03:52.183Z",
    "description" : "Lorem ipsum dolor sit amet, consectetur adipiscing elit. Vivamus vel lectus ut turpis fermentum vestibulum. ",
    "favorited" : false,
    "hyperlink" : "https://prohashing.com/help.html#tuning-main",
    "id" : "116",
    "index" : 228,
    "lastlocation" : -1,
    "newtag" : "",
    "parentId" : "1",
    "taglist" : [ "crypto", "mining" ],
    "text" : "Prohashing"
  },
  "118" : {
    "dateAddedLocal" : "9/3/2014, 11:31:15 PM",
    "dateAddedUTC" : "2014-09-04T03:31:15.837Z",
    "description" : "Lorem ipsum dolor sit amet, consectetur adipiscing elit. Vivamus vel lectus ut turpis fermentum vestibulum. ",
    "favorited" : false,
    "hyperlink" : "https://www.youtube.com/watch?v=3nyWvGJM3rE&feature=youtu.be",
    "id" : "117",
    "index" : 33,
    "lastlocation" : -1,
    "newtag" : "",
    "parentId" : "49",
    "taglist" : [ "music" ],
    "text" : "The Contortionist \"Language I: Intuition\" - YouTube"
  },
  "119" : {
    "dateAddedLocal" : "9/28/2015, 10:51:12 AM",
    "dateAddedUTC" : "2015-09-28T14:51:12.179Z",
    "description" : "Lorem ipsum dolor sit amet, consectetur adipiscing elit. Vivamus vel lectus ut turpis fermentum vestibulum. ",
    "favorited" : false,
    "hyperlink" : "http://dow-smith.com/?utm_source=designernews",
    "id" : "118",
    "index" : 10,
    "lastlocation" : -1,
    "newtag" : "",
    "parentId" : "756",
    "taglist" : [ "creative-agency" ],
    "text" : "Dow-Smith Studio - Browser OS in site Portfolio"
  },
  "120" : {
    "dateAddedLocal" : "6/23/2014, 6:22:19 PM",
    "dateAddedUTC" : "2014-06-23T22:22:19.392Z",
    "description" : "Lorem ipsum dolor sit amet, consectetur adipiscing elit. Vivamus vel lectus ut turpis fermentum vestibulum. ",
    "favorited" : false,
    "hyperlink" : "https://www.youtube.com/watch?v=LVCRgB2jPuc",
    "id" : "119",
    "index" : 27,
    "lastlocation" : -1,
    "newtag" : "",
    "parentId" : "49",
    "taglist" : [ "music" ],
    "text" : "Bondax - Giving It All - YouTube"
  },
  "121" : {
    "dateAddedLocal" : "8/5/2016, 7:23:27 PM",
    "dateAddedUTC" : "2016-08-05T23:23:27.416Z",
    "description" : "Lorem ipsum dolor sit amet, consectetur adipiscing elit. Vivamus vel lectus ut turpis fermentum vestibulum. ",
    "favorited" : false,
    "hyperlink" : "http://www.ibm.com/developerworks/aix/library/au-speakingunix9/",
    "id" : "120",
    "index" : 179,
    "lastlocation" : -1,
    "newtag" : "",
    "parentId" : "1",
    "taglist" : [ "javascript", "education" ],
    "text" : "Regex tutorial IBM"
  },
  "122" : {
    "dateAddedLocal" : "11/16/2014, 7:34:32 PM",
    "dateAddedUTC" : "2014-11-17T00:34:32.185Z",
    "description" : "Lorem ipsum dolor sit amet, consectetur adipiscing elit. Vivamus vel lectus ut turpis fermentum vestibulum. ",
    "favorited" : false,
    "hyperlink" : "http://christopheviau.com/d3list/gallery.html",
    "id" : "121",
    "index" : 5,
    "lastlocation" : -1,
    "newtag" : "",
    "parentId" : "23",
    "taglist" : [ "data-viz", "d3.js", "website-gallery" ],
    "text" : "christopheviau.com/d3list/gallery.html"
  },
  "123" : {
    "dateAddedLocal" : "7/8/2015, 9:23:47 PM",
    "dateAddedUTC" : "2015-07-09T01:23:47.406Z",
    "description" : "Lorem ipsum dolor sit amet, consectetur adipiscing elit. Vivamus vel lectus ut turpis fermentum vestibulum. ",
    "favorited" : false,
    "hyperlink" : "http://www.thrillist.com/drink/boston/every-rooftop-bar-in-boston",
    "id" : "122",
    "index" : 3,
    "lastlocation" : -1,
    "newtag" : "",
    "parentId" : "42",
    "taglist" : [ "boston" ],
    "text" : "Every Rooftop Bar in Boston"
  },
  "124" : {
    "dateAddedLocal" : "6/30/2014, 12:21:25 AM",
    "dateAddedUTC" : "2014-06-30T04:21:25.783Z",
    "description" : "Lorem ipsum dolor sit amet, consectetur adipiscing elit. Vivamus vel lectus ut turpis fermentum vestibulum. ",
    "favorited" : false,
    "hyperlink" : "http://sufferlikegdid.bandcamp.com/album/raspberry-ep",
    "id" : "123",
    "index" : 8,
    "lastlocation" : -1,
    "newtag" : "",
    "parentId" : "49",
    "taglist" : [ "music" ],
    "text" : "â–¶ Raspberry EP | Suffer Like G Did"
  },
  "125" : {
    "dateAddedLocal" : "10/12/2016, 8:37:42 AM",
    "dateAddedUTC" : "2016-10-12T12:37:42.449Z",
    "description" : "Lorem ipsum dolor sit amet, consectetur adipiscing elit. Vivamus vel lectus ut turpis fermentum vestibulum. ",
    "favorited" : false,
    "hyperlink" : "http://www.wildflower.org/collections/collection.php?all=true",
    "id" : "124",
    "index" : 3,
    "lastlocation" : -1,
    "newtag" : "",
    "parentId" : "666",
    "taglist" : [ "data" ],
    "text" : "WildFlower All Plants"
  },
  "126" : {
    "dateAddedLocal" : "7/29/2018, 10:48:55 PM",
    "dateAddedUTC" : "2018-07-30T02:48:55.932Z",
    "description" : "Lorem ipsum dolor sit amet, consectetur adipiscing elit. Vivamus vel lectus ut turpis fermentum vestibulum. ",
    "favorited" : false,
    "hyperlink" : "https://cointracking.info/",
    "id" : "125",
    "index" : 73,
    "lastlocation" : -1,
    "newtag" : "",
    "parentId" : "2",
    "taglist" : [ "crypto", "personal-finance" ],
    "text" : "CoinTracking Â· Bitcoin Portfolio/Tax Reporting"
  },
  "127" : {
    "dateAddedLocal" : "8/21/2018, 2:01:52 PM",
    "dateAddedUTC" : "2018-08-21T18:01:52.097Z",
    "description" : "Lorem ipsum dolor sit amet, consectetur adipiscing elit. Vivamus vel lectus ut turpis fermentum vestibulum. ",
    "favorited" : false,
    "hyperlink" : "https://www.awwwards.com/20-best-web-fonts-from-google-web-fonts-and-font-face.html",
    "id" : "126",
    "index" : 40,
    "lastlocation" : -1,
    "newtag" : "",
    "parentId" : "1",
    "taglist" : [ "typography" ],
    "text" : "20 Best Google Fonts"
  },
  "128" : {
    "dateAddedLocal" : "12/9/2016, 2:08:48 PM",
    "dateAddedUTC" : "2016-12-09T19:08:48.548Z",
    "description" : "Lorem ipsum dolor sit amet, consectetur adipiscing elit. Vivamus vel lectus ut turpis fermentum vestibulum. ",
    "favorited" : false,
    "hyperlink" : "http://momentjs.com/",
    "id" : "127",
    "index" : 207,
    "lastlocation" : -1,
    "newtag" : "",
    "parentId" : "1",
    "taglist" : [ "javascript", "api" ],
    "text" : "Moment.js | Time library"
  },
  "129" : {
    "dateAddedLocal" : "1/27/2019, 11:11:39 PM",
    "dateAddedUTC" : "2019-01-28T04:11:39.726Z",
    "description" : "Lorem ipsum dolor sit amet, consectetur adipiscing elit. Vivamus vel lectus ut turpis fermentum vestibulum. ",
    "favorited" : false,
    "hyperlink" : "https://www.hotjar.com/",
    "id" : "128",
    "index" : 269,
    "lastlocation" : -1,
    "newtag" : "",
    "parentId" : "1",
    "taglist" : [ "marketing" ],
    "text" : "Hotjar"
  },
  "130" : {
    "dateAddedLocal" : "9/7/2018, 6:24:44 PM",
    "dateAddedUTC" : "2018-09-07T22:24:44.188Z",
    "description" : "Lorem ipsum dolor sit amet, consectetur adipiscing elit. Vivamus vel lectus ut turpis fermentum vestibulum. ",
    "favorited" : false,
    "hyperlink" : "https://github.com/tipoqueno/UI-Design#books",
    "id" : "129",
    "index" : 91,
    "lastlocation" : -1,
    "newtag" : "",
    "parentId" : "2",
    "taglist" : [ "books" ],
    "text" : "UI books"
  },
  "131" : {
    "dateAddedLocal" : "10/15/2015, 2:28:08 PM",
    "dateAddedUTC" : "2015-10-15T18:28:08.459Z",
    "description" : "Lorem ipsum dolor sit amet, consectetur adipiscing elit. Vivamus vel lectus ut turpis fermentum vestibulum. ",
    "favorited" : false,
    "hyperlink" : "http://tympanus.net/codrops/2015/10/15/effect-ideas-for-image-grids/",
    "id" : "130",
    "index" : 2,
    "lastlocation" : -1,
    "newtag" : "",
    "parentId" : "59",
    "taglist" : [ "web-design", "blog" ],
    "text" : "Coding teh IMage Grid"
  },
  "132" : {
    "dateAddedLocal" : "5/30/2019, 1:23:10 PM",
    "dateAddedUTC" : "2019-05-30T17:23:10.536Z",
    "description" : "Lorem ipsum dolor sit amet, consectetur adipiscing elit. Vivamus vel lectus ut turpis fermentum vestibulum. ",
    "favorited" : false,
    "hyperlink" : "http://www.colleen-curtis.com/ifactory",
    "id" : "131",
    "index" : 14,
    "lastlocation" : -1,
    "newtag" : "",
    "parentId" : "1",
    "taglist" : [ "portfolio", "documentation" ],
    "text" : "Colleen Curtis"
  },
  "133" : {
    "dateAddedLocal" : "1/3/2019, 10:33:18 PM",
    "dateAddedUTC" : "2019-01-04T03:33:18.065Z",
    "description" : "Lorem ipsum dolor sit amet, consectetur adipiscing elit. Vivamus vel lectus ut turpis fermentum vestibulum. ",
    "favorited" : false,
    "hyperlink" : "https://material.io/tools/icons/?icon=check_circle&style=baseline",
    "id" : "132",
    "index" : 85,
    "lastlocation" : -1,
    "newtag" : "",
    "parentId" : "2",
    "taglist" : [ "design-language", "icons", "resources" ],
    "text" : "material ui icons"
  },
  "134" : {
    "dateAddedLocal" : "9/2/2015, 4:07:31 PM",
    "dateAddedUTC" : "2015-09-02T20:07:31.773Z",
    "description" : "Lorem ipsum dolor sit amet, consectetur adipiscing elit. Vivamus vel lectus ut turpis fermentum vestibulum. ",
    "favorited" : false,
    "hyperlink" : "http://food52.com/recipes/31763-roasted-cauliflower-with-cumin-and-cilantro",
    "id" : "133",
    "index" : 0,
    "lastlocation" : -1,
    "newtag" : "",
    "parentId" : "43",
    "taglist" : [ "food", "cooking" ],
    "text" : "Roasted Cauliflower with Cumin and Cilantro "
  },
  "135" : {
    "dateAddedLocal" : "3/29/2019, 5:08:16 PM",
    "dateAddedUTC" : "2019-03-29T21:08:16.376Z",
    "description" : "Lorem ipsum dolor sit amet, consectetur adipiscing elit. Vivamus vel lectus ut turpis fermentum vestibulum. ",
    "favorited" : false,
    "hyperlink" : "https://addyosmani.com/resources/essentialjsdesignpatterns/book/index.html#constructorpatternjavascript",
    "id" : "134",
    "index" : 317,
    "lastlocation" : -1,
    "newtag" : "",
    "parentId" : "1",
    "taglist" : [ "javascript", "education" ],
    "text" : "Learning JavaScript Design Patterns - Addy Osmani"
  },
  "136" : {
    "dateAddedLocal" : "4/7/2016, 2:41:02 PM",
    "dateAddedUTC" : "2016-04-07T18:41:02.029Z",
    "description" : "Lorem ipsum dolor sit amet, consectetur adipiscing elit. Vivamus vel lectus ut turpis fermentum vestibulum. ",
    "favorited" : false,
    "hyperlink" : "https://www.everlane.com/collections/mens-all",
    "id" : "135",
    "index" : 165,
    "lastlocation" : -1,
    "newtag" : "",
    "parentId" : "1",
    "taglist" : [ "clothing" ],
    "text" : "Everlane | Radical transparency"
  },
  "137" : {
    "dateAddedLocal" : "8/24/2014, 10:52:34 PM",
    "dateAddedUTC" : "2014-08-25T02:52:34.901Z",
    "description" : "Lorem ipsum dolor sit amet, consectetur adipiscing elit. Vivamus vel lectus ut turpis fermentum vestibulum. ",
    "favorited" : false,
    "hyperlink" : "http://www.sanaa.co.jp/",
    "id" : "136",
    "index" : 0,
    "lastlocation" : -1,
    "newtag" : "",
    "parentId" : "457",
    "taglist" : [ "architecture" ],
    "text" : "Kazuyo Sejima + Ryue Nishizawa /"
  },
  "138" : {
    "dateAddedLocal" : "4/9/2015, 4:48:56 PM",
    "dateAddedUTC" : "2015-04-09T20:48:56.734Z",
    "description" : "Lorem ipsum dolor sit amet, consectetur adipiscing elit. Vivamus vel lectus ut turpis fermentum vestibulum. ",
    "favorited" : false,
    "hyperlink" : "http://femmebot.github.io/google-type/",
    "id" : "137",
    "index" : 9,
    "lastlocation" : -1,
    "newtag" : "",
    "parentId" : "38",
    "taglist" : [ "typography" ],
    "text" : "Google Web Fonts Typographic Project"
  },
  "139" : {
    "dateAddedLocal" : "10/8/2017, 3:02:31 PM",
    "dateAddedUTC" : "2017-10-08T19:02:31.382Z",
    "description" : "Lorem ipsum dolor sit amet, consectetur adipiscing elit. Vivamus vel lectus ut turpis fermentum vestibulum. ",
    "favorited" : false,
    "hyperlink" : "http://plant22.co/",
    "id" : "138",
    "index" : 1,
    "lastlocation" : -1,
    "newtag" : "",
    "parentId" : "549",
    "taglist" : [ "coworking", "travel" ],
    "text" : "Plant22 - A creative co-working space in Amsterdam-West."
  },
  "140" : {
    "dateAddedLocal" : "1/27/2019, 9:05:06 PM",
    "dateAddedUTC" : "2019-01-28T02:05:06.499Z",
    "description" : "Lorem ipsum dolor sit amet, consectetur adipiscing elit. Vivamus vel lectus ut turpis fermentum vestibulum. ",
    "favorited" : false,
    "hyperlink" : "https://webflow.com/dashboard",
    "id" : "139",
    "index" : 265,
    "lastlocation" : -1,
    "newtag" : "",
    "parentId" : "1",
    "taglist" : [ "web-tools", "web-design" ],
    "text" : "Webflow"
  },
  "141" : {
    "dateAddedLocal" : "9/23/2018, 12:30:35 AM",
    "dateAddedUTC" : "2018-09-23T04:30:35.221Z",
    "description" : "Lorem ipsum dolor sit amet, consectetur adipiscing elit. Vivamus vel lectus ut turpis fermentum vestibulum. ",
    "favorited" : false,
    "hyperlink" : "http://haya2now.jp/en.html",
    "id" : "140",
    "index" : 302,
    "lastlocation" : -1,
    "newtag" : "",
    "parentId" : "1",
    "taglist" : [ "modern-aesthetic", "creative-agency", "data-viz" ],
    "text" : "Haya2NOW"
  },
  "142" : {
    "dateAddedLocal" : "9/23/2015, 8:58:07 PM",
    "dateAddedUTC" : "2015-09-24T00:58:07.345Z",
    "description" : "Lorem ipsum dolor sit amet, consectetur adipiscing elit. Vivamus vel lectus ut turpis fermentum vestibulum. ",
    "favorited" : false,
    "hyperlink" : "http://www.yogajournal.com/category/poses/",
    "id" : "141",
    "index" : 0,
    "lastlocation" : -1,
    "newtag" : "",
    "parentId" : "52",
    "taglist" : [ "health", "exercise" ],
    "text" : "Yoga Poses & Asanas - Basic to Advanced"
  },
  "143" : {
    "dateAddedLocal" : "9/24/2015, 4:05:32 PM",
    "dateAddedUTC" : "2015-09-24T20:05:32.344Z",
    "description" : "Lorem ipsum dolor sit amet, consectetur adipiscing elit. Vivamus vel lectus ut turpis fermentum vestibulum. ",
    "favorited" : false,
    "hyperlink" : "https://developers.google.com/web/fundamentals/layouts/rwd-fundamentals/",
    "id" : "142",
    "index" : 5,
    "lastlocation" : -1,
    "newtag" : "",
    "parentId" : "48",
    "taglist" : [ "web-design", "blog" ],
    "text" : "Responsive Web Design Basics â€” Web Fundamentals"
  },
  "144" : {
    "dateAddedLocal" : "8/16/2015, 3:53:42 AM",
    "dateAddedUTC" : "2015-08-16T07:53:42.995Z",
    "description" : "Lorem ipsum dolor sit amet, consectetur adipiscing elit. Vivamus vel lectus ut turpis fermentum vestibulum. ",
    "favorited" : false,
    "hyperlink" : "http://www.kirikomade.com/collections/summer-man",
    "id" : "143",
    "index" : 5,
    "lastlocation" : -1,
    "newtag" : "",
    "parentId" : "25",
    "taglist" : [ "clothing" ],
    "text" : "Summer Man | Kiriko Made"
  },
  "145" : {
    "dateAddedLocal" : "11/12/2015, 12:19:29 PM",
    "dateAddedUTC" : "2015-11-12T17:19:29.361Z",
    "description" : "Lorem ipsum dolor sit amet, consectetur adipiscing elit. Vivamus vel lectus ut turpis fermentum vestibulum. ",
    "favorited" : false,
    "hyperlink" : "http://huhwhatandwhere.com/",
    "id" : "144",
    "index" : 66,
    "lastlocation" : -1,
    "newtag" : "",
    "parentId" : "2",
    "taglist" : [ "music" ],
    "text" : "HW&W Records"
  },
  "146" : {
    "dateAddedLocal" : "5/3/2015, 1:21:18 AM",
    "dateAddedUTC" : "2015-05-03T05:21:18.654Z",
    "description" : "Lorem ipsum dolor sit amet, consectetur adipiscing elit. Vivamus vel lectus ut turpis fermentum vestibulum. ",
    "favorited" : false,
    "hyperlink" : "http://frankchimero.com/about/",
    "id" : "145",
    "index" : 16,
    "lastlocation" : -1,
    "newtag" : "",
    "parentId" : "35",
    "taglist" : [ "portfolio" ],
    "text" : "Frank Chimero - About"
  },
  "147" : {
    "dateAddedLocal" : "11/29/2018, 7:18:35 PM",
    "dateAddedUTC" : "2018-11-30T00:18:35.538Z",
    "description" : "Lorem ipsum dolor sit amet, consectetur adipiscing elit. Vivamus vel lectus ut turpis fermentum vestibulum. ",
    "favorited" : false,
    "hyperlink" : "https://www.allrecipes.com/",
    "id" : "146",
    "index" : 278,
    "lastlocation" : -1,
    "newtag" : "",
    "parentId" : "1",
    "taglist" : [ "cooking" ],
    "text" : "allrecipes"
  },
  "148" : {
    "dateAddedLocal" : "8/28/2018, 7:22:23 PM",
    "dateAddedUTC" : "2018-08-28T23:22:23.388Z",
    "description" : "Lorem ipsum dolor sit amet, consectetur adipiscing elit. Vivamus vel lectus ut turpis fermentum vestibulum. ",
    "favorited" : false,
    "hyperlink" : "https://en.wikipedia.org/wiki/Test_functions_for_optimization",
    "id" : "147",
    "index" : 76,
    "lastlocation" : -1,
    "newtag" : "",
    "parentId" : "2",
    "taglist" : [ "modern-aesthetic", "data-viz", "math", "3d" ],
    "text" : "Test functions for optimization - Wikipedia"
  },
  "149" : {
    "dateAddedLocal" : "2/21/2014, 12:04:36 PM",
    "dateAddedUTC" : "2014-02-21T17:04:36.842Z",
    "description" : "Lorem ipsum dolor sit amet, consectetur adipiscing elit. Vivamus vel lectus ut turpis fermentum vestibulum. ",
    "favorited" : false,
    "hyperlink" : "http://500.chromeexperiments.com/",
    "id" : "148",
    "index" : 1,
    "lastlocation" : -1,
    "newtag" : "",
    "parentId" : "756",
    "taglist" : [ "web-tools", "website-gallery" ],
    "text" : "Chrome Experiment #500"
  },
  "150" : {
    "dateAddedLocal" : "9/14/2015, 4:03:31 PM",
    "dateAddedUTC" : "2015-09-14T20:03:31.198Z",
    "description" : "Lorem ipsum dolor sit amet, consectetur adipiscing elit. Vivamus vel lectus ut turpis fermentum vestibulum. ",
    "favorited" : false,
    "hyperlink" : "http://www.pentagram.com/work/#/all/all/newest/",
    "id" : "149",
    "index" : 1,
    "lastlocation" : -1,
    "newtag" : "",
    "parentId" : "45",
    "taglist" : [ "creative-agency" ],
    "text" : "Pentagram"
  },
  "151" : {
    "dateAddedLocal" : "3/30/2015, 7:13:19 PM",
    "dateAddedUTC" : "2015-03-30T23:13:19.256Z",
    "description" : "Lorem ipsum dolor sit amet, consectetur adipiscing elit. Vivamus vel lectus ut turpis fermentum vestibulum. ",
    "favorited" : false,
    "hyperlink" : "http://www.stereogum.com/1789649/young-thug-beat-it-feat-jacquees-halftime/mp3s/",
    "id" : "150",
    "index" : 44,
    "lastlocation" : -1,
    "newtag" : "",
    "parentId" : "49",
    "taglist" : [ "music" ],
    "text" : "Young Thug â€“ â€œBeat Itâ€ (Feat. Jacquees) & â€œHalftimeâ€ "
  },
  "152" : {
    "dateAddedLocal" : "4/22/2018, 12:49:23 PM",
    "dateAddedUTC" : "2018-04-22T16:49:23.959Z",
    "description" : "Lorem ipsum dolor sit amet, consectetur adipiscing elit. Vivamus vel lectus ut turpis fermentum vestibulum. ",
    "favorited" : false,
    "hyperlink" : "http://www.spacex.com/careers/position/214393",
    "id" : "151",
    "index" : 1,
    "lastlocation" : -1,
    "newtag" : "",
    "parentId" : "522",
    "taglist" : [ "career" ],
    "text" : "Software Engineer - DevOps | SpaceX"
  },
  "153" : {
    "dateAddedLocal" : "12/10/2015, 7:36:42 PM",
    "dateAddedUTC" : "2015-12-11T00:36:42.993Z",
    "description" : "Lorem ipsum dolor sit amet, consectetur adipiscing elit. Vivamus vel lectus ut turpis fermentum vestibulum. ",
    "favorited" : false,
    "hyperlink" : "https://nucareers.northeastern.edu/home.htm",
    "id" : "152",
    "index" : 150,
    "lastlocation" : -1,
    "newtag" : "",
    "parentId" : "1",
    "taglist" : [ "career" ],
    "text" : "NUCareers"
  },
  "154" : {
    "dateAddedLocal" : "4/23/2017, 11:44:24 AM",
    "dateAddedUTC" : "2017-04-23T15:44:24.079Z",
    "description" : "Lorem ipsum dolor sit amet, consectetur adipiscing elit. Vivamus vel lectus ut turpis fermentum vestibulum. ",
    "favorited" : false,
    "hyperlink" : "https://directory.startupberlin.co/",
    "id" : "153",
    "index" : 65,
    "lastlocation" : -1,
    "newtag" : "",
    "parentId" : "2",
    "taglist" : [ "career" ],
    "text" : "berlin jobs"
  },
  "155" : {
    "dateAddedLocal" : "10/15/2015, 11:19:39 AM",
    "dateAddedUTC" : "2015-10-15T15:19:39.491Z",
    "description" : "Lorem ipsum dolor sit amet, consectetur adipiscing elit. Vivamus vel lectus ut turpis fermentum vestibulum. ",
    "favorited" : false,
    "hyperlink" : "http://www.onthegrid.city/",
    "id" : "154",
    "index" : 50,
    "lastlocation" : -1,
    "newtag" : "",
    "parentId" : "2",
    "taglist" : [ "grid", "creative-agency" ],
    "text" : "On the Grid :: The designer's neighborhood guide"
  },
  "156" : {
    "dateAddedLocal" : "4/28/2014, 6:47:33 PM",
    "dateAddedUTC" : "2014-04-28T22:47:33.986Z",
    "description" : "Lorem ipsum dolor sit amet, consectetur adipiscing elit. Vivamus vel lectus ut turpis fermentum vestibulum. ",
    "favorited" : false,
    "hyperlink" : "http://www.youtube.com/watch?v=YGYj5F1OD9w",
    "id" : "155",
    "index" : 1,
    "lastlocation" : -1,
    "newtag" : "",
    "parentId" : "189",
    "taglist" : [ "music" ],
    "text" : "YUI - fight - Pop Guitar"
  },
  "157" : {
    "dateAddedLocal" : "1/17/2016, 1:25:24 AM",
    "dateAddedUTC" : "2016-01-17T06:25:24.163Z",
    "description" : "Lorem ipsum dolor sit amet, consectetur adipiscing elit. Vivamus vel lectus ut turpis fermentum vestibulum. ",
    "favorited" : false,
    "hyperlink" : "http://pingomatic.com/",
    "id" : "156",
    "index" : 0,
    "lastlocation" : -1,
    "newtag" : "",
    "parentId" : "623",
    "taglist" : [ "web-tools" ],
    "text" : "Ping-o-Matic!"
  },
  "158" : {
    "dateAddedLocal" : "1/16/2016, 7:12:51 PM",
    "dateAddedUTC" : "2016-01-17T00:12:51.695Z",
    "description" : "Lorem ipsum dolor sit amet, consectetur adipiscing elit. Vivamus vel lectus ut turpis fermentum vestibulum. ",
    "favorited" : false,
    "hyperlink" : "https://blog.kissmetrics.com/get-google-to-index/",
    "id" : "157",
    "index" : 15,
    "lastlocation" : -1,
    "newtag" : "",
    "parentId" : "65",
    "taglist" : [ "seo" ],
    "text" : "get indexed - kissmetrics"
  },
  "159" : {
    "dateAddedLocal" : "5/17/2014, 2:50:23 AM",
    "dateAddedUTC" : "2014-05-17T06:50:23.735Z",
    "description" : "Lorem ipsum dolor sit amet, consectetur adipiscing elit. Vivamus vel lectus ut turpis fermentum vestibulum. ",
    "favorited" : false,
    "hyperlink" : "http://zenhabits.net/55-ways-to-get-more-energy/",
    "id" : "158",
    "index" : 0,
    "lastlocation" : -1,
    "newtag" : "",
    "parentId" : "14",
    "taglist" : [ "health", "blog", "wisdom" ],
    "text" : "55 Ways to Get More Energy : zenhabits"
  },
  "160" : {
    "dateAddedLocal" : "9/6/2015, 4:08:14 PM",
    "dateAddedUTC" : "2015-09-06T20:08:14.200Z",
    "description" : "Lorem ipsum dolor sit amet, consectetur adipiscing elit. Vivamus vel lectus ut turpis fermentum vestibulum. ",
    "favorited" : false,
    "hyperlink" : "http://www.webcreme.com/",
    "id" : "159",
    "index" : 146,
    "lastlocation" : -1,
    "newtag" : "",
    "parentId" : "1",
    "taglist" : [ "website-gallery" ],
    "text" : "Web Creme"
  },
  "161" : {
    "dateAddedLocal" : "10/20/2015, 2:21:19 PM",
    "dateAddedUTC" : "2015-10-20T18:21:19.543Z",
    "description" : "Lorem ipsum dolor sit amet, consectetur adipiscing elit. Vivamus vel lectus ut turpis fermentum vestibulum. ",
    "favorited" : false,
    "hyperlink" : "http://www.brainfeedersite.com/",
    "id" : "160",
    "index" : 156,
    "lastlocation" : -1,
    "newtag" : "",
    "parentId" : "1",
    "taglist" : [ "music" ],
    "text" : "BrainFeeder Records"
  },
  "162" : {
    "dateAddedLocal" : "4/15/2018, 9:07:58 PM",
    "dateAddedUTC" : "2018-04-16T01:07:58.887Z",
    "description" : "Lorem ipsum dolor sit amet, consectetur adipiscing elit. Vivamus vel lectus ut turpis fermentum vestibulum. ",
    "favorited" : false,
    "hyperlink" : "https://angel.co/jobs#find/f!%7B%22locations%22%3A%5B%221653-Los%20Angeles%2C%20CA%22%5D%2C%22roles%22%3A%5B%22Frontend%20Developer%22%5D%7D",
    "id" : "161",
    "index" : 2,
    "lastlocation" : -1,
    "newtag" : "",
    "parentId" : "520",
    "taglist" : [ "career" ],
    "text" : "Startup Jobs - AngelList"
  },
  "163" : {
    "dateAddedLocal" : "9/29/2016, 7:41:14 AM",
    "dateAddedUTC" : "2016-09-29T11:41:14.405Z",
    "description" : "Lorem ipsum dolor sit amet, consectetur adipiscing elit. Vivamus vel lectus ut turpis fermentum vestibulum. ",
    "favorited" : false,
    "hyperlink" : "http://exrx.net/Beginning.html",
    "id" : "162",
    "index" : 198,
    "lastlocation" : -1,
    "newtag" : "",
    "parentId" : "1",
    "taglist" : [ "health", "exercise" ],
    "text" : "ExRx Beginner's Page: Beginning an Exercise Program"
  },
  "164" : {
    "dateAddedLocal" : "6/10/2018, 11:04:46 PM",
    "dateAddedUTC" : "2018-06-11T03:04:46.044Z",
    "description" : "Lorem ipsum dolor sit amet, consectetur adipiscing elit. Vivamus vel lectus ut turpis fermentum vestibulum. ",
    "favorited" : false,
    "hyperlink" : "https://news.ycombinator.com/best",
    "id" : "163",
    "index" : 33,
    "lastlocation" : -1,
    "newtag" : "",
    "parentId" : "1",
    "taglist" : [ "root" ],
    "text" : "HackerNews"
  },
  "165" : {
    "dateAddedLocal" : "11/7/2017, 9:57:11 AM",
    "dateAddedUTC" : "2017-11-07T14:57:11.378Z",
    "description" : "Lorem ipsum dolor sit amet, consectetur adipiscing elit. Vivamus vel lectus ut turpis fermentum vestibulum. ",
    "favorited" : false,
    "hyperlink" : "http://www.gradientify.dfusic.net/",
    "id" : "164",
    "index" : 130,
    "lastlocation" : -1,
    "newtag" : "",
    "parentId" : "1",
    "taglist" : [ "color-tool" ],
    "text" : "Gradientify - Best gradients in one place."
  },
  "166" : {
    "dateAddedLocal" : "7/30/2018, 12:10:59 PM",
    "dateAddedUTC" : "2018-07-30T16:10:59.742Z",
    "description" : "Lorem ipsum dolor sit amet, consectetur adipiscing elit. Vivamus vel lectus ut turpis fermentum vestibulum. ",
    "favorited" : false,
    "hyperlink" : "http://recharts.org/en-US/",
    "id" : "165",
    "index" : 6,
    "lastlocation" : -1,
    "newtag" : "",
    "parentId" : "502",
    "taglist" : [ "data-viz", "api" ],
    "text" : "Recharts"
  },
  "167" : {
    "dateAddedLocal" : "10/8/2017, 8:34:49 PM",
    "dateAddedUTC" : "2017-10-09T00:34:49.917Z",
    "description" : "Lorem ipsum dolor sit amet, consectetur adipiscing elit. Vivamus vel lectus ut turpis fermentum vestibulum. ",
    "favorited" : false,
    "hyperlink" : "https://justinegrey.com/food-affiliate-programs/",
    "id" : "166",
    "index" : 4,
    "lastlocation" : -1,
    "newtag" : "",
    "parentId" : "580",
    "taglist" : [ "first-tag" ],
    "text" : "53+ Food Affiliate Programs for Bloggers and Content Creators"
  },
  "168" : {
    "dateAddedLocal" : "1/16/2016, 7:13:09 PM",
    "dateAddedUTC" : "2016-01-17T00:13:09.122Z",
    "description" : "Lorem ipsum dolor sit amet, consectetur adipiscing elit. Vivamus vel lectus ut turpis fermentum vestibulum. ",
    "favorited" : false,
    "hyperlink" : "https://wordpress.org/plugins/google-sitemap-generator/",
    "id" : "167",
    "index" : 1,
    "lastlocation" : -1,
    "newtag" : "",
    "parentId" : "623",
    "taglist" : [ "first-tag" ],
    "text" : "Google XML Sitemaps Â« WordPress Plugins"
  },
  "169" : {
    "dateAddedLocal" : "3/7/2015, 5:20:27 PM",
    "dateAddedUTC" : "2015-03-07T22:20:27.430Z",
    "description" : "Lorem ipsum dolor sit amet, consectetur adipiscing elit. Vivamus vel lectus ut turpis fermentum vestibulum. ",
    "favorited" : false,
    "hyperlink" : "https://soundcloud.com/trap-door-official",
    "id" : "168",
    "index" : 16,
    "lastlocation" : -1,
    "newtag" : "",
    "parentId" : "49",
    "taglist" : [ "music" ],
    "text" : "TRAPDOOR RECORDSâ€™s stream on SoundCloud - Hear the worldâ€™s sounds"
  },
  "170" : {
    "dateAddedLocal" : "11/8/2015, 10:13:32 AM",
    "dateAddedUTC" : "2015-11-08T15:13:32.077Z",
    "description" : "Lorem ipsum dolor sit amet, consectetur adipiscing elit. Vivamus vel lectus ut turpis fermentum vestibulum. ",
    "favorited" : false,
    "hyperlink" : "https://www.reddit.com/r/Meditation/comments/3rx9uu/taoist_zuowang_meditation/",
    "id" : "169",
    "index" : 3,
    "lastlocation" : -1,
    "newtag" : "",
    "parentId" : "52",
    "taglist" : [ "wisdom" ],
    "text" : "Taoist ZuoWang Meditation : Meditation"
  },
  "171" : {
    "dateAddedLocal" : "12/16/2013, 8:12:17 PM",
    "dateAddedUTC" : "2013-12-17T01:12:17.256Z",
    "description" : "Lorem ipsum dolor sit amet, consectetur adipiscing elit. Vivamus vel lectus ut turpis fermentum vestibulum. ",
    "favorited" : false,
    "hyperlink" : "http://store.editionrecords.com/album/places-and-other-spaces",
    "id" : "170",
    "index" : 3,
    "lastlocation" : -1,
    "newtag" : "",
    "parentId" : "49",
    "taglist" : [ "music" ],
    "text" : "solo instruments jazz"
  },
  "172" : {
    "dateAddedLocal" : "9/14/2014, 6:57:06 PM",
    "dateAddedUTC" : "2014-09-14T22:57:06.437Z",
    "description" : "Lorem ipsum dolor sit amet, consectetur adipiscing elit. Vivamus vel lectus ut turpis fermentum vestibulum. ",
    "favorited" : false,
    "hyperlink" : "https://www.youtube.com/watch?v=2rmFTc51Zk0",
    "id" : "171",
    "index" : 35,
    "lastlocation" : -1,
    "newtag" : "",
    "parentId" : "49",
    "taglist" : [ "music" ],
    "text" : "Flying Lotus - 1983 (full album) - YouTube"
  },
  "173" : {
    "dateAddedLocal" : "2/8/2015, 11:48:45 AM",
    "dateAddedUTC" : "2015-02-08T16:48:45.128Z",
    "description" : "Lorem ipsum dolor sit amet, consectetur adipiscing elit. Vivamus vel lectus ut turpis fermentum vestibulum. ",
    "favorited" : false,
    "hyperlink" : "https://www.youtube.com/watch?v=VulY3T8nc0g#t=147",
    "id" : "172",
    "index" : 5,
    "lastlocation" : -1,
    "newtag" : "",
    "parentId" : "163",
    "taglist" : [ "music" ],
    "text" : "Jazmine Sullivan - Dumb (Explicit) ft. Meek Mill - YouTube"
  },
  "174" : {
    "dateAddedLocal" : "11/28/2018, 2:51:41 PM",
    "dateAddedUTC" : "2018-11-28T19:51:41.161Z",
    "description" : "Lorem ipsum dolor sit amet, consectetur adipiscing elit. Vivamus vel lectus ut turpis fermentum vestibulum. ",
    "favorited" : false,
    "hyperlink" : "https://thetie.io/coin-detail/ZEC.X#data",
    "id" : "173",
    "index" : 288,
    "lastlocation" : -1,
    "newtag" : "",
    "parentId" : "1",
    "taglist" : [ "first-tag" ],
    "text" : "TIE "
  },
  "175" : {
    "dateAddedLocal" : "4/21/2014, 1:32:47 PM",
    "dateAddedUTC" : "2014-04-21T17:32:47.981Z",
    "description" : "Lorem ipsum dolor sit amet, consectetur adipiscing elit. Vivamus vel lectus ut turpis fermentum vestibulum. ",
    "favorited" : false,
    "hyperlink" : "https://medium.com/design-ux/62ae4bcbe01b",
    "id" : "174",
    "index" : 0,
    "lastlocation" : -1,
    "newtag" : "",
    "parentId" : "3",
    "taglist" : [ "first-tag" ],
    "text" : "Stock photos that donâ€™t suck â€” Design / UX â€” Medium"
  },
  "176" : {
    "dateAddedLocal" : "1/17/2019, 11:03:57 PM",
    "dateAddedUTC" : "2019-01-18T04:03:57.861Z",
    "description" : "Lorem ipsum dolor sit amet, consectetur adipiscing elit. Vivamus vel lectus ut turpis fermentum vestibulum. ",
    "favorited" : false,
    "hyperlink" : "https://socialcaptain.com/",
    "id" : "175",
    "index" : 274,
    "lastlocation" : -1,
    "newtag" : "",
    "parentId" : "1",
    "taglist" : [ "marketing", "web-tools" ],
    "text" : "socialcaptain"
  },
  "177" : {
    "dateAddedLocal" : "6/28/2015, 10:17:25 AM",
    "dateAddedUTC" : "2015-06-28T14:17:25.813Z",
    "description" : "Lorem ipsum dolor sit amet, consectetur adipiscing elit. Vivamus vel lectus ut turpis fermentum vestibulum. ",
    "favorited" : false,
    "hyperlink" : "https://concertwith.me/en/gigs-in-boston-us-2?type=all&festival=all&place=120037&month=all&tags%5B%5D=-1",
    "id" : "176",
    "index" : 0,
    "lastlocation" : -1,
    "newtag" : "",
    "parentId" : "42",
    "taglist" : [ "boston" ],
    "text" : "Find Concerts"
  },
  "178" : {
    "dateAddedLocal" : "1/26/2017, 8:09:11 PM",
    "dateAddedUTC" : "2017-01-27T01:09:11.687Z",
    "description" : "Lorem ipsum dolor sit amet, consectetur adipiscing elit. Vivamus vel lectus ut turpis fermentum vestibulum. ",
    "favorited" : false,
    "hyperlink" : "https://www.google.com/maps/d/viewer?mid=1Z1dI8hoBZSJNWFx2xr_MMxSxSxY&ll=-3.81666561775622e-14%2C39.739915100000076&z=1",
    "id" : "177",
    "index" : 214,
    "lastlocation" : -1,
    "newtag" : "",
    "parentId" : "1",
    "taglist" : [ "first-tag" ],
    "text" : "Wireless Passwords From Airports And Lounges Around The World"
  },
  "179" : {
    "dateAddedLocal" : "1/19/2015, 9:50:06 AM",
    "dateAddedUTC" : "2015-01-19T14:50:06.838Z",
    "description" : "Lorem ipsum dolor sit amet, consectetur adipiscing elit. Vivamus vel lectus ut turpis fermentum vestibulum. ",
    "favorited" : false,
    "hyperlink" : "https://www.mapbox.com/",
    "id" : "178",
    "index" : 13,
    "lastlocation" : -1,
    "newtag" : "",
    "parentId" : "39",
    "taglist" : [ "data-viz" ],
    "text" : "Mapbox | Design and publish beautiful maps"
  },
  "180" : {
    "dateAddedLocal" : "3/26/2015, 4:58:48 PM",
    "dateAddedUTC" : "2015-03-26T20:58:48.910Z",
    "description" : "Lorem ipsum dolor sit amet, consectetur adipiscing elit. Vivamus vel lectus ut turpis fermentum vestibulum. ",
    "favorited" : false,
    "hyperlink" : "http://dillinger.io/",
    "id" : "179",
    "index" : 5,
    "lastlocation" : -1,
    "newtag" : "",
    "parentId" : "35",
    "taglist" : [ "creative-agency" ],
    "text" : "great menu"
  },
  "181" : {
    "dateAddedLocal" : "7/22/2018, 1:41:47 AM",
    "dateAddedUTC" : "2018-07-22T05:41:47.701Z",
    "description" : "Lorem ipsum dolor sit amet, consectetur adipiscing elit. Vivamus vel lectus ut turpis fermentum vestibulum. ",
    "favorited" : false,
    "hyperlink" : "https://www.cryptomiso.com/",
    "id" : "180",
    "index" : 5,
    "lastlocation" : -1,
    "newtag" : "",
    "parentId" : "502",
    "taglist" : [ "first-tag" ],
    "text" : "CryptoMiso - Ranking cryptocurrencies based on Github commits of past 12 months"
  },
  "182" : {
    "dateAddedLocal" : "3/23/2015, 11:25:51 AM",
    "dateAddedUTC" : "2015-03-23T15:25:51.076Z",
    "description" : "Lorem ipsum dolor sit amet, consectetur adipiscing elit. Vivamus vel lectus ut turpis fermentum vestibulum. ",
    "favorited" : false,
    "hyperlink" : "https://www.youtube.com/watch?v=1H1-6cHrNJs",
    "id" : "181",
    "index" : 40,
    "lastlocation" : -1,
    "newtag" : "",
    "parentId" : "49",
    "taglist" : [ "music" ],
    "text" : "Phoenix - Armistice (RAC Mix) - YouTube"
  },
  "183" : {
    "dateAddedLocal" : "11/17/2014, 7:22:38 AM",
    "dateAddedUTC" : "2014-11-17T12:22:38.163Z",
    "description" : "Lorem ipsum dolor sit amet, consectetur adipiscing elit. Vivamus vel lectus ut turpis fermentum vestibulum. ",
    "favorited" : false,
    "hyperlink" : "https://www.iconfinder.com/icons/318226/add_article_blog_book_education_lecture_read_reading_icon#size=128",
    "id" : "182",
    "index" : 7,
    "lastlocation" : -1,
    "newtag" : "",
    "parentId" : "23",
    "taglist" : [ "first-tag" ],
    "text" : "Add, article, blog, book, education, lecture, read, reading icon | Icon search engine"
  },
  "184" : {
    "dateAddedLocal" : "7/27/2014, 3:10:15 AM",
    "dateAddedUTC" : "2014-07-27T07:10:15.784Z",
    "description" : "Lorem ipsum dolor sit amet, consectetur adipiscing elit. Vivamus vel lectus ut turpis fermentum vestibulum. ",
    "favorited" : false,
    "hyperlink" : "http://www.mettaskincare.com/",
    "id" : "183",
    "index" : 0,
    "lastlocation" : -1,
    "newtag" : "",
    "parentId" : "756",
    "taglist" : [ "first-tag" ],
    "text" : "MettÄ Natural Skin Care Products - Home"
  },
  "185" : {
    "dateAddedLocal" : "9/28/2015, 6:58:30 PM",
    "dateAddedUTC" : "2015-09-28T22:58:30.582Z",
    "description" : "Lorem ipsum dolor sit amet, consectetur adipiscing elit. Vivamus vel lectus ut turpis fermentum vestibulum. ",
    "favorited" : false,
    "hyperlink" : "http://musicforvisuals.tumblr.com/compositions",
    "id" : "184",
    "index" : 50,
    "lastlocation" : -1,
    "newtag" : "",
    "parentId" : "49",
    "taglist" : [ "first-tag" ],
    "text" : "Music for Visuals â€” Compositions"
  },
  "186" : {
    "dateAddedLocal" : "10/31/2016, 5:09:50 PM",
    "dateAddedUTC" : "2016-10-31T21:09:50.034Z",
    "description" : "Lorem ipsum dolor sit amet, consectetur adipiscing elit. Vivamus vel lectus ut turpis fermentum vestibulum. ",
    "favorited" : false,
    "hyperlink" : "https://bl.ocks.org/mbostock/4339083",
    "id" : "185",
    "index" : 11,
    "lastlocation" : -1,
    "newtag" : "",
    "parentId" : "666",
    "taglist" : [ "first-tag" ],
    "text" : "Collapsible Tree - bl.ocks.org"
  },
  "187" : {
    "dateAddedLocal" : "10/2/2017, 4:41:52 PM",
    "dateAddedUTC" : "2017-10-02T20:41:52.727Z",
    "description" : "Lorem ipsum dolor sit amet, consectetur adipiscing elit. Vivamus vel lectus ut turpis fermentum vestibulum. ",
    "favorited" : false,
    "hyperlink" : "https://www.codeinwp.com/blog/secure-your-wordpress-website/",
    "id" : "186",
    "index" : 108,
    "lastlocation" : -1,
    "newtag" : "",
    "parentId" : "1",
    "taglist" : [ "cybersecurity" ],
    "text" : "secure WP"
  },
  "188" : {
    "dateAddedLocal" : "11/23/2016, 11:05:55 PM",
    "dateAddedUTC" : "2016-11-24T04:05:55.596Z",
    "description" : "Lorem ipsum dolor sit amet, consectetur adipiscing elit. Vivamus vel lectus ut turpis fermentum vestibulum. ",
    "favorited" : false,
    "hyperlink" : "http://imgur.com/gallery/sDqmm",
    "id" : "187",
    "index" : 205,
    "lastlocation" : -1,
    "newtag" : "",
    "parentId" : "1",
    "taglist" : [ "cooking" ],
    "text" : "20+ chicken recipes you should try out - Album on Imgur"
  },
  "189" : {
    "dateAddedLocal" : "1/9/2016, 3:13:48 PM",
    "dateAddedUTC" : "2016-01-09T20:13:48.895Z",
    "description" : "Lorem ipsum dolor sit amet, consectetur adipiscing elit. Vivamus vel lectus ut turpis fermentum vestibulum. ",
    "favorited" : false,
    "hyperlink" : "http://www.thecoli.com/forums/the-booth.3/",
    "id" : "188",
    "index" : 145,
    "lastlocation" : -1,
    "newtag" : "",
    "parentId" : "1",
    "taglist" : [ "music" ],
    "text" : "The Coli - The booth"
  },
  "190" : {
    "dateAddedLocal" : "5/15/2019, 9:44:57 AM",
    "dateAddedUTC" : "2019-05-15T13:44:57.710Z",
    "description" : "Lorem ipsum dolor sit amet, consectetur adipiscing elit. Vivamus vel lectus ut turpis fermentum vestibulum. ",
    "favorited" : false,
    "hyperlink" : "https://docs.google.com/document/d/1KdyDMBFM8wuOgWIFnJE-hNjMmSeTBJ1BZGSyFveXZvE/edit",
    "id" : "189",
    "index" : 15,
    "lastlocation" : -1,
    "newtag" : "",
    "parentId" : "1",
    "taglist" : [ "career", "boston" ],
    "text" : "Dori NEU Resources"
  },
  "191" : {
    "dateAddedLocal" : "5/8/2016, 12:15:36 AM",
    "dateAddedUTC" : "2016-05-08T04:15:36.425Z",
    "description" : "Lorem ipsum dolor sit amet, consectetur adipiscing elit. Vivamus vel lectus ut turpis fermentum vestibulum. ",
    "favorited" : false,
    "hyperlink" : "http://muyueh.com/greenhoney/",
    "id" : "190",
    "index" : 168,
    "lastlocation" : -1,
    "newtag" : "",
    "parentId" : "1",
    "taglist" : [ "data-viz", "creative-agency" ],
    "text" : "great d3 color organization"
  },
  "192" : {
    "dateAddedLocal" : "7/25/2014, 11:33:28 AM",
    "dateAddedUTC" : "2014-07-25T15:33:28.480Z",
    "description" : "Lorem ipsum dolor sit amet, consectetur adipiscing elit. Vivamus vel lectus ut turpis fermentum vestibulum. ",
    "favorited" : false,
    "hyperlink" : "https://www.youtube.com/watch?v=jD_k7Ni1btU",
    "id" : "191",
    "index" : 3,
    "lastlocation" : -1,
    "newtag" : "",
    "parentId" : "163",
    "taglist" : [ "first-tag" ],
    "text" : "Missy Elliott - Lose Control [HD] - YouTube"
  },
  "193" : {
    "dateAddedLocal" : "11/22/2015, 10:42:04 PM",
    "dateAddedUTC" : "2015-11-23T03:42:04.645Z",
    "description" : "Lorem ipsum dolor sit amet, consectetur adipiscing elit. Vivamus vel lectus ut turpis fermentum vestibulum. ",
    "favorited" : false,
    "hyperlink" : "http://mojs.io/",
    "id" : "192",
    "index" : 48,
    "lastlocation" : -1,
    "newtag" : "",
    "parentId" : "2",
    "taglist" : [ "api" ],
    "text" : "mo Â· js - Motion Graphics For The Web"
  },
  "194" : {
    "dateAddedLocal" : "4/7/2016, 5:11:28 PM",
    "dateAddedUTC" : "2016-04-07T21:11:28.799Z",
    "description" : "Lorem ipsum dolor sit amet, consectetur adipiscing elit. Vivamus vel lectus ut turpis fermentum vestibulum. ",
    "favorited" : false,
    "hyperlink" : "http://www.materialui.co/colors",
    "id" : "193",
    "index" : 124,
    "lastlocation" : -1,
    "newtag" : "",
    "parentId" : "1",
    "taglist" : [ "first-tag" ],
    "text" : "unnamed"
  },
  "195" : {
    "dateAddedLocal" : "2/26/2015, 11:45:07 AM",
    "dateAddedUTC" : "2015-02-26T16:45:07.903Z",
    "description" : "Lorem ipsum dolor sit amet, consectetur adipiscing elit. Vivamus vel lectus ut turpis fermentum vestibulum. ",
    "favorited" : false,
    "hyperlink" : "http://www.typography.com/",
    "id" : "194",
    "index" : 0,
    "lastlocation" : -1,
    "newtag" : "",
    "parentId" : "311",
    "taglist" : [ "first-tag" ],
    "text" : "Hoefler & Co."
  },
  "196" : {
    "dateAddedLocal" : "2/4/2018, 12:04:52 AM",
    "dateAddedUTC" : "2018-02-04T05:04:52.554Z",
    "description" : "Lorem ipsum dolor sit amet, consectetur adipiscing elit. Vivamus vel lectus ut turpis fermentum vestibulum. ",
    "favorited" : false,
    "hyperlink" : "http://charlieosbornedesign.co.uk/",
    "id" : "195",
    "index" : 6,
    "lastlocation" : -1,
    "newtag" : "",
    "parentId" : "549",
    "taglist" : [ "first-tag" ],
    "text" : "Charlie Osborne Design"
  },
  "197" : {
    "dateAddedLocal" : "3/6/2015, 11:54:57 AM",
    "dateAddedUTC" : "2015-03-06T16:54:57.975Z",
    "description" : "Lorem ipsum dolor sit amet, consectetur adipiscing elit. Vivamus vel lectus ut turpis fermentum vestibulum. ",
    "favorited" : false,
    "hyperlink" : "https://www.august.com.au/",
    "id" : "196",
    "index" : 0,
    "lastlocation" : -1,
    "newtag" : "",
    "parentId" : "35",
    "taglist" : [ "first-tag" ],
    "text" : "Immersive Sharp Illustration inspiration"
  },
  "198" : {
    "dateAddedLocal" : "7/19/2014, 1:18:34 PM",
    "dateAddedUTC" : "2014-07-19T17:18:34.883Z",
    "description" : "Lorem ipsum dolor sit amet, consectetur adipiscing elit. Vivamus vel lectus ut turpis fermentum vestibulum. ",
    "favorited" : false,
    "hyperlink" : "http://kimd.cc/",
    "id" : "197",
    "index" : 0,
    "lastlocation" : -1,
    "newtag" : "",
    "parentId" : "759",
    "taglist" : [ "first-tag" ],
    "text" : "Kimd | z-index to move on a one-pager"
  },
  "199" : {
    "dateAddedLocal" : "12/23/2014, 11:47:43 AM",
    "dateAddedUTC" : "2014-12-23T16:47:43.317Z",
    "description" : "Lorem ipsum dolor sit amet, consectetur adipiscing elit. Vivamus vel lectus ut turpis fermentum vestibulum. ",
    "favorited" : false,
    "hyperlink" : "https://www.youtube.com/watch?v=PV7m4c4MU9Y",
    "id" : "198",
    "index" : 4,
    "lastlocation" : -1,
    "newtag" : "",
    "parentId" : "163",
    "taglist" : [ "first-tag" ],
    "text" : "Tink - Around the Clock ft. Charlamagne Tha God - YouTube"
  },
  "200" : {
    "dateAddedLocal" : "8/13/2018, 12:48:10 PM",
    "dateAddedUTC" : "2018-08-13T16:48:10.385Z",
    "description" : "Lorem ipsum dolor sit amet, consectetur adipiscing elit. Vivamus vel lectus ut turpis fermentum vestibulum. ",
    "favorited" : false,
    "id" : "199",
    "index" : 92,
    "lastlocation" : -1,
    "newtag" : "",
    "parentId" : "2",
    "taglist" : [ "first-tag" ],
    "text" : "Icon Grid"
  },
  "201" : {
    "dateAddedLocal" : "9/24/2015, 3:43:42 PM",
    "dateAddedUTC" : "2015-09-24T19:43:42.393Z",
    "description" : "Lorem ipsum dolor sit amet, consectetur adipiscing elit. Vivamus vel lectus ut turpis fermentum vestibulum. ",
    "favorited" : false,
    "id" : "200",
    "index" : 41,
    "lastlocation" : -1,
    "newtag" : "",
    "parentId" : "2",
    "taglist" : [ "first-tag" ],
    "text" : "awd unit 1 responsive web design"
  },
  "202" : {
    "dateAddedLocal" : "10/10/2017, 6:12:26 PM",
    "dateAddedUTC" : "2017-10-10T22:12:26.648Z",
    "description" : "Lorem ipsum dolor sit amet, consectetur adipiscing elit. Vivamus vel lectus ut turpis fermentum vestibulum. ",
    "favorited" : false,
    "id" : "201",
    "index" : 110,
    "lastlocation" : -1,
    "newtag" : "",
    "parentId" : "1",
    "taglist" : [ "first-tag" ],
    "text" : "Bali"
  },
  "203" : {
    "dateAddedLocal" : "1/9/2014, 2:59:45 PM",
    "dateAddedUTC" : "2014-01-09T19:59:45.711Z",
    "description" : "Lorem ipsum dolor sit amet, consectetur adipiscing elit. Vivamus vel lectus ut turpis fermentum vestibulum. ",
    "favorited" : false,
    "hyperlink" : "http://www.youtube.com/watch?v=fa4tn6k037M",
    "id" : "202",
    "index" : 21,
    "lastlocation" : -1,
    "newtag" : "",
    "parentId" : "49",
    "taglist" : [ "first-tag" ],
    "text" : "party dnb/dubstep"
  },
  "204" : {
    "dateAddedLocal" : "10/25/2017, 6:46:30 PM",
    "dateAddedUTC" : "2017-10-25T22:46:30.907Z",
    "description" : "Lorem ipsum dolor sit amet, consectetur adipiscing elit. Vivamus vel lectus ut turpis fermentum vestibulum. ",
    "favorited" : false,
    "hyperlink" : "https://ivomynttinen.com/contact",
    "id" : "203",
    "index" : 4,
    "lastlocation" : -1,
    "newtag" : "",
    "parentId" : "549",
    "taglist" : [ "first-tag" ],
    "text" : "Contact - Ivo Mynttinen / User Interface Designer"
  },
  "205" : {
    "dateAddedLocal" : "11/14/2018, 9:50:04 PM",
    "dateAddedUTC" : "2018-11-15T02:50:04.166Z",
    "description" : "Lorem ipsum dolor sit amet, consectetur adipiscing elit. Vivamus vel lectus ut turpis fermentum vestibulum. ",
    "favorited" : false,
    "hyperlink" : "https://analytics.mosaic.io/login",
    "id" : "204",
    "index" : 287,
    "lastlocation" : -1,
    "newtag" : "",
    "parentId" : "1",
    "taglist" : [ "first-tag" ],
    "text" : "unnamed"
  },
  "206" : {
    "dateAddedLocal" : "1/2/2017, 10:45:43 PM",
    "dateAddedUTC" : "2017-01-03T03:45:43.551Z",
    "description" : "Lorem ipsum dolor sit amet, consectetur adipiscing elit. Vivamus vel lectus ut turpis fermentum vestibulum. ",
    "favorited" : false,
    "hyperlink" : "http://travellerstash.com/flight-hacks/",
    "id" : "205",
    "index" : 210,
    "lastlocation" : -1,
    "newtag" : "",
    "parentId" : "1",
    "taglist" : [ "first-tag" ],
    "text" : "Flight Hacks"
  },
  "207" : {
    "dateAddedLocal" : "12/3/2017, 7:22:18 AM",
    "dateAddedUTC" : "2017-12-03T12:22:18.476Z",
    "description" : "Lorem ipsum dolor sit amet, consectetur adipiscing elit. Vivamus vel lectus ut turpis fermentum vestibulum. ",
    "favorited" : false,
    "hyperlink" : "https://www.turtlebc.com/tools/buy_percentage",
    "id" : "206",
    "index" : 96,
    "lastlocation" : -1,
    "newtag" : "",
    "parentId" : "1",
    "taglist" : [ "first-tag" ],
    "text" : "turtle"
  },
  "208" : {
    "dateAddedLocal" : "6/19/2015, 10:32:05 AM",
    "dateAddedUTC" : "2015-06-19T14:32:05.498Z",
    "description" : "Lorem ipsum dolor sit amet, consectetur adipiscing elit. Vivamus vel lectus ut turpis fermentum vestibulum. ",
    "favorited" : false,
    "hyperlink" : "https://mail.google.com/mail/u/0/",
    "id" : "207",
    "index" : 1,
    "lastlocation" : -1,
    "newtag" : "",
    "parentId" : "1",
    "taglist" : [ "first-tag" ],
    "text" : "Gmail"
  },
  "209" : {
    "dateAddedLocal" : "9/24/2015, 4:05:24 PM",
    "dateAddedUTC" : "2015-09-24T20:05:24.776Z",
    "description" : "Lorem ipsum dolor sit amet, consectetur adipiscing elit. Vivamus vel lectus ut turpis fermentum vestibulum. ",
    "favorited" : false,
    "hyperlink" : "http://blog.teamtreehouse.com/beginners-guide-to-responsive-web-design",
    "id" : "208",
    "index" : 4,
    "lastlocation" : -1,
    "newtag" : "",
    "parentId" : "51",
    "taglist" : [ "first-tag" ],
    "text" : "Beginnerâ€™s Guide to Responsive Web Design - Treehouse Blog"
  },
  "210" : {
    "dateAddedLocal" : "1/17/2018, 5:59:20 AM",
    "dateAddedUTC" : "2018-01-17T10:59:20.852Z",
    "description" : "Lorem ipsum dolor sit amet, consectetur adipiscing elit. Vivamus vel lectus ut turpis fermentum vestibulum. ",
    "favorited" : false,
    "hyperlink" : "https://facebook.github.io/react-native/docs/getting-started.html",
    "id" : "209",
    "index" : 84,
    "lastlocation" : -1,
    "newtag" : "",
    "parentId" : "1",
    "taglist" : [ "first-tag" ],
    "text" : "unnamed"
  },
  "211" : {
    "dateAddedLocal" : "3/4/2015, 9:18:08 AM",
    "dateAddedUTC" : "2015-03-04T14:18:08.393Z",
    "description" : "Lorem ipsum dolor sit amet, consectetur adipiscing elit. Vivamus vel lectus ut turpis fermentum vestibulum. ",
    "favorited" : false,
    "hyperlink" : "http://www.ibm.com/design/language/resources/swatch-book.shtml",
    "id" : "210",
    "index" : 1,
    "lastlocation" : -1,
    "newtag" : "",
    "parentId" : "38",
    "taglist" : [ "first-tag" ],
    "text" : "unnamed"
  },
  "212" : {
    "dateAddedLocal" : "9/13/2016, 6:16:21 PM",
    "dateAddedUTC" : "2016-09-13T22:16:21.294Z",
    "description" : "Lorem ipsum dolor sit amet, consectetur adipiscing elit. Vivamus vel lectus ut turpis fermentum vestibulum. ",
    "favorited" : false,
    "hyperlink" : "http://www.dave-landry.com/classes/",
    "id" : "211",
    "index" : 194,
    "lastlocation" : -1,
    "newtag" : "",
    "parentId" : "1",
    "taglist" : [ "first-tag" ],
    "text" : "Dave Landry - Classes"
  },
  "213" : {
    "dateAddedLocal" : "9/6/2015, 2:53:41 PM",
    "dateAddedUTC" : "2015-09-06T18:53:41.457Z",
    "description" : "Lorem ipsum dolor sit amet, consectetur adipiscing elit. Vivamus vel lectus ut turpis fermentum vestibulum. ",
    "favorited" : false,
    "id" : "212",
    "index" : 43,
    "lastlocation" : -1,
    "newtag" : "",
    "parentId" : "2",
    "taglist" : [ "first-tag" ],
    "text" : "Portfolio Inspiration"
  },
  "214" : {
    "dateAddedLocal" : "4/2/2016, 1:57:03 PM",
    "dateAddedUTC" : "2016-04-02T17:57:03.762Z",
    "description" : "Lorem ipsum dolor sit amet, consectetur adipiscing elit. Vivamus vel lectus ut turpis fermentum vestibulum. ",
    "favorited" : false,
    "hyperlink" : "https://flatuicolors.com/",
    "id" : "213",
    "index" : 128,
    "lastlocation" : -1,
    "newtag" : "",
    "parentId" : "1",
    "taglist" : [ "first-tag" ],
    "text" : "unnamed"
  },
  "215" : {
    "dateAddedLocal" : "7/12/2014, 3:52:57 PM",
    "dateAddedUTC" : "2014-07-12T19:52:57.287Z",
    "description" : "Lorem ipsum dolor sit amet, consectetur adipiscing elit. Vivamus vel lectus ut turpis fermentum vestibulum. ",
    "favorited" : false,
    "hyperlink" : "https://onlycoin.com/",
    "id" : "214",
    "index" : 2,
    "lastlocation" : -1,
    "newtag" : "",
    "parentId" : "759",
    "taglist" : [ "first-tag" ],
    "text" : "Coin | amazing web design"
  },
  "216" : {
    "dateAddedLocal" : "4/5/2015, 4:07:11 PM",
    "dateAddedUTC" : "2015-04-05T20:07:11.182Z",
    "description" : "Lorem ipsum dolor sit amet, consectetur adipiscing elit. Vivamus vel lectus ut turpis fermentum vestibulum. ",
    "favorited" : false,
    "hyperlink" : "http://yalantis.com/",
    "id" : "215",
    "index" : 14,
    "lastlocation" : -1,
    "newtag" : "",
    "parentId" : "35",
    "taglist" : [ "first-tag" ],
    "text" : "V similar"
  },
  "217" : {
    "dateAddedLocal" : "3/21/2018, 6:48:25 PM",
    "dateAddedUTC" : "2018-03-21T22:48:25.796Z",
    "description" : "Lorem ipsum dolor sit amet, consectetur adipiscing elit. Vivamus vel lectus ut turpis fermentum vestibulum. ",
    "favorited" : false,
    "hyperlink" : "https://www.youtube.com/user/lewishowes/videos",
    "id" : "216",
    "index" : 78,
    "lastlocation" : -1,
    "newtag" : "",
    "parentId" : "1",
    "taglist" : [ "first-tag" ],
    "text" : "Lewis Howes "
  },
  "218" : {
    "dateAddedLocal" : "9/11/2015, 10:30:27 AM",
    "dateAddedUTC" : "2015-09-11T14:30:27.040Z",
    "description" : "Lorem ipsum dolor sit amet, consectetur adipiscing elit. Vivamus vel lectus ut turpis fermentum vestibulum. ",
    "favorited" : false,
    "hyperlink" : "http://www.smartdestinations.com/blog/boston-fall-events/",
    "id" : "217",
    "index" : 8,
    "lastlocation" : -1,
    "newtag" : "",
    "parentId" : "42",
    "taglist" : [ "first-tag" ],
    "text" : "19 Things to Do in Boston in the Fall - Go City Card"
  },
  "219" : {
    "dateAddedLocal" : "6/4/2019, 9:38:18 PM",
    "dateAddedUTC" : "2019-06-05T01:38:18.293Z",
    "description" : "Lorem ipsum dolor sit amet, consectetur adipiscing elit. Vivamus vel lectus ut turpis fermentum vestibulum. ",
    "favorited" : false,
    "hyperlink" : "https://hashnode.com/n/reactjs",
    "id" : "218",
    "index" : 12,
    "lastlocation" : -1,
    "newtag" : "",
    "parentId" : "1",
    "taglist" : [ "first-tag" ],
    "text" : "React - Hashnode Community"
  },
  "220" : {
    "dateAddedLocal" : "9/13/2014, 7:42:26 PM",
    "dateAddedUTC" : "2014-09-13T23:42:26.679Z",
    "description" : "Lorem ipsum dolor sit amet, consectetur adipiscing elit. Vivamus vel lectus ut turpis fermentum vestibulum. ",
    "favorited" : false,
    "hyperlink" : "https://www.youtube.com/watch?v=6P9Pxm8Apg0&list=PL153BAFA3AEFFDDF1&index=5",
    "id" : "219",
    "index" : 34,
    "lastlocation" : -1,
    "newtag" : "",
    "parentId" : "49",
    "taglist" : [ "first-tag" ],
    "text" : "Blueprint - In The Beginning - YouTube"
  },
  "221" : {
    "dateAddedLocal" : "1/16/2015, 12:50:43 PM",
    "dateAddedUTC" : "2015-01-16T17:50:43.079Z",
    "description" : "Lorem ipsum dolor sit amet, consectetur adipiscing elit. Vivamus vel lectus ut turpis fermentum vestibulum. ",
    "favorited" : false,
    "hyperlink" : "https://www.youtube.com/watch?v=1V_nTWcrprI",
    "id" : "220",
    "index" : 37,
    "lastlocation" : -1,
    "newtag" : "",
    "parentId" : "49",
    "taglist" : [ "first-tag" ],
    "text" : "Sunrise Mass. 1) The Spheres - Ola Gjeilo - YouTube"
  },
  "222" : {
    "dateAddedLocal" : "9/30/2016, 4:51:06 PM",
    "dateAddedUTC" : "2016-09-30T20:51:06.356Z",
    "description" : "Lorem ipsum dolor sit amet, consectetur adipiscing elit. Vivamus vel lectus ut turpis fermentum vestibulum. ",
    "favorited" : false,
    "hyperlink" : "https://christinecha.github.io/choreographer-js/?utm_source=codropscollective",
    "id" : "221",
    "index" : 199,
    "lastlocation" : -1,
    "newtag" : "",
    "parentId" : "1",
    "taglist" : [ "first-tag" ],
    "text" : "Choreographer-js"
  },
  "223" : {
    "dateAddedLocal" : "9/24/2015, 3:43:47 PM",
    "dateAddedUTC" : "2015-09-24T19:43:47.709Z",
    "description" : "Lorem ipsum dolor sit amet, consectetur adipiscing elit. Vivamus vel lectus ut turpis fermentum vestibulum. ",
    "favorited" : false,
    "hyperlink" : "http://abookapart.com/products/responsive-web-design",
    "id" : "222",
    "index" : 1,
    "lastlocation" : -1,
    "newtag" : "",
    "parentId" : "51",
    "taglist" : [ "first-tag" ],
    "text" : "A Book Apart, Responsive Web Design"
  },
  "224" : {
    "dateAddedLocal" : "9/4/2018, 6:09:51 PM",
    "dateAddedUTC" : "2018-09-04T22:09:51.970Z",
    "description" : "Lorem ipsum dolor sit amet, consectetur adipiscing elit. Vivamus vel lectus ut turpis fermentum vestibulum. ",
    "favorited" : false,
    "hyperlink" : "https://medium.com/@Melt_Dem/the-tezos-experiment-b97e124e5b38",
    "id" : "223",
    "index" : 248,
    "lastlocation" : -1,
    "newtag" : "",
    "parentId" : "1",
    "taglist" : [ "first-tag" ],
    "text" : "The Tezos Experiment â€“ Meltem Demirors â€“ Medium"
  },
  "225" : {
    "dateAddedLocal" : "2/19/2019, 2:01:06 PM",
    "dateAddedUTC" : "2019-02-19T19:01:06.087Z",
    "description" : "Lorem ipsum dolor sit amet, consectetur adipiscing elit. Vivamus vel lectus ut turpis fermentum vestibulum. ",
    "favorited" : false,
    "hyperlink" : "https://www.youtube.com/user/Kemetprince1/videos",
    "id" : "224",
    "index" : 258,
    "lastlocation" : -1,
    "newtag" : "",
    "parentId" : "1",
    "taglist" : [ "first-tag" ],
    "text" : "Infinite Waters"
  },
  "226" : {
    "dateAddedLocal" : "8/1/2015, 4:57:25 AM",
    "dateAddedUTC" : "2015-08-01T08:57:25.160Z",
    "description" : "Lorem ipsum dolor sit amet, consectetur adipiscing elit. Vivamus vel lectus ut turpis fermentum vestibulum. ",
    "favorited" : false,
    "hyperlink" : "https://www.youtube.com/watch?v=RF2I89Dpo3I",
    "id" : "225",
    "index" : 48,
    "lastlocation" : -1,
    "newtag" : "",
    "parentId" : "49",
    "taglist" : [ "first-tag" ],
    "text" : "Mike Dece - Rich Slut [Full Album] - YouTube"
  },
  "227" : {
    "dateAddedLocal" : "7/11/2018, 9:55:51 PM",
    "dateAddedUTC" : "2018-07-12T01:55:51.477Z",
    "description" : "Lorem ipsum dolor sit amet, consectetur adipiscing elit. Vivamus vel lectus ut turpis fermentum vestibulum. ",
    "favorited" : false,
    "hyperlink" : "http://www.blocktivity.info/",
    "id" : "226",
    "index" : 0,
    "lastlocation" : -1,
    "newtag" : "",
    "parentId" : "508",
    "taglist" : [ "first-tag" ],
    "text" : "Block'tivity"
  },
  "228" : {
    "dateAddedLocal" : "1/6/2019, 1:04:27 PM",
    "dateAddedUTC" : "2019-01-06T18:04:27.158Z",
    "description" : "Lorem ipsum dolor sit amet, consectetur adipiscing elit. Vivamus vel lectus ut turpis fermentum vestibulum. ",
    "favorited" : false,
    "hyperlink" : "https://coolidgeyoga.com/brookline-studio-schedule",
    "id" : "227",
    "index" : 260,
    "lastlocation" : -1,
    "newtag" : "",
    "parentId" : "1",
    "taglist" : [ "first-tag" ],
    "text" : "Yoga"
  },
  "229" : {
    "dateAddedLocal" : "4/6/2015, 6:40:05 PM",
    "dateAddedUTC" : "2015-04-06T22:40:05.180Z",
    "description" : "Lorem ipsum dolor sit amet, consectetur adipiscing elit. Vivamus vel lectus ut turpis fermentum vestibulum. ",
    "favorited" : false,
    "id" : "228",
    "index" : 17,
    "lastlocation" : -1,
    "newtag" : "",
    "parentId" : "35",
    "taglist" : [ "first-tag" ],
    "text" : "student ports"
  },
  "230" : {
    "dateAddedLocal" : "1/16/2016, 7:05:02 PM",
    "dateAddedUTC" : "2016-01-17T00:05:02.681Z",
    "description" : "Lorem ipsum dolor sit amet, consectetur adipiscing elit. Vivamus vel lectus ut turpis fermentum vestibulum. ",
    "favorited" : false,
    "hyperlink" : "http://www.longtailpro.com/",
    "id" : "229",
    "index" : 14,
    "lastlocation" : -1,
    "newtag" : "",
    "parentId" : "65",
    "taglist" : [ "first-tag" ],
    "text" : "Long Tail Pro - Keyword Research Software - free trial"
  },
  "231" : {
    "dateAddedLocal" : "7/22/2018, 10:46:12 AM",
    "dateAddedUTC" : "2018-07-22T14:46:12.944Z",
    "description" : "Lorem ipsum dolor sit amet, consectetur adipiscing elit. Vivamus vel lectus ut turpis fermentum vestibulum. ",
    "favorited" : false,
    "hyperlink" : "http://satisgroup.io/",
    "id" : "230",
    "index" : 2,
    "lastlocation" : -1,
    "newtag" : "",
    "parentId" : "508",
    "taglist" : [ "first-tag" ],
    "text" : "Satis Group â€“ Premier ICO advisory firm"
  },
  "232" : {
    "dateAddedLocal" : "9/2/2017, 12:43:14 AM",
    "dateAddedUTC" : "2017-09-02T04:43:14.175Z",
    "description" : "Lorem ipsum dolor sit amet, consectetur adipiscing elit. Vivamus vel lectus ut turpis fermentum vestibulum. ",
    "favorited" : false,
    "hyperlink" : "http://www.bonappetit.com/story/whole-foods-products-deals-on-amazon?mbid=social_twitter",
    "id" : "231",
    "index" : 1,
    "lastlocation" : -1,
    "newtag" : "",
    "parentId" : "580",
    "taglist" : [ "first-tag" ],
    "text" : "13 Whole Foods Product Deals on Amazon Right Now | Bon Appetit"
  },
  "233" : {
    "dateAddedLocal" : "10/23/2017, 6:04:13 PM",
    "dateAddedUTC" : "2017-10-23T22:04:13.462Z",
    "description" : "Lorem ipsum dolor sit amet, consectetur adipiscing elit. Vivamus vel lectus ut turpis fermentum vestibulum. ",
    "favorited" : false,
    "hyperlink" : "http://blog.mclain.ca/buy-and-hold-31-cryptocurrencies-for-365-days-week-10/",
    "id" : "232",
    "index" : 3,
    "lastlocation" : -1,
    "newtag" : "",
    "parentId" : "549",
    "taglist" : [ "first-tag" ],
    "text" : "loading bar for how scrolled you are"
  },
  "234" : {
    "dateAddedLocal" : "7/2/2014, 12:23:07 PM",
    "dateAddedUTC" : "2014-07-02T16:23:07.031Z",
    "description" : "Lorem ipsum dolor sit amet, consectetur adipiscing elit. Vivamus vel lectus ut turpis fermentum vestibulum. ",
    "favorited" : false,
    "hyperlink" : "http://www.jasondavies.com/",
    "id" : "233",
    "index" : 2,
    "lastlocation" : -1,
    "newtag" : "",
    "parentId" : "418",
    "taglist" : [ "first-tag" ],
    "text" : "Jason Davies- co creator of D3"
  },
  "235" : {
    "dateAddedLocal" : "4/8/2019, 11:30:15 PM",
    "dateAddedUTC" : "2019-04-09T03:30:15.143Z",
    "description" : "Lorem ipsum dolor sit amet, consectetur adipiscing elit. Vivamus vel lectus ut turpis fermentum vestibulum. ",
    "favorited" : false,
    "hyperlink" : "https://www.youtube.com/user/Kemetprince1/videos",
    "id" : "234",
    "index" : 24,
    "lastlocation" : -1,
    "newtag" : "",
    "parentId" : "1",
    "taglist" : [ "first-tag" ],
    "text" : "Infinite Waters"
  },
  "236" : {
    "dateAddedLocal" : "9/2/2014, 1:44:50 AM",
    "dateAddedUTC" : "2014-09-02T05:44:50.041Z",
    "description" : "Lorem ipsum dolor sit amet, consectetur adipiscing elit. Vivamus vel lectus ut turpis fermentum vestibulum. ",
    "favorited" : false,
    "hyperlink" : "https://www.youtube.com/watch?v=S98Q11zhS-g",
    "id" : "235",
    "index" : 32,
    "lastlocation" : -1,
    "newtag" : "",
    "parentId" : "49",
    "taglist" : [ "first-tag" ],
    "text" : "BANKS - Goddess (Lyric Video) - YouTube"
  },
  "237" : {
    "dateAddedLocal" : "2/25/2016, 1:29:54 PM",
    "dateAddedUTC" : "2016-02-25T18:29:54.213Z",
    "description" : "Lorem ipsum dolor sit amet, consectetur adipiscing elit. Vivamus vel lectus ut turpis fermentum vestibulum. ",
    "favorited" : false,
    "hyperlink" : "http://ffffound.com/",
    "id" : "236",
    "index" : 164,
    "lastlocation" : -1,
    "newtag" : "",
    "parentId" : "1",
    "taglist" : [ "first-tag" ],
    "text" : "FFFFOUND!"
  },
  "238" : {
    "dateAddedLocal" : "3/6/2015, 3:13:01 PM",
    "dateAddedUTC" : "2015-03-06T20:13:01.706Z",
    "description" : "Lorem ipsum dolor sit amet, consectetur adipiscing elit. Vivamus vel lectus ut turpis fermentum vestibulum. ",
    "favorited" : false,
    "hyperlink" : "http://joelcalifa.com/",
    "id" : "237",
    "index" : 3,
    "lastlocation" : -1,
    "newtag" : "",
    "parentId" : "35",
    "taglist" : [ "first-tag" ],
    "text" : "solid port"
  },
  "239" : {
    "dateAddedLocal" : "9/24/2015, 4:26:36 PM",
    "dateAddedUTC" : "2015-09-24T20:26:36.067Z",
    "description" : "Lorem ipsum dolor sit amet, consectetur adipiscing elit. Vivamus vel lectus ut turpis fermentum vestibulum. ",
    "favorited" : false,
    "hyperlink" : "http://dl.acm.org.ezproxy.neu.edu/citation.cfm?id=2775441.2775478&coll=DL&dl=ACM&CFID=716221908&CFTOKEN=83382888",
    "id" : "238",
    "index" : 8,
    "lastlocation" : -1,
    "newtag" : "",
    "parentId" : "51",
    "taglist" : [ "first-tag" ],
    "text" : "Responsive, mobile app, mobile first"
  },
  "240" : {
    "dateAddedLocal" : "6/28/2014, 6:17:21 PM",
    "dateAddedUTC" : "2014-06-28T22:17:21.462Z",
    "description" : "Lorem ipsum dolor sit amet, consectetur adipiscing elit. Vivamus vel lectus ut turpis fermentum vestibulum. ",
    "favorited" : false,
    "hyperlink" : "http://bl.ocks.org/ilyabo/1373263",
    "id" : "239",
    "index" : 7,
    "lastlocation" : -1,
    "newtag" : "",
    "parentId" : "16",
    "taglist" : [ "first-tag" ],
    "text" : "D3 tooltip using jQuery tipsy"
  },
  "241" : {
    "dateAddedLocal" : "4/9/2018, 6:04:49 PM",
    "dateAddedUTC" : "2018-04-09T22:04:49.394Z",
    "description" : "Lorem ipsum dolor sit amet, consectetur adipiscing elit. Vivamus vel lectus ut turpis fermentum vestibulum. ",
    "favorited" : false,
    "hyperlink" : "https://medium.com/bleecoin/top-cryptocurrency-venture-capital-firms-3da1720202ad",
    "id" : "240",
    "index" : 64,
    "lastlocation" : -1,
    "newtag" : "",
    "parentId" : "1",
    "taglist" : [ "first-tag" ],
    "text" : "Firms"
  },
  "242" : {
    "dateAddedLocal" : "8/31/2015, 9:37:15 PM",
    "dateAddedUTC" : "2015-09-01T01:37:15.049Z",
    "description" : "Lorem ipsum dolor sit amet, consectetur adipiscing elit. Vivamus vel lectus ut turpis fermentum vestibulum. ",
    "favorited" : false,
    "id" : "241",
    "index" : 36,
    "lastlocation" : -1,
    "newtag" : "",
    "parentId" : "2",
    "taglist" : [ "first-tag" ],
    "text" : "cooking"
  },
  "243" : {
    "dateAddedLocal" : "10/20/2015, 2:21:19 PM",
    "dateAddedUTC" : "2015-10-20T18:21:19.543Z",
    "description" : "Lorem ipsum dolor sit amet, consectetur adipiscing elit. Vivamus vel lectus ut turpis fermentum vestibulum. ",
    "favorited" : false,
    "hyperlink" : "http://www.brainfeedersite.com/",
    "id" : "242",
    "index" : 144,
    "lastlocation" : -1,
    "newtag" : "",
    "parentId" : "1",
    "taglist" : [ "first-tag" ],
    "text" : "unnamed"
  },
  "244" : {
    "dateAddedLocal" : "6/1/2015, 12:29:28 AM",
    "dateAddedUTC" : "2015-06-01T04:29:28.551Z",
    "description" : "Lorem ipsum dolor sit amet, consectetur adipiscing elit. Vivamus vel lectus ut turpis fermentum vestibulum. ",
    "favorited" : false,
    "hyperlink" : "http://aceaglobal.com/",
    "id" : "243",
    "index" : 2,
    "lastlocation" : -1,
    "newtag" : "",
    "parentId" : "44",
    "taglist" : [ "first-tag" ],
    "text" : "unnamed"
  },
  "245" : {
    "dateAddedLocal" : "3/30/2015, 9:58:18 PM",
    "dateAddedUTC" : "2015-03-31T01:58:18.224Z",
    "description" : "Lorem ipsum dolor sit amet, consectetur adipiscing elit. Vivamus vel lectus ut turpis fermentum vestibulum. ",
    "favorited" : false,
    "hyperlink" : "https://www.youtube.com/watch?v=qBXYNn4x0jA&app=desktop",
    "id" : "244",
    "index" : 1,
    "lastlocation" : -1,
    "newtag" : "",
    "parentId" : "28",
    "taglist" : [ "first-tag" ],
    "text" : "An intro to the Q&A feature in Power BI for Office 365 - YouTube"
  },
  "246" : {
    "dateAddedLocal" : "7/3/2014, 7:42:01 PM",
    "dateAddedUTC" : "2014-07-03T23:42:01.719Z",
    "description" : "Lorem ipsum dolor sit amet, consectetur adipiscing elit. Vivamus vel lectus ut turpis fermentum vestibulum. ",
    "favorited" : false,
    "hyperlink" : "http://bl.ocks.org/mbostock",
    "id" : "245",
    "index" : 3,
    "lastlocation" : -1,
    "newtag" : "",
    "parentId" : "418",
    "taglist" : [ "first-tag" ],
    "text" : "bl.ocks.org - mbostock"
  },
  "247" : {
    "dateAddedLocal" : "11/21/2013, 6:25:53 PM",
    "dateAddedUTC" : "2013-11-21T23:25:53.512Z",
    "description" : "Lorem ipsum dolor sit amet, consectetur adipiscing elit. Vivamus vel lectus ut turpis fermentum vestibulum. ",
    "favorited" : false,
    "hyperlink" : "http://www.youtube.com/watch?v=Uzw1QJ2--38",
    "id" : "246",
    "index" : 20,
    "lastlocation" : -1,
    "newtag" : "",
    "parentId" : "49",
    "taglist" : [ "first-tag" ],
    "text" : "â–¶ K os The Love Song - YouTube"
  },
  "248" : {
    "dateAddedLocal" : "9/7/2016, 5:44:12 PM",
    "dateAddedUTC" : "2016-09-07T21:44:12.731Z",
    "description" : "Lorem ipsum dolor sit amet, consectetur adipiscing elit. Vivamus vel lectus ut turpis fermentum vestibulum. ",
    "favorited" : false,
    "hyperlink" : "https://groups.google.com/forum/?hl=en#!forum/nuhoc",
    "id" : "247",
    "index" : 192,
    "lastlocation" : -1,
    "newtag" : "",
    "parentId" : "1",
    "taglist" : [ "first-tag" ],
    "text" : "NUHOC message board"
  },
  "249" : {
    "dateAddedLocal" : "9/13/2015, 12:38:32 AM",
    "dateAddedUTC" : "2015-09-13T04:38:32.596Z",
    "description" : "Lorem ipsum dolor sit amet, consectetur adipiscing elit. Vivamus vel lectus ut turpis fermentum vestibulum. ",
    "favorited" : false,
    "hyperlink" : "http://www.zafu.co/",
    "id" : "248",
    "index" : 136,
    "lastlocation" : -1,
    "newtag" : "",
    "parentId" : "1",
    "taglist" : [ "first-tag" ],
    "text" : "unnamed"
  },
  "250" : {
    "dateAddedLocal" : "10/13/2014, 12:49:44 PM",
    "dateAddedUTC" : "2014-10-13T16:49:44.615Z",
    "description" : "Lorem ipsum dolor sit amet, consectetur adipiscing elit. Vivamus vel lectus ut turpis fermentum vestibulum. ",
    "favorited" : false,
    "hyperlink" : "http://www.nemisclothing.com/collections/urban-streetwear-clothing/products/bottom-up-tee-red",
    "id" : "249",
    "index" : 5,
    "lastlocation" : -1,
    "newtag" : "",
    "parentId" : "15",
    "taglist" : [ "first-tag" ],
    "text" : "Bottom-Up Tee Red | Nemis Clothing"
  },
  "251" : {
    "dateAddedLocal" : "3/29/2019, 5:48:49 PM",
    "dateAddedUTC" : "2019-03-29T21:48:49.084Z",
    "description" : "Lorem ipsum dolor sit amet, consectetur adipiscing elit. Vivamus vel lectus ut turpis fermentum vestibulum. ",
    "favorited" : false,
    "hyperlink" : "https://www.vuemastery.com/courses/intro-to-vue-js/vue-instance",
    "id" : "250",
    "index" : 318,
    "lastlocation" : -1,
    "newtag" : "",
    "parentId" : "1",
    "taglist" : [ "first-tag" ],
    "text" : "The Vue Instance - Intro to Vue.js | Vue Mastery"
  },
  "252" : {
    "dateAddedLocal" : "1/4/2018, 10:56:29 PM",
    "dateAddedUTC" : "2018-01-05T03:56:29.995Z",
    "description" : "Lorem ipsum dolor sit amet, consectetur adipiscing elit. Vivamus vel lectus ut turpis fermentum vestibulum. ",
    "favorited" : false,
    "hyperlink" : "https://portal.ezeep.com/#print",
    "id" : "251",
    "index" : 79,
    "lastlocation" : -1,
    "newtag" : "",
    "parentId" : "1",
    "taglist" : [ "first-tag" ],
    "text" : "unnamed"
  },
  "253" : {
    "dateAddedLocal" : "7/4/2014, 4:41:53 PM",
    "dateAddedUTC" : "2014-07-04T20:41:53.005Z",
    "description" : "Lorem ipsum dolor sit amet, consectetur adipiscing elit. Vivamus vel lectus ut turpis fermentum vestibulum. ",
    "favorited" : false,
    "hyperlink" : "https://www.youtube.com/watch?v=chwADnoFDng&index=4&list=PL687D40A721F83904",
    "id" : "252",
    "index" : 8,
    "lastlocation" : -1,
    "newtag" : "",
    "parentId" : "189",
    "taglist" : [ "first-tag" ],
    "text" : "Sakura - Japanese Folk Music - YouTube | Meditaiton"
  },
  "254" : {
    "dateAddedLocal" : "10/27/2014, 10:04:08 PM",
    "dateAddedUTC" : "2014-10-28T02:04:08.568Z",
    "description" : "Lorem ipsum dolor sit amet, consectetur adipiscing elit. Vivamus vel lectus ut turpis fermentum vestibulum. ",
    "favorited" : false,
    "hyperlink" : "http://en.wikipedia.org/wiki/William_Playfair",
    "id" : "253",
    "index" : 3,
    "lastlocation" : -1,
    "newtag" : "",
    "parentId" : "23",
    "taglist" : [ "first-tag" ],
    "text" : "William Playfair - Wikipedia, the free encyclopedia"
  },
  "255" : {
    "dateAddedLocal" : "9/3/2014, 1:14:23 PM",
    "dateAddedUTC" : "2014-09-03T17:14:23.576Z",
    "description" : "Lorem ipsum dolor sit amet, consectetur adipiscing elit. Vivamus vel lectus ut turpis fermentum vestibulum. ",
    "favorited" : false,
    "hyperlink" : "http://startbootstrap.com/",
    "id" : "254",
    "index" : 6,
    "lastlocation" : -1,
    "newtag" : "",
    "parentId" : "39",
    "taglist" : [ "first-tag" ],
    "text" : "Start Bootstrap - Free Bootstrap Themes and Templates"
  },
  "256" : {
    "dateAddedLocal" : "7/18/2015, 1:30:30 AM",
    "dateAddedUTC" : "2015-07-18T05:30:30.143Z",
    "description" : "Lorem ipsum dolor sit amet, consectetur adipiscing elit. Vivamus vel lectus ut turpis fermentum vestibulum. ",
    "favorited" : false,
    "hyperlink" : "https://bakabt.me/",
    "id" : "255",
    "index" : 140,
    "lastlocation" : -1,
    "newtag" : "",
    "parentId" : "1",
    "taglist" : [ "first-tag" ],
    "text" : "unnamed"
  },
  "257" : {
    "dateAddedLocal" : "1/16/2016, 12:25:29 PM",
    "dateAddedUTC" : "2016-01-16T17:25:29.669Z",
    "description" : "Lorem ipsum dolor sit amet, consectetur adipiscing elit. Vivamus vel lectus ut turpis fermentum vestibulum. ",
    "favorited" : false,
    "hyperlink" : "http://neilpatel.com/seo-analyzer/",
    "id" : "256",
    "index" : 10,
    "lastlocation" : -1,
    "newtag" : "",
    "parentId" : "65",
    "taglist" : [ "first-tag" ],
    "text" : "neil patel Seo Analyzer"
  },
  "258" : {
    "dateAddedLocal" : "11/27/2014, 12:01:09 AM",
    "dateAddedUTC" : "2014-11-27T05:01:09.346Z",
    "description" : "Lorem ipsum dolor sit amet, consectetur adipiscing elit. Vivamus vel lectus ut turpis fermentum vestibulum. ",
    "favorited" : false,
    "hyperlink" : "http://bezier.method.ac/",
    "id" : "257",
    "index" : 1,
    "lastlocation" : -1,
    "newtag" : "",
    "parentId" : "37",
    "taglist" : [ "first-tag" ],
    "text" : "The BÃ©zier Game"
  },
  "259" : {
    "dateAddedLocal" : "5/6/2015, 4:23:51 PM",
    "dateAddedUTC" : "2015-05-06T20:23:51.279Z",
    "description" : "Lorem ipsum dolor sit amet, consectetur adipiscing elit. Vivamus vel lectus ut turpis fermentum vestibulum. ",
    "favorited" : false,
    "hyperlink" : "https://aceateam.slack.com/messages",
    "id" : "258",
    "index" : 3,
    "lastlocation" : -1,
    "newtag" : "",
    "parentId" : "44",
    "taglist" : [ "first-tag" ],
    "text" : "unnamed"
  },
  "260" : {
    "dateAddedLocal" : "9/7/2017, 2:44:30 PM",
    "dateAddedUTC" : "2017-09-07T18:44:30.475Z",
    "description" : "Lorem ipsum dolor sit amet, consectetur adipiscing elit. Vivamus vel lectus ut turpis fermentum vestibulum. ",
    "favorited" : false,
    "hyperlink" : "https://codepen.io/virgilpana/pen/NPzodr",
    "id" : "259",
    "index" : 229,
    "lastlocation" : -1,
    "newtag" : "",
    "parentId" : "1",
    "taglist" : [ "first-tag" ],
    "text" : "snowball effect "
  },
  "261" : {
    "dateAddedLocal" : "11/20/2018, 6:39:10 PM",
    "dateAddedUTC" : "2018-11-20T23:39:10.086Z",
    "description" : "Lorem ipsum dolor sit amet, consectetur adipiscing elit. Vivamus vel lectus ut turpis fermentum vestibulum. ",
    "favorited" : false,
    "hyperlink" : "https://secure.bankofamerica.com/finance/spending/spending-overview/?request_locale=en-us&adx=5d4f18c565bfbee5ef8d1e3773f0aabfa39472c97646381c76f8b082f3fc1502&returnSiteIndicator=GAIMW",
    "id" : "260",
    "index" : 304,
    "lastlocation" : -1,
    "newtag" : "",
    "parentId" : "1",
    "taglist" : [ "first-tag" ],
    "text" : "unnamed"
  },
  "262" : {
    "dateAddedLocal" : "7/4/2018, 12:06:40 PM",
    "dateAddedUTC" : "2018-07-04T16:06:40.821Z",
    "description" : "Lorem ipsum dolor sit amet, consectetur adipiscing elit. Vivamus vel lectus ut turpis fermentum vestibulum. ",
    "favorited" : false,
    "hyperlink" : "https://docs.google.com/presentation/d/1CEq3ydhVx1tuS0OEVjxQaONYZTAQC-Bnf0MEPDvXvWA/edit#slide=id.g3d4e6f24d7_0_12",
    "id" : "261",
    "index" : 71,
    "lastlocation" : -1,
    "newtag" : "",
    "parentId" : "2",
    "taglist" : [ "first-tag" ],
    "text" : "bloomberg-mosaic-v0.7 - Google Slides"
  },
  "263" : {
    "dateAddedLocal" : "10/2/2017, 4:39:23 PM",
    "dateAddedUTC" : "2017-10-02T20:39:23.837Z",
    "description" : "Lorem ipsum dolor sit amet, consectetur adipiscing elit. Vivamus vel lectus ut turpis fermentum vestibulum. ",
    "favorited" : false,
    "hyperlink" : "https://kanbanflow.com/board/68283154e0b2daa9ddec04247e2805c9",
    "id" : "262",
    "index" : 107,
    "lastlocation" : -1,
    "newtag" : "",
    "parentId" : "1",
    "taglist" : [ "first-tag" ],
    "text" : "24T Board"
  },
  "264" : {
    "dateAddedLocal" : "7/9/2018, 6:10:37 PM",
    "dateAddedUTC" : "2018-07-09T22:10:37.871Z",
    "description" : "Lorem ipsum dolor sit amet, consectetur adipiscing elit. Vivamus vel lectus ut turpis fermentum vestibulum. ",
    "favorited" : false,
    "hyperlink" : "https://www.chartiq.com/",
    "id" : "263",
    "index" : 3,
    "lastlocation" : -1,
    "newtag" : "",
    "parentId" : "502",
    "taglist" : [ "first-tag" ],
    "text" : "IQ"
  },
  "265" : {
    "dateAddedLocal" : "12/14/2017, 5:41:12 AM",
    "dateAddedUTC" : "2017-12-14T10:41:12.584Z",
    "description" : "Lorem ipsum dolor sit amet, consectetur adipiscing elit. Vivamus vel lectus ut turpis fermentum vestibulum. ",
    "favorited" : false,
    "hyperlink" : "http://upng.photopea.com/",
    "id" : "264",
    "index" : 106,
    "lastlocation" : -1,
    "newtag" : "",
    "parentId" : "1",
    "taglist" : [ "first-tag" ],
    "text" : "min"
  },
  "266" : {
    "dateAddedLocal" : "7/27/2014, 2:56:02 AM",
    "dateAddedUTC" : "2014-07-27T06:56:02.896Z",
    "description" : "Lorem ipsum dolor sit amet, consectetur adipiscing elit. Vivamus vel lectus ut turpis fermentum vestibulum. ",
    "favorited" : false,
    "hyperlink" : "http://www.satyajewelry.com/lapis-eye-pendant-stretch.html",
    "id" : "265",
    "index" : 0,
    "lastlocation" : -1,
    "newtag" : "",
    "parentId" : "15",
    "taglist" : [ "first-tag" ],
    "text" : "Men's Lapis Eye Bracelet | Satya Jewelry"
  },
  "267" : {
    "dateAddedLocal" : "4/15/2015, 4:36:10 PM",
    "dateAddedUTC" : "2015-04-15T20:36:10.101Z",
    "description" : "Lorem ipsum dolor sit amet, consectetur adipiscing elit. Vivamus vel lectus ut turpis fermentum vestibulum. ",
    "favorited" : false,
    "hyperlink" : "http://quirksmode.org/js/contents.html",
    "id" : "266",
    "index" : 13,
    "lastlocation" : -1,
    "newtag" : "",
    "parentId" : "36",
    "taglist" : [ "first-tag" ],
    "text" : "JavaScript - Table of Contents"
  },
  "268" : {
    "dateAddedLocal" : "6/10/2018, 11:18:25 PM",
    "dateAddedUTC" : "2018-06-11T03:18:25.019Z",
    "description" : "Lorem ipsum dolor sit amet, consectetur adipiscing elit. Vivamus vel lectus ut turpis fermentum vestibulum. ",
    "favorited" : false,
    "hyperlink" : "https://blog.openai.com/openai-fellows/",
    "id" : "267",
    "index" : 52,
    "lastlocation" : -1,
    "newtag" : "",
    "parentId" : "1",
    "taglist" : [ "first-tag" ],
    "text" : "fellow"
  },
  "269" : {
    "dateAddedLocal" : "10/12/2015, 1:26:58 PM",
    "dateAddedUTC" : "2015-10-12T17:26:58.169Z",
    "description" : "Lorem ipsum dolor sit amet, consectetur adipiscing elit. Vivamus vel lectus ut turpis fermentum vestibulum. ",
    "favorited" : false,
    "hyperlink" : "http://alistapart.com/article/using-responsive-images-now",
    "id" : "268",
    "index" : 12,
    "lastlocation" : -1,
    "newtag" : "",
    "parentId" : "51",
    "taglist" : [ "first-tag" ],
    "text" : "unnamed"
  },
  "270" : {
    "dateAddedLocal" : "9/10/2018, 3:28:41 PM",
    "dateAddedUTC" : "2018-09-10T19:28:41.136Z",
    "description" : "Lorem ipsum dolor sit amet, consectetur adipiscing elit. Vivamus vel lectus ut turpis fermentum vestibulum. ",
    "favorited" : false,
    "hyperlink" : "https://discordapp.com/channels/@me/479703042002780170",
    "id" : "269",
    "index" : 97,
    "lastlocation" : -1,
    "newtag" : "",
    "parentId" : "2",
    "taglist" : [ "first-tag" ],
    "text" : "max"
  },
  "271" : {
    "dateAddedLocal" : "4/28/2014, 7:04:37 PM",
    "dateAddedUTC" : "2014-04-28T23:04:37.511Z",
    "description" : "Lorem ipsum dolor sit amet, consectetur adipiscing elit. Vivamus vel lectus ut turpis fermentum vestibulum. ",
    "favorited" : false,
    "hyperlink" : "http://www.youtube.com/watch?v=K2aB6nLbp2g",
    "id" : "270",
    "index" : 6,
    "lastlocation" : -1,
    "newtag" : "",
    "parentId" : "189",
    "taglist" : [ "first-tag" ],
    "text" : "ãµã¡ãŒã¿ã¨ãµãªã¨ - Lounge lay low "
  },
  "272" : {
    "dateAddedLocal" : "7/10/2018, 2:43:33 PM",
    "dateAddedUTC" : "2018-07-10T18:43:33.292Z",
    "description" : "Lorem ipsum dolor sit amet, consectetur adipiscing elit. Vivamus vel lectus ut turpis fermentum vestibulum. ",
    "favorited" : false,
    "hyperlink" : "https://finance.yahoo.com/quote/FB?p=FB",
    "id" : "271",
    "index" : 1,
    "lastlocation" : -1,
    "newtag" : "",
    "parentId" : "502",
    "taglist" : [ "first-tag" ],
    "text" : "unnamed"
  },
  "273" : {
    "dateAddedLocal" : "4/5/2018, 7:45:59 PM",
    "dateAddedUTC" : "2018-04-05T23:45:59.734Z",
    "description" : "Lorem ipsum dolor sit amet, consectetur adipiscing elit. Vivamus vel lectus ut turpis fermentum vestibulum. ",
    "favorited" : false,
    "hyperlink" : "https://www.investopedia.com/terms/f/fintech.asp",
    "id" : "272",
    "index" : 0,
    "lastlocation" : -1,
    "newtag" : "",
    "parentId" : "520",
    "taglist" : [ "first-tag" ],
    "text" : "Fintech Definition | Investopedia"
  },
  "274" : {
    "dateAddedLocal" : "2/5/2018, 7:49:06 AM",
    "dateAddedUTC" : "2018-02-05T12:49:06.712Z",
    "description" : "Lorem ipsum dolor sit amet, consectetur adipiscing elit. Vivamus vel lectus ut turpis fermentum vestibulum. ",
    "favorited" : false,
    "hyperlink" : "https://www.reddit.com/r/infosec",
    "id" : "273",
    "index" : 7,
    "lastlocation" : -1,
    "newtag" : "",
    "parentId" : "549",
    "taglist" : [ "first-tag" ],
    "text" : "top scoring links : hacking"
  },
  "275" : {
    "dateAddedLocal" : "3/31/2015, 7:40:36 PM",
    "dateAddedUTC" : "2015-03-31T23:40:36.858Z",
    "description" : "Lorem ipsum dolor sit amet, consectetur adipiscing elit. Vivamus vel lectus ut turpis fermentum vestibulum. ",
    "favorited" : false,
    "hyperlink" : "http://robin-noguier.com/#/draft-camp",
    "id" : "274",
    "index" : 7,
    "lastlocation" : -1,
    "newtag" : "",
    "parentId" : "35",
    "taglist" : [ "first-tag" ],
    "text" : "process inspiration"
  },
  "276" : {
    "dateAddedLocal" : "4/14/2019, 10:51:00 PM",
    "dateAddedUTC" : "2019-04-15T02:51:00.922Z",
    "description" : "Lorem ipsum dolor sit amet, consectetur adipiscing elit. Vivamus vel lectus ut turpis fermentum vestibulum. ",
    "favorited" : false,
    "hyperlink" : "https://github.com/dboudro",
    "id" : "275",
    "index" : 320,
    "lastlocation" : -1,
    "newtag" : "",
    "parentId" : "1",
    "taglist" : [ "first-tag" ],
    "text" : "                       (2)"
  },
  "277" : {
    "dateAddedLocal" : "8/24/2014, 10:51:59 PM",
    "dateAddedUTC" : "2014-08-25T02:51:59.395Z",
    "description" : "Lorem ipsum dolor sit amet, consectetur adipiscing elit. Vivamus vel lectus ut turpis fermentum vestibulum. ",
    "favorited" : false,
    "id" : "276",
    "index" : 3,
    "lastlocation" : -1,
    "newtag" : "",
    "parentId" : "9",
    "taglist" : [ "first-tag" ],
    "text" : "Mehran"
  },
  "278" : {
    "dateAddedLocal" : "7/19/2015, 4:33:40 PM",
    "dateAddedUTC" : "2015-07-19T20:33:40.631Z",
    "description" : "Lorem ipsum dolor sit amet, consectetur adipiscing elit. Vivamus vel lectus ut turpis fermentum vestibulum. ",
    "favorited" : false,
    "hyperlink" : "http://www.audiodharma.org/",
    "id" : "277",
    "index" : 138,
    "lastlocation" : -1,
    "newtag" : "",
    "parentId" : "1",
    "taglist" : [ "first-tag" ],
    "text" : "unnamed"
  },
  "279" : {
    "dateAddedLocal" : "9/13/2015, 12:29:39 AM",
    "dateAddedUTC" : "2015-09-13T04:29:39.409Z",
    "description" : "Lorem ipsum dolor sit amet, consectetur adipiscing elit. Vivamus vel lectus ut turpis fermentum vestibulum. ",
    "favorited" : false,
    "hyperlink" : "https://vimeo.com/ondemand/10037",
    "id" : "278",
    "index" : 4,
    "lastlocation" : -1,
    "newtag" : "",
    "parentId" : "40",
    "taglist" : [ "first-tag" ],
    "text" : "Watch Zen Relaxation DVD - Japanese Gardens for Relaxing and Meditation Online | Vimeo On Demand"
  },
  "280" : {
    "dateAddedLocal" : "8/12/2016, 12:40:33 PM",
    "dateAddedUTC" : "2016-08-12T16:40:33.825Z",
    "description" : "Lorem ipsum dolor sit amet, consectetur adipiscing elit. Vivamus vel lectus ut turpis fermentum vestibulum. ",
    "favorited" : false,
    "hyperlink" : "http://discover.typography.com/theme/cheers/",
    "id" : "279",
    "index" : 183,
    "lastlocation" : -1,
    "newtag" : "",
    "parentId" : "1",
    "taglist" : [ "first-tag" ],
    "text" : "Cheers! | Discover.typography by H&Co"
  },
  "281" : {
    "dateAddedLocal" : "7/20/2014, 1:14:52 AM",
    "dateAddedUTC" : "2014-07-20T05:14:52.455Z",
    "description" : "Lorem ipsum dolor sit amet, consectetur adipiscing elit. Vivamus vel lectus ut turpis fermentum vestibulum. ",
    "favorited" : false,
    "hyperlink" : "http://cssarrowplease.com/",
    "id" : "280",
    "index" : 4,
    "lastlocation" : -1,
    "newtag" : "",
    "parentId" : "39",
    "taglist" : [ "first-tag" ],
    "text" : "CSS tooltip style gen"
  },
  "282" : {
    "dateAddedLocal" : "8/10/2015, 1:36:47 AM",
    "dateAddedUTC" : "2015-08-10T05:36:47.083Z",
    "description" : "Lorem ipsum dolor sit amet, consectetur adipiscing elit. Vivamus vel lectus ut turpis fermentum vestibulum. ",
    "favorited" : false,
    "hyperlink" : "https://vimeo.com/1475822",
    "id" : "281",
    "index" : 1,
    "lastlocation" : -1,
    "newtag" : "",
    "parentId" : "40",
    "taglist" : [ "first-tag" ],
    "text" : "sunrise oregon 4/5"
  },
  "283" : {
    "dateAddedLocal" : "8/9/2018, 1:22:55 PM",
    "dateAddedUTC" : "2018-08-09T17:22:55.057Z",
    "description" : "Lorem ipsum dolor sit amet, consectetur adipiscing elit. Vivamus vel lectus ut turpis fermentum vestibulum. ",
    "favorited" : false,
    "id" : "282",
    "index" : 93,
    "lastlocation" : -1,
    "newtag" : "",
    "parentId" : "2",
    "taglist" : [ "first-tag" ],
    "text" : "Market Data Platforms"
  },
  "284" : {
    "dateAddedLocal" : "1/6/2016, 7:42:34 PM",
    "dateAddedUTC" : "2016-01-07T00:42:34.972Z",
    "description" : "Lorem ipsum dolor sit amet, consectetur adipiscing elit. Vivamus vel lectus ut turpis fermentum vestibulum. ",
    "favorited" : false,
    "hyperlink" : "http://afuk.affiliate.affiliatefuture.co.uk/login.aspx?Returnhyperlink=%2fdefault.aspx",
    "id" : "283",
    "index" : 54,
    "lastlocation" : -1,
    "newtag" : "",
    "parentId" : "2",
    "taglist" : [ "first-tag" ],
    "text" : "affiliatefuture"
  },
  "285" : {
    "dateAddedLocal" : "1/12/2018, 1:07:43 AM",
    "dateAddedUTC" : "2018-01-12T06:07:43.380Z",
    "description" : "Lorem ipsum dolor sit amet, consectetur adipiscing elit. Vivamus vel lectus ut turpis fermentum vestibulum. ",
    "favorited" : false,
    "hyperlink" : "http://sketchshortcuts.com/",
    "id" : "284",
    "index" : 91,
    "lastlocation" : -1,
    "newtag" : "",
    "parentId" : "1",
    "taglist" : [ "first-tag" ],
    "text" : "unnamed"
  },
  "286" : {
    "dateAddedLocal" : "6/27/2017, 10:27:16 PM",
    "dateAddedUTC" : "2017-06-28T02:27:16.091Z",
    "description" : "Lorem ipsum dolor sit amet, consectetur adipiscing elit. Vivamus vel lectus ut turpis fermentum vestibulum. ",
    "favorited" : false,
    "hyperlink" : "file:///home/astronaut/Desktop/roots/Pages/crypto.html",
    "id" : "285",
    "index" : 62,
    "lastlocation" : -1,
    "newtag" : "",
    "parentId" : "1",
    "taglist" : [ "first-tag" ],
    "text" : "l"
  },
  "287" : {
    "dateAddedLocal" : "7/7/2015, 9:55:36 AM",
    "dateAddedUTC" : "2015-07-07T13:55:36.832Z",
    "description" : "Lorem ipsum dolor sit amet, consectetur adipiscing elit. Vivamus vel lectus ut turpis fermentum vestibulum. ",
    "favorited" : false,
    "hyperlink" : "https://toggl.com/app/timer",
    "id" : "286",
    "index" : 4,
    "lastlocation" : -1,
    "newtag" : "",
    "parentId" : "44",
    "taglist" : [ "first-tag" ],
    "text" : "toggl"
  },
  "288" : {
    "dateAddedLocal" : "9/21/2015, 1:59:09 PM",
    "dateAddedUTC" : "2015-09-21T17:59:09.547Z",
    "description" : "Lorem ipsum dolor sit amet, consectetur adipiscing elit. Vivamus vel lectus ut turpis fermentum vestibulum. ",
    "favorited" : false,
    "hyperlink" : "http://williamngan.github.io/pt/index.html",
    "id" : "287",
    "index" : 8,
    "lastlocation" : -1,
    "newtag" : "",
    "parentId" : "756",
    "taglist" : [ "first-tag" ],
    "text" : "williamngan.github.io/pt/index.html"
  },
  "289" : {
    "dateAddedLocal" : "8/11/2015, 11:12:54 AM",
    "dateAddedUTC" : "2015-08-11T15:12:54.353Z",
    "description" : "Lorem ipsum dolor sit amet, consectetur adipiscing elit. Vivamus vel lectus ut turpis fermentum vestibulum. ",
    "favorited" : false,
    "hyperlink" : "http://www.colorhunt.co/?ref=producthunt",
    "id" : "288",
    "index" : 131,
    "lastlocation" : -1,
    "newtag" : "",
    "parentId" : "1",
    "taglist" : [ "first-tag" ],
    "text" : "unnamed"
  },
  "290" : {
    "dateAddedLocal" : "10/22/2015, 11:22:48 AM",
    "dateAddedUTC" : "2015-10-22T15:22:48.792Z",
    "description" : "Lorem ipsum dolor sit amet, consectetur adipiscing elit. Vivamus vel lectus ut turpis fermentum vestibulum. ",
    "favorited" : false,
    "hyperlink" : "http://www.davidrevoy.com/categorie5/tutorials",
    "id" : "289",
    "index" : 152,
    "lastlocation" : -1,
    "newtag" : "",
    "parentId" : "1",
    "taglist" : [ "first-tag" ],
    "text" : "unnamed"
  },
  "291" : {
    "dateAddedLocal" : "10/27/2014, 10:02:49 PM",
    "dateAddedUTC" : "2014-10-28T02:02:49.992Z",
    "description" : "Lorem ipsum dolor sit amet, consectetur adipiscing elit. Vivamus vel lectus ut turpis fermentum vestibulum. ",
    "favorited" : false,
    "hyperlink" : "https://www.youtube.com/watch?v=T5lRLA_Vn7o",
    "id" : "290",
    "index" : 2,
    "lastlocation" : -1,
    "newtag" : "",
    "parentId" : "23",
    "taglist" : [ "first-tag" ],
    "text" : "Processing tutorial: Overview of data visualization | lynda.com - YouTube"
  },
  "292" : {
    "dateAddedLocal" : "4/14/2019, 10:51:24 PM",
    "dateAddedUTC" : "2019-04-15T02:51:24.348Z",
    "description" : "Lorem ipsum dolor sit amet, consectetur adipiscing elit. Vivamus vel lectus ut turpis fermentum vestibulum. ",
    "favorited" : false,
    "hyperlink" : "https://github.com/dboudro",
    "id" : "291",
    "index" : 48,
    "lastlocation" : -1,
    "newtag" : "",
    "parentId" : "1",
    "taglist" : [ "first-tag" ],
    "text" : "                       3"
  },
  "293" : {
    "dateAddedLocal" : "8/30/2018, 2:10:16 PM",
    "dateAddedUTC" : "2018-08-30T18:10:16.936Z",
    "description" : "Lorem ipsum dolor sit amet, consectetur adipiscing elit. Vivamus vel lectus ut turpis fermentum vestibulum. ",
    "favorited" : false,
    "hyperlink" : "https://apexcharts.com/",
    "id" : "292",
    "index" : 245,
    "lastlocation" : -1,
    "newtag" : "",
    "parentId" : "1",
    "taglist" : [ "data-viz" ],
    "text" : "ApexCharts.js â€“ Open-Source HTML5 JavaScript Charts"
  },
  "294" : {
    "dateAddedLocal" : "2/26/2015, 11:43:51 AM",
    "dateAddedUTC" : "2015-02-26T16:43:51.759Z",
    "description" : "Lorem ipsum dolor sit amet, consectetur adipiscing elit. Vivamus vel lectus ut turpis fermentum vestibulum. ",
    "favorited" : false,
    "hyperlink" : "http://www.frerejones.com/",
    "id" : "293",
    "index" : 1,
    "lastlocation" : -1,
    "newtag" : "",
    "parentId" : "311",
    "taglist" : [ "first-tag" ],
    "text" : "Frere-Jones Type | Home"
  },
  "295" : {
    "dateAddedLocal" : "10/10/2017, 5:00:49 PM",
    "dateAddedUTC" : "2017-10-10T21:00:49.640Z",
    "description" : "Lorem ipsum dolor sit amet, consectetur adipiscing elit. Vivamus vel lectus ut turpis fermentum vestibulum. ",
    "favorited" : false,
    "hyperlink" : "https://cronometer.com/#foods",
    "id" : "294",
    "index" : 113,
    "lastlocation" : -1,
    "newtag" : "",
    "parentId" : "1",
    "taglist" : [ "first-tag" ],
    "text" : "food tracking"
  },
  "296" : {
    "dateAddedLocal" : "7/24/2018, 4:40:56 PM",
    "dateAddedUTC" : "2018-07-24T20:40:56.099Z",
    "description" : "Lorem ipsum dolor sit amet, consectetur adipiscing elit. Vivamus vel lectus ut turpis fermentum vestibulum. ",
    "favorited" : false,
    "hyperlink" : "https://drive.google.com/drive/folders/1DdWfweWAXYzfmbgEfJstB0eA226ZeNmi",
    "id" : "295",
    "index" : 305,
    "lastlocation" : -1,
    "newtag" : "",
    "parentId" : "1",
    "taglist" : [ "first-tag" ],
    "text" : "D-Assets"
  },
  "297" : {
    "dateAddedLocal" : "9/9/2014, 3:50:20 PM",
    "dateAddedUTC" : "2014-09-09T19:50:20.332Z",
    "description" : "Lorem ipsum dolor sit amet, consectetur adipiscing elit. Vivamus vel lectus ut turpis fermentum vestibulum. ",
    "favorited" : false,
    "hyperlink" : "http://html5boilerplate.com/",
    "id" : "296",
    "index" : 7,
    "lastlocation" : -1,
    "newtag" : "",
    "parentId" : "39",
    "taglist" : [ "first-tag" ],
    "text" : "HTML5 Boilerplate"
  },
  "298" : {
    "dateAddedLocal" : "11/20/2018, 2:25:45 PM",
    "dateAddedUTC" : "2018-11-20T19:25:45.642Z",
    "description" : "Lorem ipsum dolor sit amet, consectetur adipiscing elit. Vivamus vel lectus ut turpis fermentum vestibulum. ",
    "favorited" : false,
    "hyperlink" : "https://docs.google.com/document/d/1IdPy2mM73HeTw4gKvYwbob8_Y3IFSRvVzkcqqZSBjE0/edit",
    "id" : "297",
    "index" : 298,
    "lastlocation" : -1,
    "newtag" : "",
    "parentId" : "1",
    "taglist" : [ "first-tag" ],
    "text" : "ai"
  },
  "299" : {
    "dateAddedLocal" : "4/14/2018, 10:39:31 PM",
    "dateAddedUTC" : "2018-04-15T02:39:31.453Z",
    "description" : "Lorem ipsum dolor sit amet, consectetur adipiscing elit. Vivamus vel lectus ut turpis fermentum vestibulum. ",
    "favorited" : false,
    "hyperlink" : "http://www.myfitnesspal.com/food/diary/?date=2018-04-15",
    "id" : "298",
    "index" : 63,
    "lastlocation" : -1,
    "newtag" : "",
    "parentId" : "1",
    "taglist" : [ "first-tag" ],
    "text" : "unnamed"
  },
  "300" : {
    "dateAddedLocal" : "7/27/2015, 11:56:25 AM",
    "dateAddedUTC" : "2015-07-27T15:56:25.736Z",
    "description" : "Lorem ipsum dolor sit amet, consectetur adipiscing elit. Vivamus vel lectus ut turpis fermentum vestibulum. ",
    "favorited" : false,
    "hyperlink" : "https://bonobos.com/shop/pants/chinos",
    "id" : "299",
    "index" : 3,
    "lastlocation" : -1,
    "newtag" : "",
    "parentId" : "25",
    "taglist" : [ "first-tag" ],
    "text" : "Men's Chinos in Slim, Straight Leg, & Bootcut | Bonobos"
  },
  "301" : {
    "dateAddedLocal" : "5/12/2012, 11:04:46 PM",
    "dateAddedUTC" : "2012-05-13T03:04:46.097Z",
    "description" : "Lorem ipsum dolor sit amet, consectetur adipiscing elit. Vivamus vel lectus ut turpis fermentum vestibulum. ",
    "favorited" : false,
    "hyperlink" : "http://www.gardenersown.co.uk/Education/Lectures/R/correl.htm#cor_sig",
    "id" : "300",
    "index" : 1,
    "lastlocation" : -1,
    "newtag" : "",
    "parentId" : "8",
    "taglist" : [ "first-tag" ],
    "text" : "unnamed"
  },
  "302" : {
    "dateAddedLocal" : "9/20/2014, 3:47:27 PM",
    "dateAddedUTC" : "2014-09-20T19:47:27.276Z",
    "description" : "Lorem ipsum dolor sit amet, consectetur adipiscing elit. Vivamus vel lectus ut turpis fermentum vestibulum. ",
    "favorited" : false,
    "hyperlink" : "https://www.youtube.com/watch?v=TRrL5j3MIvo",
    "id" : "301",
    "index" : 3,
    "lastlocation" : -1,
    "newtag" : "",
    "parentId" : "37",
    "taglist" : [ "first-tag" ],
    "text" : "Introduction to Angular.js in 50 Examples (part 1) - YouTube"
  },
  "303" : {
    "dateAddedLocal" : "2/4/2015, 9:49:17 AM",
    "dateAddedUTC" : "2015-02-04T14:49:17.614Z",
    "description" : "Lorem ipsum dolor sit amet, consectetur adipiscing elit. Vivamus vel lectus ut turpis fermentum vestibulum. ",
    "favorited" : false,
    "hyperlink" : "https://www.qualcomm.com/company/careers/interns",
    "id" : "302",
    "index" : 1,
    "lastlocation" : -1,
    "newtag" : "",
    "parentId" : "29",
    "taglist" : [ "first-tag" ],
    "text" : "Careers for Interns"
  },
  "304" : {
    "dateAddedLocal" : "4/28/2014, 12:34:10 AM",
    "dateAddedUTC" : "2014-04-28T04:34:10.174Z",
    "description" : "Lorem ipsum dolor sit amet, consectetur adipiscing elit. Vivamus vel lectus ut turpis fermentum vestibulum. ",
    "favorited" : false,
    "hyperlink" : "http://www.youtube.com/watch?v=MzCi5kr4Aak",
    "id" : "303",
    "index" : 7,
    "lastlocation" : -1,
    "newtag" : "",
    "parentId" : "189",
    "taglist" : [ "first-tag" ],
    "text" : "Yoshinori Sunahara - Hypnotize - YouTube"
  },
  "305" : {
    "dateAddedLocal" : "4/1/2015, 10:28:56 AM",
    "dateAddedUTC" : "2015-04-01T14:28:56.782Z",
    "description" : "Lorem ipsum dolor sit amet, consectetur adipiscing elit. Vivamus vel lectus ut turpis fermentum vestibulum. ",
    "favorited" : false,
    "hyperlink" : "https://releaseblueprints.ibm.com/display/WORKL/MobileFirst+Design",
    "id" : "304",
    "index" : 3,
    "lastlocation" : -1,
    "newtag" : "",
    "parentId" : "28",
    "taglist" : [ "first-tag" ],
    "text" : "Release Blueprints"
  },
  "306" : {
    "dateAddedLocal" : "2/7/2015, 12:52:58 PM",
    "dateAddedUTC" : "2015-02-07T17:52:58.309Z",
    "description" : "Lorem ipsum dolor sit amet, consectetur adipiscing elit. Vivamus vel lectus ut turpis fermentum vestibulum. ",
    "favorited" : false,
    "hyperlink" : "http://www.hotnewhiphop.com/kid-ink-about-mine-feat-trey-songz-prod-by-dj-mustard-new-song.1962290.html",
    "id" : "305",
    "index" : 39,
    "lastlocation" : -1,
    "newtag" : "",
    "parentId" : "49",
    "taglist" : [ "first-tag" ],
    "text" : "Kid Ink - About Mine Feat. Trey Songz (Prod. by DJ Mustard) | Stream & Listen [New Song]"
  },
  "307" : {
    "dateAddedLocal" : "9/11/2013, 1:23:12 PM",
    "dateAddedUTC" : "2013-09-11T17:23:12.000Z",
    "description" : "Lorem ipsum dolor sit amet, consectetur adipiscing elit. Vivamus vel lectus ut turpis fermentum vestibulum. ",
    "favorited" : false,
    "hyperlink" : "https://www.khanacademy.org/math/calculus",
    "id" : "306",
    "index" : 2,
    "lastlocation" : -1,
    "newtag" : "",
    "parentId" : "464",
    "taglist" : [ "first-tag" ],
    "text" : "khan videos"
  },
  "308" : {
    "dateAddedLocal" : "9/24/2015, 3:50:02 PM",
    "dateAddedUTC" : "2015-09-24T19:50:02.169Z",
    "description" : "Lorem ipsum dolor sit amet, consectetur adipiscing elit. Vivamus vel lectus ut turpis fermentum vestibulum. ",
    "favorited" : false,
    "hyperlink" : "http://alistapart.com/",
    "id" : "307",
    "index" : 132,
    "lastlocation" : -1,
    "newtag" : "",
    "parentId" : "1",
    "taglist" : [ "first-tag" ],
    "text" : "unnamed"
  },
  "309" : {
    "dateAddedLocal" : "11/3/2013, 9:27:20 PM",
    "dateAddedUTC" : "2013-11-04T02:27:20.566Z",
    "hyperlink" : "http://s.fb.com/22O5mFBqVrCXa2d",
    "id" : "308",
    "index" : 1,
    "parentId" : "3",
    "text" : "Tyy"
  },
  "310" : {
    "dateAddedLocal" : "9/24/2015, 3:54:19 PM",
    "dateAddedUTC" : "2015-09-24T19:54:19.554Z",
    "description" : "Lorem ipsum dolor sit amet, consectetur adipiscing elit. Vivamus vel lectus ut turpis fermentum vestibulum. ",
    "favorited" : false,
    "hyperlink" : "http://alistapart.com/article/responsive-web-design",
    "id" : "309",
    "index" : 2,
    "lastlocation" : -1,
    "newtag" : "",
    "parentId" : "48",
    "taglist" : [ "first-tag" ],
    "text" : "Responsive Web Design Â· An A List Apart Article"
  },
  "311" : {
    "dateAddedLocal" : "12/15/2017, 1:58:45 AM",
    "dateAddedUTC" : "2017-12-15T06:58:45.098Z",
    "description" : "Lorem ipsum dolor sit amet, consectetur adipiscing elit. Vivamus vel lectus ut turpis fermentum vestibulum. ",
    "favorited" : false,
    "hyperlink" : "http://truffleframework.com/",
    "id" : "310",
    "index" : 103,
    "lastlocation" : -1,
    "newtag" : "",
    "parentId" : "1",
    "taglist" : [ "first-tag" ],
    "text" : "Truffle ETH"
  },
  "312" : {
    "dateAddedLocal" : "3/21/2018, 5:42:23 PM",
    "dateAddedUTC" : "2018-03-21T21:42:23.909Z",
    "description" : "Lorem ipsum dolor sit amet, consectetur adipiscing elit. Vivamus vel lectus ut turpis fermentum vestibulum. ",
    "favorited" : false,
    "hyperlink" : "https://accounts.intuit.com/index.html?offering_id=Intuit.ifs.mint&namespace_id=50000026&redirect_hyperlink=https%3A%2F%2Fmint.intuit.com%2Ftrend.event",
    "id" : "311",
    "index" : 65,
    "lastlocation" : -1,
    "newtag" : "",
    "parentId" : "1",
    "taglist" : [ "first-tag" ],
    "text" : "Mint"
  },
  "313" : {
    "dateAddedLocal" : "10/10/2017, 12:09:07 AM",
    "dateAddedUTC" : "2017-10-10T04:09:07.509Z",
    "description" : "Lorem ipsum dolor sit amet, consectetur adipiscing elit. Vivamus vel lectus ut turpis fermentum vestibulum. ",
    "favorited" : false,
    "hyperlink" : "https://www.youtube.com/channel/UCpyhJZhJQWKDdJCR07jPY-Q/videos",
    "id" : "312",
    "index" : 118,
    "lastlocation" : -1,
    "newtag" : "",
    "parentId" : "1",
    "taglist" : [ "first-tag" ],
    "text" : "sim"
  },
  "314" : {
    "dateAddedLocal" : "7/19/2014, 9:17:21 AM",
    "dateAddedUTC" : "2014-07-19T13:17:21.278Z",
    "description" : "Lorem ipsum dolor sit amet, consectetur adipiscing elit. Vivamus vel lectus ut turpis fermentum vestibulum. ",
    "favorited" : false,
    "hyperlink" : "https://github.com/dypsilon/frontend-dev-bookmarks",
    "id" : "313",
    "index" : 4,
    "lastlocation" : -1,
    "newtag" : "",
    "parentId" : "36",
    "taglist" : [ "first-tag" ],
    "text" : "dypsilon/frontend-dev-bookmarks"
  },
  "315" : {
    "dateAddedLocal" : "9/24/2015, 4:05:32 PM",
    "dateAddedUTC" : "2015-09-24T20:05:32.344Z",
    "description" : "Lorem ipsum dolor sit amet, consectetur adipiscing elit. Vivamus vel lectus ut turpis fermentum vestibulum. ",
    "favorited" : false,
    "hyperlink" : "https://developers.google.com/web/fundamentals/layouts/rwd-fundamentals/",
    "id" : "314",
    "index" : 5,
    "lastlocation" : -1,
    "newtag" : "",
    "parentId" : "51",
    "taglist" : [ "first-tag" ],
    "text" : "Responsive Web Design Basics â€” Web Fundamentals"
  },
  "316" : {
    "dateAddedLocal" : "5/30/2019, 1:20:26 PM",
    "dateAddedUTC" : "2019-05-30T17:20:26.708Z",
    "description" : "Lorem ipsum dolor sit amet, consectetur adipiscing elit. Vivamus vel lectus ut turpis fermentum vestibulum. ",
    "favorited" : false,
    "hyperlink" : "https://christinaallan.com/illustrations.html",
    "id" : "315",
    "index" : 13,
    "lastlocation" : -1,
    "newtag" : "",
    "parentId" : "1",
    "taglist" : [ "first-tag" ],
    "text" : "dory port"
  },
  "317" : {
    "dateAddedLocal" : "6/17/2018, 12:50:28 AM",
    "dateAddedUTC" : "2018-06-17T04:50:28.128Z",
    "description" : "Lorem ipsum dolor sit amet, consectetur adipiscing elit. Vivamus vel lectus ut turpis fermentum vestibulum. ",
    "favorited" : false,
    "hyperlink" : "http://es6-features.org/#Constants",
    "id" : "316",
    "index" : 53,
    "lastlocation" : -1,
    "newtag" : "",
    "parentId" : "1",
    "taglist" : [ "first-tag" ],
    "text" : "ES6"
  },
  "318" : {
    "dateAddedLocal" : "4/14/2015, 11:31:18 AM",
    "dateAddedUTC" : "2015-04-14T15:31:18.069Z",
    "description" : "Lorem ipsum dolor sit amet, consectetur adipiscing elit. Vivamus vel lectus ut turpis fermentum vestibulum. ",
    "favorited" : false,
    "hyperlink" : "http://caniuse.com/",
    "id" : "317",
    "index" : 19,
    "lastlocation" : -1,
    "newtag" : "",
    "parentId" : "39",
    "taglist" : [ "first-tag" ],
    "text" : "Can I use... Support tables for HTML5, CSS3, etc"
  },
  "319" : {
    "dateAddedLocal" : "8/13/2014, 10:12:15 AM",
    "dateAddedUTC" : "2014-08-13T14:12:15.053Z",
    "description" : "Lorem ipsum dolor sit amet, consectetur adipiscing elit. Vivamus vel lectus ut turpis fermentum vestibulum. ",
    "favorited" : false,
    "hyperlink" : "https://www.youtube.com/watch?v=lDL1tFsSeWI",
    "id" : "318",
    "index" : 11,
    "lastlocation" : -1,
    "newtag" : "",
    "parentId" : "49",
    "taglist" : [ "first-tag" ],
    "text" : "Dj Krush - Zen (full album) - YouTube"
  },
  "320" : {
    "dateAddedLocal" : "7/13/2014, 10:19:33 AM",
    "dateAddedUTC" : "2014-07-13T14:19:33.979Z",
    "description" : "Lorem ipsum dolor sit amet, consectetur adipiscing elit. Vivamus vel lectus ut turpis fermentum vestibulum. ",
    "favorited" : false,
    "hyperlink" : "http://aprilzero.com/about/",
    "id" : "319",
    "index" : 1,
    "lastlocation" : -1,
    "newtag" : "",
    "parentId" : "759",
    "taglist" : [ "first-tag" ],
    "text" : "A P R I L Z E R O"
  },
  "321" : {
    "dateAddedLocal" : "1/12/2016, 3:35:57 PM",
    "dateAddedUTC" : "2016-01-12T20:35:57.051Z",
    "description" : "Lorem ipsum dolor sit amet, consectetur adipiscing elit. Vivamus vel lectus ut turpis fermentum vestibulum. ",
    "favorited" : false,
    "hyperlink" : "https://davidwalsh.name/",
    "id" : "320",
    "index" : 62,
    "lastlocation" : -1,
    "newtag" : "",
    "parentId" : "2",
    "taglist" : [ "first-tag" ],
    "text" : "unnamed"
  },
  "322" : {
    "dateAddedLocal" : "4/28/2014, 6:47:23 PM",
    "dateAddedUTC" : "2014-04-28T22:47:23.608Z",
    "description" : "Lorem ipsum dolor sit amet, consectetur adipiscing elit. Vivamus vel lectus ut turpis fermentum vestibulum. ",
    "favorited" : false,
    "hyperlink" : "http://www.youtube.com/watch?v=ug3SXDtYavI",
    "id" : "321",
    "index" : 0,
    "lastlocation" : -1,
    "newtag" : "",
    "parentId" : "189",
    "taglist" : [ "first-tag" ],
    "text" : "Kahimi Karie - Elastic Girl Rock"
  },
  "323" : {
    "dateAddedLocal" : "5/31/2016, 3:27:32 PM",
    "dateAddedUTC" : "2016-05-31T19:27:32.844Z",
    "description" : "Lorem ipsum dolor sit amet, consectetur adipiscing elit. Vivamus vel lectus ut turpis fermentum vestibulum. ",
    "favorited" : false,
    "hyperlink" : "http://www.palettable.io/",
    "id" : "322",
    "index" : 126,
    "lastlocation" : -1,
    "newtag" : "",
    "parentId" : "1",
    "taglist" : [ "first-tag" ],
    "text" : "unnamed"
  },
  "324" : {
    "dateAddedLocal" : "1/27/2019, 9:05:14 PM",
    "dateAddedUTC" : "2019-01-28T02:05:14.386Z",
    "description" : "Lorem ipsum dolor sit amet, consectetur adipiscing elit. Vivamus vel lectus ut turpis fermentum vestibulum. ",
    "favorited" : false,
    "hyperlink" : "https://bubble.is/welcome",
    "id" : "323",
    "index" : 266,
    "lastlocation" : -1,
    "newtag" : "",
    "parentId" : "1",
    "taglist" : [ "first-tag" ],
    "text" : "Bubble"
  },
  "325" : {
    "dateAddedLocal" : "7/22/2015, 4:25:25 AM",
    "dateAddedUTC" : "2015-07-22T08:25:25.558Z",
    "description" : "Lorem ipsum dolor sit amet, consectetur adipiscing elit. Vivamus vel lectus ut turpis fermentum vestibulum. ",
    "favorited" : false,
    "hyperlink" : "https://p3plcpnl0550.prod.phx3.secureserver.net:2083/cpsess640150847/frontend/gl_paper_lantern/index.html?post_login=60168098667369",
    "id" : "324",
    "index" : 94,
    "lastlocation" : -1,
    "newtag" : "",
    "parentId" : "1",
    "taglist" : [ "first-tag" ],
    "text" : "unnamed"
  },
  "326" : {
    "dateAddedLocal" : "7/30/2014, 10:53:17 PM",
    "dateAddedUTC" : "2014-07-31T02:53:17.362Z",
    "description" : "Lorem ipsum dolor sit amet, consectetur adipiscing elit. Vivamus vel lectus ut turpis fermentum vestibulum. ",
    "favorited" : false,
    "hyperlink" : "http://adamschwartz.co/magic-of-css/",
    "id" : "325",
    "index" : 1,
    "lastlocation" : -1,
    "newtag" : "",
    "parentId" : "36",
    "taglist" : [ "first-tag" ],
    "text" : "Magic of CSS â€” Adam Schwartz"
  },
  "327" : {
    "dateAddedLocal" : "9/14/2018, 4:25:17 PM",
    "dateAddedUTC" : "2018-09-14T20:25:17.186Z",
    "description" : "Lorem ipsum dolor sit amet, consectetur adipiscing elit. Vivamus vel lectus ut turpis fermentum vestibulum. ",
    "favorited" : false,
    "hyperlink" : "https://hackernoon.com/how-much-income-does-tezos-pay-and-how-to-earn-baking-income-46743bb28e3b",
    "id" : "326",
    "index" : 250,
    "lastlocation" : -1,
    "newtag" : "",
    "parentId" : "1",
    "taglist" : [ "first-tag" ],
    "text" : "How Much Income does Tezos Pay and How to Earn Baking Income?"
  },
  "328" : {
    "dateAddedLocal" : "9/11/2015, 5:52:18 AM",
    "dateAddedUTC" : "2015-09-11T09:52:18.758Z",
    "description" : "Lorem ipsum dolor sit amet, consectetur adipiscing elit. Vivamus vel lectus ut turpis fermentum vestibulum. ",
    "favorited" : false,
    "hyperlink" : "http://mideastoffers.com/me/content/downstairs-shows",
    "id" : "327",
    "index" : 7,
    "lastlocation" : -1,
    "newtag" : "",
    "parentId" : "42",
    "taglist" : [ "first-tag" ],
    "text" : "Jade Ott"
  },
  "329" : {
    "dateAddedLocal" : "9/25/2017, 10:58:44 PM",
    "dateAddedUTC" : "2017-09-26T02:58:44.068Z",
    "description" : "Lorem ipsum dolor sit amet, consectetur adipiscing elit. Vivamus vel lectus ut turpis fermentum vestibulum. ",
    "favorited" : false,
    "hyperlink" : "https://www.neverendingvoyage.com/digital-nomad-guide-living-in-ubud/",
    "id" : "328",
    "index" : 0,
    "lastlocation" : -1,
    "newtag" : "",
    "parentId" : "574",
    "taglist" : [ "first-tag" ],
    "text" : "A Digital Nomadâ€™s Guide to Living in Ubud, Bali"
  },
  "330" : {
    "dateAddedLocal" : "12/17/2013, 3:28:49 AM",
    "dateAddedUTC" : "2013-12-17T08:28:49.790Z",
    "description" : "Lorem ipsum dolor sit amet, consectetur adipiscing elit. Vivamus vel lectus ut turpis fermentum vestibulum. ",
    "favorited" : false,
    "hyperlink" : "http://timshiel.bandcamp.com/album/duet-ost",
    "id" : "329",
    "index" : 5,
    "lastlocation" : -1,
    "newtag" : "",
    "parentId" : "180",
    "taglist" : [ "first-tag" ],
    "text" : "Duet OST | Tim Shiel"
  },
  "331" : {
    "dateAddedLocal" : "10/27/2014, 10:04:15 PM",
    "dateAddedUTC" : "2014-10-28T02:04:15.328Z",
    "description" : "Lorem ipsum dolor sit amet, consectetur adipiscing elit. Vivamus vel lectus ut turpis fermentum vestibulum. ",
    "favorited" : false,
    "id" : "330",
    "index" : 4,
    "lastlocation" : -1,
    "newtag" : "",
    "parentId" : "23",
    "taglist" : [ "first-tag" ],
    "text" : "examples"
  },
  "332" : {
    "dateAddedLocal" : "4/6/2015, 6:40:05 PM",
    "dateAddedUTC" : "2015-04-06T22:40:05.822Z",
    "description" : "Lorem ipsum dolor sit amet, consectetur adipiscing elit. Vivamus vel lectus ut turpis fermentum vestibulum. ",
    "favorited" : false,
    "hyperlink" : "http://www.nickalekhine.com/essays",
    "id" : "331",
    "index" : 0,
    "lastlocation" : -1,
    "newtag" : "",
    "parentId" : "358",
    "taglist" : [ "first-tag" ],
    "text" : "nickalekhine"
  },
  "333" : {
    "dateAddedLocal" : "9/23/2018, 12:24:26 AM",
    "dateAddedUTC" : "2018-09-23T04:24:26.696Z",
    "description" : "Lorem ipsum dolor sit amet, consectetur adipiscing elit. Vivamus vel lectus ut turpis fermentum vestibulum. ",
    "favorited" : false,
    "hyperlink" : "http://bitcoinbook.cs.princeton.edu/",
    "id" : "332",
    "index" : 77,
    "lastlocation" : -1,
    "newtag" : "",
    "parentId" : "2",
    "taglist" : [ "first-tag" ],
    "text" : "princeton crypto book"
  },
  "334" : {
    "dateAddedLocal" : "12/16/2013, 8:24:05 PM",
    "dateAddedUTC" : "2013-12-17T01:24:05.203Z",
    "description" : "Lorem ipsum dolor sit amet, consectetur adipiscing elit. Vivamus vel lectus ut turpis fermentum vestibulum. ",
    "favorited" : false,
    "hyperlink" : "http://fsgreen.bandcamp.com/album/git-witt-u",
    "id" : "333",
    "index" : 4,
    "lastlocation" : -1,
    "newtag" : "",
    "parentId" : "49",
    "taglist" : [ "first-tag" ],
    "text" : "party funk electronic"
  },
  "335" : {
    "dateAddedLocal" : "10/15/2015, 2:27:54 PM",
    "dateAddedUTC" : "2015-10-15T18:27:54.489Z",
    "description" : "Lorem ipsum dolor sit amet, consectetur adipiscing elit. Vivamus vel lectus ut turpis fermentum vestibulum. ",
    "favorited" : false,
    "hyperlink" : "http://masonry.desandro.com/",
    "id" : "334",
    "index" : 40,
    "lastlocation" : -1,
    "newtag" : "",
    "parentId" : "2",
    "taglist" : [ "first-tag" ],
    "text" : "Cascading grid layouts"
  },
  "336" : {
    "dateAddedLocal" : "10/4/2014, 12:08:38 PM",
    "dateAddedUTC" : "2014-10-04T16:08:38.324Z",
    "description" : "Lorem ipsum dolor sit amet, consectetur adipiscing elit. Vivamus vel lectus ut turpis fermentum vestibulum. ",
    "favorited" : false,
    "hyperlink" : "http://julian.com/research/velocity/",
    "id" : "335",
    "index" : 11,
    "lastlocation" : -1,
    "newtag" : "",
    "parentId" : "39",
    "taglist" : [ "first-tag" ],
    "text" : "Velocity.js"
  },
  "337" : {
    "dateAddedLocal" : "7/1/2015, 1:25:35 PM",
    "dateAddedUTC" : "2015-07-01T17:25:35.202Z",
    "description" : "Lorem ipsum dolor sit amet, consectetur adipiscing elit. Vivamus vel lectus ut turpis fermentum vestibulum. ",
    "favorited" : false,
    "id" : "336",
    "index" : 37,
    "lastlocation" : -1,
    "newtag" : "",
    "parentId" : "2",
    "taglist" : [ "first-tag" ],
    "text" : "ACEA"
  },
  "338" : {
    "dateAddedLocal" : "9/23/2015, 8:58:07 PM",
    "dateAddedUTC" : "2015-09-24T00:58:07.345Z",
    "description" : "Lorem ipsum dolor sit amet, consectetur adipiscing elit. Vivamus vel lectus ut turpis fermentum vestibulum. ",
    "favorited" : false,
    "hyperlink" : "http://www.yogajournal.com/category/poses/",
    "id" : "337",
    "index" : 0,
    "lastlocation" : -1,
    "newtag" : "",
    "parentId" : "59",
    "taglist" : [ "first-tag" ],
    "text" : "Yoga Poses & Asanas - Basic to Advanced"
  },
  "339" : {
    "dateAddedLocal" : "4/5/2015, 7:58:05 PM",
    "dateAddedUTC" : "2015-04-05T23:58:05.566Z",
    "description" : "Lorem ipsum dolor sit amet, consectetur adipiscing elit. Vivamus vel lectus ut turpis fermentum vestibulum. ",
    "favorited" : false,
    "hyperlink" : "https://ia.net/",
    "id" : "338",
    "index" : 5,
    "lastlocation" : -1,
    "newtag" : "",
    "parentId" : "756",
    "taglist" : [ "first-tag" ],
    "text" : "iA | Home"
  },
  "340" : {
    "dateAddedLocal" : "9/8/2015, 1:11:15 AM",
    "dateAddedUTC" : "2015-09-08T05:11:15.397Z",
    "description" : "Lorem ipsum dolor sit amet, consectetur adipiscing elit. Vivamus vel lectus ut turpis fermentum vestibulum. ",
    "favorited" : false,
    "hyperlink" : "http://calendar.google.com/",
    "id" : "339",
    "index" : 3,
    "lastlocation" : -1,
    "newtag" : "",
    "parentId" : "1",
    "taglist" : [ "first-tag" ],
    "text" : "Google Calendar"
  },
  "341" : {
    "dateAddedLocal" : "9/24/2015, 3:43:42 PM",
    "dateAddedUTC" : "2015-09-24T19:43:42.393Z",
    "description" : "Lorem ipsum dolor sit amet, consectetur adipiscing elit. Vivamus vel lectus ut turpis fermentum vestibulum. ",
    "favorited" : false,
    "id" : "340",
    "index" : 44,
    "lastlocation" : -1,
    "newtag" : "",
    "parentId" : "2",
    "taglist" : [ "first-tag" ],
    "text" : "awd"
  },
  "342" : {
    "dateAddedLocal" : "1/12/2015, 5:10:13 PM",
    "dateAddedUTC" : "2015-01-12T22:10:13.091Z",
    "description" : "Lorem ipsum dolor sit amet, consectetur adipiscing elit. Vivamus vel lectus ut turpis fermentum vestibulum. ",
    "favorited" : false,
    "hyperlink" : "http://www.unheap.com/",
    "id" : "341",
    "index" : 24,
    "lastlocation" : -1,
    "newtag" : "",
    "parentId" : "2",
    "taglist" : [ "first-tag" ],
    "text" : "unnamed"
  },
  "343" : {
    "dateAddedLocal" : "7/1/2018, 4:21:49 PM",
    "dateAddedUTC" : "2018-07-01T20:21:49.748Z",
    "description" : "Lorem ipsum dolor sit amet, consectetur adipiscing elit. Vivamus vel lectus ut turpis fermentum vestibulum. ",
    "favorited" : false,
    "hyperlink" : "https://en.wikipedia.org/wiki/List_of_Egyptian_hieroglyphs",
    "id" : "342",
    "index" : 239,
    "lastlocation" : -1,
    "newtag" : "",
    "parentId" : "1",
    "taglist" : [ "first-tag" ],
    "text" : "List of Egyptian hieroglyphs - Wikipedia"
  },
  "344" : {
    "dateAddedLocal" : "9/24/2015, 4:50:40 PM",
    "dateAddedUTC" : "2015-09-24T20:50:40.774Z",
    "description" : "Lorem ipsum dolor sit amet, consectetur adipiscing elit. Vivamus vel lectus ut turpis fermentum vestibulum. ",
    "favorited" : false,
    "hyperlink" : "http://search.proquest.com.ezproxy.neu.edu/docview/1270283793/fulltextPDF/E7C935640AD249EBPQ/1?accountid=12826",
    "id" : "343",
    "index" : 9,
    "lastlocation" : -1,
    "newtag" : "",
    "parentId" : "48",
    "taglist" : [ "first-tag" ],
    "text" : "Responsive Web Design - ProQuest"
  },
  "345" : {
    "dateAddedLocal" : "6/26/2014, 11:10:46 PM",
    "dateAddedUTC" : "2014-06-27T03:10:46.193Z",
    "description" : "Lorem ipsum dolor sit amet, consectetur adipiscing elit. Vivamus vel lectus ut turpis fermentum vestibulum. ",
    "favorited" : false,
    "hyperlink" : "http://bost.ocks.org/mike/algorithms/",
    "id" : "344",
    "index" : 5,
    "lastlocation" : -1,
    "newtag" : "",
    "parentId" : "16",
    "taglist" : [ "first-tag" ],
    "text" : "Visualizing Algorithms"
  },
  "346" : {
    "dateAddedLocal" : "12/1/2016, 9:29:58 PM",
    "dateAddedUTC" : "2016-12-02T02:29:58.259Z",
    "description" : "Lorem ipsum dolor sit amet, consectetur adipiscing elit. Vivamus vel lectus ut turpis fermentum vestibulum. ",
    "favorited" : false,
    "hyperlink" : "https://www.google.com/search?q=texas+highway+signs+delta+shape&safe=off&source=lnms&tbm=isch&sa=X&ved=0ahUKEwj91KG76tPQAhWhrFQKHdBYAP8Q_AUICCgB&biw=1280&bih=703#safe=off&tbm=isch&q=1950+car+fin&imgrc=6hO3RtH6nKwRAM%3A",
    "id" : "345",
    "index" : 3,
    "lastlocation" : -1,
    "newtag" : "",
    "parentId" : "670",
    "taglist" : [ "first-tag" ],
    "text" : "1950 car fin - Google Search"
  },
  "347" : {
    "dateAddedLocal" : "12/1/2016, 9:29:55 PM",
    "dateAddedUTC" : "2016-12-02T02:29:55.150Z",
    "description" : "Lorem ipsum dolor sit amet, consectetur adipiscing elit. Vivamus vel lectus ut turpis fermentum vestibulum. ",
    "favorited" : false,
    "hyperlink" : "https://upload.wikimedia.org/wikipedia/commons/thumb/3/3a/1915NatGeog.jpg/220px-1915NatGeog.jpg",
    "id" : "346",
    "index" : 1,
    "lastlocation" : -1,
    "newtag" : "",
    "parentId" : "670",
    "taglist" : [ "first-tag" ],
    "text" : "220px-1915NatGeog.jpg (220Ã—305)"
  },
  "348" : {
    "dateAddedLocal" : "12/27/2017, 7:34:35 AM",
    "dateAddedUTC" : "2017-12-27T12:34:35.909Z",
    "description" : "Lorem ipsum dolor sit amet, consectetur adipiscing elit. Vivamus vel lectus ut turpis fermentum vestibulum. ",
    "favorited" : false,
    "hyperlink" : "https://coinmarketcap.com/currencies/poet/",
    "id" : "347",
    "index" : 233,
    "lastlocation" : -1,
    "newtag" : "",
    "parentId" : "1",
    "taglist" : [ "first-tag" ],
    "text" : "Po.et (POE) $0.030736 (2.98%) | CoinMarketCap"
  },
  "349" : {
    "dateAddedLocal" : "1/14/2019, 9:57:20 PM",
    "dateAddedUTC" : "2019-01-15T02:57:20.605Z",
    "description" : "Lorem ipsum dolor sit amet, consectetur adipiscing elit. Vivamus vel lectus ut turpis fermentum vestibulum. ",
    "favorited" : false,
    "hyperlink" : "https://help.bigcartel.com/printful",
    "id" : "348",
    "index" : 294,
    "lastlocation" : -1,
    "newtag" : "",
    "parentId" : "1",
    "taglist" : [ "first-tag" ],
    "text" : "Printful app integration for Big Cartel"
  },
  "350" : {
    "dateAddedLocal" : "3/26/2015, 3:17:28 PM",
    "dateAddedUTC" : "2015-03-26T19:17:28.056Z",
    "description" : "Lorem ipsum dolor sit amet, consectetur adipiscing elit. Vivamus vel lectus ut turpis fermentum vestibulum. ",
    "favorited" : false,
    "id" : "349",
    "index" : 21,
    "lastlocation" : -1,
    "newtag" : "",
    "parentId" : "2",
    "taglist" : [ "first-tag" ],
    "text" : "PI"
  },
  "351" : {
    "dateAddedLocal" : "1/14/2016, 2:40:22 AM",
    "dateAddedUTC" : "2016-01-14T07:40:22.710Z",
    "description" : "Lorem ipsum dolor sit amet, consectetur adipiscing elit. Vivamus vel lectus ut turpis fermentum vestibulum. ",
    "favorited" : false,
    "hyperlink" : "http://www.hubspot.com/blog-topic-generator",
    "id" : "350",
    "index" : 0,
    "lastlocation" : -1,
    "newtag" : "",
    "parentId" : "60",
    "taglist" : [ "first-tag" ],
    "text" : "HubSpot's Blog Topic Generator"
  },
  "352" : {
    "dateAddedLocal" : "10/22/2018, 8:01:24 PM",
    "dateAddedUTC" : "2018-10-23T00:01:24.345Z",
    "description" : "Lorem ipsum dolor sit amet, consectetur adipiscing elit. Vivamus vel lectus ut turpis fermentum vestibulum. ",
    "favorited" : false,
    "hyperlink" : "https://docs.google.com/document/d/1eo25bLGU-pWLeARsdtmfE3dluHOXGz_N5D328wY4Jm0/edit",
    "id" : "351",
    "index" : 252,
    "lastlocation" : -1,
    "newtag" : "",
    "parentId" : "1",
    "taglist" : [ "first-tag" ],
    "text" : "Design Meeting - Google Docs"
  },
  "353" : {
    "dateAddedLocal" : "6/10/2017, 2:42:41 PM",
    "dateAddedUTC" : "2017-06-10T18:42:41.902Z",
    "description" : "Lorem ipsum dolor sit amet, consectetur adipiscing elit. Vivamus vel lectus ut turpis fermentum vestibulum. ",
    "favorited" : false,
    "hyperlink" : "https://forum.bodybuilding.com/forumdisplay.php?f=13",
    "id" : "352",
    "index" : 111,
    "lastlocation" : -1,
    "newtag" : "",
    "parentId" : "1",
    "taglist" : [ "first-tag" ],
    "text" : "Nutrition"
  },
  "354" : {
    "dateAddedLocal" : "4/28/2014, 7:03:34 PM",
    "dateAddedUTC" : "2014-04-28T23:03:34.614Z",
    "description" : "Lorem ipsum dolor sit amet, consectetur adipiscing elit. Vivamus vel lectus ut turpis fermentum vestibulum. ",
    "favorited" : false,
    "hyperlink" : "http://www.youtube.com/watch?v=V-0-Y2Hmp4A",
    "id" : "353",
    "index" : 5,
    "lastlocation" : -1,
    "newtag" : "",
    "parentId" : "189",
    "taglist" : [ "first-tag" ],
    "text" : "KARATE BAKABON - Trippy Blues"
  },
  "355" : {
    "dateAddedLocal" : "1/31/2015, 11:28:27 PM",
    "dateAddedUTC" : "2015-02-01T04:28:27.739Z",
    "description" : "Lorem ipsum dolor sit amet, consectetur adipiscing elit. Vivamus vel lectus ut turpis fermentum vestibulum. ",
    "favorited" : false,
    "hyperlink" : "http://fathom.info/careers",
    "id" : "354",
    "index" : 0,
    "lastlocation" : -1,
    "newtag" : "",
    "parentId" : "29",
    "taglist" : [ "first-tag" ],
    "text" : "Careers | Fathom"
  },
  "356" : {
    "dateAddedLocal" : "1/6/2019, 3:11:29 PM",
    "dateAddedUTC" : "2019-01-06T20:11:29.386Z",
    "description" : "Lorem ipsum dolor sit amet, consectetur adipiscing elit. Vivamus vel lectus ut turpis fermentum vestibulum. ",
    "favorited" : false,
    "hyperlink" : "https://www.mylt.life/clubs/ma/chestnut-hill/classes.html?departmentDescription=Group%20Fitness%7CBarbell%20Strength&departmentDescription=Yoga%7CFLOW%20(Heated)&departmentDescription=Yoga%7CSURRENDER&departmentDescription=Group%20Fitness%7CWarrior%20Sculpt%20(Heated)&departmentDescription=Group%20Fitness%7CWarrior%20Sculpt&departmentDescription=Yoga%7CFeature%20Yoga&departmentDescription=Group%20Fitness%7CCardio%20Kickboxing&departmentDescription=Yoga%7CAshtanga%20Vinyasa&departmentDescription=Group%20Fitness%7CStrictly%20Strength&departmentDescription=Group%20Fitness%7CYoga-Pilates%20Fusion&departmentDescription=Yoga%7CBE&departmentDescription=Yoga%7CFLOW%20Guided&departmentDescription=Yoga%7CFLOW%20Guided%20(Heated)&departmentDescription=Yoga%7CSpa%20Yoga&departmentDescription=Yoga%7CVinyasa&selecteddate=2019-01-06",
    "id" : "355",
    "index" : 259,
    "lastlocation" : -1,
    "newtag" : "",
    "parentId" : "1",
    "taglist" : [ "first-tag" ],
    "text" : "GYM"
  },
  "357" : {
    "dateAddedLocal" : "1/12/2019, 7:34:21 PM",
    "dateAddedUTC" : "2019-01-13T00:34:21.254Z",
    "description" : "Lorem ipsum dolor sit amet, consectetur adipiscing elit. Vivamus vel lectus ut turpis fermentum vestibulum. ",
    "favorited" : false,
    "hyperlink" : "https://members.cj.com/member/publisher/home.do",
    "id" : "356",
    "index" : 280,
    "lastlocation" : -1,
    "newtag" : "",
    "parentId" : "1",
    "taglist" : [ "first-tag" ],
    "text" : "CJ"
  },
  "358" : {
    "dateAddedLocal" : "9/6/2014, 12:48:55 PM",
    "dateAddedUTC" : "2014-09-06T16:48:55.042Z",
    "description" : "Lorem ipsum dolor sit amet, consectetur adipiscing elit. Vivamus vel lectus ut turpis fermentum vestibulum. ",
    "favorited" : false,
    "hyperlink" : "http://threejsplaygnd.brangerbriz.net/",
    "id" : "357",
    "index" : 8,
    "lastlocation" : -1,
    "newtag" : "",
    "parentId" : "39",
    "taglist" : [ "first-tag" ],
    "text" : "threejs playground"
  },
  "359" : {
    "dateAddedLocal" : "10/15/2015, 2:28:08 PM",
    "dateAddedUTC" : "2015-10-15T18:28:08.459Z",
    "description" : "Lorem ipsum dolor sit amet, consectetur adipiscing elit. Vivamus vel lectus ut turpis fermentum vestibulum. ",
    "favorited" : false,
    "hyperlink" : "http://tympanus.net/codrops/2015/10/15/effect-ideas-for-image-grids/",
    "id" : "358",
    "index" : 2,
    "lastlocation" : -1,
    "newtag" : "",
    "parentId" : "52",
    "taglist" : [ "first-tag" ],
    "text" : "Coding teh IMage Grid"
  },
  "360" : {
    "dateAddedLocal" : "9/24/2015, 3:56:52 PM",
    "dateAddedUTC" : "2015-09-24T19:56:52.071Z",
    "description" : "Lorem ipsum dolor sit amet, consectetur adipiscing elit. Vivamus vel lectus ut turpis fermentum vestibulum. ",
    "favorited" : false,
    "hyperlink" : "http://blog.froont.com/9-basic-principles-of-responsive-web-design/",
    "id" : "359",
    "index" : 3,
    "lastlocation" : -1,
    "newtag" : "",
    "parentId" : "48",
    "taglist" : [ "first-tag" ],
    "text" : "9 basic principles of responsive web design"
  },
  "361" : {
    "dateAddedLocal" : "6/25/2015, 12:27:17 AM",
    "dateAddedUTC" : "2015-06-25T04:27:17.468Z",
    "description" : "Lorem ipsum dolor sit amet, consectetur adipiscing elit. Vivamus vel lectus ut turpis fermentum vestibulum. ",
    "favorited" : false,
    "hyperlink" : "http://fontfabric.com/bebas-neue/?utm_source=fontsquirrel.com&utm_medium=download_link&utm_campaign=bebas-neue",
    "id" : "360",
    "index" : 4,
    "lastlocation" : -1,
    "newtag" : "",
    "parentId" : "311",
    "taglist" : [ "first-tag" ],
    "text" : "Bebas Neue | Fontfabricâ„¢"
  },
  "362" : {
    "dateAddedLocal" : "9/6/2013, 12:27:03 AM",
    "dateAddedUTC" : "2013-09-06T04:27:03.000Z",
    "description" : "Lorem ipsum dolor sit amet, consectetur adipiscing elit. Vivamus vel lectus ut turpis fermentum vestibulum. ",
    "favorited" : false,
    "hyperlink" : "http://acm.ccs.neu.edu/calendar/",
    "id" : "361",
    "index" : 0,
    "lastlocation" : -1,
    "newtag" : "",
    "parentId" : "18",
    "taglist" : [ "first-tag" ],
    "text" : "acm"
  },
  "363" : {
    "dateAddedLocal" : "1/18/2019, 5:49:06 PM",
    "dateAddedUTC" : "2019-01-18T22:49:06.261Z",
    "description" : "Lorem ipsum dolor sit amet, consectetur adipiscing elit. Vivamus vel lectus ut turpis fermentum vestibulum. ",
    "favorited" : false,
    "hyperlink" : "https://www.indiehackers.com/",
    "id" : "362",
    "index" : 263,
    "lastlocation" : -1,
    "newtag" : "",
    "parentId" : "1",
    "taglist" : [ "first-tag" ],
    "text" : "indie"
  },
  "364" : {
    "dateAddedLocal" : "3/26/2015, 10:53:00 AM",
    "dateAddedUTC" : "2015-03-26T14:53:00.546Z",
    "description" : "Lorem ipsum dolor sit amet, consectetur adipiscing elit. Vivamus vel lectus ut turpis fermentum vestibulum. ",
    "favorited" : false,
    "hyperlink" : "http://en.wikipedia.org/wiki/Gantt_chart",
    "id" : "363",
    "index" : 1,
    "lastlocation" : -1,
    "newtag" : "",
    "parentId" : "301",
    "taglist" : [ "data-viz" ],
    "text" : "Gantt chart - Project Schedule"
  },
  "365" : {
    "dateAddedLocal" : "4/14/2016, 1:00:57 PM",
    "dateAddedUTC" : "2016-04-14T17:00:57.476Z",
    "description" : "Lorem ipsum dolor sit amet, consectetur adipiscing elit. Vivamus vel lectus ut turpis fermentum vestibulum. ",
    "favorited" : false,
    "hyperlink" : "http://www.bohemiantrails.com/links/",
    "id" : "364",
    "index" : 60,
    "lastlocation" : -1,
    "newtag" : "",
    "parentId" : "2",
    "taglist" : [ "first-tag" ],
    "text" : "bohemaian trail "
  },
  "366" : {
    "dateAddedLocal" : "7/27/2014, 3:06:36 AM",
    "dateAddedUTC" : "2014-07-27T07:06:36.978Z",
    "description" : "Lorem ipsum dolor sit amet, consectetur adipiscing elit. Vivamus vel lectus ut turpis fermentum vestibulum. ",
    "favorited" : false,
    "id" : "365",
    "index" : 2,
    "lastlocation" : -1,
    "newtag" : "",
    "parentId" : "2",
    "taglist" : [ "first-tag" ],
    "text" : "Web Design"
  },
  "367" : {
    "dateAddedLocal" : "11/17/2014, 12:10:56 PM",
    "dateAddedUTC" : "2014-11-17T17:10:56.222Z",
    "description" : "Lorem ipsum dolor sit amet, consectetur adipiscing elit. Vivamus vel lectus ut turpis fermentum vestibulum. ",
    "favorited" : false,
    "hyperlink" : "http://markgeyer.com/pres/the-art-of-ui-animations/#/3/4",
    "id" : "366",
    "index" : 11,
    "lastlocation" : -1,
    "newtag" : "",
    "parentId" : "38",
    "taglist" : [ "first-tag" ],
    "text" : "The Art of UI Animations, Lean UX SF"
  },
  "368" : {
    "dateAddedLocal" : "1/15/2019, 11:04:52 AM",
    "dateAddedUTC" : "2019-01-15T16:04:52.255Z",
    "description" : "Lorem ipsum dolor sit amet, consectetur adipiscing elit. Vivamus vel lectus ut turpis fermentum vestibulum. ",
    "favorited" : false,
    "hyperlink" : "https://www.bloomberg.com/features/2016-how-to-invest-10k/?cmpid=BBD011419_BIZ&utm_medium=email&utm_source=newsletter&utm_term=190114&utm_campaign=bloombergdaily",
    "id" : "367",
    "index" : 88,
    "lastlocation" : -1,
    "newtag" : "",
    "parentId" : "2",
    "taglist" : [ "first-tag" ],
    "text" : "Top Investment Advisors: Where to invest $10,000 in 2019"
  },
  "369" : {
    "dateAddedLocal" : "4/7/2015, 3:38:47 PM",
    "dateAddedUTC" : "2015-04-07T19:38:47.090Z",
    "description" : "Lorem ipsum dolor sit amet, consectetur adipiscing elit. Vivamus vel lectus ut turpis fermentum vestibulum. ",
    "favorited" : false,
    "hyperlink" : "https://www.google.com/webhp?sourceid=chrome-instant&ion=1&espv=2&ie=UTF-8#q=chromecast",
    "id" : "368",
    "index" : 8,
    "lastlocation" : -1,
    "newtag" : "",
    "parentId" : "15",
    "taglist" : [ "first-tag" ],
    "text" : "chromecast - Google Search"
  },
  "370" : {
    "dateAddedLocal" : "12/20/2013, 12:18:50 AM",
    "dateAddedUTC" : "2013-12-20T05:18:50.495Z",
    "description" : "Lorem ipsum dolor sit amet, consectetur adipiscing elit. Vivamus vel lectus ut turpis fermentum vestibulum. ",
    "favorited" : false,
    "hyperlink" : "http://www.youtube.com/watch?v=6el_SNoIrLs",
    "id" : "369",
    "index" : 2,
    "lastlocation" : -1,
    "newtag" : "",
    "parentId" : "10",
    "taglist" : [ "first-tag" ],
    "text" : "â–¶ Loving Kindness Meditation - YouTube"
  },
  "371" : {
    "dateAddedLocal" : "9/19/2018, 9:52:41 PM",
    "dateAddedUTC" : "2018-09-20T01:52:41.370Z",
    "description" : "Lorem ipsum dolor sit amet, consectetur adipiscing elit. Vivamus vel lectus ut turpis fermentum vestibulum. ",
    "favorited" : false,
    "hyperlink" : "https://sidebar.io/",
    "id" : "370",
    "index" : 31,
    "lastlocation" : -1,
    "newtag" : "",
    "parentId" : "1",
    "taglist" : [ "first-tag" ],
    "text" : "Sidebar"
  },
  "372" : {
    "dateAddedLocal" : "9/24/2015, 4:05:54 PM",
    "dateAddedUTC" : "2015-09-24T20:05:54.735Z",
    "description" : "Lorem ipsum dolor sit amet, consectetur adipiscing elit. Vivamus vel lectus ut turpis fermentum vestibulum. ",
    "favorited" : false,
    "hyperlink" : "http://www.smashingmagazine.com/2011/01/guidelines-for-responsive-web-design/",
    "id" : "371",
    "index" : 6,
    "lastlocation" : -1,
    "newtag" : "",
    "parentId" : "48",
    "taglist" : [ "first-tag" ],
    "text" : "Responsive Web Design: What It Is and How To Use It â€“ Smashing Magazine"
  },
  "373" : {
    "dateAddedLocal" : "10/30/2013, 11:22:50 PM",
    "dateAddedUTC" : "2013-10-31T03:22:50.647Z",
    "description" : "Lorem ipsum dolor sit amet, consectetur adipiscing elit. Vivamus vel lectus ut turpis fermentum vestibulum. ",
    "favorited" : false,
    "id" : "372",
    "index" : 17,
    "lastlocation" : -1,
    "newtag" : "",
    "parentId" : "49",
    "taglist" : [ "first-tag" ],
    "text" : "hw music"
  },
  "374" : {
    "dateAddedLocal" : "4/28/2014, 6:47:20 PM",
    "dateAddedUTC" : "2014-04-28T22:47:20.633Z",
    "description" : "Lorem ipsum dolor sit amet, consectetur adipiscing elit. Vivamus vel lectus ut turpis fermentum vestibulum. ",
    "favorited" : false,
    "id" : "373",
    "index" : 26,
    "lastlocation" : -1,
    "newtag" : "",
    "parentId" : "49",
    "taglist" : [ "first-tag" ],
    "text" : "JM"
  },
  "375" : {
    "dateAddedLocal" : "2/18/2014, 7:21:15 PM",
    "dateAddedUTC" : "2014-02-19T00:21:15.060Z",
    "description" : "Lorem ipsum dolor sit amet, consectetur adipiscing elit. Vivamus vel lectus ut turpis fermentum vestibulum. ",
    "favorited" : false,
    "hyperlink" : "http://socket.io/",
    "id" : "374",
    "index" : 0,
    "lastlocation" : -1,
    "newtag" : "",
    "parentId" : "13",
    "taglist" : [ "first-tag" ],
    "text" : "Socket.IO: the cross-browser WebSocket for realtime apps."
  },
  "376" : {
    "dateAddedLocal" : "11/12/2015, 2:50:05 PM",
    "dateAddedUTC" : "2015-11-12T19:50:05.539Z",
    "description" : "Lorem ipsum dolor sit amet, consectetur adipiscing elit. Vivamus vel lectus ut turpis fermentum vestibulum. ",
    "favorited" : false,
    "hyperlink" : "http://www.discogs.com/artist/1134382-Knowledge-11",
    "id" : "375",
    "index" : 155,
    "lastlocation" : -1,
    "newtag" : "",
    "parentId" : "1",
    "taglist" : [ "first-tag" ],
    "text" : "unnamed"
  },
  "377" : {
    "dateAddedLocal" : "6/12/2015, 11:17:47 AM",
    "dateAddedUTC" : "2015-06-12T15:17:47.232Z",
    "description" : "Lorem ipsum dolor sit amet, consectetur adipiscing elit. Vivamus vel lectus ut turpis fermentum vestibulum. ",
    "favorited" : false,
    "hyperlink" : "http://www.artsbrookline.org/",
    "id" : "376",
    "index" : 1,
    "lastlocation" : -1,
    "newtag" : "",
    "parentId" : "42",
    "taglist" : [ "first-tag" ],
    "text" : "artsbrookline.org"
  },
  "378" : {
    "dateAddedLocal" : "11/12/2013, 9:34:59 PM",
    "dateAddedUTC" : "2013-11-13T02:34:59.634Z",
    "description" : "Lorem ipsum dolor sit amet, consectetur adipiscing elit. Vivamus vel lectus ut turpis fermentum vestibulum. ",
    "favorited" : false,
    "hyperlink" : "http://www.youtube.com/watch?v=MqoANESQ4cQ",
    "id" : "377",
    "index" : 3,
    "lastlocation" : -1,
    "newtag" : "",
    "parentId" : "180",
    "taglist" : [ "first-tag" ],
    "text" : "The Cinematic Orchestra Arrival of the Birds & Transformation - YouTube"
  },
  "379" : {
    "dateAddedLocal" : "3/6/2014, 3:03:13 PM",
    "dateAddedUTC" : "2014-03-06T20:03:13.518Z",
    "description" : "Lorem ipsum dolor sit amet, consectetur adipiscing elit. Vivamus vel lectus ut turpis fermentum vestibulum. ",
    "favorited" : false,
    "hyperlink" : "http://www.youtube.com/watch?v=g7bc_xdiRUU",
    "id" : "378",
    "index" : 25,
    "lastlocation" : -1,
    "newtag" : "",
    "parentId" : "49",
    "taglist" : [ "first-tag" ],
    "text" : "The Juju Orchestra - Kind of Latin Rhythm (Smoove Remix) - YouTube"
  },
  "380" : {
    "dateAddedLocal" : "4/3/2015, 7:36:05 PM",
    "dateAddedUTC" : "2015-04-03T23:36:05.507Z",
    "description" : "Lorem ipsum dolor sit amet, consectetur adipiscing elit. Vivamus vel lectus ut turpis fermentum vestibulum. ",
    "favorited" : false,
    "hyperlink" : "http://quentinmorisseau.com/about",
    "id" : "379",
    "index" : 8,
    "lastlocation" : -1,
    "newtag" : "",
    "parentId" : "35",
    "taglist" : [ "first-tag" ],
    "text" : "Quentin Morisseau - Designer"
  },
  "381" : {
    "dateAddedLocal" : "12/1/2016, 9:29:56 PM",
    "dateAddedUTC" : "2016-12-02T02:29:56.688Z",
    "description" : "Lorem ipsum dolor sit amet, consectetur adipiscing elit. Vivamus vel lectus ut turpis fermentum vestibulum. ",
    "favorited" : false,
    "hyperlink" : "http://www.logodesignlove.com/nasa-logo",
    "id" : "380",
    "index" : 2,
    "lastlocation" : -1,
    "newtag" : "",
    "parentId" : "670",
    "taglist" : [ "first-tag" ],
    "text" : "NASA logo evolution: meatball vs worm | Logo Design Love"
  },
  "382" : {
    "dateAddedLocal" : "3/27/2018, 12:12:08 PM",
    "dateAddedUTC" : "2018-03-27T16:12:08.953Z",
    "description" : "Lorem ipsum dolor sit amet, consectetur adipiscing elit. Vivamus vel lectus ut turpis fermentum vestibulum. ",
    "favorited" : false,
    "hyperlink" : "https://drive.google.com/drive/folders/1CG7M2oYklhuxbzqzg-04tD6whiCrMpfM",
    "id" : "381",
    "index" : 72,
    "lastlocation" : -1,
    "newtag" : "",
    "parentId" : "1",
    "taglist" : [ "first-tag" ],
    "text" : "Finances "
  },
  "383" : {
    "dateAddedLocal" : "9/9/2015, 12:44:28 PM",
    "dateAddedUTC" : "2015-09-09T16:44:28.739Z",
    "description" : "Lorem ipsum dolor sit amet, consectetur adipiscing elit. Vivamus vel lectus ut turpis fermentum vestibulum. ",
    "favorited" : false,
    "hyperlink" : "http://www.harvardartmuseums.org/plan-your-visit",
    "id" : "382",
    "index" : 6,
    "lastlocation" : -1,
    "newtag" : "",
    "parentId" : "42",
    "taglist" : [ "first-tag" ],
    "text" : "Plan Your Visit | Harvard Art Museums"
  },
  "384" : {
    "dateAddedLocal" : "11/17/2014, 7:22:53 AM",
    "dateAddedUTC" : "2014-11-17T12:22:53.726Z",
    "description" : "Lorem ipsum dolor sit amet, consectetur adipiscing elit. Vivamus vel lectus ut turpis fermentum vestibulum. ",
    "favorited" : false,
    "hyperlink" : "https://www.iconfinder.com/icons/318227/article_blog_book_bookmark_bookmarked_bookmarks_education_lecture_read_reading_icon#size=128",
    "id" : "383",
    "index" : 8,
    "lastlocation" : -1,
    "newtag" : "",
    "parentId" : "23",
    "taglist" : [ "first-tag" ],
    "text" : "Article, blog, book, bookmark, bookmarked, bookmarks, education, lecture, read, reading icon | Icon search engine"
  },
  "385" : {
    "dateAddedLocal" : "9/20/2016, 7:00:22 PM",
    "dateAddedUTC" : "2016-09-20T23:00:22.442Z",
    "description" : "Lorem ipsum dolor sit amet, consectetur adipiscing elit. Vivamus vel lectus ut turpis fermentum vestibulum. ",
    "favorited" : false,
    "hyperlink" : "http://research.google.com/bigpicture/music/#",
    "id" : "384",
    "index" : 64,
    "lastlocation" : -1,
    "newtag" : "",
    "parentId" : "2",
    "taglist" : [ "first-tag" ],
    "text" : "Music Timeline"
  },
  "386" : {
    "dateAddedLocal" : "4/14/2019, 10:53:22 PM",
    "dateAddedUTC" : "2019-04-15T02:53:22.032Z",
    "description" : "Lorem ipsum dolor sit amet, consectetur adipiscing elit. Vivamus vel lectus ut turpis fermentum vestibulum. ",
    "favorited" : false,
    "hyperlink" : "https://www.thebostoncalendar.com/",
    "id" : "385",
    "index" : 27,
    "lastlocation" : -1,
    "newtag" : "",
    "parentId" : "1",
    "taglist" : [ "first-tag" ],
    "text" : "events"
  },
  "387" : {
    "dateAddedLocal" : "6/14/2019, 11:43:05 AM",
    "dateAddedUTC" : "2019-06-14T15:43:05.164Z",
    "description" : "Lorem ipsum dolor sit amet, consectetur adipiscing elit. Vivamus vel lectus ut turpis fermentum vestibulum. ",
    "favorited" : false,
    "hyperlink" : "https://pandas.pydata.org/",
    "id" : "386",
    "index" : 7,
    "lastlocation" : -1,
    "newtag" : "",
    "parentId" : "1",
    "taglist" : [ "first-tag" ],
    "text" : "Pandas Data Analysis Library"
  },
  "388" : {
    "dateAddedLocal" : "3/15/2019, 1:31:16 AM",
    "dateAddedUTC" : "2019-03-15T05:31:16.327Z",
    "description" : "Lorem ipsum dolor sit amet, consectetur adipiscing elit. Vivamus vel lectus ut turpis fermentum vestibulum. ",
    "favorited" : false,
    "hyperlink" : "https://en.wikipedia.org/wiki/Alchemical_Symbols_(Unicode_block)",
    "id" : "387",
    "index" : 314,
    "lastlocation" : -1,
    "newtag" : "",
    "parentId" : "1",
    "taglist" : [ "first-tag" ],
    "text" : "Alchemical Symbols (Unicode block) - Wikipedia"
  },
  "389" : {
    "dateAddedLocal" : "6/22/2018, 5:10:28 PM",
    "dateAddedUTC" : "2018-06-22T21:10:28.439Z",
    "description" : "Lorem ipsum dolor sit amet, consectetur adipiscing elit. Vivamus vel lectus ut turpis fermentum vestibulum. ",
    "favorited" : false,
    "hyperlink" : "https://github.com/trekhleb/javascript-algorithms",
    "id" : "388",
    "index" : 54,
    "lastlocation" : -1,
    "newtag" : "",
    "parentId" : "1",
    "taglist" : [ "first-tag" ],
    "text" : "JS"
  },
  "390" : {
    "dateAddedLocal" : "1/7/2016, 2:05:01 AM",
    "dateAddedUTC" : "2016-01-07T07:05:01.135Z",
    "description" : "Lorem ipsum dolor sit amet, consectetur adipiscing elit. Vivamus vel lectus ut turpis fermentum vestibulum. ",
    "favorited" : false,
    "hyperlink" : "https://www.pexels.com/photo/smoke-incense-2763/",
    "id" : "389",
    "index" : 153,
    "lastlocation" : -1,
    "newtag" : "",
    "parentId" : "1",
    "taglist" : [ "first-tag" ],
    "text" : "unnamed"
  },
  "391" : {
    "dateAddedLocal" : "7/2/2014, 12:16:12 PM",
    "dateAddedUTC" : "2014-07-02T16:16:12.571Z",
    "description" : "Lorem ipsum dolor sit amet, consectetur adipiscing elit. Vivamus vel lectus ut turpis fermentum vestibulum. ",
    "favorited" : false,
    "hyperlink" : "http://bost.ocks.org/mike/#talks",
    "id" : "390",
    "index" : 1,
    "lastlocation" : -1,
    "newtag" : "",
    "parentId" : "418",
    "taglist" : [ "first-tag" ],
    "text" : "d3 talks"
  },
  "392" : {
    "dateAddedLocal" : "7/24/2018, 4:07:00 PM",
    "dateAddedUTC" : "2018-07-24T20:07:00.561Z",
    "description" : "Lorem ipsum dolor sit amet, consectetur adipiscing elit. Vivamus vel lectus ut turpis fermentum vestibulum. ",
    "favorited" : false,
    "hyperlink" : "https://www.colophon-foundry.org/typefaces/apercu/",
    "id" : "391",
    "index" : 240,
    "lastlocation" : -1,
    "newtag" : "",
    "parentId" : "1",
    "taglist" : [ "first-tag" ],
    "text" : "Colophon Foundry"
  },
  "393" : {
    "dateAddedLocal" : "10/1/2015, 5:20:55 PM",
    "dateAddedUTC" : "2015-10-01T21:20:55.852Z",
    "description" : "Lorem ipsum dolor sit amet, consectetur adipiscing elit. Vivamus vel lectus ut turpis fermentum vestibulum. ",
    "favorited" : false,
    "hyperlink" : "http://bradfrost.com/blog/post/the-principles-of-adaptive-design/",
    "id" : "392",
    "index" : 10,
    "lastlocation" : -1,
    "newtag" : "",
    "parentId" : "51",
    "taglist" : [ "first-tag" ],
    "text" : "The Principles of Adaptive Design | Brad Frost ???"
  },
  "394" : {
    "dateAddedLocal" : "7/13/2018, 11:55:30 PM",
    "dateAddedUTC" : "2018-07-14T03:55:30.363Z",
    "description" : "Lorem ipsum dolor sit amet, consectetur adipiscing elit. Vivamus vel lectus ut turpis fermentum vestibulum. ",
    "favorited" : false,
    "hyperlink" : "https://medium.com/@jc_78614/finding-a-floor-in-cryptoasset-valuation-606d2c7aa7a9",
    "id" : "393",
    "index" : 1,
    "lastlocation" : -1,
    "newtag" : "",
    "parentId" : "508",
    "taglist" : [ "first-tag" ],
    "text" : "Finding a floor in cryptoasset valuation â€“ Jonathan Cheesman â€“ Medium"
  },
  "395" : {
    "dateAddedLocal" : "9/19/2018, 10:06:54 PM",
    "dateAddedUTC" : "2018-09-20T02:06:54.618Z",
    "description" : "Lorem ipsum dolor sit amet, consectetur adipiscing elit. Vivamus vel lectus ut turpis fermentum vestibulum. ",
    "favorited" : false,
    "hyperlink" : "https://material.io/develop",
    "id" : "394",
    "index" : 30,
    "lastlocation" : -1,
    "newtag" : "",
    "parentId" : "1",
    "taglist" : [ "first-tag" ],
    "text" : "Material"
  },
  "396" : {
    "dateAddedLocal" : "8/10/2016, 1:57:26 AM",
    "dateAddedUTC" : "2016-08-10T05:57:26.404Z",
    "description" : "Lorem ipsum dolor sit amet, consectetur adipiscing elit. Vivamus vel lectus ut turpis fermentum vestibulum. ",
    "favorited" : false,
    "hyperlink" : "https://sugarjs.com/",
    "id" : "395",
    "index" : 180,
    "lastlocation" : -1,
    "newtag" : "",
    "parentId" : "1",
    "taglist" : [ "first-tag" ],
    "text" : "Sugar - A Javascript utility library for working with native objects."
  },
  "397" : {
    "dateAddedLocal" : "2/28/2015, 4:14:22 PM",
    "dateAddedUTC" : "2015-02-28T21:14:22.730Z",
    "description" : "Lorem ipsum dolor sit amet, consectetur adipiscing elit. Vivamus vel lectus ut turpis fermentum vestibulum. ",
    "favorited" : false,
    "id" : "396",
    "index" : 22,
    "lastlocation" : -1,
    "newtag" : "",
    "parentId" : "2",
    "taglist" : [ "first-tag" ],
    "text" : "Internships"
  },
  "398" : {
    "dateAddedLocal" : "4/14/2019, 11:37:56 PM",
    "dateAddedUTC" : "2019-04-15T03:37:56.534Z",
    "description" : "Lorem ipsum dolor sit amet, consectetur adipiscing elit. Vivamus vel lectus ut turpis fermentum vestibulum. ",
    "favorited" : false,
    "hyperlink" : "https://y2mate.com/youtube/3WB6PwVPYw8",
    "id" : "397",
    "index" : 43,
    "lastlocation" : -1,
    "newtag" : "",
    "parentId" : "1",
    "taglist" : [ "first-tag" ],
    "text" : "DL vid assets"
  },
  "399" : {
    "dateAddedLocal" : "8/11/2016, 9:56:44 PM",
    "dateAddedUTC" : "2016-08-12T01:56:44.984Z",
    "description" : "Lorem ipsum dolor sit amet, consectetur adipiscing elit. Vivamus vel lectus ut turpis fermentum vestibulum. ",
    "favorited" : false,
    "hyperlink" : "https://www.indiehackers.com/businesses",
    "id" : "398",
    "index" : 181,
    "lastlocation" : -1,
    "newtag" : "",
    "parentId" : "1",
    "taglist" : [ "first-tag" ],
    "text" : "Indie Hackers: Make Money from Your Apps and Be Your Own Boss"
  },
  "400" : {
    "dateAddedLocal" : "4/19/2019, 3:27:47 PM",
    "dateAddedUTC" : "2019-04-19T19:27:47.136Z",
    "description" : "Lorem ipsum dolor sit amet, consectetur adipiscing elit. Vivamus vel lectus ut turpis fermentum vestibulum. ",
    "favorited" : false,
    "hyperlink" : "https://docs.google.com/document/d/1HV-cXouVC1EzPSY2gO1LdJjCwLiiFfMNyFoi22H7UJM/edit",
    "id" : "399",
    "index" : 35,
    "lastlocation" : -1,
    "newtag" : "",
    "parentId" : "1",
    "taglist" : [ "first-tag" ],
    "text" : "Cover Letter"
  },
  "401" : {
    "dateAddedLocal" : "3/26/2014, 12:57:50 AM",
    "dateAddedUTC" : "2014-03-26T04:57:50.874Z",
    "description" : "Lorem ipsum dolor sit amet, consectetur adipiscing elit. Vivamus vel lectus ut turpis fermentum vestibulum. ",
    "favorited" : false,
    "hyperlink" : "https://www.youtube.com/watch?v=mAsBVMZDZwE",
    "id" : "400",
    "index" : 1,
    "lastlocation" : -1,
    "newtag" : "",
    "parentId" : "163",
    "taglist" : [ "first-tag" ],
    "text" : "Shareefa - Need A Boss ft. Ludacris - YouTube"
  },
  "402" : {
    "dateAddedLocal" : "11/3/2013, 1:28:34 PM",
    "dateAddedUTC" : "2013-11-03T18:28:34.202Z",
    "description" : "Lorem ipsum dolor sit amet, consectetur adipiscing elit. Vivamus vel lectus ut turpis fermentum vestibulum. ",
    "favorited" : false,
    "hyperlink" : "http://www.youtube.com/watch?v=pnSgC7azKvo&feature=youtu.be",
    "id" : "401",
    "index" : 0,
    "lastlocation" : -1,
    "newtag" : "",
    "parentId" : "164",
    "taglist" : [ "first-tag" ],
    "text" : "Rawtekk Feat. Miss K. - Snowflakes [Original] [HD] - YouTube"
  },
  "403" : {
    "dateAddedLocal" : "7/20/2014, 1:07:23 AM",
    "dateAddedUTC" : "2014-07-20T05:07:23.351Z",
    "description" : "Lorem ipsum dolor sit amet, consectetur adipiscing elit. Vivamus vel lectus ut turpis fermentum vestibulum. ",
    "favorited" : false,
    "hyperlink" : "https://kuler.adobe.com/explore/most-popular/?time=month",
    "id" : "402",
    "index" : 4,
    "lastlocation" : -1,
    "newtag" : "",
    "parentId" : "9",
    "taglist" : [ "first-tag" ],
    "text" : "unnamed"
  },
  "404" : {
    "dateAddedLocal" : "10/21/2016, 6:48:12 PM",
    "dateAddedUTC" : "2016-10-21T22:48:12.926Z",
    "description" : "Lorem ipsum dolor sit amet, consectetur adipiscing elit. Vivamus vel lectus ut turpis fermentum vestibulum. ",
    "favorited" : false,
    "hyperlink" : "https://wikipedia.readthedocs.io/en/latest/code.html",
    "id" : "403",
    "index" : 7,
    "lastlocation" : -1,
    "newtag" : "",
    "parentId" : "666",
    "taglist" : [ "first-tag" ],
    "text" : "pypi wikipedia API"
  },
  "405" : {
    "dateAddedLocal" : "1/19/2014, 1:47:01 PM",
    "dateAddedUTC" : "2014-01-19T18:47:01.969Z",
    "description" : "Lorem ipsum dolor sit amet, consectetur adipiscing elit. Vivamus vel lectus ut turpis fermentum vestibulum. ",
    "favorited" : false,
    "hyperlink" : "http://www.youtube.com/watch?v=RaF9spgA0xs&list=RDUsU0zSXmuzQ",
    "id" : "404",
    "index" : 3,
    "lastlocation" : -1,
    "newtag" : "",
    "parentId" : "164",
    "taglist" : [ "first-tag" ],
    "text" : "Half speed"
  },
  "406" : {
    "dateAddedLocal" : "5/17/2017, 12:47:53 PM",
    "dateAddedUTC" : "2017-05-17T16:47:53.116Z",
    "description" : "Lorem ipsum dolor sit amet, consectetur adipiscing elit. Vivamus vel lectus ut turpis fermentum vestibulum. ",
    "favorited" : false,
    "hyperlink" : "https://zenculture.co/",
    "id" : "405",
    "index" : 0,
    "lastlocation" : -1,
    "newtag" : "",
    "parentId" : "86",
    "taglist" : [ "first-tag" ],
    "text" : "Zen Culture"
  },
  "407" : {
    "dateAddedLocal" : "12/31/2015, 3:51:33 AM",
    "dateAddedUTC" : "2015-12-31T08:51:33.921Z",
    "description" : "Lorem ipsum dolor sit amet, consectetur adipiscing elit. Vivamus vel lectus ut turpis fermentum vestibulum. ",
    "favorited" : false,
    "hyperlink" : "http://searchengineland.com/",
    "id" : "406",
    "index" : 9,
    "lastlocation" : -1,
    "newtag" : "",
    "parentId" : "65",
    "taglist" : [ "first-tag" ],
    "text" : "SearchEngineLand"
  },
  "408" : {
    "dateAddedLocal" : "9/28/2015, 8:43:27 PM",
    "dateAddedUTC" : "2015-09-29T00:43:27.779Z",
    "description" : "Lorem ipsum dolor sit amet, consectetur adipiscing elit. Vivamus vel lectus ut turpis fermentum vestibulum. ",
    "favorited" : false,
    "hyperlink" : "https://www.reddit.com/r/InternetIsBeautiful/comments/3mpcl3/had_a_stressful_day_this_website_can_help_you/",
    "id" : "407",
    "index" : 1,
    "lastlocation" : -1,
    "newtag" : "",
    "parentId" : "59",
    "taglist" : [ "first-tag" ],
    "text" : "Had a stressful day? This website can help you meditate! : InternetIsBeautiful"
  },
  "409" : {
    "dateAddedLocal" : "1/14/2016, 2:02:46 AM",
    "dateAddedUTC" : "2016-01-14T07:02:46.224Z",
    "description" : "Lorem ipsum dolor sit amet, consectetur adipiscing elit. Vivamus vel lectus ut turpis fermentum vestibulum. ",
    "favorited" : false,
    "hyperlink" : "http://tools.seobook.com/general/keyword-density/",
    "id" : "408",
    "index" : 2,
    "lastlocation" : -1,
    "newtag" : "",
    "parentId" : "65",
    "taglist" : [ "first-tag" ],
    "text" : "Keyword Density Analyzer"
  },
  "410" : {
    "dateAddedLocal" : "12/24/2017, 2:51:20 AM",
    "dateAddedUTC" : "2017-12-24T07:51:20.183Z",
    "description" : "Lorem ipsum dolor sit amet, consectetur adipiscing elit. Vivamus vel lectus ut turpis fermentum vestibulum. ",
    "favorited" : false,
    "hyperlink" : "https://www.binance.com/",
    "id" : "409",
    "index" : 89,
    "lastlocation" : -1,
    "newtag" : "",
    "parentId" : "1",
    "taglist" : [ "first-tag" ],
    "text" : "unnamed"
  },
  "411" : {
    "dateAddedLocal" : "4/23/2019, 5:39:05 PM",
    "dateAddedUTC" : "2019-04-23T21:39:05.555Z",
    "description" : "Lorem ipsum dolor sit amet, consectetur adipiscing elit. Vivamus vel lectus ut turpis fermentum vestibulum. ",
    "favorited" : false,
    "hyperlink" : "https://sketch.london/",
    "id" : "410",
    "index" : 36,
    "lastlocation" : -1,
    "newtag" : "",
    "parentId" : "1",
    "taglist" : [ "first-tag" ],
    "text" : "sketch London"
  },
  "412" : {
    "dateAddedLocal" : "10/15/2015, 10:17:08 PM",
    "dateAddedUTC" : "2015-10-16T02:17:08.212Z",
    "description" : "Lorem ipsum dolor sit amet, consectetur adipiscing elit. Vivamus vel lectus ut turpis fermentum vestibulum. ",
    "favorited" : false,
    "hyperlink" : "http://commandogroup.no/",
    "id" : "411",
    "index" : 51,
    "lastlocation" : -1,
    "newtag" : "",
    "parentId" : "2",
    "taglist" : [ "first-tag" ],
    "text" : "unnamed"
  },
  "413" : {
    "dateAddedLocal" : "1/27/2016, 11:55:17 PM",
    "dateAddedUTC" : "2016-01-28T04:55:17.316Z",
    "description" : "Lorem ipsum dolor sit amet, consectetur adipiscing elit. Vivamus vel lectus ut turpis fermentum vestibulum. ",
    "favorited" : false,
    "hyperlink" : "https://monkeytest.it/",
    "id" : "412",
    "index" : 21,
    "lastlocation" : -1,
    "newtag" : "",
    "parentId" : "65",
    "taglist" : [ "first-tag" ],
    "text" : "Monkey Website Test"
  },
  "414" : {
    "dateAddedLocal" : "1/13/2016, 7:15:07 PM",
    "dateAddedUTC" : "2016-01-14T00:15:07.846Z",
    "description" : "Lorem ipsum dolor sit amet, consectetur adipiscing elit. Vivamus vel lectus ut turpis fermentum vestibulum. ",
    "favorited" : false,
    "hyperlink" : "http://www.website-test.org/",
    "id" : "413",
    "index" : 0,
    "lastlocation" : -1,
    "newtag" : "",
    "parentId" : "65",
    "taglist" : [ "first-tag" ],
    "text" : "SEO test"
  },
  "415" : {
    "dateAddedLocal" : "11/20/2018, 6:31:21 PM",
    "dateAddedUTC" : "2018-11-20T23:31:21.617Z",
    "description" : "Lorem ipsum dolor sit amet, consectetur adipiscing elit. Vivamus vel lectus ut turpis fermentum vestibulum. ",
    "favorited" : false,
    "hyperlink" : "https://github.com/mosaicio/mosaic-web/tree/mosaic-web",
    "id" : "414",
    "index" : 300,
    "lastlocation" : -1,
    "newtag" : "",
    "parentId" : "1",
    "taglist" : [ "first-tag" ],
    "text" : "app"
  },
  "416" : {
    "dateAddedLocal" : "6/25/2014, 8:55:17 PM",
    "dateAddedUTC" : "2014-06-26T00:55:17.497Z",
    "description" : "Lorem ipsum dolor sit amet, consectetur adipiscing elit. Vivamus vel lectus ut turpis fermentum vestibulum. ",
    "favorited" : false,
    "hyperlink" : "http://bost.ocks.org/mike/",
    "id" : "415",
    "index" : 1,
    "lastlocation" : -1,
    "newtag" : "",
    "parentId" : "417",
    "taglist" : [ "first-tag" ],
    "text" : "mike bostock"
  },
  "417" : {
    "dateAddedLocal" : "9/8/2015, 9:05:29 PM",
    "dateAddedUTC" : "2015-09-09T01:05:29.885Z",
    "description" : "Lorem ipsum dolor sit amet, consectetur adipiscing elit. Vivamus vel lectus ut turpis fermentum vestibulum. ",
    "favorited" : false,
    "hyperlink" : "http://www.typeconnection.com/matches.php#refPtUnivers",
    "id" : "416",
    "index" : 3,
    "lastlocation" : -1,
    "newtag" : "",
    "parentId" : "50",
    "taglist" : [ "first-tag" ],
    "text" : "type connection"
  },
  "418" : {
    "dateAddedLocal" : "1/15/2016, 7:54:48 PM",
    "dateAddedUTC" : "2016-01-16T00:54:48.482Z",
    "description" : "Lorem ipsum dolor sit amet, consectetur adipiscing elit. Vivamus vel lectus ut turpis fermentum vestibulum. ",
    "favorited" : false,
    "hyperlink" : "https://www.seoclerks.com/google-marketing/337408/Add-110-GOOGLE-Plus-Votes-For-Websites-Or-Google-Plus-Followers-To-Your-Circle",
    "id" : "417",
    "index" : 0,
    "lastlocation" : -1,
    "newtag" : "",
    "parentId" : "621",
    "taglist" : [ "first-tag" ],
    "text" : "Add 110+ GOOGLE Plus Votes For Websites Or Google Plus Followers To Your Circle for $1 - SEOClerks"
  },
  "419" : {
    "dateAddedLocal" : "3/3/2018, 9:23:57 AM",
    "dateAddedUTC" : "2018-03-03T14:23:57.801Z",
    "description" : "Lorem ipsum dolor sit amet, consectetur adipiscing elit. Vivamus vel lectus ut turpis fermentum vestibulum. ",
    "favorited" : false,
    "hyperlink" : "https://marvelapp.com/40ae01a/screen/38977105",
    "id" : "418",
    "index" : 235,
    "lastlocation" : -1,
    "newtag" : "",
    "parentId" : "1",
    "taglist" : [ "first-tag" ],
    "text" : "Klaver Mobile"
  },
  "420" : {
    "dateAddedLocal" : "5/5/2019, 12:59:23 PM",
    "dateAddedUTC" : "2019-05-05T16:59:23.580Z",
    "description" : "Lorem ipsum dolor sit amet, consectetur adipiscing elit. Vivamus vel lectus ut turpis fermentum vestibulum. ",
    "favorited" : false,
    "hyperlink" : "https://my.northeastern.edu/group/student",
    "id" : "419",
    "index" : 16,
    "lastlocation" : -1,
    "newtag" : "",
    "parentId" : "1",
    "taglist" : [ "first-tag" ],
    "text" : "NEU"
  },
  "421" : {
    "dateAddedLocal" : "2/23/2019, 4:50:22 PM",
    "dateAddedUTC" : "2019-02-23T21:50:22.993Z",
    "description" : "Lorem ipsum dolor sit amet, consectetur adipiscing elit. Vivamus vel lectus ut turpis fermentum vestibulum. ",
    "favorited" : false,
    "hyperlink" : "http://powerthoughtsmeditationclub.com/info-on-solfeggio-frequencies/",
    "id" : "420",
    "index" : 310,
    "lastlocation" : -1,
    "newtag" : "",
    "parentId" : "1",
    "taglist" : [ "first-tag" ],
    "text" : "solfeggio"
  },
  "422" : {
    "dateAddedLocal" : "7/2/2018, 10:14:45 PM",
    "dateAddedUTC" : "2018-07-03T02:14:45.664Z",
    "description" : "Lorem ipsum dolor sit amet, consectetur adipiscing elit. Vivamus vel lectus ut turpis fermentum vestibulum. ",
    "favorited" : false,
    "hyperlink" : "https://docs.google.com/presentation/d/1soWKkoQv0E8yTYU63B750RICP8zwRTg5IuGpCghFqGg/edit?usp=sharing_eip&ts=5b3a5d47",
    "id" : "421",
    "index" : 70,
    "lastlocation" : -1,
    "newtag" : "",
    "parentId" : "2",
    "taglist" : [ "first-tag" ],
    "text" : "Bloomberg v0.6 Google Slides"
  },
  "423" : {
    "dateAddedLocal" : "2/8/2018, 6:52:55 AM",
    "dateAddedUTC" : "2018-02-08T11:52:55.280Z",
    "description" : "Lorem ipsum dolor sit amet, consectetur adipiscing elit. Vivamus vel lectus ut turpis fermentum vestibulum. ",
    "favorited" : false,
    "hyperlink" : "https://waitbutwhy.com/2017/04/neuralink.html",
    "id" : "422",
    "index" : 77,
    "lastlocation" : -1,
    "newtag" : "",
    "parentId" : "1",
    "taglist" : [ "first-tag" ],
    "text" : "neuralink reading"
  },
  "424" : {
    "dateAddedLocal" : "3/3/2014, 1:18:08 PM",
    "dateAddedUTC" : "2014-03-03T18:18:08.551Z",
    "description" : "Lorem ipsum dolor sit amet, consectetur adipiscing elit. Vivamus vel lectus ut turpis fermentum vestibulum. ",
    "favorited" : false,
    "hyperlink" : "https://www.youtube.com/watch?v=XUjAtYQkFm8",
    "id" : "423",
    "index" : 24,
    "lastlocation" : -1,
    "newtag" : "",
    "parentId" : "49",
    "taglist" : [ "first-tag" ],
    "text" : "Air - Alone In Kyoto - YouTube"
  },
  "425" : {
    "dateAddedLocal" : "7/29/2014, 10:35:51 PM",
    "dateAddedUTC" : "2014-07-30T02:35:51.027Z",
    "description" : "Lorem ipsum dolor sit amet, consectetur adipiscing elit. Vivamus vel lectus ut turpis fermentum vestibulum. ",
    "favorited" : false,
    "hyperlink" : "https://dribbble.com/yoga",
    "id" : "424",
    "index" : 2,
    "lastlocation" : -1,
    "newtag" : "",
    "parentId" : "12",
    "taglist" : [ "first-tag" ],
    "text" : "Yoga "
  },
  "426" : {
    "dateAddedLocal" : "9/3/2017, 10:58:29 PM",
    "dateAddedUTC" : "2017-09-04T02:58:29.201Z",
    "description" : "Lorem ipsum dolor sit amet, consectetur adipiscing elit. Vivamus vel lectus ut turpis fermentum vestibulum. ",
    "favorited" : false,
    "hyperlink" : "http://paletton.com/#uid=7010u0keetn53Nv9qB8jlocojj9",
    "id" : "425",
    "index" : 2,
    "lastlocation" : -1,
    "newtag" : "",
    "parentId" : "580",
    "taglist" : [ "first-tag" ],
    "text" : "Paletton - The Color Scheme Designer"
  },
  "427" : {
    "dateAddedLocal" : "4/8/2017, 8:46:48 AM",
    "dateAddedUTC" : "2017-04-08T12:46:48.760Z",
    "description" : "Lorem ipsum dolor sit amet, consectetur adipiscing elit. Vivamus vel lectus ut turpis fermentum vestibulum. ",
    "favorited" : false,
    "hyperlink" : "https://tympanus.net/Development/TooltipStylesInspiration/bloated.html",
    "id" : "426",
    "index" : 218,
    "lastlocation" : -1,
    "newtag" : "",
    "parentId" : "1",
    "taglist" : [ "first-tag" ],
    "text" : "Tooltip Styles Inspiration | Bloated"
  },
  "428" : {
    "dateAddedLocal" : "4/18/2019, 1:46:32 PM",
    "dateAddedUTC" : "2019-04-18T17:46:32.700Z",
    "description" : "Lorem ipsum dolor sit amet, consectetur adipiscing elit. Vivamus vel lectus ut turpis fermentum vestibulum. ",
    "favorited" : false,
    "hyperlink" : "https://x.company/",
    "id" : "427",
    "index" : 327,
    "lastlocation" : -1,
    "newtag" : "",
    "parentId" : "1",
    "taglist" : [ "first-tag" ],
    "text" : "X â€“Â The Moonshot Factory"
  },
  "429" : {
    "dateAddedLocal" : "10/26/2017, 3:24:49 PM",
    "dateAddedUTC" : "2017-10-26T19:24:49.432Z",
    "description" : "Lorem ipsum dolor sit amet, consectetur adipiscing elit. Vivamus vel lectus ut turpis fermentum vestibulum. ",
    "favorited" : false,
    "hyperlink" : "https://ecommerce-platforms.com/ecommerce-selling-advice/ultimate-epic-guide-successful-online-shop#firstimpression",
    "id" : "428",
    "index" : 6,
    "lastlocation" : -1,
    "newtag" : "",
    "parentId" : "580",
    "taglist" : [ "first-tag" ],
    "text" : "The 17- Step Guide to Create a Successful Online Business in 2017"
  },
  "430" : {
    "dateAddedLocal" : "7/23/2015, 9:24:46 AM",
    "dateAddedUTC" : "2015-07-23T13:24:46.772Z",
    "description" : "Lorem ipsum dolor sit amet, consectetur adipiscing elit. Vivamus vel lectus ut turpis fermentum vestibulum. ",
    "favorited" : false,
    "hyperlink" : "http://startmeditating.org/",
    "id" : "429",
    "index" : 137,
    "lastlocation" : -1,
    "newtag" : "",
    "parentId" : "1",
    "taglist" : [ "first-tag" ],
    "text" : "unnamed"
  },
  "431" : {
    "dateAddedLocal" : "1/17/2016, 1:15:43 PM",
    "dateAddedUTC" : "2016-01-17T18:15:43.787Z",
    "description" : "Lorem ipsum dolor sit amet, consectetur adipiscing elit. Vivamus vel lectus ut turpis fermentum vestibulum. ",
    "favorited" : false,
    "hyperlink" : "https://wordpress.org/plugins/all-in-one-seo-pack/",
    "id" : "430",
    "index" : 2,
    "lastlocation" : -1,
    "newtag" : "",
    "parentId" : "623",
    "taglist" : [ "first-tag" ],
    "text" : "WordPress â€º All in One SEO Pack Â« WordPress Plugins"
  },
  "432" : {
    "dateAddedLocal" : "10/15/2017, 3:34:25 PM",
    "dateAddedUTC" : "2017-10-15T19:34:25.211Z",
    "description" : "Lorem ipsum dolor sit amet, consectetur adipiscing elit. Vivamus vel lectus ut turpis fermentum vestibulum. ",
    "favorited" : false,
    "hyperlink" : "https://www.cloudflare.com/a/dns/dylanboudro.com",
    "id" : "431",
    "index" : 119,
    "lastlocation" : -1,
    "newtag" : "",
    "parentId" : "1",
    "taglist" : [ "first-tag" ],
    "text" : "Cloud"
  },
  "433" : {
    "dateAddedLocal" : "8/3/2018, 7:47:13 PM",
    "dateAddedUTC" : "2018-08-03T23:47:13.734Z",
    "description" : "Lorem ipsum dolor sit amet, consectetur adipiscing elit. Vivamus vel lectus ut turpis fermentum vestibulum. ",
    "favorited" : false,
    "hyperlink" : "https://www.myfonts.com/search/apercu/",
    "id" : "432",
    "index" : 241,
    "lastlocation" : -1,
    "newtag" : "",
    "parentId" : "1",
    "taglist" : [ "first-tag" ],
    "text" : "apercu Â« MyFonts"
  },
  "434" : {
    "dateAddedLocal" : "1/14/2016, 2:28:40 AM",
    "dateAddedUTC" : "2016-01-14T07:28:40.537Z",
    "description" : "Lorem ipsum dolor sit amet, consectetur adipiscing elit. Vivamus vel lectus ut turpis fermentum vestibulum. ",
    "favorited" : false,
    "hyperlink" : "https://marketing.grader.com/?__hstc=20629287.de07b30d69c8c3cf868288fce243b024.1452756240941.1452756240941.1452756240941.1&__hssc=20629287.7.1452756240941&__hsfp=3539398678",
    "id" : "433",
    "index" : 8,
    "lastlocation" : -1,
    "newtag" : "",
    "parentId" : "65",
    "taglist" : [ "first-tag" ],
    "text" : "Hubspot Marketing Grader"
  },
  "435" : {
    "dateAddedLocal" : "9/24/2015, 4:50:40 PM",
    "dateAddedUTC" : "2015-09-24T20:50:40.774Z",
    "description" : "Lorem ipsum dolor sit amet, consectetur adipiscing elit. Vivamus vel lectus ut turpis fermentum vestibulum. ",
    "favorited" : false,
    "hyperlink" : "http://search.proquest.com.ezproxy.neu.edu/docview/1270283793/fulltextPDF/E7C935640AD249EBPQ/1?accountid=12826",
    "id" : "434",
    "index" : 9,
    "lastlocation" : -1,
    "newtag" : "",
    "parentId" : "51",
    "taglist" : [ "first-tag" ],
    "text" : "Responsive Web Design - ProQuest"
  },
  "436" : {
    "dateAddedLocal" : "8/21/2014, 9:59:07 PM",
    "dateAddedUTC" : "2014-08-22T01:59:07.313Z",
    "description" : "Lorem ipsum dolor sit amet, consectetur adipiscing elit. Vivamus vel lectus ut turpis fermentum vestibulum. ",
    "favorited" : false,
    "hyperlink" : "http://osvaldas.info/audio-player-responsive-and-touch-friendly",
    "id" : "435",
    "index" : 1,
    "lastlocation" : -1,
    "newtag" : "",
    "parentId" : "11",
    "taglist" : [ "first-tag" ],
    "text" : "intelligent cs blog"
  },
  "437" : {
    "dateAddedLocal" : "4/14/2019, 10:48:08 PM",
    "dateAddedUTC" : "2019-04-15T02:48:08.052Z",
    "description" : "Lorem ipsum dolor sit amet, consectetur adipiscing elit. Vivamus vel lectus ut turpis fermentum vestibulum. ",
    "favorited" : false,
    "hyperlink" : "https://www.reddit.com/r/Fitness/",
    "id" : "436",
    "index" : 29,
    "lastlocation" : -1,
    "newtag" : "",
    "parentId" : "1",
    "taglist" : [ "first-tag" ],
    "text" : "Fitness"
  },
  "438" : {
    "dateAddedLocal" : "1/19/2014, 1:47:01 PM",
    "dateAddedUTC" : "2014-01-19T18:47:01.185Z",
    "description" : "Lorem ipsum dolor sit amet, consectetur adipiscing elit. Vivamus vel lectus ut turpis fermentum vestibulum. ",
    "favorited" : false,
    "hyperlink" : "http://www.youtube.com/watch?v=RaF9spgA0xs&list=RDUsU0zSXmuzQ",
    "id" : "437",
    "index" : 7,
    "lastlocation" : -1,
    "newtag" : "",
    "parentId" : "164",
    "taglist" : [ "first-tag" ],
    "text" : "â–¶ Zerbaman - Another Day (Acrux Remix) - YouTube"
  },
  "439" : {
    "dateAddedLocal" : "4/14/2019, 10:50:29 PM",
    "dateAddedUTC" : "2019-04-15T02:50:29.147Z",
    "description" : "Lorem ipsum dolor sit amet, consectetur adipiscing elit. Vivamus vel lectus ut turpis fermentum vestibulum. ",
    "favorited" : false,
    "hyperlink" : "https://github.com/dboudro",
    "id" : "438",
    "index" : 45,
    "lastlocation" : -1,
    "newtag" : "",
    "parentId" : "1",
    "taglist" : [ "first-tag" ],
    "text" : "                      "
  },
  "440" : {
    "dateAddedLocal" : "11/3/2013, 1:28:31 PM",
    "dateAddedUTC" : "2013-11-03T18:28:31.183Z",
    "description" : "Lorem ipsum dolor sit amet, consectetur adipiscing elit. Vivamus vel lectus ut turpis fermentum vestibulum. ",
    "favorited" : false,
    "id" : "439",
    "index" : 1,
    "lastlocation" : -1,
    "newtag" : "",
    "parentId" : "49",
    "taglist" : [ "first-tag" ],
    "text" : "liquid dnb"
  },
  "441" : {
    "dateAddedLocal" : "2/8/2015, 11:17:16 PM",
    "dateAddedUTC" : "2015-02-09T04:17:16.394Z",
    "description" : "Lorem ipsum dolor sit amet, consectetur adipiscing elit. Vivamus vel lectus ut turpis fermentum vestibulum. ",
    "favorited" : false,
    "hyperlink" : "https://www.youtube.com/watch?v=36dPCRvN9Qo",
    "id" : "440",
    "index" : 6,
    "lastlocation" : -1,
    "newtag" : "",
    "parentId" : "164",
    "taglist" : [ "first-tag" ],
    "text" : "Peshay - On the Nile - YouTube"
  },
  "442" : {
    "dateAddedLocal" : "9/7/2015, 3:31:39 PM",
    "dateAddedUTC" : "2015-09-07T19:31:39.867Z",
    "description" : "Lorem ipsum dolor sit amet, consectetur adipiscing elit. Vivamus vel lectus ut turpis fermentum vestibulum. ",
    "favorited" : false,
    "hyperlink" : "http://violaineetjeremy.fr/",
    "id" : "441",
    "index" : 0,
    "lastlocation" : -1,
    "newtag" : "",
    "parentId" : "45",
    "taglist" : [ "first-tag" ],
    "text" : "Violaine & JÃ©rÃ©my"
  },
  "443" : {
    "dateAddedLocal" : "9/22/2014, 9:25:33 PM",
    "dateAddedUTC" : "2014-09-23T01:25:33.077Z",
    "description" : "Lorem ipsum dolor sit amet, consectetur adipiscing elit. Vivamus vel lectus ut turpis fermentum vestibulum. ",
    "favorited" : false,
    "id" : "442",
    "index" : 30,
    "lastlocation" : -1,
    "newtag" : "",
    "parentId" : "2",
    "taglist" : [ "first-tag" ],
    "text" : "V"
  },
  "444" : {
    "dateAddedLocal" : "7/20/2014, 12:18:49 AM",
    "dateAddedUTC" : "2014-07-20T04:18:49.957Z",
    "description" : "Lorem ipsum dolor sit amet, consectetur adipiscing elit. Vivamus vel lectus ut turpis fermentum vestibulum. ",
    "favorited" : false,
    "id" : "443",
    "index" : 2,
    "lastlocation" : -1,
    "newtag" : "",
    "parentId" : "756",
    "taglist" : [ "first-tag" ],
    "text" : "FeE"
  },
  "445" : {
    "dateAddedLocal" : "1/28/2016, 7:27:23 PM",
    "dateAddedUTC" : "2016-01-29T00:27:23.653Z",
    "description" : "Lorem ipsum dolor sit amet, consectetur adipiscing elit. Vivamus vel lectus ut turpis fermentum vestibulum. ",
    "favorited" : false,
    "hyperlink" : "http://webcomponents.org/",
    "id" : "444",
    "index" : 56,
    "lastlocation" : -1,
    "newtag" : "",
    "parentId" : "2",
    "taglist" : [ "first-tag" ],
    "text" : "WebComponents.org"
  },
  "446" : {
    "dateAddedLocal" : "9/24/2015, 3:43:47 PM",
    "dateAddedUTC" : "2015-09-24T19:43:47.709Z",
    "description" : "Lorem ipsum dolor sit amet, consectetur adipiscing elit. Vivamus vel lectus ut turpis fermentum vestibulum. ",
    "favorited" : false,
    "hyperlink" : "http://abookapart.com/products/responsive-web-design",
    "id" : "445",
    "index" : 1,
    "lastlocation" : -1,
    "newtag" : "",
    "parentId" : "48",
    "taglist" : [ "first-tag" ],
    "text" : "A Book Apart, Responsive Web Design"
  },
  "447" : {
    "dateAddedLocal" : "5/5/2019, 4:08:49 PM",
    "dateAddedUTC" : "2019-05-05T20:08:49.874Z",
    "description" : "Lorem ipsum dolor sit amet, consectetur adipiscing elit. Vivamus vel lectus ut turpis fermentum vestibulum. ",
    "favorited" : false,
    "hyperlink" : "https://nucareers.northeastern.edu/myAccount/dashboard.htm",
    "id" : "446",
    "index" : 20,
    "lastlocation" : -1,
    "newtag" : "",
    "parentId" : "1",
    "taglist" : [ "first-tag" ],
    "text" : "NUCareers"
  },
  "448" : {
    "dateAddedLocal" : "7/11/2018, 7:45:59 PM",
    "dateAddedUTC" : "2018-07-11T23:45:59.691Z",
    "description" : "Lorem ipsum dolor sit amet, consectetur adipiscing elit. Vivamus vel lectus ut turpis fermentum vestibulum. ",
    "favorited" : false,
    "hyperlink" : "https://multicoin.capital/2018/07/10/the-web3-stack/",
    "id" : "447",
    "index" : 74,
    "lastlocation" : -1,
    "newtag" : "",
    "parentId" : "2",
    "taglist" : [ "first-tag" ],
    "text" : "Web3 Stack"
  },
  "449" : {
    "dateAddedLocal" : "4/5/2015, 8:04:31 PM",
    "dateAddedUTC" : "2015-04-06T00:04:31.627Z",
    "description" : "Lorem ipsum dolor sit amet, consectetur adipiscing elit. Vivamus vel lectus ut turpis fermentum vestibulum. ",
    "favorited" : false,
    "hyperlink" : "http://www.typewolf.com/",
    "id" : "448",
    "index" : 4,
    "lastlocation" : -1,
    "newtag" : "",
    "parentId" : "38",
    "taglist" : [ "first-tag" ],
    "text" : "Typewolf â†’ Typography Inspiration for the Modern Web"
  },
  "450" : {
    "dateAddedLocal" : "7/4/2014, 10:52:37 PM",
    "dateAddedUTC" : "2014-07-05T02:52:37.570Z",
    "description" : "Lorem ipsum dolor sit amet, consectetur adipiscing elit. Vivamus vel lectus ut turpis fermentum vestibulum. ",
    "favorited" : false,
    "hyperlink" : "https://www.youtube.com/watch?v=ATqEpJ6x1C4&list=PLDfKAXSi6kUZczwycO8UcABjn-w3WJ_71",
    "id" : "449",
    "index" : 9,
    "lastlocation" : -1,
    "newtag" : "",
    "parentId" : "49",
    "taglist" : [ "first-tag" ],
    "text" : "KOAN Sound - Lost In Thought | ambient"
  },
  "451" : {
    "dateAddedLocal" : "4/27/2018, 4:36:47 PM",
    "dateAddedUTC" : "2018-04-27T20:36:47.077Z",
    "description" : "Lorem ipsum dolor sit amet, consectetur adipiscing elit. Vivamus vel lectus ut turpis fermentum vestibulum. ",
    "favorited" : false,
    "hyperlink" : "https://ssr23.supercp.com:2083/cpsess3969262034/frontend/paper_lantern/index.html?login=1&post_login=91009303684980",
    "id" : "450",
    "index" : 61,
    "lastlocation" : -1,
    "newtag" : "",
    "parentId" : "1",
    "taglist" : [ "first-tag" ],
    "text" : "cPanel - Main"
  },
  "452" : {
    "dateAddedLocal" : "5/17/2018, 10:08:09 PM",
    "dateAddedUTC" : "2018-05-18T02:08:09.126Z",
    "description" : "Lorem ipsum dolor sit amet, consectetur adipiscing elit. Vivamus vel lectus ut turpis fermentum vestibulum. ",
    "favorited" : false,
    "hyperlink" : "file:///Users/boods/Desktop/nuevo-prod/index.html",
    "id" : "451",
    "index" : 49,
    "lastlocation" : -1,
    "newtag" : "",
    "parentId" : "1",
    "taglist" : [ "first-tag" ],
    "text" : "                                                                                                                                                     (3)"
  },
  "453" : {
    "dateAddedLocal" : "1/6/2019, 12:47:08 PM",
    "dateAddedUTC" : "2019-01-06T17:47:08.606Z",
    "description" : "Lorem ipsum dolor sit amet, consectetur adipiscing elit. Vivamus vel lectus ut turpis fermentum vestibulum. ",
    "favorited" : false,
    "hyperlink" : "https://www.spacesworks.com/boston/newbury-street/",
    "id" : "452",
    "index" : 261,
    "lastlocation" : -1,
    "newtag" : "",
    "parentId" : "1",
    "taglist" : [ "first-tag" ],
    "text" : "unnamed"
  },
  "454" : {
    "dateAddedLocal" : "11/19/2013, 9:07:30 PM",
    "dateAddedUTC" : "2013-11-20T02:07:30.227Z",
    "description" : "Lorem ipsum dolor sit amet, consectetur adipiscing elit. Vivamus vel lectus ut turpis fermentum vestibulum. ",
    "favorited" : false,
    "hyperlink" : "http://www.youtube.com/watch?v=T7APxBRUMeY",
    "id" : "453",
    "index" : 2,
    "lastlocation" : -1,
    "newtag" : "",
    "parentId" : "49",
    "taglist" : [ "first-tag" ],
    "text" : "â–¶ Reflection Eternal- Just begun - YouTube"
  },
  "455" : {
    "dateAddedLocal" : "10/5/2014, 7:10:04 PM",
    "dateAddedUTC" : "2014-10-05T23:10:04.112Z",
    "description" : "Lorem ipsum dolor sit amet, consectetur adipiscing elit. Vivamus vel lectus ut turpis fermentum vestibulum. ",
    "favorited" : false,
    "hyperlink" : "http://selection.datavisualization.ch/",
    "id" : "454",
    "index" : 0,
    "lastlocation" : -1,
    "newtag" : "",
    "parentId" : "23",
    "taglist" : [ "first-tag" ],
    "text" : "Datavisualization.ch Selected Tools"
  },
  "456" : {
    "dateAddedLocal" : "10/24/2016, 10:53:14 PM",
    "dateAddedUTC" : "2016-10-25T02:53:14.783Z",
    "description" : "Lorem ipsum dolor sit amet, consectetur adipiscing elit. Vivamus vel lectus ut turpis fermentum vestibulum. ",
    "favorited" : false,
    "hyperlink" : "http://www.andtalmor.com/work",
    "id" : "455",
    "index" : 204,
    "lastlocation" : -1,
    "newtag" : "",
    "parentId" : "1",
    "taglist" : [ "first-tag" ],
    "text" : "Work â€” Talmor & Talmor & Talmor"
  },
  "457" : {
    "dateAddedLocal" : "3/12/2015, 3:21:24 PM",
    "dateAddedUTC" : "2015-03-12T19:21:24.720Z",
    "description" : "Lorem ipsum dolor sit amet, consectetur adipiscing elit. Vivamus vel lectus ut turpis fermentum vestibulum. ",
    "favorited" : false,
    "hyperlink" : "http://d3plus.org/",
    "id" : "456",
    "index" : 12,
    "lastlocation" : -1,
    "newtag" : "",
    "parentId" : "16",
    "taglist" : [ "first-tag" ],
    "text" : "D3plus"
  },
  "458" : {
    "dateAddedLocal" : "10/28/2014, 3:22:34 PM",
    "dateAddedUTC" : "2014-10-28T19:22:34.234Z",
    "description" : "Lorem ipsum dolor sit amet, consectetur adipiscing elit. Vivamus vel lectus ut turpis fermentum vestibulum. ",
    "favorited" : false,
    "hyperlink" : "http://www.jam3.com/",
    "id" : "457",
    "index" : 10,
    "lastlocation" : -1,
    "newtag" : "",
    "parentId" : "35",
    "taglist" : [ "first-tag" ],
    "text" : "Jam3 | Toronto Digital Design and Development Agency"
  },
  "459" : {
    "dateAddedLocal" : "3/24/2018, 8:06:49 PM",
    "dateAddedUTC" : "2018-03-25T00:06:49.577Z",
    "description" : "Lorem ipsum dolor sit amet, consectetur adipiscing elit. Vivamus vel lectus ut turpis fermentum vestibulum. ",
    "favorited" : false,
    "hyperlink" : "https://docs.google.com/spreadsheets/d/1APiAPkyMtyb24VnNx_sEe6kAvAnUb175lDSE1Pmwdpw/edit#gid=1429650160",
    "id" : "458",
    "index" : 75,
    "lastlocation" : -1,
    "newtag" : "",
    "parentId" : "1",
    "taglist" : [ "first-tag" ],
    "text" : "Monthly Budget"
  },
  "460" : {
    "dateAddedLocal" : "3/3/2015, 5:34:03 PM",
    "dateAddedUTC" : "2015-03-03T22:34:03.557Z",
    "description" : "Lorem ipsum dolor sit amet, consectetur adipiscing elit. Vivamus vel lectus ut turpis fermentum vestibulum. ",
    "favorited" : false,
    "hyperlink" : "http://quirksmode.org/js/contents.html",
    "id" : "459",
    "index" : 2,
    "lastlocation" : -1,
    "newtag" : "",
    "parentId" : "7",
    "taglist" : [ "first-tag" ],
    "text" : "JavaScript - Table of Contents"
  },
  "461" : {
    "dateAddedLocal" : "7/27/2014, 3:00:39 AM",
    "dateAddedUTC" : "2014-07-27T07:00:39.914Z",
    "description" : "Lorem ipsum dolor sit amet, consectetur adipiscing elit. Vivamus vel lectus ut turpis fermentum vestibulum. ",
    "favorited" : false,
    "id" : "460",
    "index" : 6,
    "lastlocation" : -1,
    "newtag" : "",
    "parentId" : "2",
    "taglist" : [ "first-tag" ],
    "text" : "Javascript Frameworks"
  },
  "462" : {
    "dateAddedLocal" : "8/10/2015, 1:34:34 AM",
    "dateAddedUTC" : "2015-08-10T05:34:34.882Z",
    "description" : "Lorem ipsum dolor sit amet, consectetur adipiscing elit. Vivamus vel lectus ut turpis fermentum vestibulum. ",
    "favorited" : false,
    "hyperlink" : "https://vimeo.com/39145634",
    "id" : "461",
    "index" : 0,
    "lastlocation" : -1,
    "newtag" : "",
    "parentId" : "40",
    "taglist" : [ "first-tag" ],
    "text" : "Nature - Time 4 timelapse on Vimeo"
  },
  "463" : {
    "dateAddedLocal" : "8/20/2014, 2:05:15 PM",
    "dateAddedUTC" : "2014-08-20T18:05:15.524Z",
    "description" : "Lorem ipsum dolor sit amet, consectetur adipiscing elit. Vivamus vel lectus ut turpis fermentum vestibulum. ",
    "favorited" : false,
    "id" : "462",
    "index" : 10,
    "lastlocation" : -1,
    "newtag" : "",
    "parentId" : "2",
    "taglist" : [ "first-tag" ],
    "text" : "Books"
  },
  "464" : {
    "dateAddedLocal" : "6/11/2014, 12:25:07 PM",
    "dateAddedUTC" : "2014-06-11T16:25:07.479Z",
    "description" : "Lorem ipsum dolor sit amet, consectetur adipiscing elit. Vivamus vel lectus ut turpis fermentum vestibulum. ",
    "favorited" : false,
    "hyperlink" : "https://developer.mozilla.org/en-US/docs/Web/JavaScript/Reference",
    "id" : "463",
    "index" : 1,
    "lastlocation" : -1,
    "newtag" : "",
    "parentId" : "7",
    "taglist" : [ "first-tag" ],
    "text" : "JavaScript reference - JavaScript | MDN"
  },
  "465" : {
    "dateAddedLocal" : "7/25/2014, 11:29:21 AM",
    "dateAddedUTC" : "2014-07-25T15:29:21.289Z",
    "description" : "Lorem ipsum dolor sit amet, consectetur adipiscing elit. Vivamus vel lectus ut turpis fermentum vestibulum. ",
    "favorited" : false,
    "hyperlink" : "https://www.youtube.com/watch?v=sSOtIHUJbjk",
    "id" : "464",
    "index" : 0,
    "lastlocation" : -1,
    "newtag" : "",
    "parentId" : "163",
    "taglist" : [ "first-tag" ],
    "text" : "Cassie - Me & U (Video) - YouTube"
  },
  "466" : {
    "dateAddedLocal" : "9/15/2013, 6:17:02 PM",
    "dateAddedUTC" : "2013-09-15T22:17:02.058Z",
    "description" : "Lorem ipsum dolor sit amet, consectetur adipiscing elit. Vivamus vel lectus ut turpis fermentum vestibulum. ",
    "favorited" : false,
    "hyperlink" : "http://www.youtube.com/watch?v=bfFnoyjioTk",
    "id" : "465",
    "index" : 1,
    "lastlocation" : -1,
    "newtag" : "",
    "parentId" : "164",
    "taglist" : [ "first-tag" ],
    "text" : "â–¶ Feint - Lonesong - YouTube"
  },
  "467" : {
    "dateAddedLocal" : "4/21/2017, 7:57:21 PM",
    "dateAddedUTC" : "2017-04-21T23:57:21.578Z",
    "description" : "Lorem ipsum dolor sit amet, consectetur adipiscing elit. Vivamus vel lectus ut turpis fermentum vestibulum. ",
    "favorited" : false,
    "hyperlink" : "https://slofile.com/",
    "id" : "466",
    "index" : 221,
    "lastlocation" : -1,
    "newtag" : "",
    "parentId" : "1",
    "taglist" : [ "first-tag" ],
    "text" : "Slofile - Discover Slack communities"
  },
  "468" : {
    "dateAddedLocal" : "3/21/2018, 6:46:18 PM",
    "dateAddedUTC" : "2018-03-21T22:46:18.220Z",
    "description" : "Lorem ipsum dolor sit amet, consectetur adipiscing elit. Vivamus vel lectus ut turpis fermentum vestibulum. ",
    "favorited" : false,
    "hyperlink" : "https://www.youtube.com/user/Kemetprince1",
    "id" : "467",
    "index" : 69,
    "lastlocation" : -1,
    "newtag" : "",
    "parentId" : "1",
    "taglist" : [ "first-tag" ],
    "text" : "infinite waters "
  },
  "469" : {
    "dateAddedLocal" : "12/6/2018, 8:10:06 PM",
    "dateAddedUTC" : "2018-12-07T01:10:06.241Z",
    "description" : "Lorem ipsum dolor sit amet, consectetur adipiscing elit. Vivamus vel lectus ut turpis fermentum vestibulum. ",
    "favorited" : false,
    "hyperlink" : "https://docs.google.com/document/d/1yA2Q52Ik-VspDBTHrTeLvTh8dgu0S9lXxTUo1Ix5rq8/edit?ts=5c073d21",
    "id" : "468",
    "index" : 290,
    "lastlocation" : -1,
    "newtag" : "",
    "parentId" : "1",
    "taglist" : [ "first-tag" ],
    "text" : "Wireframes "
  },
  "470" : {
    "dateAddedLocal" : "7/4/2014, 12:49:09 PM",
    "dateAddedUTC" : "2014-07-04T16:49:09.786Z",
    "description" : "Lorem ipsum dolor sit amet, consectetur adipiscing elit. Vivamus vel lectus ut turpis fermentum vestibulum. ",
    "favorited" : false,
    "hyperlink" : "http://bower.io/",
    "id" : "469",
    "index" : 17,
    "lastlocation" : -1,
    "newtag" : "",
    "parentId" : "39",
    "taglist" : [ "first-tag" ],
    "text" : "Bower (web package manager)"
  },
  "471" : {
    "dateAddedLocal" : "8/15/2018, 9:17:13 AM",
    "dateAddedUTC" : "2018-08-15T13:17:13.065Z",
    "description" : "Lorem ipsum dolor sit amet, consectetur adipiscing elit. Vivamus vel lectus ut turpis fermentum vestibulum. ",
    "favorited" : false,
    "hyperlink" : "https://formidable.com/open-source/victory/gallery/",
    "id" : "470",
    "index" : 75,
    "lastlocation" : -1,
    "newtag" : "",
    "parentId" : "2",
    "taglist" : [ "first-tag" ],
    "text" : "Victory |"
  },
  "472" : {
    "dateAddedLocal" : "4/29/2017, 9:44:31 AM",
    "dateAddedUTC" : "2017-04-29T13:44:31.965Z",
    "description" : "Lorem ipsum dolor sit amet, consectetur adipiscing elit. Vivamus vel lectus ut turpis fermentum vestibulum. ",
    "favorited" : false,
    "hyperlink" : "https://www.producthunt.com/ask/1438-what-is-your-favorite-app-plugin-to-save-and-organize-sites-links-in-your-web-browser",
    "id" : "471",
    "index" : 223,
    "lastlocation" : -1,
    "newtag" : "",
    "parentId" : "1",
    "taglist" : [ "first-tag" ],
    "text" : "Ask Product Hunt"
  },
  "473" : {
    "dateAddedLocal" : "7/27/2014, 1:26:04 AM",
    "dateAddedUTC" : "2014-07-27T05:26:04.614Z",
    "description" : "Lorem ipsum dolor sit amet, consectetur adipiscing elit. Vivamus vel lectus ut turpis fermentum vestibulum. ",
    "favorited" : false,
    "hyperlink" : "http://littleaxerecords.bandcamp.com/album/gita-pon-yeik",
    "id" : "472",
    "index" : 30,
    "lastlocation" : -1,
    "newtag" : "",
    "parentId" : "49",
    "taglist" : [ "first-tag" ],
    "text" : "Asian Harp Player"
  },
  "474" : {
    "dateAddedLocal" : "8/19/2018, 1:10:50 AM",
    "dateAddedUTC" : "2018-08-19T05:10:50.087Z",
    "description" : "Lorem ipsum dolor sit amet, consectetur adipiscing elit. Vivamus vel lectus ut turpis fermentum vestibulum. ",
    "favorited" : false,
    "hyperlink" : "https://framer.com/",
    "id" : "473",
    "index" : 79,
    "lastlocation" : -1,
    "newtag" : "",
    "parentId" : "2",
    "taglist" : [ "first-tag" ],
    "text" : "Framer"
  },
  "475" : {
    "dateAddedLocal" : "1/10/2018, 1:37:06 AM",
    "dateAddedUTC" : "2018-01-10T06:37:06.821Z",
    "description" : "Lorem ipsum dolor sit amet, consectetur adipiscing elit. Vivamus vel lectus ut turpis fermentum vestibulum. ",
    "favorited" : false,
    "hyperlink" : "https://www.youtube.com/watch?v=AV2OkzIGykA&list=PLLnpHn493BHE6UIsdKYlS5zu-ZYvx22CS",
    "id" : "474",
    "index" : 81,
    "lastlocation" : -1,
    "newtag" : "",
    "parentId" : "1",
    "taglist" : [ "first-tag" ],
    "text" : "unnamed"
  },
  "476" : {
    "dateAddedLocal" : "1/26/2015, 11:05:41 PM",
    "dateAddedUTC" : "2015-01-27T04:05:41.587Z",
    "description" : "Lorem ipsum dolor sit amet, consectetur adipiscing elit. Vivamus vel lectus ut turpis fermentum vestibulum. ",
    "favorited" : false,
    "hyperlink" : "http://www.hotnewhiphop.com/lupe-fiasco-mural-new-song.1961737.html",
    "id" : "475",
    "index" : 38,
    "lastlocation" : -1,
    "newtag" : "",
    "parentId" : "49",
    "taglist" : [ "first-tag" ],
    "text" : "Lupe Fiasco - Mural | Stream & Listen [New Song]"
  },
  "477" : {
    "dateAddedLocal" : "10/25/2017, 10:17:07 PM",
    "dateAddedUTC" : "2017-10-26T02:17:07.180Z",
    "description" : "Lorem ipsum dolor sit amet, consectetur adipiscing elit. Vivamus vel lectus ut turpis fermentum vestibulum. ",
    "favorited" : false,
    "hyperlink" : "http://www.sproutedkitchen.com/",
    "id" : "476",
    "index" : 5,
    "lastlocation" : -1,
    "newtag" : "",
    "parentId" : "580",
    "taglist" : [ "first-tag" ],
    "text" : "Sprouted Kitchen"
  },
  "478" : {
    "dateAddedLocal" : "9/24/2015, 4:05:54 PM",
    "dateAddedUTC" : "2015-09-24T20:05:54.735Z",
    "description" : "Lorem ipsum dolor sit amet, consectetur adipiscing elit. Vivamus vel lectus ut turpis fermentum vestibulum. ",
    "favorited" : false,
    "hyperlink" : "http://www.smashingmagazine.com/2011/01/guidelines-for-responsive-web-design/",
    "id" : "477",
    "index" : 6,
    "lastlocation" : -1,
    "newtag" : "",
    "parentId" : "51",
    "taglist" : [ "first-tag" ],
    "text" : "Responsive Web Design: What It Is and How To Use It â€“ Smashing Magazine"
  },
  "479" : {
    "dateAddedLocal" : "4/21/2019, 8:13:51 PM",
    "dateAddedUTC" : "2019-04-22T00:13:51.004Z",
    "description" : "Lorem ipsum dolor sit amet, consectetur adipiscing elit. Vivamus vel lectus ut turpis fermentum vestibulum. ",
    "favorited" : false,
    "hyperlink" : "https://www.spotifyjobs.com/search-jobs/#category=design-ux&location=usa",
    "id" : "478",
    "index" : 21,
    "lastlocation" : -1,
    "newtag" : "",
    "parentId" : "1",
    "taglist" : [ "first-tag" ],
    "text" : "Spotify"
  },
  "480" : {
    "dateAddedLocal" : "11/29/2016, 10:56:59 PM",
    "dateAddedUTC" : "2016-11-30T03:56:59.166Z",
    "description" : "Lorem ipsum dolor sit amet, consectetur adipiscing elit. Vivamus vel lectus ut turpis fermentum vestibulum. ",
    "favorited" : false,
    "hyperlink" : "https://github.com/d3/d3-collection#nests",
    "id" : "479",
    "index" : 12,
    "lastlocation" : -1,
    "newtag" : "",
    "parentId" : "666",
    "taglist" : [ "first-tag" ],
    "text" : "d3/d3-collection: Handy data structures for elements keyed by string."
  },
  "481" : {
    "dateAddedLocal" : "7/18/2014, 1:19:23 AM",
    "dateAddedUTC" : "2014-07-18T05:19:23.480Z",
    "description" : "Lorem ipsum dolor sit amet, consectetur adipiscing elit. Vivamus vel lectus ut turpis fermentum vestibulum. ",
    "favorited" : false,
    "hyperlink" : "http://fittextjs.com/",
    "id" : "480",
    "index" : 3,
    "lastlocation" : -1,
    "newtag" : "",
    "parentId" : "39",
    "taglist" : [ "first-tag" ],
    "text" : "FitText - A plugin for inflating web type"
  },
  "482" : {
    "dateAddedLocal" : "3/24/2015, 6:25:38 PM",
    "dateAddedUTC" : "2015-03-24T22:25:38.999Z",
    "description" : "Lorem ipsum dolor sit amet, consectetur adipiscing elit. Vivamus vel lectus ut turpis fermentum vestibulum. ",
    "favorited" : false,
    "hyperlink" : "https://css-tricks.com/gooey-effect/",
    "id" : "481",
    "index" : 12,
    "lastlocation" : -1,
    "newtag" : "",
    "parentId" : "36",
    "taglist" : [ "first-tag" ],
    "text" : "The Gooey Effect | CSS-Tricks"
  },
  "483" : {
    "dateAddedLocal" : "4/14/2019, 10:52:58 PM",
    "dateAddedUTC" : "2019-04-15T02:52:58.946Z",
    "description" : "Lorem ipsum dolor sit amet, consectetur adipiscing elit. Vivamus vel lectus ut turpis fermentum vestibulum. ",
    "favorited" : false,
    "hyperlink" : "https://solstice.us/",
    "id" : "482",
    "index" : 41,
    "lastlocation" : -1,
    "newtag" : "",
    "parentId" : "1",
    "taglist" : [ "first-tag" ],
    "text" : "Solsticeâ„¢Â Â "
  },
  "484" : {
    "dateAddedLocal" : "8/1/2014, 12:11:54 PM",
    "dateAddedUTC" : "2014-08-01T16:11:54.555Z",
    "description" : "Lorem ipsum dolor sit amet, consectetur adipiscing elit. Vivamus vel lectus ut turpis fermentum vestibulum. ",
    "favorited" : false,
    "hyperlink" : "https://www.etsy.com/listing/189070790/lava-buddha-bracelet-lava-jasper?ref=shop_home_active_10",
    "id" : "483",
    "index" : 1,
    "lastlocation" : -1,
    "newtag" : "",
    "parentId" : "15",
    "taglist" : [ "first-tag" ],
    "text" : "Lava Buddha bracelet Lava Jasper bracelet Impression by SoCutiful"
  },
  "485" : {
    "dateAddedLocal" : "3/6/2015, 12:07:04 PM",
    "dateAddedUTC" : "2015-03-06T17:07:04.434Z",
    "description" : "Lorem ipsum dolor sit amet, consectetur adipiscing elit. Vivamus vel lectus ut turpis fermentum vestibulum. ",
    "favorited" : false,
    "hyperlink" : "http://www.mabu.dk/",
    "id" : "484",
    "index" : 1,
    "lastlocation" : -1,
    "newtag" : "",
    "parentId" : "35",
    "taglist" : [ "first-tag" ],
    "text" : "love the grid of projects"
  },
  "486" : {
    "dateAddedLocal" : "12/2/2018, 4:33:43 PM",
    "dateAddedUTC" : "2018-12-02T21:33:43.552Z",
    "description" : "Lorem ipsum dolor sit amet, consectetur adipiscing elit. Vivamus vel lectus ut turpis fermentum vestibulum. ",
    "favorited" : false,
    "hyperlink" : "https://www.mrporter.com/en-us/mens/polo_ralph_lauren/pebble-grain-leather-briefcase/1056242",
    "id" : "485",
    "index" : 84,
    "lastlocation" : -1,
    "newtag" : "",
    "parentId" : "2",
    "taglist" : [ "first-tag" ],
    "text" : "Polo Ralph Lauren - Pebble-Grain Leather Briefcase"
  },
  "487" : {
    "dateAddedLocal" : "8/5/2016, 7:17:15 PM",
    "dateAddedUTC" : "2016-08-05T23:17:15.435Z",
    "description" : "Lorem ipsum dolor sit amet, consectetur adipiscing elit. Vivamus vel lectus ut turpis fermentum vestibulum. ",
    "favorited" : false,
    "hyperlink" : "http://underscorejs.org/",
    "id" : "486",
    "index" : 178,
    "lastlocation" : -1,
    "newtag" : "",
    "parentId" : "1",
    "taglist" : [ "first-tag" ],
    "text" : "Underscore.js helper functions"
  },
  "488" : {
    "dateAddedLocal" : "3/19/2019, 9:35:44 PM",
    "dateAddedUTC" : "2019-03-20T01:35:44.013Z",
    "description" : "Lorem ipsum dolor sit amet, consectetur adipiscing elit. Vivamus vel lectus ut turpis fermentum vestibulum. ",
    "favorited" : false,
    "hyperlink" : "https://en.wikipedia.org/wiki/Vajra",
    "id" : "487",
    "index" : 315,
    "lastlocation" : -1,
    "newtag" : "",
    "parentId" : "1",
    "taglist" : [ "first-tag" ],
    "text" : "Vajra - Wikipedia"
  },
  "489" : {
    "dateAddedLocal" : "7/23/2014, 1:59:51 PM",
    "dateAddedUTC" : "2014-07-23T17:59:51.593Z",
    "description" : "Lorem ipsum dolor sit amet, consectetur adipiscing elit. Vivamus vel lectus ut turpis fermentum vestibulum. ",
    "favorited" : false,
    "hyperlink" : "http://analogplayerssociety.bandcamp.com/album/analog-players-society-vol-2",
    "id" : "488",
    "index" : 29,
    "lastlocation" : -1,
    "newtag" : "",
    "parentId" : "49",
    "taglist" : [ "first-tag" ],
    "text" : "Analog Players Society - Vol. 2 | Analog Players Society"
  },
  "490" : {
    "dateAddedLocal" : "1/27/2017, 12:32:58 PM",
    "dateAddedUTC" : "2017-01-27T17:32:58.513Z",
    "description" : "Lorem ipsum dolor sit amet, consectetur adipiscing elit. Vivamus vel lectus ut turpis fermentum vestibulum. ",
    "favorited" : false,
    "hyperlink" : "https://remoteok.io/remote-design-jobs",
    "id" : "489",
    "index" : 215,
    "lastlocation" : -1,
    "newtag" : "",
    "parentId" : "1",
    "taglist" : [ "first-tag" ],
    "text" : "Remote Design Jobs"
  },
  "491" : {
    "dateAddedLocal" : "1/13/2016, 7:14:57 PM",
    "dateAddedUTC" : "2016-01-14T00:14:57.890Z",
    "description" : "Lorem ipsum dolor sit amet, consectetur adipiscing elit. Vivamus vel lectus ut turpis fermentum vestibulum. ",
    "favorited" : false,
    "id" : "490",
    "index" : 58,
    "lastlocation" : -1,
    "newtag" : "",
    "parentId" : "2",
    "taglist" : [ "first-tag" ],
    "text" : "SEO"
  },
  "492" : {
    "dateAddedLocal" : "1/11/2016, 7:53:28 PM",
    "dateAddedUTC" : "2016-01-12T00:53:28.320Z",
    "description" : "Lorem ipsum dolor sit amet, consectetur adipiscing elit. Vivamus vel lectus ut turpis fermentum vestibulum. ",
    "favorited" : false,
    "hyperlink" : "https://developers.google.com/speed/pagespeed/insights/",
    "id" : "491",
    "index" : 6,
    "lastlocation" : -1,
    "newtag" : "",
    "parentId" : "65",
    "taglist" : [ "first-tag" ],
    "text" : "website speed test - Google"
  },
  "493" : {
    "dateAddedLocal" : "9/24/2015, 3:56:52 PM",
    "dateAddedUTC" : "2015-09-24T19:56:52.071Z",
    "description" : "Lorem ipsum dolor sit amet, consectetur adipiscing elit. Vivamus vel lectus ut turpis fermentum vestibulum. ",
    "favorited" : false,
    "hyperlink" : "http://blog.froont.com/9-basic-principles-of-responsive-web-design/",
    "id" : "492",
    "index" : 3,
    "lastlocation" : -1,
    "newtag" : "",
    "parentId" : "51",
    "taglist" : [ "first-tag" ],
    "text" : "9 basic principles of responsive web design"
  },
  "494" : {
    "dateAddedLocal" : "10/9/2016, 12:03:59 AM",
    "dateAddedUTC" : "2016-10-09T04:03:59.450Z",
    "description" : "Lorem ipsum dolor sit amet, consectetur adipiscing elit. Vivamus vel lectus ut turpis fermentum vestibulum. ",
    "favorited" : false,
    "id" : "493",
    "index" : 202,
    "lastlocation" : -1,
    "newtag" : "",
    "parentId" : "1",
    "taglist" : [ "first-tag" ],
    "text" : "plants"
  },
  "495" : {
    "dateAddedLocal" : "8/18/2018, 9:50:54 AM",
    "dateAddedUTC" : "2018-08-18T13:50:54.951Z",
    "description" : "Lorem ipsum dolor sit amet, consectetur adipiscing elit. Vivamus vel lectus ut turpis fermentum vestibulum. ",
    "favorited" : false,
    "hyperlink" : "https://www.bizjournals.com/boston/subscriber-only/2018/06/14/largest-venture-capital-firms-in.html",
    "id" : "494",
    "index" : 243,
    "lastlocation" : -1,
    "newtag" : "",
    "parentId" : "1",
    "taglist" : [ "first-tag" ],
    "text" : "Largest Venture Capital Firms in Massachusetts - Boston Business Journal"
  },
  "496" : {
    "dateAddedLocal" : "12/12/2016, 10:44:05 PM",
    "dateAddedUTC" : "2016-12-13T03:44:05.904Z",
    "description" : "Lorem ipsum dolor sit amet, consectetur adipiscing elit. Vivamus vel lectus ut turpis fermentum vestibulum. ",
    "favorited" : false,
    "hyperlink" : "http://www.newyorksunshine.com/",
    "id" : "495",
    "index" : 208,
    "lastlocation" : -1,
    "newtag" : "",
    "parentId" : "1",
    "taglist" : [ "first-tag" ],
    "text" : "New York Sunshine"
  },
  "497" : {
    "dateAddedLocal" : "10/31/2013, 1:05:04 AM",
    "dateAddedUTC" : "2013-10-31T05:05:04.698Z",
    "description" : "Lorem ipsum dolor sit amet, consectetur adipiscing elit. Vivamus vel lectus ut turpis fermentum vestibulum. ",
    "favorited" : false,
    "hyperlink" : "http://www.youtube.com/watch?v=Ep1duR967BI",
    "id" : "496",
    "index" : 1,
    "lastlocation" : -1,
    "newtag" : "",
    "parentId" : "180",
    "taglist" : [ "first-tag" ],
    "text" : "â–¶ Sun Electric - Entrance (1993) - YouTube"
  },
  "498" : {
    "dateAddedLocal" : "4/15/2018, 7:00:01 PM",
    "dateAddedUTC" : "2018-04-15T23:00:01.517Z",
    "description" : "Lorem ipsum dolor sit amet, consectetur adipiscing elit. Vivamus vel lectus ut turpis fermentum vestibulum. ",
    "favorited" : false,
    "hyperlink" : "https://cryptojobslist.com/jobs/blockchain-engineer-at-indiestorm-los-angeles/apply",
    "id" : "497",
    "index" : 1,
    "lastlocation" : -1,
    "newtag" : "",
    "parentId" : "520",
    "taglist" : [ "first-tag" ],
    "text" : "Blockchain Engineer job at IndieStorm â€” Crypto Jobs List"
  },
  "499" : {
    "dateAddedLocal" : "4/14/2019, 10:51:15 PM",
    "dateAddedUTC" : "2019-04-15T02:51:15.963Z",
    "description" : "Lorem ipsum dolor sit amet, consectetur adipiscing elit. Vivamus vel lectus ut turpis fermentum vestibulum. ",
    "favorited" : false,
    "hyperlink" : "https://github.com/dboudro",
    "id" : "498",
    "index" : 323,
    "lastlocation" : -1,
    "newtag" : "",
    "parentId" : "1",
    "taglist" : [ "first-tag" ],
    "text" : "                       (1) (1) (1)"
  },
  "500" : {
    "dateAddedLocal" : "7/16/2014, 10:49:02 AM",
    "dateAddedUTC" : "2014-07-16T14:49:02.613Z",
    "description" : "Lorem ipsum dolor sit amet, consectetur adipiscing elit. Vivamus vel lectus ut turpis fermentum vestibulum. ",
    "favorited" : false,
    "hyperlink" : "http://www.jongaulin.com/2012/03/07/firefly-jquery-plugin/",
    "id" : "499",
    "index" : 2,
    "lastlocation" : -1,
    "newtag" : "",
    "parentId" : "39",
    "taglist" : [ "first-tag" ],
    "text" : "Firefly Jquery Plugin | Jon Gaulin"
  },
  "501" : {
    "dateAddedLocal" : "9/23/2015, 11:57:31 AM",
    "dateAddedUTC" : "2015-09-23T15:57:31.910Z",
    "description" : "Lorem ipsum dolor sit amet, consectetur adipiscing elit. Vivamus vel lectus ut turpis fermentum vestibulum. ",
    "favorited" : false,
    "hyperlink" : "http://printgallerybytoko.com/",
    "id" : "500",
    "index" : 5,
    "lastlocation" : -1,
    "newtag" : "",
    "parentId" : "50",
    "taglist" : [ "first-tag" ],
    "text" : "Print Gallery â€” Home"
  },
  "502" : {
    "dateAddedLocal" : "6/26/2014, 12:10:42 AM",
    "dateAddedUTC" : "2014-06-26T04:10:42.611Z",
    "description" : "Lorem ipsum dolor sit amet, consectetur adipiscing elit. Vivamus vel lectus ut turpis fermentum vestibulum. ",
    "favorited" : false,
    "hyperlink" : "http://bost.ocks.org/mike/transition/",
    "id" : "501",
    "index" : 2,
    "lastlocation" : -1,
    "newtag" : "",
    "parentId" : "16",
    "taglist" : [ "first-tag" ],
    "text" : "Working with Transitions"
  },
  "503" : {
    "dateAddedLocal" : "4/14/2019, 10:51:09 PM",
    "dateAddedUTC" : "2019-04-15T02:51:09.395Z",
    "description" : "Lorem ipsum dolor sit amet, consectetur adipiscing elit. Vivamus vel lectus ut turpis fermentum vestibulum. ",
    "favorited" : false,
    "hyperlink" : "https://github.com/dboudro",
    "id" : "502",
    "index" : 47,
    "lastlocation" : -1,
    "newtag" : "",
    "parentId" : "1",
    "taglist" : [ "first-tag" ],
    "text" : "                       4"
  },
  "504" : {
    "dateAddedLocal" : "5/5/2019, 1:06:12 PM",
    "dateAddedUTC" : "2019-05-05T17:06:12.305Z",
    "description" : "Lorem ipsum dolor sit amet, consectetur adipiscing elit. Vivamus vel lectus ut turpis fermentum vestibulum. ",
    "favorited" : false,
    "hyperlink" : "https://www.google.com/search?q=robert+half+recruiting+new+york&npsic=0&rflfq=1&rlha=0&rllag=40726755,-73980960,3756&tbm=lcl&ved=2ahUKEwj5iOjh74TiAhXCTd8KHe9MAvcQtgN6BAgKEAQ&tbs=lrf:!2m1!1e3!2m1!1e16!3sIAE,lf:1,lf_ui:4&rldoc=1#rlfi=hd:;si:;mv:!1m2!1d41.048833699999996!2d-73.2047255!2m2!1d40.518240399999996!2d-74.3611471;tbs:lrf:!2m1!1e3!2m1!1e16!3sIAE,lf:1,lf_ui:4",
    "id" : "503",
    "index" : 17,
    "lastlocation" : -1,
    "newtag" : "",
    "parentId" : "1",
    "taglist" : [ "first-tag" ],
    "text" : "Robert Half"
  },
  "505" : {
    "dateAddedLocal" : "11/21/2014, 3:29:56 PM",
    "dateAddedUTC" : "2014-11-21T20:29:56.236Z",
    "description" : "Lorem ipsum dolor sit amet, consectetur adipiscing elit. Vivamus vel lectus ut turpis fermentum vestibulum. ",
    "favorited" : false,
    "hyperlink" : "https://www.youtube.com/watch?v=dFb7Hxva5rg&feature=youtu.be",
    "id" : "504",
    "index" : 0,
    "lastlocation" : -1,
    "newtag" : "",
    "parentId" : "37",
    "taglist" : [ "first-tag" ],
    "text" : "EASTERN PHILOSOPHY - Lao Tzu - YouTube"
  },
  "506" : {
    "dateAddedLocal" : "7/21/2015, 8:10:20 AM",
    "dateAddedUTC" : "2015-07-21T12:10:20.636Z",
    "description" : "Lorem ipsum dolor sit amet, consectetur adipiscing elit. Vivamus vel lectus ut turpis fermentum vestibulum. ",
    "favorited" : false,
    "hyperlink" : "https://www.stonesthrow.com/",
    "id" : "505",
    "index" : 143,
    "lastlocation" : -1,
    "newtag" : "",
    "parentId" : "1",
    "taglist" : [ "first-tag" ],
    "text" : "unnamed"
  },
  "507" : {
    "dateAddedLocal" : "7/18/2015, 3:15:15 AM",
    "dateAddedUTC" : "2015-07-18T07:15:15.676Z",
    "description" : "Lorem ipsum dolor sit amet, consectetur adipiscing elit. Vivamus vel lectus ut turpis fermentum vestibulum. ",
    "favorited" : false,
    "hyperlink" : "https://www.etsy.com/listing/119533992/turquoise-and-silver-buddha-bracelet?ga_order=most_relevant&ga_search_type=all&ga_view_type=gallery&ga_search_query=buddha%20bracelet&ref=sr_gallery_36",
    "id" : "506",
    "index" : 10,
    "lastlocation" : -1,
    "newtag" : "",
    "parentId" : "15",
    "taglist" : [ "first-tag" ],
    "text" : "Turquoise and Silver Buddha Bracelet by TheArtsyNomad on Etsy"
  },
  "508" : {
    "dateAddedLocal" : "8/27/2014, 12:46:46 AM",
    "dateAddedUTC" : "2014-08-27T04:46:46.384Z",
    "description" : "Lorem ipsum dolor sit amet, consectetur adipiscing elit. Vivamus vel lectus ut turpis fermentum vestibulum. ",
    "favorited" : false,
    "id" : "507",
    "index" : 11,
    "lastlocation" : -1,
    "newtag" : "",
    "parentId" : "36",
    "taglist" : [ "first-tag" ],
    "text" : "V"
  },
  "509" : {
    "dateAddedLocal" : "9/6/2014, 1:39:55 AM",
    "dateAddedUTC" : "2014-09-06T05:39:55.582Z",
    "description" : "Lorem ipsum dolor sit amet, consectetur adipiscing elit. Vivamus vel lectus ut turpis fermentum vestibulum. ",
    "favorited" : false,
    "hyperlink" : "http://www.jsdb.io/",
    "id" : "508",
    "index" : 10,
    "lastlocation" : -1,
    "newtag" : "",
    "parentId" : "39",
    "taglist" : [ "first-tag" ],
    "text" : "unnamed"
  },
  "510" : {
    "dateAddedLocal" : "10/26/2014, 12:43:44 PM",
    "dateAddedUTC" : "2014-10-26T16:43:44.742Z",
    "description" : "Lorem ipsum dolor sit amet, consectetur adipiscing elit. Vivamus vel lectus ut turpis fermentum vestibulum. ",
    "favorited" : false,
    "hyperlink" : "http://pitchfork.com/reviews/albums/19897-a-wax-pullin-strings/",
    "id" : "509",
    "index" : 14,
    "lastlocation" : -1,
    "newtag" : "",
    "parentId" : "49",
    "taglist" : [ "first-tag" ],
    "text" : "A-Wax: Pullin' Strings | Album Reviews | Pitchfork"
  },
  "511" : {
    "dateAddedLocal" : "2/21/2017, 3:22:49 AM",
    "dateAddedUTC" : "2017-02-21T08:22:49.906Z",
    "description" : "Lorem ipsum dolor sit amet, consectetur adipiscing elit. Vivamus vel lectus ut turpis fermentum vestibulum. ",
    "favorited" : false,
    "hyperlink" : "https://mail.google.com/mail/u/0/#inbox",
    "id" : "510",
    "index" : 216,
    "lastlocation" : -1,
    "newtag" : "",
    "parentId" : "1",
    "taglist" : [ "first-tag" ],
    "text" : "Inbox (445) - dylanrboudro@gmail.com - Gmail"
  },
  "512" : {
    "dateAddedLocal" : "8/10/2015, 1:41:26 AM",
    "dateAddedUTC" : "2015-08-10T05:41:26.491Z",
    "description" : "Lorem ipsum dolor sit amet, consectetur adipiscing elit. Vivamus vel lectus ut turpis fermentum vestibulum. ",
    "favorited" : false,
    "hyperlink" : "https://vimeo.com/97785257",
    "id" : "511",
    "index" : 2,
    "lastlocation" : -1,
    "newtag" : "",
    "parentId" : "40",
    "taglist" : [ "first-tag" ],
    "text" : "Vancouver Island 4K - Timelapse on Vimeo"
  },
  "513" : {
    "dateAddedLocal" : "11/29/2018, 6:52:18 PM",
    "dateAddedUTC" : "2018-11-29T23:52:18.073Z",
    "description" : "Lorem ipsum dolor sit amet, consectetur adipiscing elit. Vivamus vel lectus ut turpis fermentum vestibulum. ",
    "favorited" : false,
    "hyperlink" : "https://docs.google.com/spreadsheets/d/1ZR6X4b4pdRMmhTca-5AiO6i_Z-4o5wXCPuWo1mehcMs/edit#gid=0",
    "id" : "512",
    "index" : 295,
    "lastlocation" : -1,
    "newtag" : "",
    "parentId" : "1",
    "taglist" : [ "first-tag" ],
    "text" : "Dev Features"
  },
  "514" : {
    "dateAddedLocal" : "10/11/2017, 9:58:02 PM",
    "dateAddedUTC" : "2017-10-12T01:58:02.599Z",
    "description" : "Lorem ipsum dolor sit amet, consectetur adipiscing elit. Vivamus vel lectus ut turpis fermentum vestibulum. ",
    "favorited" : false,
    "hyperlink" : "https://app.hubspot.com/reports-dashboard/3972838/marketing?via=marketing-free-setup",
    "id" : "513",
    "index" : 121,
    "lastlocation" : -1,
    "newtag" : "",
    "parentId" : "1",
    "taglist" : [ "first-tag" ],
    "text" : "Hubspot"
  },
  "515" : {
    "dateAddedLocal" : "1/14/2016, 2:40:53 AM",
    "dateAddedUTC" : "2016-01-14T07:40:53.220Z",
    "description" : "Lorem ipsum dolor sit amet, consectetur adipiscing elit. Vivamus vel lectus ut turpis fermentum vestibulum. ",
    "favorited" : false,
    "id" : "514",
    "index" : 53,
    "lastlocation" : -1,
    "newtag" : "",
    "parentId" : "2",
    "taglist" : [ "first-tag" ],
    "text" : "blogging"
  },
  "516" : {
    "dateAddedLocal" : "5/17/2018, 10:08:20 PM",
    "dateAddedUTC" : "2018-05-18T02:08:20.633Z",
    "description" : "Lorem ipsum dolor sit amet, consectetur adipiscing elit. Vivamus vel lectus ut turpis fermentum vestibulum. ",
    "favorited" : false,
    "hyperlink" : "file:///Users/boods/Desktop/nuevo-prod/index.html",
    "id" : "515",
    "index" : 237,
    "lastlocation" : -1,
    "newtag" : "",
    "parentId" : "1",
    "taglist" : [ "first-tag" ],
    "text" : "                                                                                                                                                     (6)"
  },
  "517" : {
    "dateAddedLocal" : "1/6/2019, 1:05:47 PM",
    "dateAddedUTC" : "2019-01-06T18:05:47.591Z",
    "description" : "Lorem ipsum dolor sit amet, consectetur adipiscing elit. Vivamus vel lectus ut turpis fermentum vestibulum. ",
    "favorited" : false,
    "hyperlink" : "https://www.sacred-texts.com/bud/tib/omph.htm",
    "id" : "516",
    "index" : 86,
    "lastlocation" : -1,
    "newtag" : "",
    "parentId" : "2",
    "taglist" : [ "first-tag" ],
    "text" : "Om Mani Padme Hum by The Dalai Lama"
  },
  "518" : {
    "dateAddedLocal" : "2/11/2019, 1:12:02 PM",
    "dateAddedUTC" : "2019-02-11T18:12:02.744Z",
    "description" : "Lorem ipsum dolor sit amet, consectetur adipiscing elit. Vivamus vel lectus ut turpis fermentum vestibulum. ",
    "favorited" : false,
    "hyperlink" : "https://www.mrmoneymustache.com/",
    "id" : "517",
    "index" : 309,
    "lastlocation" : -1,
    "newtag" : "",
    "parentId" : "1",
    "taglist" : [ "first-tag" ],
    "text" : "Mr. Money Mustache â€” Early Retirement through Badassity"
  },
  "519" : {
    "dateAddedLocal" : "8/25/2016, 5:55:13 PM",
    "dateAddedUTC" : "2016-08-25T21:55:13.791Z",
    "description" : "Lorem ipsum dolor sit amet, consectetur adipiscing elit. Vivamus vel lectus ut turpis fermentum vestibulum. ",
    "favorited" : false,
    "hyperlink" : "http://susaventures.com/",
    "id" : "518",
    "index" : 185,
    "lastlocation" : -1,
    "newtag" : "",
    "parentId" : "1",
    "taglist" : [ "first-tag" ],
    "text" : "awesome futuristic nature site. sweet grid bg"
  },
  "520" : {
    "dateAddedLocal" : "10/6/2015, 10:24:18 AM",
    "dateAddedUTC" : "2015-10-06T14:24:18.128Z",
    "description" : "Lorem ipsum dolor sit amet, consectetur adipiscing elit. Vivamus vel lectus ut turpis fermentum vestibulum. ",
    "favorited" : false,
    "hyperlink" : "https://www.typewolf.com/",
    "id" : "519",
    "index" : 133,
    "lastlocation" : -1,
    "newtag" : "",
    "parentId" : "1",
    "taglist" : [ "first-tag" ],
    "text" : "unnamed"
  },
  "521" : {
    "dateAddedLocal" : "4/6/2018, 1:26:42 PM",
    "dateAddedUTC" : "2018-04-06T17:26:42.034Z",
    "description" : "Lorem ipsum dolor sit amet, consectetur adipiscing elit. Vivamus vel lectus ut turpis fermentum vestibulum. ",
    "favorited" : false,
    "hyperlink" : "https://www.madfientist.com/hierarchy-of-financial-needs/",
    "id" : "520",
    "index" : 67,
    "lastlocation" : -1,
    "newtag" : "",
    "parentId" : "1",
    "taglist" : [ "first-tag" ],
    "text" : "FI"
  },
  "522" : {
    "dateAddedLocal" : "7/18/2015, 3:36:41 AM",
    "dateAddedUTC" : "2015-07-18T07:36:41.177Z",
    "description" : "Lorem ipsum dolor sit amet, consectetur adipiscing elit. Vivamus vel lectus ut turpis fermentum vestibulum. ",
    "favorited" : false,
    "hyperlink" : "http://genius.com/Genius-the-nine-most-underrated-albums-of-2015-so-far-lyrics/",
    "id" : "521",
    "index" : 47,
    "lastlocation" : -1,
    "newtag" : "",
    "parentId" : "49",
    "taglist" : [ "first-tag" ],
    "text" : "Genius â€“ The Nine Most Underrated Albums of 2015 (So Far) Lyrics | Genius"
  },
  "523" : {
    "dateAddedLocal" : "7/11/2018, 10:03:13 PM",
    "dateAddedUTC" : "2018-07-12T02:03:13.065Z",
    "description" : "Lorem ipsum dolor sit amet, consectetur adipiscing elit. Vivamus vel lectus ut turpis fermentum vestibulum. ",
    "favorited" : false,
    "id" : "522",
    "index" : 95,
    "lastlocation" : -1,
    "newtag" : "",
    "parentId" : "2",
    "taglist" : [ "first-tag" ],
    "text" : "Research"
  },
  "524" : {
    "dateAddedLocal" : "6/11/2014, 12:25:12 PM",
    "dateAddedUTC" : "2014-06-11T16:25:12.084Z",
    "description" : "Lorem ipsum dolor sit amet, consectetur adipiscing elit. Vivamus vel lectus ut turpis fermentum vestibulum. ",
    "favorited" : false,
    "hyperlink" : "https://developer.mozilla.org/en-US/docs/Web/JavaScript/Guide",
    "id" : "523",
    "index" : 0,
    "lastlocation" : -1,
    "newtag" : "",
    "parentId" : "7",
    "taglist" : [ "first-tag" ],
    "text" : "JavaScript Guide - JavaScript | MDN"
  },
  "525" : {
    "dateAddedLocal" : "1/10/2019, 8:35:21 PM",
    "dateAddedUTC" : "2019-01-11T01:35:21.460Z",
    "description" : "Lorem ipsum dolor sit amet, consectetur adipiscing elit. Vivamus vel lectus ut turpis fermentum vestibulum. ",
    "favorited" : false,
    "hyperlink" : "https://accounts.intuit.com/index.html?offering_id=Intuit.ifs.mint&namespace_id=50000026&redirect_hyperlink=https%3A%2F%2Fmint.intuit.com%2Ftrend.event",
    "id" : "524",
    "index" : 276,
    "lastlocation" : -1,
    "newtag" : "",
    "parentId" : "1",
    "taglist" : [ "first-tag" ],
    "text" : "mint"
  },
  "526" : {
    "dateAddedLocal" : "10/16/2017, 1:29:55 PM",
    "dateAddedUTC" : "2017-10-16T17:29:55.984Z",
    "description" : "Lorem ipsum dolor sit amet, consectetur adipiscing elit. Vivamus vel lectus ut turpis fermentum vestibulum. ",
    "favorited" : false,
    "hyperlink" : "https://powerandsystems.com/administrator/index.php?p0w3r098",
    "id" : "525",
    "index" : 100,
    "lastlocation" : -1,
    "newtag" : "",
    "parentId" : "1",
    "taglist" : [ "first-tag" ],
    "text" : "unnamed"
  },
  "527" : {
    "dateAddedLocal" : "3/8/2019, 10:30:26 AM",
    "dateAddedUTC" : "2019-03-08T15:30:26.845Z",
    "description" : "Lorem ipsum dolor sit amet, consectetur adipiscing elit. Vivamus vel lectus ut turpis fermentum vestibulum. ",
    "favorited" : false,
    "hyperlink" : "https://www.youtube.com/watch?v=xfvVUCWwZiI",
    "id" : "526",
    "index" : 257,
    "lastlocation" : -1,
    "newtag" : "",
    "parentId" : "1",
    "taglist" : [ "first-tag" ],
    "text" : "7"
  },
  "528" : {
    "dateAddedLocal" : "12/27/2013, 12:17:50 AM",
    "dateAddedUTC" : "2013-12-27T05:17:50.078Z",
    "description" : "Lorem ipsum dolor sit amet, consectetur adipiscing elit. Vivamus vel lectus ut turpis fermentum vestibulum. ",
    "favorited" : false,
    "hyperlink" : "http://www.vipassanadhura.com/howto.htm",
    "id" : "527",
    "index" : 0,
    "lastlocation" : -1,
    "newtag" : "",
    "parentId" : "10",
    "taglist" : [ "first-tag" ],
    "text" : "How to Meditate"
  },
  "529" : {
    "dateAddedLocal" : "2/23/2015, 9:34:40 PM",
    "dateAddedUTC" : "2015-02-24T02:34:40.768Z",
    "description" : "Lorem ipsum dolor sit amet, consectetur adipiscing elit. Vivamus vel lectus ut turpis fermentum vestibulum. ",
    "favorited" : false,
    "hyperlink" : "http://www.fateweavertarot.com/why-tarot-works/",
    "id" : "528",
    "index" : 0,
    "lastlocation" : -1,
    "newtag" : "",
    "parentId" : "26",
    "taglist" : [ "first-tag" ],
    "text" : "Great Blog talking about occult"
  },
  "530" : {
    "dateAddedLocal" : "6/10/2015, 10:46:24 AM",
    "dateAddedUTC" : "2015-06-10T14:46:24.775Z",
    "description" : "Lorem ipsum dolor sit amet, consectetur adipiscing elit. Vivamus vel lectus ut turpis fermentum vestibulum. ",
    "favorited" : false,
    "hyperlink" : "https://app.myceapp.com/",
    "id" : "529",
    "index" : 1,
    "lastlocation" : -1,
    "newtag" : "",
    "parentId" : "44",
    "taglist" : [ "first-tag" ],
    "text" : "unnamed"
  },
  "531" : {
    "dateAddedLocal" : "4/28/2014, 7:02:06 PM",
    "dateAddedUTC" : "2014-04-28T23:02:06.582Z",
    "description" : "Lorem ipsum dolor sit amet, consectetur adipiscing elit. Vivamus vel lectus ut turpis fermentum vestibulum. ",
    "favorited" : false,
    "hyperlink" : "http://www.youtube.com/watch?v=0cV4RFZmhG4",
    "id" : "530",
    "index" : 4,
    "lastlocation" : -1,
    "newtag" : "",
    "parentId" : "189",
    "taglist" : [ "first-tag" ],
    "text" : "Gacharic Spin / ä»Šã‚’ç”Ÿãã¦ã‚‹ Rock Singing Female Group"
  },
  "532" : {
    "dateAddedLocal" : "3/26/2014, 12:58:05 AM",
    "dateAddedUTC" : "2014-03-26T04:58:05.414Z",
    "description" : "Lorem ipsum dolor sit amet, consectetur adipiscing elit. Vivamus vel lectus ut turpis fermentum vestibulum. ",
    "favorited" : false,
    "hyperlink" : "https://www.youtube.com/watch?v=-s7TCuCpB5c&feature=youtu.be",
    "id" : "531",
    "index" : 2,
    "lastlocation" : -1,
    "newtag" : "",
    "parentId" : "163",
    "taglist" : [ "first-tag" ],
    "text" : "Tinashe - 2 On (Explicit) ft. SchoolBoy Q - YouTube"
  },
  "533" : {
    "dateAddedLocal" : "12/3/2017, 8:36:52 AM",
    "dateAddedUTC" : "2017-12-03T13:36:52.318Z",
    "description" : "Lorem ipsum dolor sit amet, consectetur adipiscing elit. Vivamus vel lectus ut turpis fermentum vestibulum. ",
    "favorited" : false,
    "hyperlink" : "https://www.myetherwallet.com/",
    "id" : "532",
    "index" : 95,
    "lastlocation" : -1,
    "newtag" : "",
    "parentId" : "1",
    "taglist" : [ "first-tag" ],
    "text" : "unnamed"
  },
  "534" : {
    "dateAddedLocal" : "3/24/2018, 2:37:02 PM",
    "dateAddedUTC" : "2018-03-24T18:37:02.814Z",
    "description" : "Lorem ipsum dolor sit amet, consectetur adipiscing elit. Vivamus vel lectus ut turpis fermentum vestibulum. ",
    "favorited" : false,
    "hyperlink" : "https://www.skillshare.com/classes/Personal-Finance-Discover-12-Amazing-Finance-Strategies/1075559248?via=search-layout-grid",
    "id" : "533",
    "index" : 82,
    "lastlocation" : -1,
    "newtag" : "",
    "parentId" : "1",
    "taglist" : [ "first-tag" ],
    "text" : "Personal Finance: Discover 12 Amazing Finance Strategies | Matt Bernstein | Skillshare"
  },
  "535" : {
    "dateAddedLocal" : "11/6/2017, 6:21:56 PM",
    "dateAddedUTC" : "2017-11-06T23:21:56.061Z",
    "description" : "Lorem ipsum dolor sit amet, consectetur adipiscing elit. Vivamus vel lectus ut turpis fermentum vestibulum. ",
    "favorited" : false,
    "hyperlink" : "https://github.com/lukasz-madon/awesome-remote-job",
    "id" : "534",
    "index" : 104,
    "lastlocation" : -1,
    "newtag" : "",
    "parentId" : "1",
    "taglist" : [ "first-tag" ],
    "text" : "remote"
  },
  "536" : {
    "dateAddedLocal" : "3/24/2015, 6:26:32 PM",
    "dateAddedUTC" : "2015-03-24T22:26:32.484Z",
    "description" : "Lorem ipsum dolor sit amet, consectetur adipiscing elit. Vivamus vel lectus ut turpis fermentum vestibulum. ",
    "favorited" : false,
    "id" : "535",
    "index" : 18,
    "lastlocation" : -1,
    "newtag" : "",
    "parentId" : "2",
    "taglist" : [ "first-tag" ],
    "text" : "Fashion"
  },
  "537" : {
    "dateAddedLocal" : "3/3/2018, 9:24:04 AM",
    "dateAddedUTC" : "2018-03-03T14:24:04.233Z",
    "description" : "Lorem ipsum dolor sit amet, consectetur adipiscing elit. Vivamus vel lectus ut turpis fermentum vestibulum. ",
    "favorited" : false,
    "hyperlink" : "https://marvelapp.com/40adadg/screen/38976684",
    "id" : "536",
    "index" : 236,
    "lastlocation" : -1,
    "newtag" : "",
    "parentId" : "1",
    "taglist" : [ "first-tag" ],
    "text" : "Klaver Desktop"
  },
  "538" : {
    "dateAddedLocal" : "3/5/2014, 3:05:54 PM",
    "dateAddedUTC" : "2014-03-05T20:05:54.386Z",
    "description" : "Lorem ipsum dolor sit amet, consectetur adipiscing elit. Vivamus vel lectus ut turpis fermentum vestibulum. ",
    "favorited" : false,
    "hyperlink" : "http://blog.42floors.com/want-get-startups-dont-know-start/",
    "id" : "537",
    "index" : 3,
    "lastlocation" : -1,
    "newtag" : "",
    "parentId" : "11",
    "taglist" : [ "first-tag" ],
    "text" : "I want to get into startups, but I donâ€™t know where to start"
  },
  "539" : {
    "dateAddedLocal" : "10/9/2017, 5:53:45 PM",
    "dateAddedUTC" : "2017-10-09T21:53:45.682Z",
    "description" : "Lorem ipsum dolor sit amet, consectetur adipiscing elit. Vivamus vel lectus ut turpis fermentum vestibulum. ",
    "favorited" : false,
    "hyperlink" : "http://24trauma.com/wp-admin",
    "id" : "538",
    "index" : 105,
    "lastlocation" : -1,
    "newtag" : "",
    "parentId" : "1",
    "taglist" : [ "first-tag" ],
    "text" : "24T Wordpress"
  },
  "540" : {
    "dateAddedLocal" : "7/25/2014, 11:29:20 AM",
    "dateAddedUTC" : "2014-07-25T15:29:20.694Z",
    "description" : "Lorem ipsum dolor sit amet, consectetur adipiscing elit. Vivamus vel lectus ut turpis fermentum vestibulum. ",
    "favorited" : false,
    "id" : "539",
    "index" : 0,
    "lastlocation" : -1,
    "newtag" : "",
    "parentId" : "49",
    "taglist" : [ "first-tag" ],
    "text" : "bad"
  },
  "541" : {
    "dateAddedLocal" : "10/5/2015, 12:51:09 PM",
    "dateAddedUTC" : "2015-10-05T16:51:09.151Z",
    "description" : "Lorem ipsum dolor sit amet, consectetur adipiscing elit. Vivamus vel lectus ut turpis fermentum vestibulum. ",
    "favorited" : false,
    "hyperlink" : "http://popmotion.io/",
    "id" : "540",
    "index" : 7,
    "lastlocation" : -1,
    "newtag" : "",
    "parentId" : "50",
    "taglist" : [ "first-tag" ],
    "text" : "Popmotion - JavaScript animation, physics and input tracking"
  },
  "542" : {
    "dateAddedLocal" : "1/15/2019, 12:34:17 PM",
    "dateAddedUTC" : "2019-01-15T17:34:17.918Z",
    "description" : "Lorem ipsum dolor sit amet, consectetur adipiscing elit. Vivamus vel lectus ut turpis fermentum vestibulum. ",
    "favorited" : false,
    "hyperlink" : "https://searchneu.com/201930/web",
    "id" : "541",
    "index" : 293,
    "lastlocation" : -1,
    "newtag" : "",
    "parentId" : "1",
    "taglist" : [ "first-tag" ],
    "text" : "Search NEU"
  },
  "543" : {
    "dateAddedLocal" : "6/4/2019, 11:42:17 PM",
    "dateAddedUTC" : "2019-06-05T03:42:17.825Z",
    "description" : "Lorem ipsum dolor sit amet, consectetur adipiscing elit. Vivamus vel lectus ut turpis fermentum vestibulum. ",
    "favorited" : false,
    "hyperlink" : "https://qchat.rizon.net/",
    "id" : "542",
    "index" : 9,
    "lastlocation" : -1,
    "newtag" : "",
    "parentId" : "1",
    "taglist" : [ "first-tag" ],
    "text" : "#bakabt-support - Rizon Web IRC"
  },
  "544" : {
    "dateAddedLocal" : "1/27/2019, 9:44:07 PM",
    "dateAddedUTC" : "2019-01-28T02:44:07.511Z",
    "description" : "Lorem ipsum dolor sit amet, consectetur adipiscing elit. Vivamus vel lectus ut turpis fermentum vestibulum. ",
    "favorited" : false,
    "hyperlink" : "https://clicky.com/user/",
    "id" : "543",
    "index" : 270,
    "lastlocation" : -1,
    "newtag" : "",
    "parentId" : "1",
    "taglist" : [ "first-tag" ],
    "text" : "analytics"
  },
  "545" : {
    "dateAddedLocal" : "9/30/2016, 4:51:40 PM",
    "dateAddedUTC" : "2016-09-30T20:51:40.288Z",
    "description" : "Lorem ipsum dolor sit amet, consectetur adipiscing elit. Vivamus vel lectus ut turpis fermentum vestibulum. ",
    "favorited" : false,
    "hyperlink" : "https://yeun.github.io/open-color/",
    "id" : "544",
    "index" : 125,
    "lastlocation" : -1,
    "newtag" : "",
    "parentId" : "1",
    "taglist" : [ "first-tag" ],
    "text" : "unnamed"
  },
  "546" : {
    "dateAddedLocal" : "8/3/2016, 1:04:44 PM",
    "dateAddedUTC" : "2016-08-03T17:04:44.390Z",
    "description" : "Lorem ipsum dolor sit amet, consectetur adipiscing elit. Vivamus vel lectus ut turpis fermentum vestibulum. ",
    "favorited" : false,
    "hyperlink" : "http://visionmedia.github.io/superagent/#get-requests",
    "id" : "545",
    "index" : 176,
    "lastlocation" : -1,
    "newtag" : "",
    "parentId" : "1",
    "taglist" : [ "first-tag" ],
    "text" : "SuperAgent â€” elegant API for AJAX in Node and browsers"
  },
  "547" : {
    "dateAddedLocal" : "3/25/2015, 1:48:56 PM",
    "dateAddedUTC" : "2015-03-25T17:48:56.216Z",
    "description" : "Lorem ipsum dolor sit amet, consectetur adipiscing elit. Vivamus vel lectus ut turpis fermentum vestibulum. ",
    "favorited" : false,
    "hyperlink" : "https://www.youtube.com/watch?v=F8IzlbDTgNM",
    "id" : "546",
    "index" : 43,
    "lastlocation" : -1,
    "newtag" : "",
    "parentId" : "49",
    "taglist" : [ "first-tag" ],
    "text" : "Binary Star - Masters of the universe - YouTube"
  },
  "548" : {
    "dateAddedLocal" : "4/18/2019, 10:02:27 AM",
    "dateAddedUTC" : "2019-04-18T14:02:27.703Z",
    "description" : "Lorem ipsum dolor sit amet, consectetur adipiscing elit. Vivamus vel lectus ut turpis fermentum vestibulum. ",
    "favorited" : false,
    "hyperlink" : "https://grupovenus.com/",
    "id" : "547",
    "index" : 326,
    "lastlocation" : -1,
    "newtag" : "",
    "parentId" : "1",
    "taglist" : [ "first-tag" ],
    "text" : "Astrology Readings I like"
  },
  "549" : {
    "dateAddedLocal" : "8/13/2018, 12:49:33 PM",
    "dateAddedUTC" : "2018-08-13T16:49:33.882Z",
    "description" : "Lorem ipsum dolor sit amet, consectetur adipiscing elit. Vivamus vel lectus ut turpis fermentum vestibulum. ",
    "favorited" : false,
    "hyperlink" : "https://medium.com/google-design/designing-adaptive-icons-515af294c783",
    "id" : "548",
    "index" : 0,
    "lastlocation" : -1,
    "newtag" : "",
    "parentId" : "497",
    "taglist" : [ "first-tag" ],
    "text" : "Designing Adaptive Icons â€“ Google Design â€“ Medium"
  },
  "550" : {
    "dateAddedLocal" : "9/22/2017, 8:54:43 PM",
    "dateAddedUTC" : "2017-09-23T00:54:43.277Z",
    "description" : "Lorem ipsum dolor sit amet, consectetur adipiscing elit. Vivamus vel lectus ut turpis fermentum vestibulum. ",
    "favorited" : false,
    "hyperlink" : "http://www.exrx.net/index.html",
    "id" : "549",
    "index" : 114,
    "lastlocation" : -1,
    "newtag" : "",
    "parentId" : "1",
    "taglist" : [ "first-tag" ],
    "text" : "ExRx "
  },
  "551" : {
    "dateAddedLocal" : "12/27/2013, 12:17:46 AM",
    "dateAddedUTC" : "2013-12-27T05:17:46.959Z",
    "description" : "Lorem ipsum dolor sit amet, consectetur adipiscing elit. Vivamus vel lectus ut turpis fermentum vestibulum. ",
    "favorited" : false,
    "id" : "550",
    "index" : 3,
    "lastlocation" : -1,
    "newtag" : "",
    "parentId" : "2",
    "taglist" : [ "first-tag" ],
    "text" : "meditation"
  },
  "552" : {
    "dateAddedLocal" : "3/21/2018, 5:42:44 PM",
    "dateAddedUTC" : "2018-03-21T21:42:44.564Z",
    "description" : "Lorem ipsum dolor sit amet, consectetur adipiscing elit. Vivamus vel lectus ut turpis fermentum vestibulum. ",
    "favorited" : false,
    "hyperlink" : "https://zenhabits.net/",
    "id" : "551",
    "index" : 68,
    "lastlocation" : -1,
    "newtag" : "",
    "parentId" : "1",
    "taglist" : [ "first-tag" ],
    "text" : "zen habits"
  },
  "553" : {
    "dateAddedLocal" : "6/28/2014, 11:40:39 PM",
    "dateAddedUTC" : "2014-06-29T03:40:39.804Z",
    "description" : "Lorem ipsum dolor sit amet, consectetur adipiscing elit. Vivamus vel lectus ut turpis fermentum vestibulum. ",
    "favorited" : false,
    "hyperlink" : "http://bl.ocks.org/mbostock/70a28267db0354261476",
    "id" : "552",
    "index" : 9,
    "lastlocation" : -1,
    "newtag" : "",
    "parentId" : "16",
    "taglist" : [ "first-tag" ],
    "text" : "prims alg"
  },
  "554" : {
    "dateAddedLocal" : "12/24/2017, 2:51:38 AM",
    "dateAddedUTC" : "2017-12-24T07:51:38.227Z",
    "description" : "Lorem ipsum dolor sit amet, consectetur adipiscing elit. Vivamus vel lectus ut turpis fermentum vestibulum. ",
    "favorited" : false,
    "hyperlink" : "https://www.coinbase.com/dashboard",
    "id" : "553",
    "index" : 92,
    "lastlocation" : -1,
    "newtag" : "",
    "parentId" : "1",
    "taglist" : [ "first-tag" ],
    "text" : "unnamed"
  },
  "555" : {
    "dateAddedLocal" : "4/9/2015, 4:49:08 PM",
    "dateAddedUTC" : "2015-04-09T20:49:08.958Z",
    "description" : "Lorem ipsum dolor sit amet, consectetur adipiscing elit. Vivamus vel lectus ut turpis fermentum vestibulum. ",
    "favorited" : false,
    "id" : "554",
    "index" : 10,
    "lastlocation" : -1,
    "newtag" : "",
    "parentId" : "38",
    "taglist" : [ "first-tag" ],
    "text" : "fonts"
  },
  "556" : {
    "dateAddedLocal" : "8/29/2015, 9:30:33 PM",
    "dateAddedUTC" : "2015-08-30T01:30:33.136Z",
    "description" : "Lorem ipsum dolor sit amet, consectetur adipiscing elit. Vivamus vel lectus ut turpis fermentum vestibulum. ",
    "favorited" : false,
    "hyperlink" : "http://elbowsydney.com.au/",
    "id" : "555",
    "index" : 0,
    "lastlocation" : -1,
    "newtag" : "",
    "parentId" : "50",
    "taglist" : [ "first-tag" ],
    "text" : "Elbow â€” Home"
  },
  "557" : {
    "dateAddedLocal" : "10/30/2013, 8:20:46 PM",
    "dateAddedUTC" : "2013-10-31T00:20:46.924Z",
    "description" : "Lorem ipsum dolor sit amet, consectetur adipiscing elit. Vivamus vel lectus ut turpis fermentum vestibulum. ",
    "favorited" : false,
    "id" : "556",
    "index" : 42,
    "lastlocation" : -1,
    "newtag" : "",
    "parentId" : "2",
    "taglist" : [ "first-tag" ],
    "text" : "M"
  },
  "558" : {
    "dateAddedLocal" : "6/4/2019, 9:37:25 PM",
    "dateAddedUTC" : "2019-06-05T01:37:25.616Z",
    "description" : "Lorem ipsum dolor sit amet, consectetur adipiscing elit. Vivamus vel lectus ut turpis fermentum vestibulum. ",
    "favorited" : false,
    "hyperlink" : "https://dev.to/t/react",
    "id" : "557",
    "index" : 11,
    "lastlocation" : -1,
    "newtag" : "",
    "parentId" : "1",
    "taglist" : [ "first-tag" ],
    "text" : "React - DEV Community ðŸ‘©â€ðŸ’»ðŸ‘¨â€ðŸ’»"
  },
  "559" : {
    "dateAddedLocal" : "1/14/2016, 1:26:40 AM",
    "dateAddedUTC" : "2016-01-14T06:26:40.632Z",
    "description" : "Lorem ipsum dolor sit amet, consectetur adipiscing elit. Vivamus vel lectus ut turpis fermentum vestibulum. ",
    "favorited" : false,
    "hyperlink" : "http://www.seowargames.com/on-page-seo/",
    "id" : "558",
    "index" : 1,
    "lastlocation" : -1,
    "newtag" : "",
    "parentId" : "65",
    "taglist" : [ "first-tag" ],
    "text" : "On-Page SEO Guide from phpbuilt "
  },
  "560" : {
    "dateAddedLocal" : "9/14/2018, 4:25:19 PM",
    "dateAddedUTC" : "2018-09-14T20:25:19.406Z",
    "description" : "Lorem ipsum dolor sit amet, consectetur adipiscing elit. Vivamus vel lectus ut turpis fermentum vestibulum. ",
    "favorited" : false,
    "hyperlink" : "https://hackernoon.com/how-much-income-does-tezos-pay-and-how-to-earn-baking-income-46743bb28e3b",
    "id" : "559",
    "index" : 80,
    "lastlocation" : -1,
    "newtag" : "",
    "parentId" : "2",
    "taglist" : [ "first-tag" ],
    "text" : "tez"
  },
  "561" : {
    "dateAddedLocal" : "6/12/2017, 6:14:45 PM",
    "dateAddedUTC" : "2017-06-12T22:14:45.203Z",
    "description" : "Lorem ipsum dolor sit amet, consectetur adipiscing elit. Vivamus vel lectus ut turpis fermentum vestibulum. ",
    "favorited" : false,
    "hyperlink" : "https://docs.google.com/document/d/1gdjUq0ZAjW21jpvKYatXxFKbYBhREZEtlrkFhY82TII/edit",
    "id" : "560",
    "index" : 158,
    "lastlocation" : -1,
    "newtag" : "",
    "parentId" : "1",
    "taglist" : [ "first-tag" ],
    "text" : "CryptoCurrency "
  },
  "562" : {
    "dateAddedLocal" : "7/4/2014, 2:12:07 PM",
    "dateAddedUTC" : "2014-07-04T18:12:07.030Z",
    "description" : "Lorem ipsum dolor sit amet, consectetur adipiscing elit. Vivamus vel lectus ut turpis fermentum vestibulum. ",
    "favorited" : false,
    "hyperlink" : "https://www.youtube.com/watch?v=a1oByfD1z4g&index=6&list=PLDfKAXSi6kUba6EDLtCojcKg45Uwp39Bh",
    "id" : "561",
    "index" : 28,
    "lastlocation" : -1,
    "newtag" : "",
    "parentId" : "49",
    "taglist" : [ "first-tag" ],
    "text" : "Sweet Talker - Burn It Up All Night - YouTube | indie electronic"
  },
  "563" : {
    "dateAddedLocal" : "6/10/2015, 12:36:54 PM",
    "dateAddedUTC" : "2015-06-10T16:36:54.480Z",
    "description" : "Lorem ipsum dolor sit amet, consectetur adipiscing elit. Vivamus vel lectus ut turpis fermentum vestibulum. ",
    "favorited" : false,
    "hyperlink" : "http://americanwell.dev.myceapp.com/profile-settings.php",
    "id" : "562",
    "index" : 27,
    "lastlocation" : -1,
    "newtag" : "",
    "parentId" : "2",
    "taglist" : [ "first-tag" ],
    "text" : "Profile (Settings) | My CE | Track Your Continuing Education"
  },
  "564" : {
    "dateAddedLocal" : "4/27/2017, 11:54:32 AM",
    "dateAddedUTC" : "2017-04-27T15:54:32.271Z",
    "description" : "Lorem ipsum dolor sit amet, consectetur adipiscing elit. Vivamus vel lectus ut turpis fermentum vestibulum. ",
    "favorited" : false,
    "hyperlink" : "https://en.wikivoyage.org/wiki/Berlin",
    "id" : "563",
    "index" : 222,
    "lastlocation" : -1,
    "newtag" : "",
    "parentId" : "1",
    "taglist" : [ "first-tag" ],
    "text" : "Berlin â€“ Travel guide at Wikivoyage"
  },
  "565" : {
    "dateAddedLocal" : "4/14/2019, 10:51:04 PM",
    "dateAddedUTC" : "2019-04-15T02:51:04.059Z",
    "description" : "Lorem ipsum dolor sit amet, consectetur adipiscing elit. Vivamus vel lectus ut turpis fermentum vestibulum. ",
    "favorited" : false,
    "hyperlink" : "https://github.com/dboudro",
    "id" : "564",
    "index" : 321,
    "lastlocation" : -1,
    "newtag" : "",
    "parentId" : "1",
    "taglist" : [ "first-tag" ],
    "text" : "                       (3)"
  },
  "566" : {
    "dateAddedLocal" : "9/15/2014, 5:30:33 PM",
    "dateAddedUTC" : "2014-09-15T21:30:33.399Z",
    "description" : "Lorem ipsum dolor sit amet, consectetur adipiscing elit. Vivamus vel lectus ut turpis fermentum vestibulum. ",
    "favorited" : false,
    "hyperlink" : "https://nuevents.neu.edu/",
    "id" : "565",
    "index" : 15,
    "lastlocation" : -1,
    "newtag" : "",
    "parentId" : "2",
    "taglist" : [ "first-tag" ],
    "text" : "Audio Studio"
  },
  "567" : {
    "dateAddedLocal" : "9/3/2015, 10:25:29 AM",
    "dateAddedUTC" : "2015-09-03T14:25:29.207Z",
    "description" : "Lorem ipsum dolor sit amet, consectetur adipiscing elit. Vivamus vel lectus ut turpis fermentum vestibulum. ",
    "favorited" : false,
    "hyperlink" : "http://www.mindful.org/five-steps-to-mindfulness/",
    "id" : "566",
    "index" : 139,
    "lastlocation" : -1,
    "newtag" : "",
    "parentId" : "1",
    "taglist" : [ "first-tag" ],
    "text" : "unnamed"
  },
  "568" : {
    "dateAddedLocal" : "10/15/2017, 11:13:33 PM",
    "dateAddedUTC" : "2017-10-16T03:13:33.163Z",
    "description" : "Lorem ipsum dolor sit amet, consectetur adipiscing elit. Vivamus vel lectus ut turpis fermentum vestibulum. ",
    "favorited" : false,
    "hyperlink" : "https://www.hotjar.com/",
    "id" : "567",
    "index" : 112,
    "lastlocation" : -1,
    "newtag" : "",
    "parentId" : "1",
    "taglist" : [ "first-tag" ],
    "text" : "Hotjar - Heatmaps, Visitor Recordings, Conversion Funnels, Form Analytics, Feedback Polls and Surveys in One Platform"
  },
  "569" : {
    "dateAddedLocal" : "5/18/2014, 2:33:34 AM",
    "dateAddedUTC" : "2014-05-18T06:33:34.312Z",
    "description" : "Lorem ipsum dolor sit amet, consectetur adipiscing elit. Vivamus vel lectus ut turpis fermentum vestibulum. ",
    "favorited" : false,
    "hyperlink" : "http://www.doctoroz.com/videos/48-hour-weekend-cleanse-recipes",
    "id" : "568",
    "index" : 1,
    "lastlocation" : -1,
    "newtag" : "",
    "parentId" : "14",
    "taglist" : [ "first-tag" ],
    "text" : "Dr Oz Cleanse"
  },
  "570" : {
    "dateAddedLocal" : "1/1/2018, 2:55:57 AM",
    "dateAddedUTC" : "2018-01-01T07:55:57.880Z",
    "description" : "Lorem ipsum dolor sit amet, consectetur adipiscing elit. Vivamus vel lectus ut turpis fermentum vestibulum. ",
    "favorited" : false,
    "hyperlink" : "https://bitbucket.org/ensemblai/cryptotonic#",
    "id" : "569",
    "index" : 88,
    "lastlocation" : -1,
    "newtag" : "",
    "parentId" : "1",
    "taglist" : [ "first-tag" ],
    "text" : "unnamed"
  },
  "571" : {
    "dateAddedLocal" : "2/24/2015, 10:05:18 AM",
    "dateAddedUTC" : "2015-02-24T15:05:18.854Z",
    "description" : "Lorem ipsum dolor sit amet, consectetur adipiscing elit. Vivamus vel lectus ut turpis fermentum vestibulum. ",
    "favorited" : false,
    "hyperlink" : "https://huckberry.com/#.",
    "id" : "570",
    "index" : 13,
    "lastlocation" : -1,
    "newtag" : "",
    "parentId" : "2",
    "taglist" : [ "first-tag" ],
    "text" : "Welcome to Huckberry | Huckberry"
  },
  "572" : {
    "dateAddedLocal" : "4/15/2018, 9:08:35 PM",
    "dateAddedUTC" : "2018-04-16T01:08:35.661Z",
    "description" : "Lorem ipsum dolor sit amet, consectetur adipiscing elit. Vivamus vel lectus ut turpis fermentum vestibulum. ",
    "favorited" : false,
    "hyperlink" : "https://www.linkedin.com/jobs/search/?keywords=frontend%20engineer&location=Los%20Angeles%2C%20California&locationId=PLACES.us.7-1-0-19-57",
    "id" : "571",
    "index" : 3,
    "lastlocation" : -1,
    "newtag" : "",
    "parentId" : "520",
    "taglist" : [ "first-tag" ],
    "text" : "frontend engineer Jobs | LinkedIn"
  },
  "573" : {
    "dateAddedLocal" : "8/25/2014, 1:39:55 AM",
    "dateAddedUTC" : "2014-08-25T05:39:55.645Z",
    "description" : "Lorem ipsum dolor sit amet, consectetur adipiscing elit. Vivamus vel lectus ut turpis fermentum vestibulum. ",
    "favorited" : false,
    "hyperlink" : "http://codepen.io/danielcgold/pen/doFae",
    "id" : "572",
    "index" : 2,
    "lastlocation" : -1,
    "newtag" : "",
    "parentId" : "457",
    "taglist" : [ "first-tag" ],
    "text" : "CSS Browser Window - CodePen"
  },
  "574" : {
    "dateAddedLocal" : "6/28/2014, 8:35:27 AM",
    "dateAddedUTC" : "2014-06-28T12:35:27.402Z",
    "description" : "Lorem ipsum dolor sit amet, consectetur adipiscing elit. Vivamus vel lectus ut turpis fermentum vestibulum. ",
    "favorited" : false,
    "hyperlink" : "http://read.humanjavascript.com/",
    "id" : "573",
    "index" : 3,
    "lastlocation" : -1,
    "newtag" : "",
    "parentId" : "7",
    "taglist" : [ "first-tag" ],
    "text" : "Introduction | Human JavaScript"
  },
  "575" : {
    "dateAddedLocal" : "5/5/2019, 1:13:01 PM",
    "dateAddedUTC" : "2019-05-05T17:13:01.130Z",
    "description" : "Lorem ipsum dolor sit amet, consectetur adipiscing elit. Vivamus vel lectus ut turpis fermentum vestibulum. ",
    "favorited" : false,
    "hyperlink" : "https://www.linkedin.com/feed/",
    "id" : "574",
    "index" : 18,
    "lastlocation" : -1,
    "newtag" : "",
    "parentId" : "1",
    "taglist" : [ "first-tag" ],
    "text" : "LinkedIn"
  },
  "576" : {
    "dateAddedLocal" : "10/27/2014, 10:05:31 PM",
    "dateAddedUTC" : "2014-10-28T02:05:31.642Z",
    "description" : "Lorem ipsum dolor sit amet, consectetur adipiscing elit. Vivamus vel lectus ut turpis fermentum vestibulum. ",
    "favorited" : false,
    "hyperlink" : "http://en.wikipedia.org/wiki/Florence_Nightingale#mediaviewer/File:Nightingale-mortality.jpg",
    "id" : "575",
    "index" : 1,
    "lastlocation" : -1,
    "newtag" : "",
    "parentId" : "392",
    "taglist" : [ "first-tag" ],
    "text" : "Nightingale-mortality - Florence Nightingale - Wikipedia, the free encyclopedia"
  },
  "577" : {
    "dateAddedLocal" : "10/30/2013, 11:22:56 PM",
    "dateAddedUTC" : "2013-10-31T03:22:56.027Z",
    "description" : "Lorem ipsum dolor sit amet, consectetur adipiscing elit. Vivamus vel lectus ut turpis fermentum vestibulum. ",
    "favorited" : false,
    "hyperlink" : "http://www.youtube.com/watch?v=y3sa-5_rPm0",
    "id" : "576",
    "index" : 0,
    "lastlocation" : -1,
    "newtag" : "",
    "parentId" : "180",
    "taglist" : [ "first-tag" ],
    "text" : "â–¶ Lanquidity - Sun Ra [FULL ALBUM] [HQ] - YouTube"
  },
  "578" : {
    "dateAddedLocal" : "6/12/2019, 2:12:13 PM",
    "dateAddedUTC" : "2019-06-12T18:12:13.834Z",
    "description" : "Lorem ipsum dolor sit amet, consectetur adipiscing elit. Vivamus vel lectus ut turpis fermentum vestibulum. ",
    "favorited" : false,
    "hyperlink" : "https://pandas.pydata.org/",
    "id" : "577",
    "index" : 100,
    "lastlocation" : -1,
    "newtag" : "",
    "parentId" : "2",
    "taglist" : [ "first-tag" ],
    "text" : "Python Data Analysis Library â€” pandas: Python Data Analysis Library"
  },
  "579" : {
    "dateAddedLocal" : "6/1/2016, 10:14:54 PM",
    "dateAddedUTC" : "2016-06-02T02:14:54.530Z",
    "description" : "Lorem ipsum dolor sit amet, consectetur adipiscing elit. Vivamus vel lectus ut turpis fermentum vestibulum. ",
    "favorited" : false,
    "hyperlink" : "http://zenhabits.net/",
    "id" : "578",
    "index" : 135,
    "lastlocation" : -1,
    "newtag" : "",
    "parentId" : "1",
    "taglist" : [ "first-tag" ],
    "text" : "unnamed"
  },
  "580" : {
    "dateAddedLocal" : "5/24/2017, 10:39:44 PM",
    "dateAddedUTC" : "2017-05-25T02:39:44.128Z",
    "description" : "Lorem ipsum dolor sit amet, consectetur adipiscing elit. Vivamus vel lectus ut turpis fermentum vestibulum. ",
    "favorited" : false,
    "id" : "579",
    "index" : 1,
    "lastlocation" : -1,
    "newtag" : "",
    "parentId" : "76",
    "taglist" : [ "first-tag" ],
    "text" : "marketing"
  },
  "581" : {
    "dateAddedLocal" : "1/23/2016, 4:57:45 PM",
    "dateAddedUTC" : "2016-01-23T21:57:45.090Z",
    "description" : "Lorem ipsum dolor sit amet, consectetur adipiscing elit. Vivamus vel lectus ut turpis fermentum vestibulum. ",
    "favorited" : false,
    "hyperlink" : "https://coolors.co/app/550527-688e26-faa613-f44708-a10702",
    "id" : "580",
    "index" : 127,
    "lastlocation" : -1,
    "newtag" : "",
    "parentId" : "1",
    "taglist" : [ "first-tag" ],
    "text" : "unnamed"
  },
  "582" : {
    "dateAddedLocal" : "4/10/2015, 5:33:15 PM",
    "dateAddedUTC" : "2015-04-10T21:33:15.501Z",
    "description" : "Lorem ipsum dolor sit amet, consectetur adipiscing elit. Vivamus vel lectus ut turpis fermentum vestibulum. ",
    "favorited" : false,
    "hyperlink" : "https://metamarkets.com/",
    "id" : "581",
    "index" : 6,
    "lastlocation" : -1,
    "newtag" : "",
    "parentId" : "756",
    "taglist" : [ "first-tag" ],
    "text" : "Metamarkets: Real-Time Analytics for Programmatic Advertising"
  },
  "583" : {
    "dateAddedLocal" : "9/26/2014, 8:35:17 AM",
    "dateAddedUTC" : "2014-09-26T12:35:17.541Z",
    "description" : "Lorem ipsum dolor sit amet, consectetur adipiscing elit. Vivamus vel lectus ut turpis fermentum vestibulum. ",
    "favorited" : false,
    "hyperlink" : "http://www.brooksbrothers.com/Milano-Flannel-1818-Suit/485K,default,pd.html",
    "id" : "582",
    "index" : 14,
    "lastlocation" : -1,
    "newtag" : "",
    "parentId" : "2",
    "taglist" : [ "first-tag" ],
    "text" : "Milano Flannel 1818 Suit - Brooks Brothers"
  },
  "584" : {
    "dateAddedLocal" : "10/27/2014, 10:03:47 PM",
    "dateAddedUTC" : "2014-10-28T02:03:47.274Z",
    "description" : "Lorem ipsum dolor sit amet, consectetur adipiscing elit. Vivamus vel lectus ut turpis fermentum vestibulum. ",
    "favorited" : false,
    "hyperlink" : "http://upload.wikimedia.org/wikipedia/commons/1/12/Planetary_Movements.gif",
    "id" : "583",
    "index" : 0,
    "lastlocation" : -1,
    "newtag" : "",
    "parentId" : "392",
    "taglist" : [ "first-tag" ],
    "text" : "Planetary_Movements.gif (750Ã—420)"
  },
  "585" : {
    "dateAddedLocal" : "5/17/2018, 10:08:25 PM",
    "dateAddedUTC" : "2018-05-18T02:08:25.132Z",
    "description" : "Lorem ipsum dolor sit amet, consectetur adipiscing elit. Vivamus vel lectus ut turpis fermentum vestibulum. ",
    "favorited" : false,
    "hyperlink" : "file:///Users/boods/Desktop/nuevo-prod/index.html",
    "id" : "584",
    "index" : 238,
    "lastlocation" : -1,
    "newtag" : "",
    "parentId" : "1",
    "taglist" : [ "first-tag" ],
    "text" : "                                                                                                                                                     (7)"
  },
  "586" : {
    "dateAddedLocal" : "4/30/2017, 6:25:25 PM",
    "dateAddedUTC" : "2017-04-30T22:25:25.554Z",
    "description" : "Lorem ipsum dolor sit amet, consectetur adipiscing elit. Vivamus vel lectus ut turpis fermentum vestibulum. ",
    "favorited" : false,
    "hyperlink" : "http://freelance.tv/",
    "id" : "585",
    "index" : 123,
    "lastlocation" : -1,
    "newtag" : "",
    "parentId" : "1",
    "taglist" : [ "first-tag" ],
    "text" : ".tv"
  },
  "587" : {
    "dateAddedLocal" : "5/10/2016, 10:37:49 PM",
    "dateAddedUTC" : "2016-05-11T02:37:49.231Z",
    "description" : "Lorem ipsum dolor sit amet, consectetur adipiscing elit. Vivamus vel lectus ut turpis fermentum vestibulum. ",
    "favorited" : false,
    "hyperlink" : "https://www.grailed.com/#/api/listings/grailed?filters%5Bcategories%5D%5Bfootwear%5D%5B%5D=10&filters%5Bcategories%5D%5Bfootwear%5D%5B%5D=10.5&filters%5Bdesigners%5D%5B%5D=18424&filters%5Bdesigners%5D%5B%5D=23280&filters%5Bdesigners%5D%5B%5D=10176&filters%5Bdesigners%5D%5B%5D=116&filters%5Bdesigners%5D%5B%5D=1834&filters%5Bdesigners%5D%5B%5D=1290&filters%5Bdesigners%5D%5B%5D=25527&filters%5Bdesigners%5D%5B%5D=13458&filters%5Bdesigners%5D%5B%5D=5365&filters%5Bdesigners%5D%5B%5D=12791&filters%5Bdesigners%5D%5B%5D=468&filters%5Bdesigners%5D%5B%5D=5488&filters%5Bdesigners%5D%5B%5D=27001&filters%5Bdesigners%5D%5B%5D=26999&filters%5Bdesigners%5D%5B%5D=28083&filters%5Bdesigners%5D%5B%5D=17707&filters%5Blocations%5D=all&light=true&order=desc&sort=price_updated_at&strata=grailed",
    "id" : "586",
    "index" : 171,
    "lastlocation" : -1,
    "newtag" : "",
    "parentId" : "1",
    "taglist" : [ "first-tag" ],
    "text" : "y3 search"
  },
  "588" : {
    "dateAddedLocal" : "9/14/2015, 4:06:38 PM",
    "dateAddedUTC" : "2015-09-14T20:06:38.360Z",
    "description" : "Lorem ipsum dolor sit amet, consectetur adipiscing elit. Vivamus vel lectus ut turpis fermentum vestibulum. ",
    "favorited" : false,
    "hyperlink" : "http://landor.com/",
    "id" : "587",
    "index" : 2,
    "lastlocation" : -1,
    "newtag" : "",
    "parentId" : "45",
    "taglist" : [ "first-tag" ],
    "text" : "Landor "
  },
  "589" : {
    "dateAddedLocal" : "7/4/2014, 1:21:16 PM",
    "dateAddedUTC" : "2014-07-04T17:21:16.200Z",
    "description" : "Lorem ipsum dolor sit amet, consectetur adipiscing elit. Vivamus vel lectus ut turpis fermentum vestibulum. ",
    "favorited" : false,
    "hyperlink" : "http://prinzhorn.github.io/skrollr/",
    "id" : "588",
    "index" : 0,
    "lastlocation" : -1,
    "newtag" : "",
    "parentId" : "39",
    "taglist" : [ "first-tag" ],
    "text" : "skrollr - parallax scrolling "
  },
  "590" : {
    "dateAddedLocal" : "2/27/2019, 9:12:53 AM",
    "dateAddedUTC" : "2019-02-27T14:12:53.473Z",
    "description" : "Lorem ipsum dolor sit amet, consectetur adipiscing elit. Vivamus vel lectus ut turpis fermentum vestibulum. ",
    "favorited" : false,
    "hyperlink" : "https://calendar.google.com/calendar/r/week",
    "id" : "589",
    "index" : 311,
    "lastlocation" : -1,
    "newtag" : "",
    "parentId" : "1",
    "taglist" : [ "first-tag" ],
    "text" : "Google Calendar - Week of February 24, 2019"
  },
  "591" : {
    "dateAddedLocal" : "1/6/2016, 9:45:35 PM",
    "dateAddedUTC" : "2016-01-07T02:45:35.436Z",
    "description" : "Lorem ipsum dolor sit amet, consectetur adipiscing elit. Vivamus vel lectus ut turpis fermentum vestibulum. ",
    "favorited" : false,
    "hyperlink" : "http://imristo.com/the-ultimate-followliker-instagram-tutorial/",
    "id" : "590",
    "index" : 0,
    "lastlocation" : -1,
    "newtag" : "",
    "parentId" : "62",
    "taglist" : [ "first-tag" ],
    "text" : "instagram Followliker tut"
  },
  "592" : {
    "dateAddedLocal" : "10/12/2016, 8:27:52 AM",
    "dateAddedUTC" : "2016-10-12T12:27:52.255Z",
    "description" : "Lorem ipsum dolor sit amet, consectetur adipiscing elit. Vivamus vel lectus ut turpis fermentum vestibulum. ",
    "favorited" : false,
    "hyperlink" : "http://wbd.etibioinformatics.nl/bis/",
    "id" : "591",
    "index" : 2,
    "lastlocation" : -1,
    "newtag" : "",
    "parentId" : "666",
    "taglist" : [ "first-tag" ],
    "text" : "ETI - Search the World Biodiversity Database"
  },
  "593" : {
    "dateAddedLocal" : "12/7/2017, 7:28:24 AM",
    "dateAddedUTC" : "2017-12-07T12:28:24.683Z",
    "description" : "Lorem ipsum dolor sit amet, consectetur adipiscing elit. Vivamus vel lectus ut turpis fermentum vestibulum. ",
    "favorited" : false,
    "hyperlink" : "https://www.taxesforexpats.com/",
    "id" : "592",
    "index" : 93,
    "lastlocation" : -1,
    "newtag" : "",
    "parentId" : "1",
    "taglist" : [ "first-tag" ],
    "text" : "taxes"
  },
  "594" : {
    "dateAddedLocal" : "6/22/2014, 1:52:29 PM",
    "dateAddedUTC" : "2014-06-22T17:52:29.559Z",
    "description" : "Lorem ipsum dolor sit amet, consectetur adipiscing elit. Vivamus vel lectus ut turpis fermentum vestibulum. ",
    "favorited" : false,
    "hyperlink" : "https://www.youtube.com/watch?v=nZoQkge-7nc",
    "id" : "593",
    "index" : 23,
    "lastlocation" : -1,
    "newtag" : "",
    "parentId" : "49",
    "taglist" : [ "first-tag" ],
    "text" : "Kidnap Kid | Dope Post Party / Late Party"
  },
  "595" : {
    "dateAddedLocal" : "1/17/2016, 1:25:46 AM",
    "dateAddedUTC" : "2016-01-17T06:25:46.763Z",
    "description" : "Lorem ipsum dolor sit amet, consectetur adipiscing elit. Vivamus vel lectus ut turpis fermentum vestibulum. ",
    "favorited" : false,
    "hyperlink" : "https://developers.google.com/structured-data/testing-tool/",
    "id" : "594",
    "index" : 17,
    "lastlocation" : -1,
    "newtag" : "",
    "parentId" : "65",
    "taglist" : [ "first-tag" ],
    "text" : "Rich Snippet testing tool"
  },
  "596" : {
    "dateAddedLocal" : "4/16/2017, 4:29:51 PM",
    "dateAddedUTC" : "2017-04-16T20:29:51.224Z",
    "description" : "Lorem ipsum dolor sit amet, consectetur adipiscing elit. Vivamus vel lectus ut turpis fermentum vestibulum. ",
    "favorited" : false,
    "hyperlink" : "http://telekommunisten.net/",
    "id" : "595",
    "index" : 219,
    "lastlocation" : -1,
    "newtag" : "",
    "parentId" : "1",
    "taglist" : [ "first-tag" ],
    "text" : "Telekommunisten â€” the revolution is calling"
  },
  "597" : {
    "dateAddedLocal" : "6/22/2018, 5:35:54 PM",
    "dateAddedUTC" : "2018-06-22T21:35:54.187Z",
    "description" : "Lorem ipsum dolor sit amet, consectetur adipiscing elit. Vivamus vel lectus ut turpis fermentum vestibulum. ",
    "favorited" : false,
    "hyperlink" : "https://course.ccs.neu.edu/cs3500/#%28part._materials%29",
    "id" : "596",
    "index" : 69,
    "lastlocation" : -1,
    "newtag" : "",
    "parentId" : "2",
    "taglist" : [ "first-tag" ],
    "text" : "CS 3500: Object-Oriented Design"
  },
  "598" : {
    "dateAddedLocal" : "2/22/2018, 10:14:59 PM",
    "dateAddedUTC" : "2018-02-23T03:14:59.258Z",
    "description" : "Lorem ipsum dolor sit amet, consectetur adipiscing elit. Vivamus vel lectus ut turpis fermentum vestibulum. ",
    "favorited" : false,
    "hyperlink" : "http://jsomers.net/hn/",
    "id" : "597",
    "index" : 68,
    "lastlocation" : -1,
    "newtag" : "",
    "parentId" : "2",
    "taglist" : [ "first-tag" ],
    "text" : "The Hacker Classics"
  },
  "599" : {
    "dateAddedLocal" : "10/12/2015, 1:26:58 PM",
    "dateAddedUTC" : "2015-10-12T17:26:58.169Z",
    "description" : "Lorem ipsum dolor sit amet, consectetur adipiscing elit. Vivamus vel lectus ut turpis fermentum vestibulum. ",
    "favorited" : false,
    "hyperlink" : "http://alistapart.com/article/using-responsive-images-now",
    "id" : "598",
    "index" : 12,
    "lastlocation" : -1,
    "newtag" : "",
    "parentId" : "48",
    "taglist" : [ "first-tag" ],
    "text" : "unnamed"
  },
  "600" : {
    "dateAddedLocal" : "12/4/2018, 7:10:02 PM",
    "dateAddedUTC" : "2018-12-05T00:10:02.822Z",
    "description" : "Lorem ipsum dolor sit amet, consectetur adipiscing elit. Vivamus vel lectus ut turpis fermentum vestibulum. ",
    "favorited" : false,
    "hyperlink" : "https://zeplin.io/",
    "id" : "599",
    "index" : 286,
    "lastlocation" : -1,
    "newtag" : "",
    "parentId" : "1",
    "taglist" : [ "first-tag" ],
    "text" : "unnamed"
  },
  "601" : {
    "dateAddedLocal" : "7/2/2014, 12:26:50 PM",
    "dateAddedUTC" : "2014-07-02T16:26:50.413Z",
    "description" : "Lorem ipsum dolor sit amet, consectetur adipiscing elit. Vivamus vel lectus ut turpis fermentum vestibulum. ",
    "favorited" : false,
    "id" : "600",
    "index" : 10,
    "lastlocation" : -1,
    "newtag" : "",
    "parentId" : "16",
    "taglist" : [ "first-tag" ],
    "text" : "d3l"
  },
  "602" : {
    "dateAddedLocal" : "8/9/2018, 1:24:26 PM",
    "dateAddedUTC" : "2018-08-09T17:24:26.586Z",
    "description" : "Lorem ipsum dolor sit amet, consectetur adipiscing elit. Vivamus vel lectus ut turpis fermentum vestibulum. ",
    "favorited" : false,
    "hyperlink" : "https://eikon.thomsonreuters.com/index.html",
    "id" : "601",
    "index" : 2,
    "lastlocation" : -1,
    "newtag" : "",
    "parentId" : "498",
    "taglist" : [ "first-tag" ],
    "text" : "Thomson Reuters Eikon"
  },
  "603" : {
    "dateAddedLocal" : "8/31/2016, 5:06:50 PM",
    "dateAddedUTC" : "2016-08-31T21:06:50.614Z",
    "description" : "Lorem ipsum dolor sit amet, consectetur adipiscing elit. Vivamus vel lectus ut turpis fermentum vestibulum. ",
    "favorited" : false,
    "hyperlink" : "https://riccardoscalco.github.io/textures/",
    "id" : "602",
    "index" : 189,
    "lastlocation" : -1,
    "newtag" : "",
    "parentId" : "1",
    "taglist" : [ "first-tag" ],
    "text" : "Textures.js | textures for Data Viz "
  },
  "604" : {
    "dateAddedLocal" : "4/30/2017, 6:30:39 PM",
    "dateAddedUTC" : "2017-04-30T22:30:39.482Z",
    "description" : "Lorem ipsum dolor sit amet, consectetur adipiscing elit. Vivamus vel lectus ut turpis fermentum vestibulum. ",
    "favorited" : false,
    "hyperlink" : "https://jobbatical.com/explore",
    "id" : "603",
    "index" : 224,
    "lastlocation" : -1,
    "newtag" : "",
    "parentId" : "1",
    "taglist" : [ "first-tag" ],
    "text" : "Explore available positions - Jobbatical"
  },
  "605" : {
    "dateAddedLocal" : "10/22/2017, 10:30:40 AM",
    "dateAddedUTC" : "2017-10-22T14:30:40.458Z",
    "description" : "Lorem ipsum dolor sit amet, consectetur adipiscing elit. Vivamus vel lectus ut turpis fermentum vestibulum. ",
    "favorited" : false,
    "hyperlink" : "http://valudio.com/en",
    "id" : "604",
    "index" : 2,
    "lastlocation" : -1,
    "newtag" : "",
    "parentId" : "549",
    "taglist" : [ "first-tag" ],
    "text" : "Home | Valudio"
  },
  "606" : {
    "dateAddedLocal" : "12/14/2018, 4:05:41 PM",
    "dateAddedUTC" : "2018-12-14T21:05:41.422Z",
    "description" : "Lorem ipsum dolor sit amet, consectetur adipiscing elit. Vivamus vel lectus ut turpis fermentum vestibulum. ",
    "favorited" : false,
    "hyperlink" : "https://mosaic-2.disqus.com/admin/settings/moderators/",
    "id" : "605",
    "index" : 282,
    "lastlocation" : -1,
    "newtag" : "",
    "parentId" : "1",
    "taglist" : [ "first-tag" ],
    "text" : "unnamed"
  },
  "607" : {
    "dateAddedLocal" : "11/1/2013, 12:49:30 PM",
    "dateAddedUTC" : "2013-11-01T16:49:30.026Z",
    "description" : "Lorem ipsum dolor sit amet, consectetur adipiscing elit. Vivamus vel lectus ut turpis fermentum vestibulum. ",
    "favorited" : false,
    "hyperlink" : "http://crew.ccs.neu.edu/index.html",
    "id" : "606",
    "index" : 2,
    "lastlocation" : -1,
    "newtag" : "",
    "parentId" : "18",
    "taglist" : [ "first-tag" ],
    "text" : "unnamed"
  },
  "608" : {
    "dateAddedLocal" : "3/30/2015, 10:10:26 PM",
    "dateAddedUTC" : "2015-03-31T02:10:26.137Z",
    "description" : "Lorem ipsum dolor sit amet, consectetur adipiscing elit. Vivamus vel lectus ut turpis fermentum vestibulum. ",
    "favorited" : false,
    "hyperlink" : "https://www.behance.net/gallery/24855929/4-Free-Handwritten-Custom-Fonts",
    "id" : "607",
    "index" : 2,
    "lastlocation" : -1,
    "newtag" : "",
    "parentId" : "311",
    "taglist" : [ "first-tag" ],
    "text" : "4 Free Handwritten Custom Fonts on Behance"
  },
  "609" : {
    "dateAddedLocal" : "7/5/2014, 12:33:56 AM",
    "dateAddedUTC" : "2014-07-05T04:33:56.442Z",
    "description" : "Lorem ipsum dolor sit amet, consectetur adipiscing elit. Vivamus vel lectus ut turpis fermentum vestibulum. ",
    "favorited" : false,
    "id" : "608",
    "index" : 29,
    "lastlocation" : -1,
    "newtag" : "",
    "parentId" : "2",
    "taglist" : [ "first-tag" ],
    "text" : "FeT"
  },
  "610" : {
    "dateAddedLocal" : "4/16/2017, 5:28:57 PM",
    "dateAddedUTC" : "2017-04-16T21:28:57.704Z",
    "description" : "Lorem ipsum dolor sit amet, consectetur adipiscing elit. Vivamus vel lectus ut turpis fermentum vestibulum. ",
    "favorited" : false,
    "hyperlink" : "http://www.slacklist.info/",
    "id" : "609",
    "index" : 220,
    "lastlocation" : -1,
    "newtag" : "",
    "parentId" : "1",
    "taglist" : [ "first-tag" ],
    "text" : "Slack List"
  },
  "611" : {
    "dateAddedLocal" : "7/5/2016, 12:32:06 PM",
    "dateAddedUTC" : "2016-07-05T16:32:06.892Z",
    "description" : "Lorem ipsum dolor sit amet, consectetur adipiscing elit. Vivamus vel lectus ut turpis fermentum vestibulum. ",
    "favorited" : false,
    "hyperlink" : "http://flowingdata.com/",
    "id" : "610",
    "index" : 174,
    "lastlocation" : -1,
    "newtag" : "",
    "parentId" : "1",
    "taglist" : [ "first-tag" ],
    "text" : "unnamed"
  },
  "612" : {
    "dateAddedLocal" : "5/10/2017, 4:31:03 PM",
    "dateAddedUTC" : "2017-05-10T20:31:03.970Z",
    "description" : "Lorem ipsum dolor sit amet, consectetur adipiscing elit. Vivamus vel lectus ut turpis fermentum vestibulum. ",
    "favorited" : false,
    "hyperlink" : "http://www.hankboughtabus.com/",
    "id" : "611",
    "index" : 225,
    "lastlocation" : -1,
    "newtag" : "",
    "parentId" : "1",
    "taglist" : [ "first-tag" ],
    "text" : "Hank Bought A Bus | Sometimes the best plan is to not have oneâ€¦"
  },
  "613" : {
    "dateAddedLocal" : "9/22/2015, 10:42:58 AM",
    "dateAddedUTC" : "2015-09-22T14:42:58.681Z",
    "description" : "Lorem ipsum dolor sit amet, consectetur adipiscing elit. Vivamus vel lectus ut turpis fermentum vestibulum. ",
    "favorited" : false,
    "hyperlink" : "http://visualjournal.it/",
    "id" : "612",
    "index" : 57,
    "lastlocation" : -1,
    "newtag" : "",
    "parentId" : "2",
    "taglist" : [ "first-tag" ],
    "text" : "unnamed"
  },
  "614" : {
    "dateAddedLocal" : "9/11/2014, 8:49:43 PM",
    "dateAddedUTC" : "2014-09-12T00:49:43.860Z",
    "description" : "Lorem ipsum dolor sit amet, consectetur adipiscing elit. Vivamus vel lectus ut turpis fermentum vestibulum. ",
    "favorited" : false,
    "hyperlink" : "http://hypem.com/premiere/daisuke+tanabe",
    "id" : "613",
    "index" : 13,
    "lastlocation" : -1,
    "newtag" : "",
    "parentId" : "49",
    "taglist" : [ "first-tag" ],
    "text" : "Daisuke Tanabe - Floating Underwater: Exclusive Album Premiere on Hype Machine"
  },
  "615" : {
    "dateAddedLocal" : "3/11/2015, 12:02:58 AM",
    "dateAddedUTC" : "2015-03-11T04:02:58.180Z",
    "description" : "Lorem ipsum dolor sit amet, consectetur adipiscing elit. Vivamus vel lectus ut turpis fermentum vestibulum. ",
    "favorited" : false,
    "hyperlink" : "http://type-scale.com/",
    "id" : "614",
    "index" : 3,
    "lastlocation" : -1,
    "newtag" : "",
    "parentId" : "311",
    "taglist" : [ "first-tag" ],
    "text" : "Type Scale - A Visual Calculator"
  },
  "616" : {
    "dateAddedLocal" : "4/7/2015, 3:38:07 PM",
    "dateAddedUTC" : "2015-04-07T19:38:07.630Z",
    "description" : "Lorem ipsum dolor sit amet, consectetur adipiscing elit. Vivamus vel lectus ut turpis fermentum vestibulum. ",
    "favorited" : false,
    "hyperlink" : "http://bbhbarn.com/",
    "id" : "615",
    "index" : 8,
    "lastlocation" : -1,
    "newtag" : "",
    "parentId" : "29",
    "taglist" : [ "first-tag" ],
    "text" : "BBH BARN APPLICATIONS"
  },
  "617" : {
    "dateAddedLocal" : "7/29/2014, 10:51:05 PM",
    "dateAddedUTC" : "2014-07-30T02:51:05.717Z",
    "description" : "Lorem ipsum dolor sit amet, consectetur adipiscing elit. Vivamus vel lectus ut turpis fermentum vestibulum. ",
    "favorited" : false,
    "hyperlink" : "https://www.youtube.com/watch?v=bnlFuPRxH8w&list=PLDfKAXSi6kUZczwycO8UcABjn-w3WJ_71&index=2",
    "id" : "616",
    "index" : 31,
    "lastlocation" : -1,
    "newtag" : "",
    "parentId" : "49",
    "taglist" : [ "first-tag" ],
    "text" : "beautiful classical downtemo"
  },
  "618" : {
    "dateAddedLocal" : "1/17/2016, 1:02:24 AM",
    "dateAddedUTC" : "2016-01-17T06:02:24.176Z",
    "description" : "Lorem ipsum dolor sit amet, consectetur adipiscing elit. Vivamus vel lectus ut turpis fermentum vestibulum. ",
    "favorited" : false,
    "hyperlink" : "http://webcache.googleusercontent.com/search?q=cache:herbalvapes.me&num=1&strip=1&vwsrc=0",
    "id" : "617",
    "index" : 16,
    "lastlocation" : -1,
    "newtag" : "",
    "parentId" : "65",
    "taglist" : [ "first-tag" ],
    "text" : "Cached Webpage"
  },
  "619" : {
    "dateAddedLocal" : "1/6/2016, 11:23:04 PM",
    "dateAddedUTC" : "2016-01-07T04:23:04.477Z",
    "description" : "Lorem ipsum dolor sit amet, consectetur adipiscing elit. Vivamus vel lectus ut turpis fermentum vestibulum. ",
    "favorited" : false,
    "hyperlink" : "http://socialkingmaker.com/instagram-automation-instagress-vs-followliker/",
    "id" : "618",
    "index" : 1,
    "lastlocation" : -1,
    "newtag" : "",
    "parentId" : "62",
    "taglist" : [ "first-tag" ],
    "text" : "Instagram Automation - Instagress vs Followliker"
  },
  "620" : {
    "dateAddedLocal" : "10/18/2016, 8:23:28 PM",
    "dateAddedUTC" : "2016-10-19T00:23:28.767Z",
    "description" : "Lorem ipsum dolor sit amet, consectetur adipiscing elit. Vivamus vel lectus ut turpis fermentum vestibulum. ",
    "favorited" : false,
    "hyperlink" : "https://www.crummy.com/software/BeautifulSoup/bs4/doc/#quick-start",
    "id" : "619",
    "index" : 6,
    "lastlocation" : -1,
    "newtag" : "",
    "parentId" : "666",
    "taglist" : [ "first-tag" ],
    "text" : "Beautiful Soup Documentation â€” Beautiful Soup 4.4.0 documentation"
  },
  "621" : {
    "dateAddedLocal" : "3/24/2018, 9:10:37 PM",
    "dateAddedUTC" : "2018-03-25T01:10:37.121Z",
    "description" : "Lorem ipsum dolor sit amet, consectetur adipiscing elit. Vivamus vel lectus ut turpis fermentum vestibulum. ",
    "favorited" : false,
    "hyperlink" : "https://talk.collegeconfidential.com/business-school-mba/",
    "id" : "620",
    "index" : 71,
    "lastlocation" : -1,
    "newtag" : "",
    "parentId" : "1",
    "taglist" : [ "first-tag" ],
    "text" : "mba"
  },
  "622" : {
    "dateAddedLocal" : "4/14/2019, 10:51:19 PM",
    "dateAddedUTC" : "2019-04-15T02:51:19.515Z",
    "description" : "Lorem ipsum dolor sit amet, consectetur adipiscing elit. Vivamus vel lectus ut turpis fermentum vestibulum. ",
    "favorited" : false,
    "hyperlink" : "https://github.com/dboudro",
    "id" : "621",
    "index" : 324,
    "lastlocation" : -1,
    "newtag" : "",
    "parentId" : "1",
    "taglist" : [ "first-tag" ],
    "text" : "                       (1) (1) (2)"
  },
  "623" : {
    "dateAddedLocal" : "1/6/2019, 1:07:22 PM",
    "dateAddedUTC" : "2019-01-06T18:07:22.780Z",
    "description" : "Lorem ipsum dolor sit amet, consectetur adipiscing elit. Vivamus vel lectus ut turpis fermentum vestibulum. ",
    "favorited" : false,
    "hyperlink" : "https://trello.com/b/hmXXV4u3/webapp-analytics",
    "id" : "622",
    "index" : 254,
    "lastlocation" : -1,
    "newtag" : "",
    "parentId" : "1",
    "taglist" : [ "first-tag" ],
    "text" : "unnamed"
  },
  "624" : {
    "dateAddedLocal" : "9/2/2015, 10:18:36 AM",
    "dateAddedUTC" : "2015-09-02T14:18:36.362Z",
    "description" : "Lorem ipsum dolor sit amet, consectetur adipiscing elit. Vivamus vel lectus ut turpis fermentum vestibulum. ",
    "favorited" : false,
    "hyperlink" : "http://www.dharmaseed.org/talks/",
    "id" : "623",
    "index" : 3,
    "lastlocation" : -1,
    "newtag" : "",
    "parentId" : "10",
    "taglist" : [ "first-tag" ],
    "text" : "Dharma Seed - Dharma Talks"
  },
  "625" : {
    "dateAddedLocal" : "7/20/2014, 1:09:30 AM",
    "dateAddedUTC" : "2014-07-20T05:09:30.995Z",
    "description" : "Lorem ipsum dolor sit amet, consectetur adipiscing elit. Vivamus vel lectus ut turpis fermentum vestibulum. ",
    "favorited" : false,
    "hyperlink" : "http://thetoolbox.cc/",
    "id" : "624",
    "index" : 2,
    "lastlocation" : -1,
    "newtag" : "",
    "parentId" : "9",
    "taglist" : [ "first-tag" ],
    "text" : "Web design tools"
  },
  "626" : {
    "dateAddedLocal" : "11/22/2014, 3:44:46 PM",
    "dateAddedUTC" : "2014-11-22T20:44:46.160Z",
    "description" : "Lorem ipsum dolor sit amet, consectetur adipiscing elit. Vivamus vel lectus ut turpis fermentum vestibulum. ",
    "favorited" : false,
    "hyperlink" : "http://www.jslint.com/",
    "id" : "625",
    "index" : 16,
    "lastlocation" : -1,
    "newtag" : "",
    "parentId" : "39",
    "taglist" : [ "first-tag" ],
    "text" : "JSLint,The JavaScript Code Quality Tool"
  },
  "627" : {
    "dateAddedLocal" : "7/4/2014, 1:21:15 PM",
    "dateAddedUTC" : "2014-07-04T17:21:15.448Z",
    "description" : "Lorem ipsum dolor sit amet, consectetur adipiscing elit. Vivamus vel lectus ut turpis fermentum vestibulum. ",
    "favorited" : false,
    "id" : "626",
    "index" : 32,
    "lastlocation" : -1,
    "newtag" : "",
    "parentId" : "2",
    "taglist" : [ "first-tag" ],
    "text" : "FeR"
  },
  "628" : {
    "dateAddedLocal" : "3/31/2015, 3:39:35 PM",
    "dateAddedUTC" : "2015-03-31T19:39:35.362Z",
    "description" : "Lorem ipsum dolor sit amet, consectetur adipiscing elit. Vivamus vel lectus ut turpis fermentum vestibulum. ",
    "favorited" : false,
    "hyperlink" : "http://t.co/8DjvPyYKF1",
    "id" : "627",
    "index" : 6,
    "lastlocation" : -1,
    "newtag" : "",
    "parentId" : "29",
    "taglist" : [ "first-tag" ],
    "text" : "http://www.policygenius.com"
  },
  "629" : {
    "dateAddedLocal" : "2/13/2015, 12:06:17 PM",
    "dateAddedUTC" : "2015-02-13T17:06:17.830Z",
    "description" : "Lorem ipsum dolor sit amet, consectetur adipiscing elit. Vivamus vel lectus ut turpis fermentum vestibulum. ",
    "favorited" : false,
    "hyperlink" : "http://alexgough.co/#/maelstrom/",
    "id" : "628",
    "index" : 4,
    "lastlocation" : -1,
    "newtag" : "",
    "parentId" : "35",
    "taglist" : [ "first-tag" ],
    "text" : "Alex Gough Maelstromer"
  },
  "630" : {
    "dateAddedLocal" : "9/21/2016, 10:32:42 AM",
    "dateAddedUTC" : "2016-09-21T14:32:42.206Z",
    "description" : "Lorem ipsum dolor sit amet, consectetur adipiscing elit. Vivamus vel lectus ut turpis fermentum vestibulum. ",
    "favorited" : false,
    "hyperlink" : "http://www.getthefont.com/",
    "id" : "629",
    "index" : 196,
    "lastlocation" : -1,
    "newtag" : "",
    "parentId" : "1",
    "taglist" : [ "first-tag" ],
    "text" : "Get the Font"
  },
  "631" : {
    "dateAddedLocal" : "8/27/2014, 4:31:03 PM",
    "dateAddedUTC" : "2014-08-27T20:31:03.910Z",
    "description" : "Lorem ipsum dolor sit amet, consectetur adipiscing elit. Vivamus vel lectus ut turpis fermentum vestibulum. ",
    "favorited" : false,
    "hyperlink" : "https://www.etsy.com/listing/127302322/vintage-kikkoman-sake-and-plum-wine?ref=sr_gallery_13&ga_search_query=sake&ga_order=most_relevant&ga_ship_to=US&ga_search_type=all&ga_view_type=gallery",
    "id" : "630",
    "index" : 3,
    "lastlocation" : -1,
    "newtag" : "",
    "parentId" : "15",
    "taglist" : [ "first-tag" ],
    "text" : "Vintage Sake"
  },
  "632" : {
    "dateAddedLocal" : "9/24/2015, 3:46:17 PM",
    "dateAddedUTC" : "2015-09-24T19:46:17.026Z",
    "description" : "Lorem ipsum dolor sit amet, consectetur adipiscing elit. Vivamus vel lectus ut turpis fermentum vestibulum. ",
    "favorited" : false,
    "hyperlink" : "http://bencallahan.com/",
    "id" : "631",
    "index" : 6,
    "lastlocation" : -1,
    "newtag" : "",
    "parentId" : "50",
    "taglist" : [ "first-tag" ],
    "text" : "Ben Callahan"
  },
  "633" : {
    "dateAddedLocal" : "4/6/2015, 1:30:29 AM",
    "dateAddedUTC" : "2015-04-06T05:30:29.287Z",
    "description" : "Lorem ipsum dolor sit amet, consectetur adipiscing elit. Vivamus vel lectus ut turpis fermentum vestibulum. ",
    "favorited" : false,
    "hyperlink" : "http://clementgrellier.fr/",
    "id" : "632",
    "index" : 15,
    "lastlocation" : -1,
    "newtag" : "",
    "parentId" : "35",
    "taglist" : [ "first-tag" ],
    "text" : "ClÃ©ment Grellier â€” Front-end developer"
  },
  "634" : {
    "dateAddedLocal" : "7/19/2014, 9:17:32 AM",
    "dateAddedUTC" : "2014-07-19T13:17:32.359Z",
    "description" : "Lorem ipsum dolor sit amet, consectetur adipiscing elit. Vivamus vel lectus ut turpis fermentum vestibulum. ",
    "favorited" : false,
    "hyperlink" : "https://github.com/sorrycc/awesome-javascript",
    "id" : "633",
    "index" : 5,
    "lastlocation" : -1,
    "newtag" : "",
    "parentId" : "36",
    "taglist" : [ "first-tag" ],
    "text" : "awesome js list of resources"
  },
  "635" : {
    "dateAddedLocal" : "5/10/2012, 10:20:04 AM",
    "dateAddedUTC" : "2012-05-10T14:20:04.931Z",
    "description" : "Lorem ipsum dolor sit amet, consectetur adipiscing elit. Vivamus vel lectus ut turpis fermentum vestibulum. ",
    "favorited" : false,
    "hyperlink" : "http://steve-yegge.blogspot.com/2008/03/get-that-job-at-google.html",
    "id" : "634",
    "index" : 0,
    "lastlocation" : -1,
    "newtag" : "",
    "parentId" : "11",
    "taglist" : [ "first-tag" ],
    "text" : "Stevey's Blog Rants: Get that job at Google"
  },
  "636" : {
    "dateAddedLocal" : "8/15/2014, 1:22:59 PM",
    "dateAddedUTC" : "2014-08-15T17:22:59.015Z",
    "description" : "Lorem ipsum dolor sit amet, consectetur adipiscing elit. Vivamus vel lectus ut turpis fermentum vestibulum. ",
    "favorited" : false,
    "hyperlink" : "http://www.liquiddnb.com/mix/psyco-liquidator-series-56-soulful-xmas-session-december-2012",
    "id" : "635",
    "index" : 5,
    "lastlocation" : -1,
    "newtag" : "",
    "parentId" : "164",
    "taglist" : [ "first-tag" ],
    "text" : "Liquidator series"
  },
  "637" : {
    "dateAddedLocal" : "4/22/2018, 12:48:57 PM",
    "dateAddedUTC" : "2018-04-22T16:48:57.315Z",
    "description" : "Lorem ipsum dolor sit amet, consectetur adipiscing elit. Vivamus vel lectus ut turpis fermentum vestibulum. ",
    "favorited" : false,
    "hyperlink" : "http://www.spacex.com/careers/position/215607",
    "id" : "636",
    "index" : 0,
    "lastlocation" : -1,
    "newtag" : "",
    "parentId" : "522",
    "taglist" : [ "first-tag" ],
    "text" : "Front End Software Engineer - Displays WA | SpaceX"
  },
  "638" : {
    "dateAddedLocal" : "9/24/2015, 4:05:24 PM",
    "dateAddedUTC" : "2015-09-24T20:05:24.776Z",
    "description" : "Lorem ipsum dolor sit amet, consectetur adipiscing elit. Vivamus vel lectus ut turpis fermentum vestibulum. ",
    "favorited" : false,
    "hyperlink" : "http://blog.teamtreehouse.com/beginners-guide-to-responsive-web-design",
    "id" : "637",
    "index" : 4,
    "lastlocation" : -1,
    "newtag" : "",
    "parentId" : "48",
    "taglist" : [ "first-tag" ],
    "text" : "Beginnerâ€™s Guide to Responsive Web Design - Treehouse Blog"
  },
  "639" : {
    "dateAddedLocal" : "9/30/2015, 12:20:21 PM",
    "dateAddedUTC" : "2015-09-30T16:20:21.058Z",
    "description" : "Lorem ipsum dolor sit amet, consectetur adipiscing elit. Vivamus vel lectus ut turpis fermentum vestibulum. ",
    "favorited" : false,
    "hyperlink" : "http://chris.com/",
    "id" : "638",
    "index" : 47,
    "lastlocation" : -1,
    "newtag" : "",
    "parentId" : "2",
    "taglist" : [ "first-tag" ],
    "text" : "ascii art"
  },
  "640" : {
    "dateAddedLocal" : "3/20/2019, 2:21:27 PM",
    "dateAddedUTC" : "2019-03-20T18:21:27.584Z",
    "description" : "Lorem ipsum dolor sit amet, consectetur adipiscing elit. Vivamus vel lectus ut turpis fermentum vestibulum. ",
    "favorited" : false,
    "hyperlink" : "https://github.com/dboudro/SuperFood-Store",
    "id" : "639",
    "index" : 319,
    "lastlocation" : -1,
    "newtag" : "",
    "parentId" : "1",
    "taglist" : [ "first-tag" ],
    "text" : "dboudro/SuperFood-Store: Data-visual SPA store of super foods"
  },
  "641" : {
    "dateAddedLocal" : "11/12/2013, 9:35:41 PM",
    "dateAddedUTC" : "2013-11-13T02:35:41.568Z",
    "description" : "Lorem ipsum dolor sit amet, consectetur adipiscing elit. Vivamus vel lectus ut turpis fermentum vestibulum. ",
    "favorited" : false,
    "hyperlink" : "http://www.youtube.com/watch?v=LD2RuL2nibQ",
    "id" : "640",
    "index" : 4,
    "lastlocation" : -1,
    "newtag" : "",
    "parentId" : "180",
    "taglist" : [ "first-tag" ],
    "text" : "the Cinematic Orchestra - Burn Out - YouTube"
  },
  "642" : {
    "dateAddedLocal" : "10/30/2013, 11:20:44 AM",
    "dateAddedUTC" : "2013-10-30T15:20:44.448Z",
    "description" : "Lorem ipsum dolor sit amet, consectetur adipiscing elit. Vivamus vel lectus ut turpis fermentum vestibulum. ",
    "favorited" : false,
    "id" : "641",
    "index" : 11,
    "lastlocation" : -1,
    "newtag" : "",
    "parentId" : "2",
    "taglist" : [ "first-tag" ],
    "text" : "Groups"
  },
  "643" : {
    "dateAddedLocal" : "9/28/2017, 4:23:16 PM",
    "dateAddedUTC" : "2017-09-28T20:23:16.926Z",
    "description" : "Lorem ipsum dolor sit amet, consectetur adipiscing elit. Vivamus vel lectus ut turpis fermentum vestibulum. ",
    "favorited" : false,
    "id" : "642",
    "index" : 151,
    "lastlocation" : -1,
    "newtag" : "",
    "parentId" : "1",
    "taglist" : [ "first-tag" ],
    "text" : "5d"
  },
  "644" : {
    "dateAddedLocal" : "10/30/2013, 8:20:49 PM",
    "dateAddedUTC" : "2013-10-31T00:20:49.679Z",
    "description" : "Lorem ipsum dolor sit amet, consectetur adipiscing elit. Vivamus vel lectus ut turpis fermentum vestibulum. ",
    "favorited" : false,
    "hyperlink" : "http://www.youtube.com/watch?v=OAHbIanHM3o",
    "id" : "643",
    "index" : 18,
    "lastlocation" : -1,
    "newtag" : "",
    "parentId" : "49",
    "taglist" : [ "first-tag" ],
    "text" : "Shades of Culture - Mindstate - YouTube"
  },
  "645" : {
    "dateAddedLocal" : "12/1/2016, 9:29:52 PM",
    "dateAddedUTC" : "2016-12-02T02:29:52.710Z",
    "description" : "Lorem ipsum dolor sit amet, consectetur adipiscing elit. Vivamus vel lectus ut turpis fermentum vestibulum. ",
    "favorited" : false,
    "hyperlink" : "https://www.google.com/search?q=astronaut+patches&safe=off&source=lnms&tbm=isch&sa=X&ved=0ahUKEwiogu6A6tPQAhVqyVQKHU7_DYMQ_AUICSgC&biw=1280&bih=703#imgrc=K1gJKS3xYaRvJM%3A",
    "id" : "644",
    "index" : 0,
    "lastlocation" : -1,
    "newtag" : "",
    "parentId" : "670",
    "taglist" : [ "first-tag" ],
    "text" : "astronaut patches - Google Search"
  },
  "646" : {
    "dateAddedLocal" : "6/4/2017, 1:54:09 PM",
    "dateAddedUTC" : "2017-06-04T17:54:09.576Z",
    "description" : "Lorem ipsum dolor sit amet, consectetur adipiscing elit. Vivamus vel lectus ut turpis fermentum vestibulum. ",
    "favorited" : false,
    "hyperlink" : "http://rickwaalders.com/",
    "id" : "645",
    "index" : 3,
    "lastlocation" : -1,
    "newtag" : "",
    "parentId" : "76",
    "taglist" : [ "first-tag" ],
    "text" : "Rick Waalders - Graphic Designer & Developer"
  },
  "647" : {
    "dateAddedLocal" : "7/8/2018, 7:54:55 PM",
    "dateAddedUTC" : "2018-07-08T23:54:55.101Z",
    "description" : "Lorem ipsum dolor sit amet, consectetur adipiscing elit. Vivamus vel lectus ut turpis fermentum vestibulum. ",
    "favorited" : false,
    "hyperlink" : "https://drive.google.com/file/d/1rFCIg-eH6CxBfgZNQW40U44m3NIqa_5v/view?usp=drive_web",
    "id" : "646",
    "index" : 4,
    "lastlocation" : -1,
    "newtag" : "",
    "parentId" : "502",
    "taglist" : [ "first-tag" ],
    "text" : "Kat Data Viz"
  },
  "648" : {
    "dateAddedLocal" : "4/1/2015, 11:54:02 AM",
    "dateAddedUTC" : "2015-04-01T15:54:02.212Z",
    "description" : "Lorem ipsum dolor sit amet, consectetur adipiscing elit. Vivamus vel lectus ut turpis fermentum vestibulum. ",
    "favorited" : false,
    "hyperlink" : "http://kamina-web.stage1.mybluemix.net/#welcome",
    "id" : "647",
    "index" : 4,
    "lastlocation" : -1,
    "newtag" : "",
    "parentId" : "28",
    "taglist" : [ "first-tag" ],
    "text" : "Prototype A Carlos"
  },
  "649" : {
    "dateAddedLocal" : "3/24/2015, 5:31:04 PM",
    "dateAddedUTC" : "2015-03-24T21:31:04.099Z",
    "description" : "Lorem ipsum dolor sit amet, consectetur adipiscing elit. Vivamus vel lectus ut turpis fermentum vestibulum. ",
    "favorited" : false,
    "hyperlink" : "https://www.youtube.com/watch?v=mVWeqAPQUXc&list=PLymTDGcOOxZCTkXfsG34xlsXJ7TA02ynl",
    "id" : "648",
    "index" : 42,
    "lastlocation" : -1,
    "newtag" : "",
    "parentId" : "49",
    "taglist" : [ "first-tag" ],
    "text" : "Miike Snow - Animal - YouTube"
  },
  "650" : {
    "dateAddedLocal" : "9/24/2015, 3:43:43 PM",
    "dateAddedUTC" : "2015-09-24T19:43:43.397Z",
    "description" : "Lorem ipsum dolor sit amet, consectetur adipiscing elit. Vivamus vel lectus ut turpis fermentum vestibulum. ",
    "favorited" : false,
    "hyperlink" : "http://bradfrost.github.io/this-is-responsive/",
    "id" : "649",
    "index" : 0,
    "lastlocation" : -1,
    "newtag" : "",
    "parentId" : "51",
    "taglist" : [ "first-tag" ],
    "text" : "This Is Responsive | Patterns and Resources for Responsive Web Design"
  },
  "651" : {
    "dateAddedLocal" : "5/10/2016, 9:11:07 PM",
    "dateAddedUTC" : "2016-05-11T01:11:07.014Z",
    "description" : "Lorem ipsum dolor sit amet, consectetur adipiscing elit. Vivamus vel lectus ut turpis fermentum vestibulum. ",
    "favorited" : false,
    "hyperlink" : "http://www.glitchet.com/resources",
    "id" : "650",
    "index" : 170,
    "lastlocation" : -1,
    "newtag" : "",
    "parentId" : "1",
    "taglist" : [ "first-tag" ],
    "text" : "Glitchet: Art Resources"
  },
  "652" : {
    "dateAddedLocal" : "10/18/2017, 11:51:48 PM",
    "dateAddedUTC" : "2017-10-19T03:51:48.283Z",
    "description" : "Lorem ipsum dolor sit amet, consectetur adipiscing elit. Vivamus vel lectus ut turpis fermentum vestibulum. ",
    "favorited" : false,
    "hyperlink" : "https://wwwssr23.supercp.com:2083/",
    "id" : "651",
    "index" : 99,
    "lastlocation" : -1,
    "newtag" : "",
    "parentId" : "1",
    "taglist" : [ "first-tag" ],
    "text" : "a2 cpanel"
  },
  "653" : {
    "dateAddedLocal" : "7/10/2018, 2:44:44 PM",
    "dateAddedUTC" : "2018-07-10T18:44:44.820Z",
    "description" : "Lorem ipsum dolor sit amet, consectetur adipiscing elit. Vivamus vel lectus ut turpis fermentum vestibulum. ",
    "favorited" : false,
    "hyperlink" : "http://www.favicon.cc/?action=icon&file_id=180554",
    "id" : "652",
    "index" : 44,
    "lastlocation" : -1,
    "newtag" : "",
    "parentId" : "1",
    "taglist" : [ "first-tag" ],
    "text" : "unnamed"
  },
  "654" : {
    "dateAddedLocal" : "7/13/2015, 10:06:12 AM",
    "dateAddedUTC" : "2015-07-13T14:06:12.407Z",
    "description" : "Lorem ipsum dolor sit amet, consectetur adipiscing elit. Vivamus vel lectus ut turpis fermentum vestibulum. ",
    "favorited" : false,
    "hyperlink" : "https://www.youtube.com/watch?v=JmdzX4YZEa8",
    "id" : "653",
    "index" : 46,
    "lastlocation" : -1,
    "newtag" : "",
    "parentId" : "49",
    "taglist" : [ "first-tag" ],
    "text" : "Young Thug - Calling Your Name - YouTube"
  },
  "655" : {
    "dateAddedLocal" : "10/10/2017, 8:31:09 PM",
    "dateAddedUTC" : "2017-10-11T00:31:09.455Z",
    "description" : "Lorem ipsum dolor sit amet, consectetur adipiscing elit. Vivamus vel lectus ut turpis fermentum vestibulum. ",
    "favorited" : false,
    "hyperlink" : "http://georgemauer.net/2017/10/07/csv-injection.html",
    "id" : "654",
    "index" : 232,
    "lastlocation" : -1,
    "newtag" : "",
    "parentId" : "1",
    "taglist" : [ "first-tag" ],
    "text" : "csv injection"
  },
  "656" : {
    "dateAddedLocal" : "11/28/2018, 2:51:33 PM",
    "dateAddedUTC" : "2018-11-28T19:51:33.114Z",
    "description" : "Lorem ipsum dolor sit amet, consectetur adipiscing elit. Vivamus vel lectus ut turpis fermentum vestibulum. ",
    "favorited" : false,
    "hyperlink" : "https://docs.google.com/document/d/15xMaqZQByddKh8liyArE4m4rVQV31puNqz0xdrC08yI/edit",
    "id" : "655",
    "index" : 292,
    "lastlocation" : -1,
    "newtag" : "",
    "parentId" : "1",
    "taglist" : [ "first-tag" ],
    "text" : "beta"
  },
  "657" : {
    "dateAddedLocal" : "1/14/2016, 2:22:27 AM",
    "dateAddedUTC" : "2016-01-14T07:22:27.599Z",
    "description" : "Lorem ipsum dolor sit amet, consectetur adipiscing elit. Vivamus vel lectus ut turpis fermentum vestibulum. ",
    "favorited" : false,
    "hyperlink" : "https://moz.com/blog/new-text-tag-guidelines-preview-tool",
    "id" : "656",
    "index" : 3,
    "lastlocation" : -1,
    "newtag" : "",
    "parentId" : "65",
    "taglist" : [ "first-tag" ],
    "text" : "Google Listing Previewer"
  },
  "658" : {
    "dateAddedLocal" : "3/29/2014, 1:19:39 AM",
    "dateAddedUTC" : "2014-03-29T05:19:39.898Z",
    "description" : "Lorem ipsum dolor sit amet, consectetur adipiscing elit. Vivamus vel lectus ut turpis fermentum vestibulum. ",
    "favorited" : false,
    "hyperlink" : "https://www.youtube.com/watch?v=Agl1TgVfls0",
    "id" : "657",
    "index" : 5,
    "lastlocation" : -1,
    "newtag" : "",
    "parentId" : "49",
    "taglist" : [ "first-tag" ],
    "text" : "J Dilla - Life (Instrumental) - YouTube"
  },
  "659" : {
    "dateAddedLocal" : "8/13/2015, 11:03:54 AM",
    "dateAddedUTC" : "2015-08-13T15:03:54.583Z",
    "description" : "Lorem ipsum dolor sit amet, consectetur adipiscing elit. Vivamus vel lectus ut turpis fermentum vestibulum. ",
    "favorited" : false,
    "hyperlink" : "https://www.cavempt.com/",
    "id" : "658",
    "index" : 4,
    "lastlocation" : -1,
    "newtag" : "",
    "parentId" : "25",
    "taglist" : [ "first-tag" ],
    "text" : "C.E"
  },
  "660" : {
    "dateAddedLocal" : "1/15/2018, 10:14:50 PM",
    "dateAddedUTC" : "2018-01-16T03:14:50.587Z",
    "description" : "Lorem ipsum dolor sit amet, consectetur adipiscing elit. Vivamus vel lectus ut turpis fermentum vestibulum. ",
    "favorited" : false,
    "hyperlink" : "http://www.masonforest.com/blockchain/ethereum/2017/11/13/how-to-deploy-an-erc20-token-in-20-minutes.html",
    "id" : "659",
    "index" : 98,
    "lastlocation" : -1,
    "newtag" : "",
    "parentId" : "1",
    "taglist" : [ "first-tag" ],
    "text" : "deploy"
  },
  "661" : {
    "dateAddedLocal" : "7/16/2014, 10:12:55 PM",
    "dateAddedUTC" : "2014-07-17T02:12:55.455Z",
    "description" : "Lorem ipsum dolor sit amet, consectetur adipiscing elit. Vivamus vel lectus ut turpis fermentum vestibulum. ",
    "favorited" : false,
    "hyperlink" : "https://www.youtube.com/watch?v=5mDMYLyUgQE",
    "id" : "660",
    "index" : 4,
    "lastlocation" : -1,
    "newtag" : "",
    "parentId" : "164",
    "taglist" : [ "first-tag" ],
    "text" : "Liquid dnB playlist"
  },
  "662" : {
    "dateAddedLocal" : "5/24/2017, 10:39:10 PM",
    "dateAddedUTC" : "2017-05-25T02:39:10.844Z",
    "description" : "Lorem ipsum dolor sit amet, consectetur adipiscing elit. Vivamus vel lectus ut turpis fermentum vestibulum. ",
    "favorited" : false,
    "hyperlink" : "https://www.easypost.com/",
    "id" : "661",
    "index" : 0,
    "lastlocation" : -1,
    "newtag" : "",
    "parentId" : "76",
    "taglist" : [ "first-tag" ],
    "text" : "The Simple Shipping API - EasyPost"
  },
  "663" : {
    "dateAddedLocal" : "4/14/2019, 10:50:57 PM",
    "dateAddedUTC" : "2019-04-15T02:50:57.559Z",
    "description" : "Lorem ipsum dolor sit amet, consectetur adipiscing elit. Vivamus vel lectus ut turpis fermentum vestibulum. ",
    "favorited" : false,
    "hyperlink" : "https://github.com/dboudro",
    "id" : "662",
    "index" : 46,
    "lastlocation" : -1,
    "newtag" : "",
    "parentId" : "1",
    "taglist" : [ "first-tag" ],
    "text" : "                       2"
  },
  "664" : {
    "dateAddedLocal" : "2/19/2018, 11:01:36 PM",
    "dateAddedUTC" : "2018-02-20T04:01:36.253Z",
    "description" : "Lorem ipsum dolor sit amet, consectetur adipiscing elit. Vivamus vel lectus ut turpis fermentum vestibulum. ",
    "favorited" : false,
    "hyperlink" : "https://www.behance.net/gallery/55410011/Krec-Kilometry-2017-Campaign",
    "id" : "663",
    "index" : 8,
    "lastlocation" : -1,
    "newtag" : "",
    "parentId" : "549",
    "taglist" : [ "first-tag" ],
    "text" : "KrÄ™Ä‡ Kilometry 2017 Campaign on Behance"
  },
  "665" : {
    "dateAddedLocal" : "9/19/2016, 4:26:43 PM",
    "dateAddedUTC" : "2016-09-19T20:26:43.657Z",
    "description" : "Lorem ipsum dolor sit amet, consectetur adipiscing elit. Vivamus vel lectus ut turpis fermentum vestibulum. ",
    "favorited" : false,
    "hyperlink" : "http://www.camillaperkins.com/",
    "id" : "664",
    "index" : 195,
    "lastlocation" : -1,
    "newtag" : "",
    "parentId" : "1",
    "taglist" : [ "first-tag" ],
    "text" : "Camilla Perkins Illustration"
  },
  "666" : {
    "dateAddedLocal" : "3/10/2017, 5:58:03 AM",
    "dateAddedUTC" : "2017-03-10T10:58:03.668Z",
    "description" : "Lorem ipsum dolor sit amet, consectetur adipiscing elit. Vivamus vel lectus ut turpis fermentum vestibulum. ",
    "favorited" : false,
    "hyperlink" : "http://theo-gosselin.blogspot.com.es/",
    "id" : "665",
    "index" : 217,
    "lastlocation" : -1,
    "newtag" : "",
    "parentId" : "1",
    "taglist" : [ "first-tag" ],
    "text" : "THÃ‰O GOSSELIN"
  },
  "667" : {
    "dateAddedLocal" : "7/10/2018, 2:35:45 PM",
    "dateAddedUTC" : "2018-07-10T18:35:45.798Z",
    "description" : "Lorem ipsum dolor sit amet, consectetur adipiscing elit. Vivamus vel lectus ut turpis fermentum vestibulum. ",
    "favorited" : false,
    "hyperlink" : "https://coinmetrics.io/charts/#assets=btc_left=price.365.roiRatio_right=avgTxValue",
    "id" : "666",
    "index" : 2,
    "lastlocation" : -1,
    "newtag" : "",
    "parentId" : "502",
    "taglist" : [ "first-tag" ],
    "text" : "unnamed"
  },
  "668" : {
    "dateAddedLocal" : "5/12/2012, 11:30:00 PM",
    "dateAddedUTC" : "2012-05-13T03:30:00.897Z",
    "description" : "Lorem ipsum dolor sit amet, consectetur adipiscing elit. Vivamus vel lectus ut turpis fermentum vestibulum. ",
    "favorited" : false,
    "hyperlink" : "http://www.graphpad.com/articles/interpret/corl_n_linear_reg/correlation.htm",
    "id" : "667",
    "index" : 0,
    "lastlocation" : -1,
    "newtag" : "",
    "parentId" : "8",
    "taglist" : [ "first-tag" ],
    "text" : "unnamed"
  },
  "669" : {
    "dateAddedLocal" : "1/28/2019, 9:07:25 AM",
    "dateAddedUTC" : "2019-01-28T14:07:25.562Z",
    "description" : "Lorem ipsum dolor sit amet, consectetur adipiscing elit. Vivamus vel lectus ut turpis fermentum vestibulum. ",
    "favorited" : false,
    "hyperlink" : "https://displaypurposes.com/",
    "id" : "668",
    "index" : 306,
    "lastlocation" : -1,
    "newtag" : "",
    "parentId" : "1",
    "taglist" : [ "first-tag" ],
    "text" : "instagram hashtags"
  },
  "670" : {
    "dateAddedLocal" : "8/3/2016, 7:56:53 PM",
    "dateAddedUTC" : "2016-08-03T23:56:53.088Z",
    "description" : "Lorem ipsum dolor sit amet, consectetur adipiscing elit. Vivamus vel lectus ut turpis fermentum vestibulum. ",
    "favorited" : false,
    "hyperlink" : "https://www.javascripting.com/",
    "id" : "669",
    "index" : 177,
    "lastlocation" : -1,
    "newtag" : "",
    "parentId" : "1",
    "taglist" : [ "first-tag" ],
    "text" : "JavaScripting.com - The Database of JavaScript Libraries"
  },
  "671" : {
    "dateAddedLocal" : "1/6/2016, 6:37:41 PM",
    "dateAddedUTC" : "2016-01-06T23:37:41.379Z",
    "description" : "Lorem ipsum dolor sit amet, consectetur adipiscing elit. Vivamus vel lectus ut turpis fermentum vestibulum. ",
    "favorited" : false,
    "hyperlink" : "http://backlinko.com/seo-tools",
    "id" : "670",
    "index" : 5,
    "lastlocation" : -1,
    "newtag" : "",
    "parentId" : "65",
    "taglist" : [ "first-tag" ],
    "text" : "SEO Tools: The Complete List (153 Tools Reviewed and Rated)"
  },
  "672" : {
    "dateAddedLocal" : "7/19/2014, 9:17:07 AM",
    "dateAddedUTC" : "2014-07-19T13:17:07.208Z",
    "description" : "Lorem ipsum dolor sit amet, consectetur adipiscing elit. Vivamus vel lectus ut turpis fermentum vestibulum. ",
    "favorited" : false,
    "hyperlink" : "https://github.com/lvwzhen/tools",
    "id" : "671",
    "index" : 3,
    "lastlocation" : -1,
    "newtag" : "",
    "parentId" : "36",
    "taglist" : [ "first-tag" ],
    "text" : "collection/list of web tools"
  },
  "673" : {
    "dateAddedLocal" : "5/14/2012, 11:29:42 PM",
    "dateAddedUTC" : "2012-05-15T03:29:42.246Z",
    "description" : "Lorem ipsum dolor sit amet, consectetur adipiscing elit. Vivamus vel lectus ut turpis fermentum vestibulum. ",
    "favorited" : false,
    "id" : "672",
    "index" : 1,
    "lastlocation" : -1,
    "newtag" : "",
    "parentId" : "2",
    "taglist" : [ "first-tag" ],
    "text" : "statistics"
  },
  "674" : {
    "dateAddedLocal" : "12/21/2016, 12:59:51 AM",
    "dateAddedUTC" : "2016-12-21T05:59:51.436Z",
    "description" : "Lorem ipsum dolor sit amet, consectetur adipiscing elit. Vivamus vel lectus ut turpis fermentum vestibulum. ",
    "favorited" : false,
    "hyperlink" : "https://www.functionofbeauty.com/",
    "id" : "673",
    "index" : 209,
    "lastlocation" : -1,
    "newtag" : "",
    "parentId" : "1",
    "taglist" : [ "first-tag" ],
    "text" : "Personalized Shampoo and Conditioner |Â Function of Beauty"
  },
  "675" : {
    "dateAddedLocal" : "11/6/2014, 10:51:35 AM",
    "dateAddedUTC" : "2014-11-06T15:51:35.163Z",
    "description" : "Lorem ipsum dolor sit amet, consectetur adipiscing elit. Vivamus vel lectus ut turpis fermentum vestibulum. ",
    "favorited" : false,
    "hyperlink" : "http://refills.bourbon.io/",
    "id" : "674",
    "index" : 12,
    "lastlocation" : -1,
    "newtag" : "",
    "parentId" : "39",
    "taglist" : [ "first-tag" ],
    "text" : "Refills"
  },
  "676" : {
    "dateAddedLocal" : "6/5/2016, 3:29:09 PM",
    "dateAddedUTC" : "2016-06-05T19:29:09.377Z",
    "description" : "Lorem ipsum dolor sit amet, consectetur adipiscing elit. Vivamus vel lectus ut turpis fermentum vestibulum. ",
    "favorited" : false,
    "hyperlink" : "http://www.mindbodygreen.com/",
    "id" : "675",
    "index" : 63,
    "lastlocation" : -1,
    "newtag" : "",
    "parentId" : "2",
    "taglist" : [ "first-tag" ],
    "text" : "unnamed"
  },
  "677" : {
    "dateAddedLocal" : "3/5/2019, 9:02:42 PM",
    "dateAddedUTC" : "2019-03-06T02:02:42.880Z",
    "description" : "Lorem ipsum dolor sit amet, consectetur adipiscing elit. Vivamus vel lectus ut turpis fermentum vestibulum. ",
    "favorited" : false,
    "hyperlink" : "https://cheetah-broccoli-g2ak.squarespace.com/config/",
    "id" : "676",
    "index" : 255,
    "lastlocation" : -1,
    "newtag" : "",
    "parentId" : "1",
    "taglist" : [ "first-tag" ],
    "text" : "edit"
  },
  "678" : {
    "dateAddedLocal" : "1/26/2017, 7:17:29 PM",
    "dateAddedUTC" : "2017-01-27T00:17:29.127Z",
    "description" : "Lorem ipsum dolor sit amet, consectetur adipiscing elit. Vivamus vel lectus ut turpis fermentum vestibulum. ",
    "favorited" : false,
    "hyperlink" : "http://www.soundmoose.com/#/home",
    "id" : "677",
    "index" : 213,
    "lastlocation" : -1,
    "newtag" : "",
    "parentId" : "1",
    "taglist" : [ "first-tag" ],
    "text" : "Soundmoose"
  },
  "679" : {
    "dateAddedLocal" : "10/5/2015, 12:50:17 PM",
    "dateAddedUTC" : "2015-10-05T16:50:17.230Z",
    "description" : "Lorem ipsum dolor sit amet, consectetur adipiscing elit. Vivamus vel lectus ut turpis fermentum vestibulum. ",
    "favorited" : false,
    "hyperlink" : "https://builtvisible.com/responsive-images-for-busy-people-a-quick-primer/",
    "id" : "678",
    "index" : 11,
    "lastlocation" : -1,
    "newtag" : "",
    "parentId" : "51",
    "taglist" : [ "first-tag" ],
    "text" : "Responsive Images for Busy People: Srcset & Sizes"
  },
  "680" : {
    "dateAddedLocal" : "9/24/2015, 3:54:19 PM",
    "dateAddedUTC" : "2015-09-24T19:54:19.554Z",
    "description" : "Lorem ipsum dolor sit amet, consectetur adipiscing elit. Vivamus vel lectus ut turpis fermentum vestibulum. ",
    "favorited" : false,
    "hyperlink" : "http://alistapart.com/article/responsive-web-design",
    "id" : "679",
    "index" : 2,
    "lastlocation" : -1,
    "newtag" : "",
    "parentId" : "51",
    "taglist" : [ "first-tag" ],
    "text" : "Responsive Web Design Â· An A List Apart Article"
  },
  "681" : {
    "dateAddedLocal" : "3/12/2015, 11:59:43 AM",
    "dateAddedUTC" : "2015-03-12T15:59:43.090Z",
    "description" : "Lorem ipsum dolor sit amet, consectetur adipiscing elit. Vivamus vel lectus ut turpis fermentum vestibulum. ",
    "favorited" : false,
    "id" : "680",
    "index" : 31,
    "lastlocation" : -1,
    "newtag" : "",
    "parentId" : "2",
    "taglist" : [ "first-tag" ],
    "text" : "DR"
  },
  "682" : {
    "dateAddedLocal" : "1/17/2019, 3:13:53 PM",
    "dateAddedUTC" : "2019-01-17T20:13:53.996Z",
    "description" : "Lorem ipsum dolor sit amet, consectetur adipiscing elit. Vivamus vel lectus ut turpis fermentum vestibulum. ",
    "favorited" : false,
    "hyperlink" : "http://artarchive.online/",
    "id" : "681",
    "index" : 271,
    "lastlocation" : -1,
    "newtag" : "",
    "parentId" : "1",
    "taglist" : [ "first-tag" ],
    "text" : "unnamed"
  },
  "683" : {
    "dateAddedLocal" : "7/4/2014, 1:40:59 AM",
    "dateAddedUTC" : "2014-07-04T05:40:59.778Z",
    "description" : "Lorem ipsum dolor sit amet, consectetur adipiscing elit. Vivamus vel lectus ut turpis fermentum vestibulum. ",
    "favorited" : false,
    "hyperlink" : "http://www.randomizer.org/form.htm",
    "id" : "682",
    "index" : 2,
    "lastlocation" : -1,
    "newtag" : "",
    "parentId" : "417",
    "taglist" : [ "first-tag" ],
    "text" : "random num gen"
  },
  "684" : {
    "dateAddedLocal" : "1/11/2014, 11:29:49 AM",
    "dateAddedUTC" : "2014-01-11T16:29:49.993Z",
    "description" : "Lorem ipsum dolor sit amet, consectetur adipiscing elit. Vivamus vel lectus ut turpis fermentum vestibulum. ",
    "favorited" : false,
    "hyperlink" : "http://www.youtube.com/watch?v=auFtHzMJ7NI",
    "id" : "683",
    "index" : 22,
    "lastlocation" : -1,
    "newtag" : "",
    "parentId" : "49",
    "taglist" : [ "first-tag" ],
    "text" : "josh esque post party dnb dubstep"
  },
  "685" : {
    "dateAddedLocal" : "7/11/2015, 5:58:46 PM",
    "dateAddedUTC" : "2015-07-11T21:58:46.068Z",
    "description" : "Lorem ipsum dolor sit amet, consectetur adipiscing elit. Vivamus vel lectus ut turpis fermentum vestibulum. ",
    "favorited" : false,
    "hyperlink" : "https://www.facebook.com/thebostoncalendar?fref=ts&hc_location=ufi",
    "id" : "684",
    "index" : 4,
    "lastlocation" : -1,
    "newtag" : "",
    "parentId" : "42",
    "taglist" : [ "first-tag" ],
    "text" : "The Boston Calendar"
  },
  "686" : {
    "dateAddedLocal" : "9/27/2016, 7:50:23 PM",
    "dateAddedUTC" : "2016-09-27T23:50:23.030Z",
    "description" : "Lorem ipsum dolor sit amet, consectetur adipiscing elit. Vivamus vel lectus ut turpis fermentum vestibulum. ",
    "favorited" : false,
    "hyperlink" : "https://en.todoist.com/",
    "id" : "685",
    "index" : 197,
    "lastlocation" : -1,
    "newtag" : "",
    "parentId" : "1",
    "taglist" : [ "first-tag" ],
    "text" : "To do list and task manager. Free, easy, online and mobile: Todoist"
  },
  "687" : {
    "dateAddedLocal" : "3/6/2015, 11:54:42 AM",
    "dateAddedUTC" : "2015-03-06T16:54:42.323Z",
    "description" : "Lorem ipsum dolor sit amet, consectetur adipiscing elit. Vivamus vel lectus ut turpis fermentum vestibulum. ",
    "favorited" : false,
    "id" : "686",
    "index" : 28,
    "lastlocation" : -1,
    "newtag" : "",
    "parentId" : "2",
    "taglist" : [ "first-tag" ],
    "text" : "port"
  },
  "688" : {
    "dateAddedLocal" : "4/7/2015, 4:43:35 PM",
    "dateAddedUTC" : "2015-04-07T20:43:35.879Z",
    "description" : "Lorem ipsum dolor sit amet, consectetur adipiscing elit. Vivamus vel lectus ut turpis fermentum vestibulum. ",
    "favorited" : false,
    "hyperlink" : "https://thenounproject.com/search/?q=sit",
    "id" : "687",
    "index" : 8,
    "lastlocation" : -1,
    "newtag" : "",
    "parentId" : "38",
    "taglist" : [ "first-tag" ],
    "text" : "NounProject Search"
  },
  "689" : {
    "dateAddedLocal" : "6/27/2014, 12:00:56 PM",
    "dateAddedUTC" : "2014-06-27T16:00:56.528Z",
    "description" : "Lorem ipsum dolor sit amet, consectetur adipiscing elit. Vivamus vel lectus ut turpis fermentum vestibulum. ",
    "favorited" : false,
    "hyperlink" : "https://www.youtube.com/watch?v=8gFgS1fZhLE",
    "id" : "688",
    "index" : 7,
    "lastlocation" : -1,
    "newtag" : "",
    "parentId" : "49",
    "taglist" : [ "first-tag" ],
    "text" : "Dj Drez | Downtempo hiphop"
  },
  "690" : {
    "dateAddedLocal" : "9/10/2017, 9:49:35 PM",
    "dateAddedUTC" : "2017-09-11T01:49:35.386Z",
    "description" : "Lorem ipsum dolor sit amet, consectetur adipiscing elit. Vivamus vel lectus ut turpis fermentum vestibulum. ",
    "favorited" : false,
    "hyperlink" : "http://www.theyoganomads.com/yoga-nomads-guide-to-ubud-bali-indonesia/",
    "id" : "689",
    "index" : 1,
    "lastlocation" : -1,
    "newtag" : "",
    "parentId" : "574",
    "taglist" : [ "first-tag" ],
    "text" : "Living in Ubud Bali"
  },
  "691" : {
    "dateAddedLocal" : "7/27/2014, 11:34:20 AM",
    "dateAddedUTC" : "2014-07-27T15:34:20.598Z",
    "description" : "Lorem ipsum dolor sit amet, consectetur adipiscing elit. Vivamus vel lectus ut turpis fermentum vestibulum. ",
    "favorited" : false,
    "id" : "690",
    "index" : 8,
    "lastlocation" : -1,
    "newtag" : "",
    "parentId" : "2",
    "taglist" : [ "first-tag" ],
    "text" : "Want"
  },
  "692" : {
    "dateAddedLocal" : "1/29/2015, 4:57:49 PM",
    "dateAddedUTC" : "2015-01-29T21:57:49.668Z",
    "description" : "Lorem ipsum dolor sit amet, consectetur adipiscing elit. Vivamus vel lectus ut turpis fermentum vestibulum. ",
    "favorited" : false,
    "hyperlink" : "http://thenounproject.com/",
    "id" : "691",
    "index" : 14,
    "lastlocation" : -1,
    "newtag" : "",
    "parentId" : "39",
    "taglist" : [ "first-tag" ],
    "text" : "NounProject"
  },
  "693" : {
    "dateAddedLocal" : "2/8/2016, 5:25:36 PM",
    "dateAddedUTC" : "2016-02-08T22:25:36.797Z",
    "description" : "Lorem ipsum dolor sit amet, consectetur adipiscing elit. Vivamus vel lectus ut turpis fermentum vestibulum. ",
    "favorited" : false,
    "hyperlink" : "https://www.tdc.org/",
    "id" : "692",
    "index" : 162,
    "lastlocation" : -1,
    "newtag" : "",
    "parentId" : "1",
    "taglist" : [ "first-tag" ],
    "text" : "type directors club"
  },
  "694" : {
    "dateAddedLocal" : "7/19/2014, 9:12:45 AM",
    "dateAddedUTC" : "2014-07-19T13:12:45.670Z",
    "description" : "",
    "favorited" : false,
    "hyperlink" : "https://github.com/bolshchikov/js-must-watch",
    "id" : "693",
    "index" : 2,
    "lastlocation" : -1,
    "newtag" : "",
    "parentId" : "36",
    "taglist" : [ "root", "education", "video", "javascript" ],
    "text" : "Javascript Must Watch"
  },
  "695" : {
    "dateAddedLocal" : "7/2/2014, 12:26:54 PM",
    "dateAddedUTC" : "2014-07-02T16:26:54.653Z",
    "description" : "",
    "favorited" : false,
    "hyperlink" : "http://blog.visual.ly/data-sources/",
    "id" : "694",
    "index" : 0,
    "lastlocation" : -1,
    "newtag" : "",
    "parentId" : "417",
    "taglist" : [ "data", "data-viz" ],
    "text" : "30 Places to Find Open Data on the Web"
  },
  "696" : {
    "dateAddedLocal" : "5/27/2014, 3:49:52 PM",
    "dateAddedUTC" : "2014-05-27T19:49:52.987Z",
    "description" : "Hide your header on scroll ",
    "favorited" : false,
    "hyperlink" : "http://wicky.nillia.ms/headroom.js/",
    "id" : "695",
    "index" : 2,
    "lastlocation" : -1,
    "newtag" : "",
    "parentId" : "13",
    "taglist" : [ "library", "api", "javascript" ],
    "text" : "Headroom.js"
  },
  "697" : {
    "dateAddedLocal" : "12/7/2018, 5:38:20 PM",
    "dateAddedUTC" : "2018-12-07T22:38:20.736Z",
    "description" : "we almost hired him at Mosaic",
    "favorited" : false,
    "hyperlink" : "https://www.upwork.com/freelancers/~0140cf06b51b0f63d2",
    "id" : "696",
    "index" : 285,
    "lastlocation" : -1,
    "newtag" : "",
    "parentId" : "1",
    "taglist" : [ "first-tag" ],
    "text" : "a good Upwork Freelancer"
  },
  "698" : {
    "dateAddedLocal" : "3/7/2015, 5:20:15 PM",
    "dateAddedUTC" : "2015-03-07T22:20:15.427Z",
    "description" : "",
    "favorited" : false,
    "hyperlink" : "https://soundcloud.com/babelcult/weapon-ft-misogi",
    "id" : "697",
    "index" : 15,
    "lastlocation" : -1,
    "newtag" : "",
    "parentId" : "49",
    "taglist" : [ "music" ],
    "text" : "Weapon ft. MISOGI by babel on SoundCloud - Hear the worldâ€™s sounds"
  },
  "699" : {
    "dateAddedLocal" : "10/10/2017, 12:09:30 AM",
    "dateAddedUTC" : "2017-10-10T04:09:30.605Z",
    "description" : "",
    "favorited" : false,
    "hyperlink" : "https://www.youtube.com/user/Kemetprince1/videos",
    "id" : "698",
    "index" : 117,
    "lastlocation" : -1,
    "newtag" : "",
    "parentId" : "1",
    "taglist" : [ "root", "health", "psychology", "video" ],
    "text" : "Infinite Waters"
  },
  "700" : {
    "dateAddedLocal" : "3/22/2015, 11:42:02 PM",
    "dateAddedUTC" : "2015-03-23T03:42:02.161Z",
    "description" : "nice hats",
    "favorited" : false,
    "hyperlink" : "http://strandhatters.com.au/news/page/2/",
    "id" : "699",
    "index" : 0,
    "lastlocation" : -1,
    "newtag" : "",
    "parentId" : "25",
    "taglist" : [ "clothing" ],
    "text" : "Strand Hatters"
  },
  "701" : {
    "dateAddedLocal" : "12/27/2013, 12:07:02 AM",
    "dateAddedUTC" : "2013-12-27T05:07:02.616Z",
    "description" : "Lorem ipsum dolor sit amet, consectetur adipiscing elit. Vivamus vel lectus ut turpis fermentum vestibulum. ",
    "favorited" : false,
    "hyperlink" : "http://www.calm.com/",
    "id" : "700",
    "index" : 1,
    "lastlocation" : -1,
    "newtag" : "",
    "parentId" : "10",
    "taglist" : [ "meditation" ],
    "text" : "calm.com"
  },
  "702" : {
    "dateAddedLocal" : "8/9/2018, 1:23:44 PM",
    "dateAddedUTC" : "2018-08-09T17:23:44.743Z",
    "description" : "Lorem ipsum dolor sit amet, consectetur adipiscing elit. Vivamus vel lectus ut turpis fermentum vestibulum. ",
    "favorited" : false,
    "hyperlink" : "https://www.spglobal.com/marketintelligence/en/",
    "id" : "701",
    "index" : 0,
    "lastlocation" : -1,
    "newtag" : "",
    "parentId" : "498",
    "taglist" : [ "first-tag" ],
    "text" : "Home | S&P Global Market Intelligence"
  },
  "703" : {
    "dateAddedLocal" : "1/24/2016, 10:09:38 PM",
    "dateAddedUTC" : "2016-01-25T03:09:38.259Z",
    "description" : "analyze a website",
    "favorited" : false,
    "hyperlink" : "https://website.grader.com/?ref=producthunt",
    "id" : "702",
    "index" : 19,
    "lastlocation" : -1,
    "newtag" : "",
    "parentId" : "65",
    "taglist" : [ "web-tools" ],
    "text" : "Website Grader"
  },
  "704" : {
    "dateAddedLocal" : "4/4/2015, 7:50:30 PM",
    "dateAddedUTC" : "2015-04-04T23:50:30.508Z",
    "description" : "beautiful grid outline navigation, pink bg, swedish aesthetic",
    "favorited" : false,
    "hyperlink" : "http://www.hyperquake.com/",
    "id" : "703",
    "index" : 9,
    "lastlocation" : -1,
    "newtag" : "",
    "parentId" : "35",
    "taglist" : [ "creative-agency" ],
    "text" : "Hyperquake"
  },
  "705" : {
    "dateAddedLocal" : "6/5/2016, 3:29:37 PM",
    "dateAddedUTC" : "2016-06-05T19:29:37.126Z",
    "description" : "Lorem ipsum dolor sit amet, consectetur adipiscing elit. Vivamus vel lectus ut turpis fermentum vestibulum. ",
    "favorited" : false,
    "hyperlink" : "http://www.mindbodygreen.com/",
    "id" : "704",
    "index" : 134,
    "lastlocation" : -1,
    "newtag" : "",
    "parentId" : "1",
    "taglist" : [ "health", "root", "blog" ],
    "text" : "MindbodyGreen"
  },
  "706" : {
    "dateAddedLocal" : "1/30/2014, 10:43:41 PM",
    "dateAddedUTC" : "2014-01-31T03:43:41.855Z",
    "description" : "Lorem ipsum dolor sit amet, consectetur adipiscing elit. Vivamus vel lectus ut turpis fermentum vestibulum. ",
    "favorited" : false,
    "hyperlink" : "http://farshchian.deviantart.com/art/Celebration-of-Learning-48636192",
    "id" : "705",
    "index" : 0,
    "lastlocation" : -1,
    "newtag" : "",
    "parentId" : "12",
    "taglist" : [ "art" ],
    "text" : "Celebration of Learning by Farshchian on deviantART"
  },
  "707" : {
    "dateAddedLocal" : "8/13/2018, 12:49:38 PM",
    "dateAddedUTC" : "2018-08-13T16:49:38.153Z",
    "description" : "Lorem ipsum dolor sit amet, consectetur adipiscing elit. Vivamus vel lectus ut turpis fermentum vestibulum. ",
    "favorited" : false,
    "hyperlink" : "https://medium.com/allurive/designing-icons-at-24-px-a783aa7b23cd",
    "id" : "706",
    "index" : 1,
    "lastlocation" : -1,
    "newtag" : "",
    "parentId" : "497",
    "taglist" : [ "first-tag" ],
    "text" : "Designing Icons Guide"
  },
  "708" : {
    "dateAddedLocal" : "3/30/2015, 7:01:55 PM",
    "dateAddedUTC" : "2015-03-30T23:01:55.848Z",
    "description" : "Lorem ipsum dolor sit amet, consectetur adipiscing elit. Vivamus vel lectus ut turpis fermentum vestibulum. ",
    "favorited" : false,
    "hyperlink" : "http://www.northeastern.edu/entrepreneurs/old-opportunities-around-boston/",
    "id" : "707",
    "index" : 4,
    "lastlocation" : -1,
    "newtag" : "",
    "parentId" : "29",
    "taglist" : [ "first-tag" ],
    "text" : "Â» Opportunities Around Boston"
  },
  "709" : {
    "dateAddedLocal" : "9/3/2014, 11:07:25 PM",
    "dateAddedUTC" : "2014-09-04T03:07:25.019Z",
    "description" : "",
    "favorited" : false,
    "hyperlink" : "http://www.northeastern.edu/entrepreneurs/",
    "id" : "708",
    "index" : 4,
    "lastlocation" : -1,
    "newtag" : "",
    "parentId" : "18",
    "taglist" : [ "northeastern" ],
    "text" : "Entrepreneurs Club"
  },
  "710" : {
    "dateAddedLocal" : "3/21/2018, 6:48:36 PM",
    "dateAddedUTC" : "2018-03-21T22:48:36.012Z",
    "description" : "",
    "favorited" : false,
    "hyperlink" : "https://www.youtube.com/feed/subscriptions",
    "id" : "709",
    "index" : 70,
    "lastlocation" : -1,
    "newtag" : "",
    "parentId" : "1",
    "taglist" : [ "root", "video" ],
    "text" : "Youtube Subscriptions Feed"
  },
  "711" : {
    "dateAddedLocal" : "7/29/2018, 1:17:53 AM",
    "dateAddedUTC" : "2018-07-29T05:17:53.983Z",
    "description" : "",
    "favorited" : false,
    "hyperlink" : "https://zap.jackmallers.com/",
    "id" : "710",
    "index" : 72,
    "lastlocation" : -1,
    "newtag" : "",
    "parentId" : "2",
    "taglist" : [ "crypto" ],
    "text" : "Zap - lightning network low cost trades btc wallet"
  },
  "712" : {
    "dateAddedLocal" : "4/14/2019, 10:31:01 PM",
    "dateAddedUTC" : "2019-04-15T02:31:01.544Z",
    "description" : "",
    "favorited" : false,
    "hyperlink" : "http://www.sacred-texts.com/eso/kyb/kyb04.htm",
    "id" : "711",
    "index" : 25,
    "lastlocation" : -1,
    "newtag" : "",
    "parentId" : "1",
    "taglist" : [ "wisdom" ],
    "text" : "777: Hermetic Principles"
  },
  "713" : {
    "dateAddedLocal" : "4/5/2015, 4:37:32 AM",
    "dateAddedUTC" : "2015-04-05T08:37:32.826Z",
    "description" : "",
    "favorited" : false,
    "hyperlink" : "http://paletton.com/#uid=a3h0t0kllllaFw0g0qFqFg0w0aF",
    "id" : "712",
    "index" : 3,
    "lastlocation" : -1,
    "newtag" : "",
    "parentId" : "38",
    "taglist" : [ "color-tool" ],
    "text" : "Paletton - The Color Scheme Designer"
  },
  "714" : {
    "description" : "Create color palettes ",
    "favorited" : false,
    "hyperlink" : "https://coolors.co/app",
    "id" : "713",
    "lastlocation" : -1,
    "newtag" : "",
    "taglist" : [ "color-tool" ],
    "text" : "Coolors color Palette Tool"
  },
  "715" : {
    "description" : "created by Tim Holman of Zenpen",
    "favorited" : false,
    "hyperlink" : "https://generativeartistry.com/",
    "id" : "714",
    "lastlocation" : 857,
    "tag" : "default",
    "text" : "Generative Artistry"
  },
  "716" : {
    "description" : "Create fast loading, highly readable, and 100% responsive interfaces with as little css as possible. ",
    "favorited" : false,
    "hyperlink" : "https://tachyons.io/",
    "id" : "715",
    "lastlocation" : -1,
    "newtag" : "css",
    "tag" : "default",
    "text" : "Tachyons CSS Toolkit"
  },
  "717" : {
    "description" : "Tailwind CSS is a highly customizable, low-level CSS framework that gives you all of the building blocks you need to build bespoke designs without any annoying opinionated styles you have to fight to override. Good for rapid prototyping.",
    "favorited" : false,
    "hyperlink" : "https://tailwindcss.com/",
    "id" : "716",
    "lastlocation" : -1,
    "tag" : "default",
    "text" : "Tailwind Semantic Responsive CSS Framework"
  },
  "718" : {
    "description" : "blog post",
    "favorited" : false,
    "hyperlink" : "http://mrmrs.cc/writing/scalable-css/",
    "id" : "717",
    "lastlocation" : -1,
    "tag" : "default",
    "text" : "CSS for Scalability"
  },
  "719" : {
    "description" : "Web dev writings and generative art work",
    "favorited" : false,
    "hyperlink" : "http://mrmrs.cc",
    "id" : "718",
    "lastlocation" : -1,
    "newtag" : "",
    "tag" : "default",
    "text" : "Mr Mrs CC - Web Dev Blog "
  },
  "720" : {
    "description" : "crypto ETH newsletter",
    "favorited" : false,
    "hyperlink" : "https://weekinethereum.substack.com/",
    "id" : "719",
    "lastlocation" : -1,
    "newtag" : "",
    "taglist" : [ "crypto" ],
    "text" : "Week in Ethereum"
  },
  "721" : {
    "description" : "Good to study, they have a great css setup",
    "favorited" : false,
    "hyperlink" : "https://github.com/tachyons-css/tachyons",
    "id" : "720",
    "lastlocation" : -1,
    "newtag" : "",
    "taglist" : [ "root", "education", "css", "computer-science" ],
    "text" : "Tachyons Github Repo"
  },
  "722" : {
    "description" : "polymath",
    "favorited" : false,
    "hyperlink" : "https://linktr.ee/robertedwardgrant",
    "id" : "721",
    "lastlocation" : -1,
    "newtag" : "",
    "taglist" : [ "education", "wisdom", "podcast" ],
    "text" : "Robert Edward Grant"
  },
  "723" : {
    "description" : "tool to create SVG shapes",
    "favorited" : false,
    "hyperlink" : "https://www.blobmaker.app/",
    "id" : "722",
    "lastlocation" : -1,
    "newtag" : "",
    "taglist" : [ "svg", "web-tools" ],
    "text" : "SVG Blobmaker"
  },
  "724" : {
    "description" : "",
    "favorited" : false,
    "hyperlink" : "https://www.indiehackers.com/",
    "id" : "723",
    "lastlocation" : -1,
    "newtag" : "",
    "taglist" : [ "root" ],
    "text" : "IndieHackers"
  },
  "725" : {
    "description" : "Randomly generated svg shapes with nice animation bg",
    "favorited" : false,
    "hyperlink" : "https://heartbeat.ua/",
    "id" : "724",
    "lastlocation" : -1,
    "newtag" : "",
    "taglist" : [ "creative-agency", "svg" ],
    "text" : "SVG Blob Example - Fintech Visual Identity Firm "
  },
  "726" : {
    "description" : "Utility function library",
    "favorited" : false,
    "hyperlink" : "https://underscorejs.org/",
    "id" : "725",
    "lastlocation" : 839,
    "newtag" : "",
    "taglist" : [ "api", "javascript", "root", "education", "computer-science" ],
    "text" : "Underscore.js"
  },
  "727" : {
    "description" : "{ * u * }",
    "favorited" : false,
    "hyperlink" : "https://www.smarty.net/docsv2/en/",
    "id" : "726",
    "lastlocation" : -1,
    "newtag" : "",
    "taglist" : [ "api", "framework" ],
    "text" : "Smarty PHP Templating Language"
  },
  "728" : {
    "description" : "Design API's in Postman",
    "favorited" : false,
    "hyperlink" : "https://www.getpostman.com/",
    "id" : "727",
    "lastlocation" : -1,
    "newtag" : "",
    "taglist" : [ "api" ],
    "text" : "Postman "
  },
  "729" : {
    "description" : "Chen's mining calc",
    "favorited" : false,
    "hyperlink" : "https://calc.randomcrypto.org",
    "id" : "728",
    "lastlocation" : -1,
    "newtag" : "",
    "taglist" : [ "crypto", "data-viz", "aesthetic" ],
    "text" : "Randomcrypto Mining Calculator"
  },
  "730" : {
    "description" : "PHP Framework",
    "favorited" : false,
    "hyperlink" : "https://laravel.com/",
    "id" : "729",
    "lastlocation" : -1,
    "newtag" : "",
    "taglist" : [ "api", "php", "framework" ],
    "text" : "Laravel PHP "
  },
  "731" : {
    "description" : "Designer with a nice cartoony aesthetic style",
    "favorited" : false,
    "hyperlink" : "https://jackmcdade.com/",
    "id" : "730",
    "lastlocation" : -1,
    "newtag" : "",
    "taglist" : [ "portfolio", "creative-agency" ],
    "text" : "Jack McDade Portfolio"
  },
  "732" : {
    "description" : "gradients",
    "favorited" : false,
    "hyperlink" : "https://www.grabient.com/",
    "id" : "731",
    "lastlocation" : -1,
    "newtag" : "",
    "taglist" : [ "color-tool" ],
    "text" : "Grabient"
  },
  "733" : {
    "description" : "beautiful typographic portfolio",
    "favorited" : false,
    "hyperlink" : "http://zefs.website/",
    "id" : "732",
    "lastlocation" : -1,
    "newtag" : "",
    "taglist" : [ "portfolio", "creative-agency", "typography" ],
    "text" : "Zefs Website "
  },
  "734" : {
    "description" : "",
    "favorited" : false,
    "hyperlink" : "https://tympanus.net/Development/GradientTopographyAnimation/",
    "id" : "733",
    "lastlocation" : -1,
    "newtag" : "",
    "taglist" : [ "data-viz" ],
    "text" : "Topographic Blobs"
  },
  "735" : {
    "description" : "",
    "favorited" : false,
    "hyperlink" : "https://www.arch.columbia.edu",
    "id" : "734",
    "lastlocation" : -1,
    "newtag" : "",
    "taglist" : [ "architecture" ],
    "text" : "Columbia Architecture"
  },
  "736" : {
    "description" : "css system in html visual semantic css",
    "favorited" : false,
    "hyperlink" : "https://getbootstrap.com/docs/4.0/utilities/spacing/",
    "id" : "735",
    "lastlocation" : -1,
    "newtag" : "",
    "taglist" : [ "css", "api", "essential" ],
    "text" : "Bootstrap 4.0 Utilities: padding"
  },
  "737" : {
    "description" : "Simple yet flexible JavaScript charting for designers & developers",
    "favorited" : false,
    "hyperlink" : "https://www.chartjs.org/",
    "id" : "736",
    "lastlocation" : -1,
    "newtag" : "",
    "taglist" : [ "data-viz", "api" ],
    "text" : "Chart JS"
  },
  "738" : {
    "description" : "",
    "favorited" : false,
    "hyperlink" : "https://paveldogreat.github.io/WebGL-Fluid-Simulation/",
    "id" : "737",
    "lastlocation" : -1,
    "newtag" : "",
    "taglist" : [ "webgl" ],
    "text" : "WebGL Fluid Simulation"
  },
  "739" : {
    "description" : "",
    "favorited" : false,
    "hyperlink" : "https://www.thekooples.com/us/men-sale/must-have-us.html",
    "id" : "738",
    "lastlocation" : -1,
    "newtag" : "",
    "taglist" : [ "clothing" ],
    "text" : "The Kooples"
  },
  "740" : {
    "description" : "",
    "favorited" : false,
    "hyperlink" : "https://www.nngroup.com/",
    "id" : "739",
    "lastlocation" : -1,
    "newtag" : "",
    "taglist" : [ "ux", "graphic-design" ],
    "text" : "Nielsen Norman Group | UX Research"
  },
  "741" : {
    "description" : "",
    "favorited" : false,
    "hyperlink" : "https://www.printedmatter.org",
    "id" : "740",
    "lastlocation" : -1,
    "newtag" : "",
    "taglist" : [ "art", "new-york", "graphic-design" ],
    "text" : "Printed Matter Art Books"
  },
  "742" : {
    "description" : "really nice SF website design",
    "favorited" : false,
    "hyperlink" : "https://stripe.com/atlas",
    "id" : "741",
    "lastlocation" : -1,
    "newtag" : "",
    "taglist" : [ "creative-agency" ],
    "text" : "Stripe Atlas"
  },
  "743" : {
    "description" : "",
    "favorited" : false,
    "hyperlink" : "http://danielstern.ca/range.css/?ref=css-tricks#/",
    "id" : "742",
    "lastlocation" : -1,
    "newtag" : "",
    "taglist" : [ "web-tools", "css" ],
    "text" : "range slider css"
  },
  "744" : {
    "description" : "",
    "favorited" : false,
    "hyperlink" : "https://bossanova.uk/jexcel/v3/",
    "id" : "743",
    "lastlocation" : -1,
    "newtag" : "",
    "taglist" : [ "api", "javascript" ],
    "text" : "JExcel - Javascript Excel"
  },
  "745" : {
    "description" : "",
    "favorited" : false,
    "hyperlink" : "https://isometric.online/",
    "id" : "744",
    "lastlocation" : -1,
    "newtag" : "",
    "taglist" : [ "resources", "illustration" ],
    "text" : "Isometric Illustration Gallery"
  },
  "746" : {
    "description" : "",
    "favorited" : false,
    "hyperlink" : "https://developer.apple.com/design/human-interface-guidelines",
    "id" : "745",
    "lastlocation" : -1,
    "newtag" : "",
    "taglist" : [ "design-language" ],
    "text" : "Apple Human Interface Guidelines"
  },
  "747" : {
    "description" : "",
    "favorited" : false,
    "hyperlink" : "https://github.com/edent/SuperTinyIcons",
    "id" : "746",
    "lastlocation" : -1,
    "newtag" : "",
    "taglist" : [ "resources" ],
    "text" : "Super Tiny Icons"
  },
  "748" : {
    "description" : "",
    "favorited" : false,
    "hyperlink" : "https://www.levels.fyi/",
    "id" : "747",
    "lastlocation" : -1,
    "newtag" : "",
    "taglist" : [ "career", "web-tools", "personal-finance" ],
    "text" : "Levels FYI"
  },
  "749" : {
    "description" : "",
    "favorited" : false,
    "hyperlink" : "https://trennd.co/?period=6",
    "id" : "748",
    "lastlocation" : -1,
    "newtag" : "",
    "taglist" : [ "data-viz", "web-tools" ],
    "text" : "Trennd Google Trends"
  },
  "750" : {
    "description" : "",
    "favorited" : false,
    "hyperlink" : "https://github.com/Treast/puffin.js",
    "id" : "749",
    "lastlocation" : -1,
    "newtag" : "",
    "taglist" : [ "modern-aesthetic", "api" ],
    "text" : "Puffin.js - img hover effects"
  },
  "751" : {
    "description" : "",
    "favorited" : false,
    "hyperlink" : "https://devhints.io/",
    "id" : "750",
    "lastlocation" : -1,
    "newtag" : "",
    "taglist" : [ "modern-aesthetic", "creative-agency" ],
    "text" : "Devhints"
  },
  "752" : {
    "description" : "",
    "favorited" : false,
    "hyperlink" : "https://paravelinc.com/work/",
    "id" : "751",
    "lastlocation" : -1,
    "newtag" : "",
    "taglist" : [ "php", "api" ],
    "text" : "Paravel"
  },
  "753" : {
    "description" : "",
    "favorited" : false,
    "hyperlink" : "https://vuex.vuejs.org/",
    "id" : "752",
    "lastlocation" : -1,
    "newtag" : "",
    "taglist" : [ "vue", "javascript", "api" ],
    "text" : "VueX - State Management"
  },
  "754" : {
    "description" : "",
    "favorited" : false,
    "hyperlink" : "https://nuxtjs.org/guide",
    "id" : "753",
    "lastlocation" : -1,
    "newtag" : "",
    "taglist" : [ "vue", "javascript", "api" ],
    "text" : "Nuxt Vue "
  },
  "755" : {
    "description" : "",
    "favorited" : false,
    "hyperlink" : "https://www.figma.com/c",
    "id" : "754",
    "lastlocation" : -1,
    "newtag" : "",
    "taglist" : [ "design", "web-tools" ],
    "text" : "Figma Plugins"
  },
  "756" : {
    "description" : "",
    "favorited" : false,
    "hyperlink" : "https://tympanus.net/codrops/",
    "id" : "755",
    "lastlocation" : 828,
    "newtag" : "",
    "taglist" : [ "web-design", "creative-agency", "root", "education", "blog" ],
    "text" : "Tympanus Codrops"
  },
  "757" : {
    "description" : "",
    "favorited" : false,
    "hyperlink" : "https://ashleysheekey.co.uk/",
    "id" : "756",
    "lastlocation" : -1,
    "newtag" : "",
    "taglist" : [ "modern-aesthetic", "creative-agency", "portfolio", "modern-aesthetic" ],
    "text" : "Organic Photo Blog design"
  },
  "758" : {
    "description" : "",
    "favorited" : false,
    "hyperlink" : "https://bauhaus.futurelondonacademy.com/",
    "id" : "757",
    "lastlocation" : -1,
    "newtag" : "",
    "taglist" : [ "creative-agency" ],
    "text" : "Bauhaus Modular Academy Design"
  },
  "759" : {
    "description" : "",
    "favorited" : false,
    "hyperlink" : "https://github.com/vioan/nodejs-learning-resources",
    "id" : "758",
    "lastlocation" : -1,
    "taglist" : [ "newtag" ],
    "text" : "Node Learning Resources"
  },
  "760" : {
    "description" : "",
    "favorited" : false,
    "hyperlink" : "https://tandem.chat/",
    "id" : "759",
    "lastlocation" : -1,
    "taglist" : [ "newtag" ],
    "text" : "Tandem SaaS"
  },
  "761" : {
    "description" : "",
    "favorited" : false,
    "hyperlink" : "https://www.notion.so/",
    "id" : "760",
    "lastlocation" : -1,
    "taglist" : [ "newtag" ],
    "text" : "Notion Task Saas"
  },
  "762" : {
    "description" : "",
    "favorited" : false,
    "hyperlink" : "https://undraw.co/",
    "id" : "761",
    "lastlocation" : -1,
    "taglist" : [ "newtag" ],
    "text" : "Undraw - Illustrations"
  },
  "763" : {
    "description" : "",
    "favorited" : false,
    "hyperlink" : "https://www.humaaans.com/",
    "id" : "762",
    "lastlocation" : -1,
    "taglist" : [ "newtag" ],
    "text" : "Humaaans - illustrations"
  },
  "764" : {
    "description" : "",
    "favorited" : false,
    "hyperlink" : "https://semantic-ui.com/",
    "id" : "763",
    "lastlocation" : -1,
    "taglist" : [ "newtag" ],
    "text" : "Semantic UI"
  },
  "765" : {
    "description" : "",
    "favorited" : false,
    "hyperlink" : "https://umbrellajs.com/documentation",
    "id" : "764",
    "lastlocation" : -1,
    "taglist" : [ "newtag" ],
    "text" : "Umbrella JS"
  },
  "766" : {
    "description" : "",
    "favorited" : false,
    "hyperlink" : "http://motion.ant.design/",
    "id" : "765",
    "lastlocation" : -1,
    "taglist" : [ "newtag" ],
    "text" : "Motion Design Framework"
  },
  "767" : {
    "description" : "",
    "favorited" : false,
    "hyperlink" : "https://www.joypixels.com/",
    "id" : "766",
    "lastlocation" : -1,
    "taglist" : [ "newtag" ],
    "text" : "Emoji Font"
  },
  "768" : {
    "description" : "",
    "favorited" : false,
    "hyperlink" : "https://github.com/ryanburgess/engineer-manager",
    "id" : "767",
    "lastlocation" : -1,
    "taglist" : [ "newtag" ],
    "text" : "Engineering Manager Links"
  },
  "769" : {
    "description" : "",
    "favorited" : false,
    "hyperlink" : "https://rupertbevan.com/",
    "id" : "768",
    "lastlocation" : -1,
    "taglist" : [ "newtag" ],
    "text" : "Rupert Nice website"
  },
  "770" : {
    "description" : "",
    "favorited" : false,
    "hyperlink" : "https://logz.io/learn/complete-guide-elk-stack/",
    "id" : "769",
    "lastlocation" : -1,
    "taglist" : [ "newtag" ],
    "text" : "Logz Elk Stack"
  },
  "771" : {
    "description" : "",
    "favorited" : false,
    "hyperlink" : "https://www.svgbackgrounds.com/",
    "id" : "770",
    "lastlocation" : -1,
    "taglist" : [ "newtag" ],
    "text" : "svg backgrounds"
  },
  "772" : {
    "description" : "",
    "favorited" : false,
    "hyperlink" : "https://www.avantui.com/",
    "id" : "771",
    "lastlocation" : -1,
    "taglist" : [ "newtag" ],
    "text" : "avant ui"
  },
  "773" : {
    "description" : "",
    "favorited" : false,
    "hyperlink" : "https://mjml.io/",
    "id" : "772",
    "lastlocation" : -1,
    "taglist" : [ "newtag" ],
    "text" : "Email Templating Language"
  },
  "774" : {
    "description" : "",
    "favorited" : false,
    "hyperlink" : "https://airtable.com/",
    "id" : "773",
    "lastlocation" : -1,
    "taglist" : [ "newtag" ],
    "text" : "Airtable Database Spreadsheets"
  },
  "775" : {
    "description" : "",
    "favorited" : false,
    "hyperlink" : "https://nohq.co/tools/",
    "id" : "774",
    "lastlocation" : -1,
    "taglist" : [ "newtag" ],
    "text" : "No HQ Remote Work Tools"
  },
  "776" : {
    "description" : "",
    "favorited" : false,
    "hyperlink" : "https://victorzhou.com/",
    "id" : "775",
    "lastlocation" : -1,
    "taglist" : [ "newtag" ],
    "text" : "VictorZhou - Web Dev & ML Blog"
  },
  "777" : {
    "description" : "",
    "favorited" : false,
    "hyperlink" : "https://github.com/rmharrison/awesome-ubi-organisations",
    "id" : "776",
    "lastlocation" : -1,
    "taglist" : [ "newtag" ],
    "text" : "Universal Basic Income Links"
  },
  "778" : {
    "description" : "",
    "favorited" : false,
    "hyperlink" : "https://keybase.io/",
    "id" : "777",
    "lastlocation" : -1,
    "taglist" : [ "newtag" ],
    "text" : "Keybase"
  },
  "779" : {
    "description" : "",
    "favorited" : false,
    "hyperlink" : "https://books.vishnuks.com/",
    "id" : "778",
    "lastlocation" : -1,
    "taglist" : [ "newtag" ],
    "text" : "Books List"
  },
  "780" : {
    "description" : "",
    "favorited" : false,
    "hyperlink" : "http://mrcthms.com/",
    "id" : "779",
    "lastlocation" : -1,
    "taglist" : [ "newtag" ],
    "text" : "Marc Thomas"
  },
  "781" : {
    "description" : "",
    "favorited" : false,
    "hyperlink" : "https://juliangarnier.com/",
    "id" : "780",
    "lastlocation" : -1,
    "taglist" : [ "newtag" ],
    "text" : "Julian Garnier"
  },
  "-LmKytIlUQuSRK8C6jC5" : {
    "description" : "",
    "favorited" : false,
    "hyperlink" : "https://www.startupschool.org/",
    "lastlocation" : -1,
    "taglist" : [ "newtag" ],
    "text" : "YC Startup School "
  },
  "-LmL2QPrQn4wDXdZ1x0U" : {
    "description" : "",
    "favorited" : false,
    "hyperlink" : "http://www.paulgraham.com/articles.html",
    "lastlocation" : -1,
    "taglist" : [ "newtag" ],
    "text" : "Paul Graham Blog"
  },
  "-LmL5kyuLQRQtxfs4K1F" : {
    "description" : "",
    "favorited" : false,
    "hyperlink" : "http://hedonometer.org/index.html",
    "lastlocation" : -1,
    "taglist" : [ "newtag" ],
    "text" : "Happiness Meter"
  },
  "-LmLsOlnHem1Hy197G28" : {
    "description" : "",
    "favorited" : false,
    "hyperlink" : "https://adaptivecapital.co/",
    "lastlocation" : -1,
    "taglist" : [ "newtag" ],
    "text" : "Adaptive Capital"
  },
  "-LmMDKPLzoSJc9RPgOz7" : {
    "description" : "",
    "favorited" : false,
    "hyperlink" : "http://blog.samaltman.com/",
    "lastlocation" : -1,
    "taglist" : [ "newtag" ],
    "text" : "Sam Altman Blog"
  },
  "-LmML9EKKbupYaEoa5kZ" : {
    "description" : "",
    "favorited" : false,
    "hyperlink" : "https://www.mytheresa.com/en-us/",
    "lastlocation" : -1,
    "taglist" : [ "newtag" ],
    "text" : "My Theresa"
  },
  "-LmN5JWyAC4JNdwI_Squ" : {
    "description" : "",
    "favorited" : false,
    "hyperlink" : "https://imgur.com/gallery/pHUdq",
    "lastlocation" : -1,
    "taglist" : [ "newtag" ],
    "text" : "MMM Cooking"
  },
  "-LmRDC8NLBbzkCj7PGv_" : {
    "description" : "",
    "favorited" : false,
    "hyperlink" : "http://www.vipassanadhura.com/",
    "lastlocation" : -1,
    "taglist" : [ "newtag" ],
    "text" : "Vipassana"
  },
  "-LmRFNn-RNk1CDHk6XWo" : {
    "description" : "",
    "favorited" : false,
    "hyperlink" : "https://www.csrwire.com/blog/posts/733-the-three-economic-principles-of-sustainability",
    "lastlocation" : -1,
    "taglist" : [ "newtag" ],
    "text" : "3 Economic Principles"
  }
}
